Sr. No.,Date(dd/mm/yyyy),Startup Name,Industry Vertical,City / Location,Investors’ Name,InvestmentType,Amount (in USD),Remarks,Industry/ Vertical,Sub-Vertical,Invest-mentType,Date,Industry/Vertical,City,Investor Name,Investment Type,Amount(in USD),Unnamed: 0,Founding Date,Founders,Investors,Investment Stage,0,1,2,3,4,5,6,7,8,Amount_Cleaned,Date_Parsed,Year,Sector_Standardized,State_Standardized
1.0,03/04/2015,Swiggy,Online Food Delivery,Bangalore,"Accel Partners, SAIF Partners",Private Equity,"2,000,000",Series A,,,,,,,,,,,,,,,,,,,,,,,,2000000.0,2015-03-04,2015.0,online food delivery,bangalore
2.0,04/04/2015,Bluegape,Web Content Publishing,Gurgaon,"Rudy Gopalakrishnan, ah! Ventures",Seed Funding,"200,000",,,,,,,,,,,,,,,,,,,,,,,,,200000.0,2015-04-04,2015.0,web content publishing,gurgaon
3.0,04/04/2015,KeepTrax,Location Based App,Dallas / Hyderabad,,Seed Funding,"1,000,000",,,,,,,,,,,,,,,,,,,,,,,,,1000000.0,2015-04-04,2015.0,location based app,dallas / hyderabad
4.0,06/04/2015,InstaLively,Video Streaming,New Delhi,"Rajesh Sawheny , Rajan Anandan, Amit Ranjan, Niraj Singh, AECAL, MeraEvents.",Seed Funding,"120,000",,,,,,,,,,,,,,,,,,,,,,,,,120000.0,2015-06-04,2015.0,video streaming,new delhi
5.0,07/04/2015,Pricejugaad,Price Comparison,Hyderabad,"Amit Tyagi, Sandeep Acharya & others",Seed Funding,"165,000",,,,,,,,,,,,,,,,,,,,,,,,,165000.0,2015-07-04,2015.0,price comparison,hyderabad
6.0,07/04/2015,Quikr,Online Classifieds,Mumbai,"Tiger Global, Investment AB Kinnevik, Steadview Capital",Private Equity,"150,000,000",Series G (Checkprev funding details here),,,,,,,,,,,,,,,,,,,,,,,,150000000.0,2015-07-04,2015.0,online classifieds,mumbai
7.0,07/04/2015,PressPlay,Travel Entertainment,New Delhi,"Sequoia Capital, Jason Hirschhorn, Jarett Posner, and Amit Bhatiani",Seed Funding,"2,200,000",,,,,,,,,,,,,,,,,,,,,,,,,2200000.0,2015-07-04,2015.0,travel entertainment,new delhi
8.0,07/04/2015,LogiNext,Logistics Tech,Mumbai,"Ajit Surana, Sanjay Mehta",Seed Funding,,,,,,,,,,,,,,,,,,,,,,,,,,,2015-07-04,2015.0,logistics tech,mumbai
9.0,08/04/2015,FirstCry.com,eCommerce,Pune,"Silicon Valley Ventures, NEA Ventures, Valiant Capital, IDG Ventures India,  SAIF Partners, Vertex Ventures",Private Equity,"10,000,000","Series D( In Feb it was announced they raised 26M, but it is 36M, so added here)",,,,,,,,,,,,,,,,,,,,,,,,10000000.0,2015-08-04,2015.0,ecommerce,pune
10.0,08/04/2015,MobiKwik,Digital / Mobile Wallet,Gurgaon,"Tree Line Asia, Cisco Investments, American Express, Sequoia Capital",Private Equity,"25,000,000",Series B,,,,,,,,,,,,,,,,,,,,,,,,25000000.0,2015-08-04,2015.0,digital / mobile wallet,gurgaon
11.0,08/04/2015,Olacabs,Cab Aggregator,Bangalore,"DST Global, Steadview Capital, Tiger Global, Accel Partners & Others",Private Equity,"400,000,000",Series E (Updated from 315M to 400M after Press Release),,,,,,,,,,,,,,,,,,,,,,,,400000000.0,2015-08-04,2015.0,cab aggregator,bangalore
12.0,09/04/2015,Gadgetwood,Device Repair Svcs,New Delhi,"Ajai Chowdhry, Ashvin Chadha, Yogesh Bansal,Nitin Singhal & Others",Seed Funding,"200,000",,,,,,,,,,,,,,,,,,,,,,,,,200000.0,2015-09-04,2015.0,device repair svcs,new delhi
13.0,09/04/2015,Bonhomia,Premium Beverages,New Delhi,"Kanwaljit Singh, Shripad Nadkarni, Sarvesh Shahra & Others",Seed Funding,"2,000,000",,,,,,,,,,,,,,,,,,,,,,,,,2000000.0,2015-09-04,2015.0,premium beverages,new delhi
14.0,09/04/2015,Changer Mints,Digital / Mobile Wallet,Kolkata,Hyderabad based investor,Seed Funding,"165,000",,,,,,,,,,,,,,,,,,,,,,,,,165000.0,2015-09-04,2015.0,digital / mobile wallet,kolkata
15.0,09/04/2015,Urban Ladder,Online FurnishingeCommerce,Bangalore,"Sequoia Capital, TR Capital, Steadview Capital, SAIF Partners, Kalaari Capital",Private Equity,"50,000,000",Series C,,,,,,,,,,,,,,,,,,,,,,,,50000000.0,2015-09-04,2015.0,online furnishingecommerce,bangalore
16.0,09/04/2015,Purple Squirrel,Ed-Tech,Mumbai,"Matrix Partners India, India Quotient",Private Equity,,Series B,,,,,,,,,,,,,,,,,,,,,,,,,2015-09-04,2015.0,ed-tech,mumbai
17.0,10/04/2015,Whatfix,Interactive  How-To Guides,Bangalore,"Helion Venture Partner, Powerhouse Ventures, GSF and Other angel investors",Seed Funding,"900,000",,,,,,,,,,,,,,,,,,,,,,,,,900000.0,2015-10-04,2015.0,interactive  how-to guides,bangalore
18.0,10/04/2015,iMMi Life,Mobile Health Tech,Chennai,Unitus Seed Fund,Seed Funding,,,,,,,,,,,,,,,,,,,,,,,,,,,2015-10-04,2015.0,mobile health tech,chennai
19.0,11/04/2015,Zomato,Restaurant Reviews,Gurgaon,Info Edge (India),Private Equity,"25,000,000",Late Stage,,,,,,,,,,,,,,,,,,,,,,,,25000000.0,2015-11-04,2015.0,restaurant reviews,gurgaon
20.0,13/04/2015,ZopNow,Online Grocer,Bangalore,"Dragoneer Investment, Accel Partners, Qualcomm Ventures, Times Internet",Private Equity,"10,000,000",Series B,,,,,,,,,,,,,,,,,,,,,,,,10000000.0,2015-04-13,2015.0,online grocer,bangalore
21.0,13/04/2015,Nayi Disha,Ed-Tech,New Delhi,"Ajay Relan,",Seed Funding,"300,000",,,,,,,,,,,,,,,,,,,,,,,,,300000.0,2015-04-13,2015.0,ed-tech,new delhi
22.0,13/04.2015,The Porter,Logistics Tech,Mumbai,Kae Capital,Seed Funding,"500,000",,,,,,,,,,,,,,,,,,,,,,,,,500000.0,2015-04-13,2015.0,logistics tech,mumbai
23.0,13/04/2015,Commeasure,Online Hotel Booking,Noida,Jungle Ventures,Seed Funding,"1,000,000",,,,,,,,,,,,,,,,,,,,,,,,,1000000.0,2015-04-13,2015.0,online hotel booking,noida
24.0,13/04/2015,Capricoast,Online Kitchen Furniture,Bangalore,Accel Partners India,Seed Funding,"1,250,000",,,,,,,,,,,,,,,,,,,,,,,,,1250000.0,2015-04-13,2015.0,online kitchen furniture,bangalore
25.0,14/04/2015,LocalOye,Hyper-local Online Services,Mumbai,"Tiger Global Management, Lightspeed Venture Partners",Private Equity,"5,000,000",Series A,,,,,,,,,,,,,,,,,,,,,,,,5000000.0,2015-04-14,2015.0,hyper-local online services,mumbai
26.0,15/04/2015,Grofers,Hyper-Local Online/Mobile Grocery,Gurgaon,"Tiger Global, Sequoia Capital",Private Equity,"35,000,000",Series B,,,,,,,,,,,,,,,,,,,,,,,,35000000.0,2015-04-15,2015.0,hyper-local online/mobile grocery,gurgaon
27.0,15/04/2015,PepperTap,Hyper-Local Online/Mobile Grocery,Gurgaon,"SAIF Partners, Sequoia Capital",Private Equity,"10,000,000",Series A,,,,,,,,,,,,,,,,,,,,,,,,10000000.0,2015-04-15,2015.0,hyper-local online/mobile grocery,gurgaon
28.0,15/04/2015,PolicyBazaar,Online Policy Aggregator,Gurgaon,"PremjiInvest, Tiger Global, Ribbit Capital",Private Equity,"40,000,000",Series D,,,,,,,,,,,,,,,,,,,,,,,,40000000.0,2015-04-15,2015.0,online policy aggregator,gurgaon
29.0,16/04/2015,UrbanClap,Hyperlocal Mobile Services Marketplace,New Delhi,"SAIF Partners, Accel Partners, Kunal Bahl, Rohit Bansal",Seed Funding,"1,600,000",,,,,,,,,,,,,,,,,,,,,,,,,1600000.0,2015-04-16,2015.0,hyperlocal mobile services marketplace,new delhi
30.0,16/04/2015,Taskbob,OnDemandMobile Handyman Services,Mumbai,"Orios Venture Partners, Mayfield India",Seed Funding,"1,200,000",,,,,,,,,,,,,,,,,,,,,,,,,1200000.0,2015-04-16,2015.0,ondemandmobile handyman services,mumbai
31.0,17/04/2015,Robosoft,Mobile App Development,Udupi,"Ascent Capital, Kalaari Capital",Private Equity,"12,000,000",Series B,,,,,,,,,,,,,,,,,,,,,,,,12000000.0,2015-04-17,2015.0,mobile app development,udupi
32.0,18/04/2015,Doormint,On-Demand Handyman Services,Mumbai,Powai Lake Ventures,Seed Funding,,,,,,,,,,,,,,,,,,,,,,,,,,,2015-04-18,2015.0,on-demand handyman services,mumbai
33.0,20/04/2015,Vyomo,Beauty & Wellness Mobile App,Gurgaon,YouWeCan Ventures,Seed Funding,,,,,,,,,,,,,,,,,,,,,,,,,,,2015-04-20,2015.0,beauty & wellness mobile app,gurgaon
34.0,20/04/2015,Pastiwala,Material Collection & Recycling,Vadodara,Agnus Capital,Private Equity,"4,000,000",Series A,,,,,,,,,,,,,,,,,,,,,,,,4000000.0,2015-04-20,2015.0,material collection & recycling,vadodara
35.0,20/04/2015,1mg (Healthkartplus),Online Pharmacy & Drug DB,Gurgaon,"Deep Kalra, Sequoia Capital, Omidyar Network, Intel Capital & Kae Capital",Private Equity,"6,000,000",Series A,,,,,,,,,,,,,,,,,,,,,,,,6000000.0,2015-04-20,2015.0,online pharmacy & drug db,gurgaon
36.0,20/04/2015,Freshdesk,Online / Mobile Customer Support,Chennai,"Tiger Global, Google Capital & Accel Partners",Private Equity,"50,000,000",Series E,,,,,,,,,,,,,,,,,,,,,,,,50000000.0,2015-04-20,2015.0,online / mobile customer support,chennai
37.0,20/04/2015,Sulekha.com,Online Classifieds & Listings,Chennai,GIC ventures,Private Equity,"28,000,000",Series C,,,,,,,,,,,,,,,,,,,,,,,,28000000.0,2015-04-20,2015.0,online classifieds & listings,chennai
38.0,22/04/2015,FindYahan,Hyperlocal services marketplace,New Delhi,The Phoenix Fund,Private Equity,,Series A,,,,,,,,,,,,,,,,,,,,,,,,,2015-04-22,2015.0,hyperlocal services marketplace,new delhi
39.0,22/04/2015,Eat.Shop.Love,Fashion ECommerce,Bangalore,Undisclosed Investor,Private Equity,"3,500,000",Series A,,,,,,,,,,,,,,,,,,,,,,,,3500000.0,2015-04-22,2015.0,fashion ecommerce,bangalore
40.0,22/04/2015,Avanti Learning,Private Coaching Centers,New Delhi,"Michael & Susan Dell Foundation, Pearson Learning Fund",Private Equity,"1,500,000",Series A,,,,,,,,,,,,,,,,,,,,,,,,1500000.0,2015-04-22,2015.0,private coaching centers,new delhi
41.0,23/04/2015,Simplilearn,Online Certification Courses,Bangalore,"Mayfield Ventures, Kalaari Capital, Helion Ventures",Private Equity,"15,000,000",Series C,,,,,,,,,,,,,,,,,,,,,,,,15000000.0,2015-04-23,2015.0,online certification courses,bangalore
42.0,23/04/2015,Craftstvilla,Ethnic Product eCommerce,Mumbai,"Sequoia Capital, Nexus venture Partners, Lightspeed Ventures, GFC",Private Equity,"18,000,000",Series B,,,,,,,,,,,,,,,,,,,,,,,,18000000.0,2015-04-23,2015.0,ethnic product ecommerce,mumbai
43.0,23/04/2015,HeadOut,Last Minute Travel Deals mobile marketplace,Bangalore / SFO,"Version One Ventures, 500 Startups, Nexus Venture Partners and Arena Ventures",Seed Funding,"1,800,000",,,,,,,,,,,,,,,,,,,,,,,,,1800000.0,2015-04-23,2015.0,last minute travel deals mobile marketplace,bangalore / sfo
44.0,23/04/2015,happay,business expense management,Bangalore,AngelPrime,Seed Funding,"500,000",,,,,,,,,,,,,,,,,,,,,,,,,500000.0,2015-04-23,2015.0,business expense management,bangalore
45.0,23/04/2015,Jugnoo,Auto Rickshaw based Logistics,Chandigarh,"Rakesh Mathur, Vikas Taneja & others",Seed Funding,"1,000,000",,,,,,,,,,,,,,,,,,,,,,,,,1000000.0,2015-04-23,2015.0,auto rickshaw based logistics,chandigarh
46.0,23/04/2015,EazyDiner,Restaurant reservation app,New Delhi,"Deepak Shahdadpuri, Gulpreet Kohli",Seed Funding,,,,,,,,,,,,,,,,,,,,,,,,,,,2015-04-23,2015.0,restaurant reservation app,new delhi
47.0,23/04/2015,Phone Warrior,Spam Call block App,New Delhi,Lightspeed Ventures,Seed Funding,,Pre-Series A,,,,,,,,,,,,,,,,,,,,,,,,,2015-04-23,2015.0,spam call block app,new delhi
48.0,24/04/2015,Coverfox,Online Insurance Aggregator,Mumbai,"Accel US, Accel India, SAIF Partners.",Private Equity,"12,000,000",Series B,,,,,,,,,,,,,,,,,,,,,,,,12000000.0,2015-04-24,2015.0,online insurance aggregator,mumbai
49.0,27/04/2015,Torqus,Restaurant Management Platform,Pune,S S Mukherji & Others,Seed Funding,"350,000",,,,,,,,,,,,,,,,,,,,,,,,,350000.0,2015-04-27,2015.0,restaurant management platform,pune
50.0,27/04/2015,Grab,Food Logistics & Delivery,Mumbai,"Oliphans Capital, Haresh Chawla",Seed Funding,"1,000,000",,,,,,,,,,,,,,,,,,,,,,,,,1000000.0,2015-04-27,2015.0,food logistics & delivery,mumbai
51.0,27/04/2015,LogicRoots,Interactive Educational Games,Jaipur,"Ah! Ventures, Calcutta Angels,  91SpringBoard",Seed Funding,"400,000",,,,,,,,,,,,,,,,,,,,,,,,,400000.0,2015-04-27,2015.0,interactive educational games,jaipur
52.0,27/04/2015,GIBBS,Clean Tech,New Delhi,Infuse Ventures fund,Private Equity,,Series B,,,,,,,,,,,,,,,,,,,,,,,,,2015-04-27,2015.0,clean tech,new delhi
53.0,28/04/2015,Babajobs,Grey collar Job Board,Bangalore,SEEK Ltd & affiliates,Private Equity,"10,000,000",Series B,,,,,,,,,,,,,,,,,,,,,,,,10000000.0,2015-04-28,2015.0,grey collar job board,bangalore
54.0,28/04/2015,Urban Ladder,Online Furniture ecommerce,Bangalore,"Anand Rajaraman, Venky Harinarayan",Private Equity,,Series D,,,,,,,,,,,,,,,,,,,,,,,,,2015-04-28,2015.0,online furniture ecommerce,bangalore
55.0,28/04/2015,Jay Robotix,Robotic Program learning,Hyderabad,Cross Border Angels & others,Seed Funding,"250,000",,,,,,,,,,,,,,,,,,,,,,,,,250000.0,2015-04-28,2015.0,robotic program learning,hyderabad
56.0,28/04/2015,Naaptol.com,Tele-Shopping / eCommerce,Mumbai,Mitsui & Co & existing investors,Private Equity,"21,500,000",Series C,,,,,,,,,,,,,,,,,,,,,,,,21500000.0,2015-04-28,2015.0,tele-shopping / ecommerce,mumbai
57.0,29/04/2015,ReGlobe,Used Gadgets Buy / Refurbishing,Gurgaon,"Bessemer Ventures, Blume Ventures",Seed Funding,"1,000,000",,,,,,,,,,,,,,,,,,,,,,,,,1000000.0,2015-04-29,2015.0,used gadgets buy / refurbishing,gurgaon
58.0,29/04/2015,Icertis,Cloud Enterprise Software,Pune / US,"Greycroft Partners, Fidelity Growth Partners",Private Equity,"6,000,000",Series A,,,,,,,,,,,,,,,,,,,,,,,,6000000.0,2015-04-29,2015.0,cloud enterprise software,pune / us
59.0,29/04/2015,Tracxn,Startup Analytics platform,Bangalore,SAIF Partners,Private Equity,"3,500,000",Series A,,,,,,,,,,,,,,,,,,,,,,,,3500000.0,2015-04-29,2015.0,startup analytics platform,bangalore
60.0,29/04/2015,Dazo,Mobile Food Ordering app,Bangalore,"Sumit Jain, Aprameya Radhakrishna, Alok Goel, Rajan Anandan, Amit Agrawal, Vinay Goel, Gaurav Munjal, Ashish Dev Kapur",Seed Funding,,,,,,,,,,,,,,,,,,,,,,,,,,,2015-04-29,2015.0,mobile food ordering app,bangalore
61.0,29/04/2015,Tradelab,Financial Markets Software,Bangalore,Rainmatter,Seed Funding,"400,000",,,,,,,,,,,,,,,,,,,,,,,,,400000.0,2015-04-29,2015.0,financial markets software,bangalore
62.0,29/04/2015,PiQube,Hiring Analytics platform,Chennai,The HR Fund,Seed Funding,"500,000",,,,,,,,,,,,,,,,,,,,,,,,,500000.0,2015-04-29,2015.0,hiring analytics platform,chennai
63.0,29/04/2015,Travel Triangle,Online Travel Marketplace,Noida,"Bessemer Venture Partners, SAIF Partners",Private Equity,"8,000,000",Series B,,,,,,,,,,,,,,,,,,,,,,,,8000000.0,2015-04-29,2015.0,online travel marketplace,noida
1.0,01/08/2015,Snapdeal,Ecommerce Marketplace,New Delhi,"Alibaba, Foxconn, Softbank",Private Equity,"500,000,000",Late Stage Round 7th (More details),,,,,,,,,,,,,,,,,,,,,,,,500000000.0,2015-01-08,2015.0,ecommerce marketplace,new delhi
2.0,01/08/2015,Ressy,Restaurant Discount app,Pune,Mohandas Pai & others,Seed Funding,"400,000",,,,,,,,,,,,,,,,,,,,,,,,,400000.0,2015-01-08,2015.0,restaurant discount app,pune
3.0,03/08/2015,Cuelearn,Tech-enabled learning,New Delhi,Alok Mittal,Seed Funding,,,,,,,,,,,,,,,,,,,,,,,,,,,2015-03-08,2015.0,tech-enabled learning,new delhi
4.0,03/08/2015,Connect India,ECommerce Logistics provider,New Delhi,Aavishkaar,Private Equity,"5,000,000",Series A,,,,,,,,,,,,,,,,,,,,,,,,5000000.0,2015-03-08,2015.0,ecommerce logistics provider,new delhi
5.0,03/08/2015,The Home Salon,on-demand home beauty and wellness portal,Mumbai,VentureNursery,Seed Funding,,,,,,,,,,,,,,,,,,,,,,,,,,,2015-03-08,2015.0,on-demand home beauty and wellness portal,mumbai
6.0,03/08/2015,Jusride,Self Driven Car rental,Mumbai,"Alok Mittal, Zeeshan Hayat, Niraj Singh, Nikunj Jain, Anirudh Damani, Punit Goyal",Seed Funding,,,,,,,,,,,,,,,,,,,,,,,,,,,2015-03-08,2015.0,self driven car rental,mumbai
7.0,03/08/2015,Oyorooms,Budget Hotel accommodation brand,New Delhi,"SoftBank Group, Greenoaks Capital, Sequoia Capital,  Lightspeed India",Private Equity,"100,000,000",Series B,,,,,,,,,,,,,,,,,,,,,,,,100000000.0,2015-03-08,2015.0,budget hotel accommodation brand,new delhi
8.0,03/08/2015,Glowship,Energy & Environment Online Marketplace,Bangalore,Infuse Ventures,Seed Funding,,,,,,,,,,,,,,,,,,,,,,,,,,,2015-03-08,2015.0,energy & environment online marketplace,bangalore
9.0,03/08/2015,Wizrocket,User Engagment & Analytics platform,Mumbai,"Sequoia Capital, Accel Partners",Private Equity,"9,600,000",Series B,,,,,,,,,,,,,,,,,,,,,,,,9600000.0,2015-03-08,2015.0,user engagment & analytics platform,mumbai
10.0,04/08/2015,Pickingo,On-Demand Delivery Logistics,New Delhi,"Orios Venture Partners, Zishaan Hayath",Private Equity,"1,300,000",Series A,,,,,,,,,,,,,,,,,,,,,,,,1300000.0,2015-04-08,2015.0,on-demand delivery logistics,new delhi
11.0,05/08/2015,Grex,fund raising platform for startups,Pune,"Kunal Bajaj, Chandru Badrinarayanan",Seed Funding,"650,000",,,,,,,,,,,,,,,,,,,,,,,,,650000.0,2015-05-08,2015.0,fund raising platform for startups,pune
12.0,05/08/2015,LetsTransport,Logistics Tech Platform,Bangalore,"Rebright Partners, Ankush Nijhawan, Gaurav Bhatnagar, Manish Dhingra",Seed Funding,"1,300,000",,,,,,,,,,,,,,,,,,,,,,,,,1300000.0,2015-05-08,2015.0,logistics tech platform,bangalore
13.0,05/08/2015,Zo Rooms,Online budget hotel chain,New Delhi,"Tiger Global Management, Orios Venture Partners",Private Equity,"30,000,000",Series A,,,,,,,,,,,,,,,,,,,,,,,,30000000.0,2015-05-08,2015.0,online budget hotel chain,new delhi
14.0,05/08/2015,Doormint,Hyperlocal Handyman services,Mumbai,"Helion Venture Partners, Kalaari Capital",Private Equity,"3,000,000",Series A,,,,,,,,,,,,,,,,,,,,,,,,3000000.0,2015-05-08,2015.0,hyperlocal handyman services,mumbai
15.0,05/08/2015,NightStay,hotel booking app,Noida,"BedRock Ventures, Rajesh Sawhney, Shailesh Singh",Seed Funding,"500,000",,,,,,,,,,,,,,,,,,,,,,,,,500000.0,2015-05-08,2015.0,hotel booking app,noida
16.0,05/08/2015,Zocalo,Rental Accomodation finder,New Delhi,"Sachin Bhatia, Rajesh Sawhney",Seed Funding,,,,,,,,,,,,,,,,,,,,,,,,,,,2015-05-08,2015.0,rental accomodation finder,new delhi
17.0,05/08/2015,Sunday Realty Solutions,Tech Platform for property brokers,Mumbai,"Ramesh Jogani, Shailesh Viswanathan, Jay Srinivasan",Seed Funding,"785,000",,,,,,,,,,,,,,,,,,,,,,,,,785000.0,2015-05-08,2015.0,tech platform for property brokers,mumbai
18.0,06/08/2015,Klozee,Luxury Apparel rental,Bangalore,Tracxn Labs,Seed Funding,,,,,,,,,,,,,,,,,,,,,,,,,,,2015-06-08,2015.0,luxury apparel rental,bangalore
19.0,06/08/2015,Appvigil,App security  testing platform,Mumbai,"Ravi Gururaj, Gaurav Sharma, Viswanath Ramachandran, RippleWave",Seed Funding,"500,000",pre Series-A,,,,,,,,,,,,,,,,,,,,,,,,500000.0,2015-06-08,2015.0,app security  testing platform,mumbai
20.0,06/08/2015,practo,Doctor Appointment booking app,Bangalore,"Sofina, Google Capital, Altimeter Capital, Sequoia Capital Global Equities, Yuri Milner, Sequoia Capital, Matrix Partners",Private Equity,"90,000,000",Series C,,,,,,,,,,,,,,,,,,,,,,,,90000000.0,2015-06-08,2015.0,doctor appointment booking app,bangalore
21.0,06/08/2015,LoudShout,anonymous bulletin board app,New Delhi,"Sanjay Sethi, Ravi Jaipuria & others",Seed Funding,,,,,,,,,,,,,,,,,,,,,,,,,,,2015-06-08,2015.0,anonymous bulletin board app,new delhi
22.0,06/08/2015,Wetravelsolo,Travel community platform,New Delhi,"CCube Angels, Frontline Strategy",Seed Funding,,,,,,,,,,,,,,,,,,,,,,,,,,,2015-06-08,2015.0,travel community platform,new delhi
23.0,06/08/2015,Ketto,Crowd funding platform,Mumbai,"Chennai Angels, Calcutta Angels, ah! Ventures, Intellecap Impact Investment Network, Indus Age Partners, Singapore Angel Network, India Internet Fund, LetsVenture",Seed Funding,"700,000",,,,,,,,,,,,,,,,,,,,,,,,,700000.0,2015-06-08,2015.0,crowd funding platform,mumbai
23.0,06/08/2015,Ezetap,Mobile based PoS solution,Bangalore,"Horizons Ventures, Capricorn Investment Group, Social+Capital, Helion Advisors, Berggruen Holdings",Private Equity,"25,000,000",Series C,,,,,,,,,,,,,,,,,,,,,,,,25000000.0,2015-06-08,2015.0,mobile based pos solution,bangalore
24.0,06/08/2015,NDTV ecommerce venture,Car & Bike ecommerce platform,Mumbai,"Inflexionpoint, Pramod Bhasin, Sixth Sense Ventures, Vindi Banga, Hiro Mashita",Private Equity,,Series A,,,,,,,,,,,,,,,,,,,,,,,,,2015-06-08,2015.0,car & bike ecommerce platform,mumbai
25.0,07/08/2015,Carl’s Jr,Fast food Chain Franchisee,Gurgaon,YouWeCan Ventures,Seed Funding,"630,000",,,,,,,,,,,,,,,,,,,,,,,,,630000.0,2015-07-08,2015.0,fast food chain franchisee,gurgaon
26.0,07/08/2015,EasyRewardz,Loyalty Programs & Reward Points,Mumbai,"Wealth First, Ashneer Grover, Atul Phadnis",Private Equity,"500,000",Pre-Series A,,,,,,,,,,,,,,,,,,,,,,,,500000.0,2015-07-08,2015.0,loyalty programs & reward points,mumbai
27.0,07/08/2015,GIBSS,Energy saving solutions provider,Mumbai,"responsAbility Investments, Infuse Ventures",Private Equity,,Series A,,,,,,,,,,,,,,,,,,,,,,,,,2015-07-08,2015.0,energy saving solutions provider,mumbai
28.0,07/08/2015,StoreMore.in,Self-Storage Spaces,Noida,Bedrock Ventures,Seed Funding,,,,,,,,,,,,,,,,,,,,,,,,,,,2015-07-08,2015.0,self-storage spaces,noida
29.0,07/08/2015,iOrderFresh,Grocery retail Mobile app,New Delhi,Best Foodworks,Seed Funding,,,,,,,,,,,,,,,,,,,,,,,,,,,2015-07-08,2015.0,grocery retail mobile app,new delhi
30.0,10/08/2015,MyTaxiIndia,Taxi Rental platform,Gurgaon,"Nihon Kotsu,",Private Equity,"500,000",Pre Series-A,,,,,,,,,,,,,,,,,,,,,,,,500000.0,2015-10-08,2015.0,taxi rental platform,gurgaon
31.0,10/08/2015,eSadar,ecommerce,New Delhi,"Neha Vats, Gaurav Vats",Seed Funding,"80,000",,,,,,,,,,,,,,,,,,,,,,,,,80000.0,2015-10-08,2015.0,ecommerce,new delhi
32.0,10/08/2015,Actionable Analytics,Machine Learning Platform,New Delhi/ Houston,"B M Gupta, Vinod Singhal",Seed Funding,,,,,,,,,,,,,,,,,,,,,,,,,,,2015-10-08,2015.0,machine learning platform,new delhi/ houston
33.0,10/08/2015,MyPoolin,mobile social network,New Delhi,QPrize from Qualcomm Ventures,Seed Funding,"250,000",QPrize Contest Winners,,,,,,,,,,,,,,,,,,,,,,,,250000.0,2015-10-08,2015.0,mobile social network,new delhi
34.0,10/08/2015,NearBuy(previously  groupon India),Hyper-Local Ecommerce,New Delhi,Sequoia Capital,Private Equity,"16,000,000",Series A,,,,,,,,,,,,,,,,,,,,,,,,16000000.0,2015-10-08,2015.0,hyper-local ecommerce,new delhi
35.0,10/08/2015,Inkmonk,Online printing marketplace,Chennai,"Girish Mathrubootham, Phanindra Sama, Vikram Chachra, Others from LetsVenture",Seed Funding,"250,000",,,,,,,,,,,,,,,,,,,,,,,,,250000.0,2015-10-08,2015.0,online printing marketplace,chennai
36.0,10/08/2015,ToneTag,mobile payment software platform,Bangalore,Reliance Capital Venture,Private Equity,"1,000,000",Series A,,,,,,,,,,,,,,,,,,,,,,,,1000000.0,2015-10-08,2015.0,mobile payment software platform,bangalore
37.0,10/08/2015,Grey Orange,Automated Storage & Warehousing Solution,Gurgaon,Tiger Global Management,Private Equity,"30,000,000",Series B,,,,,,,,,,,,,,,,,,,,,,,,30000000.0,2015-10-08,2015.0,automated storage & warehousing solution,gurgaon
38.0,11/08/2015,Livspace,Home Design & Décor solutions,Bangalore,"Helion Ventures, Jungle Ventures & Bessemer Venture Partners",Private Equity,"8,000,000",Series A,,,,,,,,,,,,,,,,,,,,,,,,8000000.0,2015-11-08,2015.0,home design & décor solutions,bangalore
39.0,11/08/2015,WOW! MOMO,Quick Service Restaurant Chain,Kolkata,Indian Angel Network,Seed Funding,"1,600,000",,,,,,,,,,,,,,,,,,,,,,,,,1600000.0,2015-11-08,2015.0,quick service restaurant chain,kolkata
40.0,11/08/2015,RainCan,Subscription based Online Grocery platform,Pune,Ajeet Khurana & Others,Seed Funding,"100,000",,,,,,,,,,,,,,,,,,,,,,,,,100000.0,2015-11-08,2015.0,subscription based online grocery platform,pune
41.0,11/08/2015,Allygrow Technologies,engineering services company,Mumbai,Zodius Technology Fund,Private Equity,"20,000,000",Series A,,,,,,,,,,,,,,,,,,,,,,,,20000000.0,2015-11-08,2015.0,engineering services company,mumbai
42.0,11/08/2015,Infogain,Business and IT consulting,New Delhi / US,ChrysCapital,Private Equity,"63,000,000",,,,,,,,,,,,,,,,,,,,,,,,,63000000.0,2015-11-08,2015.0,business and it consulting,new delhi / us
43.0,12/08/2015,OneAssist,Credit Card Fraud protection solutions,Mumbai,"Sequoia Capital, Lightspeed Ventures",Private Equity,"7,500,000",Series B,,,,,,,,,,,,,,,,,,,,,,,,7500000.0,2015-12-08,2015.0,credit card fraud protection solutions,mumbai
44.0,12/08/2015,BigBasket,Online & mobile Grocery store,Bangalore,Bessemer Venture Partners,Private Equity,"50,000,000",Series C,,,,,,,,,,,,,,,,,,,,,,,,50000000.0,2015-12-08,2015.0,online & mobile grocery store,bangalore
45.0,12/08/2015,Sheroes,Career Community for Women,Noida,"Quintillion Media, 500 Startups",Seed Funding,"770,000",,,,,,,,,,,,,,,,,,,,,,,,,770000.0,2015-12-08,2015.0,career community for women,noida
46.0,12/08/2015,Scripbox,Mutual Fund Investing platform,Bangalore,"Accel Partners, Deep Kalra, Rajesh Magow, Mohit Gupta, Shamik Sharma",Private Equity,"2,500,000",Series A,,,,,,,,,,,,,,,,,,,,,,,,2500000.0,2015-12-08,2015.0,mutual fund investing platform,bangalore
47.0,13/08/2015,betaout,Ecommerce Marketing Software Platform,Noida,"Amit Ranjan, Vijay Shekhar Sharma, Kunal Bahl, Girish Mathrubootham &  Group of other Angel investors",Seed Funding,"500,000",,,,,,,,,,,,,,,,,,,,,,,,,500000.0,2015-08-13,2015.0,ecommerce marketing software platform,noida
48.0,13/08/2015,IFMR Holdings,Financial Inclusion platform,Chennai,"Accion, LeapFrog Investments, Lok Capital",Private Equity,"25,000,000",Series B,,,,,,,,,,,,,,,,,,,,,,,,25000000.0,2015-08-13,2015.0,financial inclusion platform,chennai
49.0,13/08/2015,Massblurb,Digital Marketing automation solution,Mumbai,"LetsVenture, Mumbai Angels",Seed Funding,,,,,,,,,,,,,,,,,,,,,,,,,,,2015-08-13,2015.0,digital marketing automation solution,mumbai
50.0,13/08/2015,Agrostar,Mobile Commerce for Farmers,Pune,IDG Ventures,Private Equity,"4,000,000",Series A,,,,,,,,,,,,,,,,,,,,,,,,4000000.0,2015-08-13,2015.0,mobile commerce for farmers,pune
51.0,14/08/2015,VoxWeb,Picture based Social App,Mumbai,Jitendra Gupta & others,Seed Funding,"100,000",,,,,,,,,,,,,,,,,,,,,,,,,100000.0,2015-08-14,2015.0,picture based social app,mumbai
52.0,14/08/2015,Trukky,Logistics service platform,Ahmedabad,"Gujarat based angel investors, MMY co-Founder",Seed Funding,"245,000",,,,,,,,,,,,,,,,,,,,,,,,,245000.0,2015-08-14,2015.0,logistics service platform,ahmedabad
53.0,14/08/2015,VanityCube,On-Demand Beauty Services,New Delhi,Group of angel investors,Seed Funding,,,,,,,,,,,,,,,,,,,,,,,,,,,2015-08-14,2015.0,on-demand beauty services,new delhi
54.0,17/08/2015,Edu4Share,Exam Preparation Platform,New Delhi,Nalin Jain & other angel investors,Seed Funding,"220,000",,,,,,,,,,,,,,,,,,,,,,,,,220000.0,2015-08-17,2015.0,exam preparation platform,new delhi
55.0,17/08/2015,YourStory,Startup Focused Online Publisher,Mumbai,"Ratan Tata, Vani Kola, T V Mohandas Pai, Karthee Madasamay",Seed Funding,,,,,,,,,,,,,,,,,,,,,,,,,,,2015-08-17,2015.0,startup focused online publisher,mumbai
56.0,17/08/2015,Sampurnearth,Waste Management Solutions,Mumbai,"Intellecap Impact Investment Network, family office fund",Seed Funding,"160,000",,,,,,,,,,,,,,,,,,,,,,,,,160000.0,2015-08-17,2015.0,waste management solutions,mumbai
57.0,17/08/2015,Orobind,App based Fitness coaching,Bangalore,Existing & New Investors,Private Equity,,pre series A,,,,,,,,,,,,,,,,,,,,,,,,,2015-08-17,2015.0,app based fitness coaching,bangalore
58.0,17/08/2015,Fixy,On demand cleaning & fixing services,Mumbai,VentureNursery,Seed Funding,,,,,,,,,,,,,,,,,,,,,,,,,,,2015-08-17,2015.0,on demand cleaning & fixing services,mumbai
59.0,17/08/2015,MSM Box,Beauty & Lifestyle platform,New Delhi,Rohit Goel,Seed Funding,,,,,,,,,,,,,,,,,,,,,,,,,,,2015-08-17,2015.0,beauty & lifestyle platform,new delhi
60.0,17/08/2015,ShadowFax,on-demand delivery service,Gurgaon,"Kunal Bahl, Rohit Bansal, Zishaan Hayath, Prashant Malik",Seed Funding,"310,000",,,,,,,,,,,,,,,,,,,,,,,,,310000.0,2015-08-17,2015.0,on-demand delivery service,gurgaon
61.0,17/08/2015,Gadgets 360,Car & Bike ecommerce platform,New Delhi,One97 Communications,Private Equity,,Strategic Investment,,,,,,,,,,,,,,,,,,,,,,,,,2015-08-17,2015.0,car & bike ecommerce platform,new delhi
62.0,18/08/2015,Roposo,Fashion Discovery platform,Gurgaon,Tiger Global,Private Equity,"15,000,000",Series B,,,,,,,,,,,,,,,,,,,,,,,,15000000.0,2015-08-18,2015.0,fashion discovery platform,gurgaon
63.0,18/08/2015,IntelligenceNODE,Data Analytics Platform,Mumbai,"New Enterprise Associates, Orios Venture Partners",Private Equity,"4,200,000",Series A,,,,,,,,,,,,,,,,,,,,,,,,4200000.0,2015-08-18,2015.0,data analytics platform,mumbai
64.0,18/08/2015,HyperVerge,Deep Learning Cloud Algorithms,Chennai,"NEA, Milliways Ventures, Naya Ventures",Seed Funding,"1,000,000",,,,,,,,,,,,,,,,,,,,,,,,,1000000.0,2015-08-18,2015.0,deep learning cloud algorithms,chennai
65.0,18/08/2015,Twyst,Location based engagement & rewards platform,Gurgaon,"Rohit Bhatia, Sunil Nikhar, Vaibhav Domkundwar, Siddharth Nautiyal",Seed Funding,,,,,,,,,,,,,,,,,,,,,,,,,,,2015-08-18,2015.0,location based engagement & rewards platform,gurgaon
66.0,18/08/2015,IDfy,Online Identity Verification Services platform,Mumbai,"NEA, Blume Ventures & others",Private Equity,,Series A,,,,,,,,,,,,,,,,,,,,,,,,,2015-08-18,2015.0,online identity verification services platform,mumbai
67.0,18/08/2015,Zoojoo.be,Corporate Wellness App,Bangalore,RoundGlass Partners,Private Equity,"1,000,000",Series A,,,,,,,,,,,,,,,,,,,,,,,,1000000.0,2015-08-18,2015.0,corporate wellness app,bangalore
68.0,19/08/2015,Fashionove,Fashion Search & Review Platform,Kolkata,Umesh Yadav,Seed Funding,,,,,,,,,,,,,,,,,,,,,,,,,,,2015-08-19,2015.0,fashion search & review platform,kolkata
69.0,19/08/2015,TimeSaverz,"Hyperlocal Maintenance, Repair & Cleaning services",Mumbai,Unilazer Ventures,Private Equity,"2,400,000",,,,,,,,,,,,,,,,,,,,,,,,,2400000.0,2015-08-19,2015.0,"hyperlocal maintenance, repair & cleaning services",mumbai
70.0,19/08/2015,Envoged,pre-owned Luxury online apparel seller,Mumbai,"Manish Dhingra, Ankush Nijhawa, Gaurav Bhatnagar",Seed Funding,,,,,,,,,,,,,,,,,,,,,,,,,,,2015-08-19,2015.0,pre-owned luxury online apparel seller,mumbai
71.0,19/08/2015,MebelKart,Online Furniture Marketplace,Bangalore,AskMe,Private Equity,"20,000,000",,,,,,,,,,,,,,,,,,,,,,,,,20000000.0,2015-08-19,2015.0,online furniture marketplace,bangalore
72.0,20/08/2015,LabsAdvisor,Online Diagnostic Tests Marketplace,New Delhi,Group of Angel Investors,Seed Funding,"156,000",,,,,,,,,,,,,,,,,,,,,,,,,156000.0,2015-08-20,2015.0,online diagnostic tests marketplace,new delhi
73.0,20/08/2015,Flatpebble,Online marketplace for Photographers,Hyderabad,Indian Angel Network,Seed Funding,"600,000",,,,,,,,,,,,,,,,,,,,,,,,,600000.0,2015-08-20,2015.0,online marketplace for photographers,hyderabad
74.0,20/08/2015,Bluegape.com,Visual Blogging platform,New Delhi,"ah! Ventures, Times Internet, Rudy Gopalakrishnan",Seed Funding,"600,000",,,,,,,,,,,,,,,,,,,,,,,,,600000.0,2015-08-20,2015.0,visual blogging platform,new delhi
75.0,21/08/2015,ePoise,Job Search Platform,Bangalore,"Orios Venture Partners, Amit Ranjan & others",Seed Funding,"500,000",,,,,,,,,,,,,,,,,,,,,,,,,500000.0,2015-08-21,2015.0,job search platform,bangalore
76.0,24/08/2015,Jolly Food Fellow,Food Customer analytics platform,Ahmedabad,The 1947,Seed Funding,"300,000",,,,,,,,,,,,,,,,,,,,,,,,,300000.0,2015-08-24,2015.0,food customer analytics platform,ahmedabad
77.0,24/08/2015,BookMeIn,Professional Service Appointment booking service,Mumbai,Ajmera Group of Companies,Seed Funding,"400,000",,,,,,,,,,,,,,,,,,,,,,,,,400000.0,2015-08-24,2015.0,professional service appointment booking service,mumbai
78.0,24/08/2015,iZofy,Scientific Horoscope Online Assistance platform,Kolkata,Prime Capital Markets Ltd,Seed Funding,,,,,,,,,,,,,,,,,,,,,,,,,,,2015-08-24,2015.0,scientific horoscope online assistance platform,kolkata
79.0,24/08/2015,rBus,Tech enabled AC bus service,Mumbai,"India Quotient, Anupam Mittal & others",Seed Funding,,,,,,,,,,,,,,,,,,,,,,,,,,,2015-08-24,2015.0,tech enabled ac bus service,mumbai
80.0,25/08/2015,Qyk App,On-Demand App based Professional service provider,Bangalore,"GrowX ventures, Tracxn Labs, Powai Lake Ventures, and Sahil Barua",Private Equity,"1,000,000",pre-series A,,,,,,,,,,,,,,,,,,,,,,,,1000000.0,2015-08-25,2015.0,on-demand app based professional service provider,bangalore
81.0,25/08/2015,EazyDiner,Restaurant Reservation Platform,Gurgaon,"DSG Consumer Partners, Saama Capital",Private Equity,"3,000,000",Series A,,,,,,,,,,,,,,,,,,,,,,,,3000000.0,2015-08-25,2015.0,restaurant reservation platform,gurgaon
82.0,25/08/2015,RevX,Cross-channel CRM platform,Mumbai,"Norwest Venture Partners, Nexus Venture Partners, Helion Venture Partners, Draper Fisher Jurvetson, Peepul Capital",Private Equity,"4,000,000",Series A,,,,,,,,,,,,,,,,,,,,,,,,4000000.0,2015-08-25,2015.0,cross-channel crm platform,mumbai
83.0,25/08/2015,ICustomMadeIt,Professional Custom creators Marketplace,Pune,Group of Angel Investors,Seed Funding,"250,000",,,,,,,,,,,,,,,,,,,,,,,,,250000.0,2015-08-25,2015.0,professional custom creators marketplace,pune
84.0,26/08/2015,PickMyLaundry,on-Demand Washing & Dry-Cleaning,New Delhi,GHV Accelerator,Seed Funding,"100,000",,,,,,,,,,,,,,,,,,,,,,,,,100000.0,2015-08-26,2015.0,on-demand washing & dry-cleaning,new delhi
85.0,26/08/2015,Belita,On-Demand Beauty Service,Mumbai,"India Quotient, LetsVenture investors, Lead Angels",Seed Funding,"400,000",,,,,,,,,,,,,,,,,,,,,,,,,400000.0,2015-08-26,2015.0,on-demand beauty service,mumbai
86.0,26/08/2015,EzySolare,solar products and services marketplace,Ahmedabad,Infuse Ventures,Seed Funding,,,,,,,,,,,,,,,,,,,,,,,,,,,2015-08-26,2015.0,solar products and services marketplace,ahmedabad
87.0,26/08/2015,FoodTalkIndia,Online Food Community Platform,Gurgaon,Undisclosed Investor,Seed Funding,"500,000",,,,,,,,,,,,,,,,,,,,,,,,,500000.0,2015-08-26,2015.0,online food community platform,gurgaon
88.0,27/08/2015,InstaSafe,Private Cloud Networks SAAS platform,Bangalore,Group of Investors,Seed Funding,,,,,,,,,,,,,,,,,,,,,,,,,,,2015-08-27,2015.0,private cloud networks saas platform,bangalore
89.0,27/08/2015,Eazy Coach,Education Marketplace,Kolkata,Ravi Agarwal,Seed Funding,,,,,,,,,,,,,,,,,,,,,,,,,,,2015-08-27,2015.0,education marketplace,kolkata
90.0,27/08/2015,Djubo.com,Cloud Based Hotel Sales Platform,New Delhi,Ibibo Group,Private Equity,,Strategic Investment,,,,,,,,,,,,,,,,,,,,,,,,,2015-08-27,2015.0,cloud based hotel sales platform,new delhi
91.0,28/08/2015,BetterButter.in,online recipe sharing platform,New Delhi,"Growx Ventures, Manish Singhal",Seed Funding,,,,,,,,,,,,,,,,,,,,,,,,,,,2015-08-28,2015.0,online recipe sharing platform,new delhi
92.0,28/08/2015,Vyomo,Beauty & Lifestyle Mobile Marketplace,Bangalore,Rocket Internet,Private Equity,"2,000,000",Pre-Series A,,,,,,,,,,,,,,,,,,,,,,,,2000000.0,2015-08-28,2015.0,beauty & lifestyle mobile marketplace,bangalore
93.0,28/08/2015,RollMafia,QSR Restaurant Chain,Pune,Equentia Natural Resources,Seed Funding,"160,000",,,,,,,,,,,,,,,,,,,,,,,,,160000.0,2015-08-28,2015.0,qsr restaurant chain,pune
94.0,29/08/2015,iamwire,Digital Media publishing platform,Gurgaon,"Li Tao, Li Jian, Draphant Consultants, Nitin Garg, Saurabh Jain, Mohit Agarwal",Seed Funding,,,,,,,,,,,,,,,,,,,,,,,,,,,2015-08-29,2015.0,digital media publishing platform,gurgaon
95.0,31/08/2015,DropKaffe,Online Coffee Delivery platform,Bangalore,"Manish Singhal, P39 Capital & Others",Seed Funding,"300,000",,,,,,,,,,,,,,,,,,,,,,,,,300000.0,2015-08-31,2015.0,online coffee delivery platform,bangalore
96.0,31/08/2015,Reverie,Language Localization Cloud platform,Bangalore,"Aspada Investment Advisors, Qualcomm Ventures",Private Equity,"4,000,000",Series A,,,,,,,,,,,,,,,,,,,,,,,,4000000.0,2015-08-31,2015.0,language localization cloud platform,bangalore
97.0,31/08/2015,Infinite Analytics,Big Data & predictive Analysis Platform,Mumbai,"Ratan Tata, Nikhil Vora & others",Private Equity,,Bridge Round,,,,,,,,,,,,,,,,,,,,,,,,,2015-08-31,2015.0,big data & predictive analysis platform,mumbai
98.0,31/08/2015,,,,,,,,,,,,,,,,,,,,,,,,,,,,,,,,2015-08-31,2015.0,,
99.0,31/08/2015,,,,,,,,,,,,,,,,,,,,,,,,,,,,,,,,2015-08-31,2015.0,,
1.0,01/12/2015,CollegeDekho,Online Education Information platform,Jaipur,GirnarSoft,Seed Funding,"1,000,000",,,,,,,,,,,,,,,,,,,,,,,,,1000000.0,2015-01-12,2015.0,online education information platform,jaipur
2.0,01/12/2015,Black White Orange Brands,Brand Licensing Startup,Mumbai,YouWeCan Ventures,Seed Funding,,,,,,,,,,,,,,,,,,,,,,,,,,,2015-01-12,2015.0,brand licensing startup,mumbai
3.0,01/12/2015,Biteclub,Gourmet Food Discovery & Delivery platform,Gurgaon,growX ventures,Private Equity,,Pre-Series A,,,,,,,,,,,,,,,,,,,,,,,,,2015-01-12,2015.0,gourmet food discovery & delivery platform,gurgaon
4.0,01/12/2015,Patel Logistics,Transportation & Logistics Platform,Mumbai,Frontline Strategy,Private Equity,"5,600,000",,,,,,,,,,,,,,,,,,,,,,,,,5600000.0,2015-01-12,2015.0,transportation & logistics platform,mumbai
5.0,01/12/2015,Wigzo,Enterprise Marketing Automation platform,New Delhi,"Aarin Capital Partners, TV Mohandas Pai",Seed Funding,"500,000",Pre-Series A,,,,,,,,,,,,,,,,,,,,,,,,500000.0,2015-01-12,2015.0,enterprise marketing automation platform,new delhi
6.0,01/12/2015,Zapluk,"Health, Wellness & Beauty Services App",Hyderabad,,Seed Funding,,,,,,,,,,,,,,,,,,,,,,,,,,,2015-01-12,2015.0,"health, wellness & beauty services app",hyderabad
7.0,01/12/2015,Godof Hospitals,Digital Healthcare,New Delhi,Pankaj Gupta,Seed Funding,"2,000,000",,,,,,,,,,,,,,,,,,,,,,,,,2000000.0,2015-01-12,2015.0,digital healthcare,new delhi
8.0,02/12/2015,RoomsTonite,Last Minute Hotel Booking App,Bangalore,"Lashit Sanghvi, Nikhil Vora, Venkat Vardhan,Mohammed Bin Abdul Rehman Al Khalifa,  Ralph Berezan, Vissal Mathew,  Balamurali Krishna",Seed Funding,"1,500,000",,,,,,,,,,,,,,,,,,,,,,,,,1500000.0,2015-02-12,2015.0,last minute hotel booking app,bangalore
9.0,02/12/2015,Kaaryah,Womens Fashion Wear Portal,New Delhi,"The Saha Fund, TV Mohandas Pai",Private Equity,,Pre-Series A,,,,,,,,,,,,,,,,,,,,,,,,,2015-02-12,2015.0,womens fashion wear portal,new delhi
10.0,03/12/2015,Anakage,Product Learning platform,Bangalore,CIO Angel Network (CAN),Seed Funding,,,,,,,,,,,,,,,,,,,,,,,,,,,2015-03-12,2015.0,product learning platform,bangalore
11.0,03/12/2015,EasyKhaana,Online Food ordering & Delivery platform,New Delhi,Undisclosed investors,Seed Funding,"100,000",,,,,,,,,,,,,,,,,,,,,,,,,100000.0,2015-03-12,2015.0,online food ordering & delivery platform,new delhi
12.0,03/12/2015,Shuttl,App based Bus Pooling Services,Gurgaon,"Sequoia Capital, Times Internet Ltd & One more Fund",Private Equity,"20,000,000",Series B,,,,,,,,,,,,,,,,,,,,,,,,20000000.0,2015-03-12,2015.0,app based bus pooling services,gurgaon
13.0,03/12/2015,Eckovation,Social Learning Platform,New Delhi,Chandigarh Angel Network (CAN),Seed Funding,,,,,,,,,,,,,,,,,,,,,,,,,,,2015-03-12,2015.0,social learning platform,new delhi
14.0,03/12/2015,Fitcircle,Social Fitness platform,Mumbai,Beerud Sheth and Ravi Mantha,Seed Funding,,Pre-Series A,,,,,,,,,,,,,,,,,,,,,,,,,2015-03-12,2015.0,social fitness platform,mumbai
15.0,04/12/2015,Applop,On Demand Mobile app developer,Kolkata,GHV Accelerator,Seed Funding,"100,000",,,,,,,,,,,,,,,,,,,,,,,,,100000.0,2015-04-12,2015.0,on demand mobile app developer,kolkata
16.0,04/12/2015,CaRPM,Car Maintenance & Management mobile app,Gurgaon,GHV Accelerator,Seed Funding,"100,000",,,,,,,,,,,,,,,,,,,,,,,,,100000.0,2015-04-12,2015.0,car maintenance & management mobile app,gurgaon
17.0,04/12/2015,NDTV Wedding portal,Online Wedding Marketplace,New Delhi,CerraCap,Private Equity,"20,000,000",Series A,,,,,,,,,,,,,,,,,,,,,,,,20000000.0,2015-04-12,2015.0,online wedding marketplace,new delhi
18.0,04/12/2015,Splitkart,Splitting Bills Mobile App,New Delhi,"Rajesh Sawhney, Anupam Mittal, Dinesh Agarwal, Gaurav Gupta,",Seed Funding,,,,,,,,,,,,,,,,,,,,,,,,,,,2015-04-12,2015.0,splitting bills mobile app,new delhi
19.0,07/12/2015,Zenatix,IOT Energy Management Analytics platform,Gurgaon,Blume Ventures,Private Equity,,Pre-Series A,,,,,,,,,,,,,,,,,,,,,,,,,2015-07-12,2015.0,iot energy management analytics platform,gurgaon
20.0,07/12/2015,Customfurnish,Custom Made furniture e-tailer,Hyderabad,Agnus Capital,Private Equity,"4,500,000",Series A,,,,,,,,,,,,,,,,,,,,,,,,4500000.0,2015-07-12,2015.0,custom made furniture e-tailer,hyderabad
21.0,07/12/2015,Faasos,QSR Chain,Pune,"ru-Net, Sequoia Capital,  Lightbox Ventures",Private Equity,"30,000,000",Series C,,,,,,,,,,,,,,,,,,,,,,,,30000000.0,2015-07-12,2015.0,qsr chain,pune
22.0,07/12/2015,Vlurn,eLearning platform,Mumbai,Vidyadhar Sarfare,Seed Funding,,,,,,,,,,,,,,,,,,,,,,,,,,,2015-07-12,2015.0,elearning platform,mumbai
23.0,07/12/2015,Leaf Wearables,Smart Safety Wearable Devices,New Delhi,"Ajeet Khurana Jinesh Shah, Vikram Chachra, Dr. Aniruddha Malpani",Seed Funding,"250,000",,,,,,,,,,,,,,,,,,,,,,,,,250000.0,2015-07-12,2015.0,smart safety wearable devices,new delhi
24.0,07/12/2015,Coolshare,Cab Sharing service Mobile app,Mumbai,Gopal Aggarwal,Seed Funding,"100,000",,,,,,,,,,,,,,,,,,,,,,,,,100000.0,2015-07-12,2015.0,cab sharing service mobile app,mumbai
25.0,08/12/2015,mFicient,Cloud Enterprise Mobility Platform,New Delhi,Undisclosed investors,Seed Funding,,,,,,,,,,,,,,,,,,,,,,,,,,,2015-08-12,2015.0,cloud enterprise mobility platform,new delhi
26.0,08/12/2015,HeyBiz,Online Shopping Assistant Mobile app,New Delhi,Shopclues,Seed Funding,,Strategic Funding,,,,,,,,,,,,,,,,,,,,,,,,,2015-08-12,2015.0,online shopping assistant mobile app,new delhi
27.0,08/12/2015,Yumist,Home Cooked Food Order & Delivery platform,Gurgaon,"Unilazer Ventures, Orios Venture Partners, Steven Lurie",Private Equity,"2,000,000",Series A,,,,,,,,,,,,,,,,,,,,,,,,2000000.0,2015-08-12,2015.0,home cooked food order & delivery platform,gurgaon
28.0,09/12/2015,Jigsaw Academy,Online School for Analytics learning,Bangalore,Manipal Global Education Services,Private Equity,"3,000,000",Series A,,,,,,,,,,,,,,,,,,,,,,,,3000000.0,2015-09-12,2015.0,online school for analytics learning,bangalore
29.0,09/12/2015,JoeHukum,Chat based personal Assistant App,Gurgaon,"TracxnLabs, Jitendra Gupta, Prashant Tandon",Seed Funding,,,,,,,,,,,,,,,,,,,,,,,,,,,2015-09-12,2015.0,chat based personal assistant app,gurgaon
30.0,09/12/2015,Voxweb,Picture creation & Social mobile app,Mumbai,Undisclosed Investor,Seed Funding,"350,000",,,,,,,,,,,,,,,,,,,,,,,,,350000.0,2015-09-12,2015.0,picture creation & social mobile app,mumbai
31.0,09/12/2015,Aye Finance,Nonbanking finance company,New Delhi,"SAIF Partners, Accion",Private Equity,"3,000,000",Series B,,,,,,,,,,,,,,,,,,,,,,,,3000000.0,2015-09-12,2015.0,nonbanking finance company,new delhi
32.0,09/12/2015,JumboBasket,eCommerce returns etailer,Chandigarh,Chandigarh Angels Network,Seed Funding,,,,,,,,,,,,,,,,,,,,,,,,,,,2015-09-12,2015.0,ecommerce returns etailer,chandigarh
33.0,10/12/2015,BlackBuck,Online Freight Services Aggregator,Bangalore,"Tiger Global Management, Yuri Milner, Apoletto, Accel Partners, Flipkart",Private Equity,"25,000,000",Series B,,,,,,,,,,,,,,,,,,,,,,,,25000000.0,2015-10-12,2015.0,online freight services aggregator,bangalore
34.0,10/12/2015,HomeStudio,Online Branded Furniture etailer,Bangalore,Bren Corporation,Private Equity,"5,000,000",Series A,,,,,,,,,,,,,,,,,,,,,,,,5000000.0,2015-10-12,2015.0,online branded furniture etailer,bangalore
35.0,10/12/2015,PropheSee,Digital Analytics Platform,New Delhi,"Indian Angel Network, Stanford Angels, Entrepreneurs India",Seed Funding,"500,000",,,,,,,,,,,,,,,,,,,,,,,,,500000.0,2015-10-12,2015.0,digital analytics platform,new delhi
36.0,10/12/2015,i2e1,Internet Network Infrastructure Services,New Delhi,GrowX Ventures,Seed Funding,"500,000",,,,,,,,,,,,,,,,,,,,,,,,,500000.0,2015-10-12,2015.0,internet network infrastructure services,new delhi
37.0,10/12/2015,Holisol Logistics,Supply Chain & Logistics Solutions,New Delhi,CLSA Capital Partners ARIA IV Funds,Private Equity,"10,000,000",,,,,,,,,,,,,,,,,,,,,,,,,10000000.0,2015-10-12,2015.0,supply chain & logistics solutions,new delhi
38.0,10/12/2015,Stay Simple Resorts,Holiday Resort Chain,Bangalore,"Mr. Sudhir & Ms. Shalini Sethi, Mr. Praveen Someshwar",Seed Funding,,,,,,,,,,,,,,,,,,,,,,,,,,,2015-10-12,2015.0,holiday resort chain,bangalore
39.0,10/12/2015,Paynear,Mobile Point of Sale solutions,Hyderabad,Mitesh Majithia,Private Equity,"2,500,000",Pre-Series A,,,,,,,,,,,,,,,,,,,,,,,,2500000.0,2015-10-12,2015.0,mobile point of sale solutions,hyderabad
40.0,10/12/2015,Chillr,Peer-to-Peer Money Transfer & Recharge App,Mumbai,"Sequoia Capital, Blume Ventures, Uniqorn Ventures and other",Private Equity,"7,000,0000",Series A,,,,,,,,,,,,,,,,,,,,,,,,70000000.0,2015-10-12,2015.0,peer-to-peer money transfer & recharge app,mumbai
41.0,11/12/2015,EureQa,Test Automation SAAS platform,Hyderabad/USA,"Sashi Reddi, Gabriel Investments",Seed Funding,"600,000",,,,,,,,,,,,,,,,,,,,,,,,,600000.0,2015-11-12,2015.0,test automation saas platform,hyderabad/usa
42.0,11/12/2015,LocalCircles,Citizens Engagement Platform,Noida,Anand Mahindra,Private Equity,,,,,,,,,,,,,,,,,,,,,,,,,,,2015-11-12,2015.0,citizens engagement platform,noida
43.0,11/12/2015,GetFocus,Indoor Navigation & Analytics Solutions,Mumbai,Undisclosed investors,Seed Funding,,,,,,,,,,,,,,,,,,,,,,,,,,,2015-11-12,2015.0,indoor navigation & analytics solutions,mumbai
44.0,11/12/2015,UrbanClap,Hyperlocal On-Demand Household Services platform,Gurgaon,Ratan Tata,Private Equity,,,,,,,,,,,,,,,,,,,,,,,,,,,2015-11-12,2015.0,hyperlocal on-demand household services platform,gurgaon
45.0,11/12/2015,OnlineRTI,Online RTI application services,Bangalore,"LetsVenture, Mohandas Pai",Seed Funding,"150,000",,,,,,,,,,,,,,,,,,,,,,,,,150000.0,2015-11-12,2015.0,online rti application services,bangalore
46.0,11/12/2015,Powerstores,ECommerce Website Creation SAAS platform,Goa,Extreme Venture Partners  William Bissell,Seed Funding,,,,,,,,,,,,,,,,,,,,,,,,,,,2015-11-12,2015.0,ecommerce website creation saas platform,goa
47.0,11/12/2015,Weddingz.in,Wedding Venues & Vendors Marketplace,Mumbai,"Rajan Anandan, Zoya Akhtar, Reema Kagati, Ruchi Narain, Amrish Kumar, Hrishikesh Parandekar",Seed Funding,"1,000,000",,,,,,,,,,,,,,,,,,,,,,,,,1000000.0,2015-11-12,2015.0,wedding venues & vendors marketplace,mumbai
48.0,11/12/2015,Intelligent Interfaces,Interface development platform for Government officials,Bangalore,"Sachin Bansal, Binny Bansal",Seed Funding,,Yet to Launch platform,,,,,,,,,,,,,,,,,,,,,,,,,2015-11-12,2015.0,interface development platform for government officials,bangalore
49.0,14/12/2015,Capricoast,Modular Furnishings Marketplace,Bangalore,"Accel Partners India, RB Investments",Private Equity,"3,500,000",Series A,,,,,,,,,,,,,,,,,,,,,,,,3500000.0,2015-12-14,2015.0,modular furnishings marketplace,bangalore
50.0,14/12/2015,JetSetGo,Private Jet Bookings Marketplace,Bangalore,Puneet Dalmia,Private Equity,,,,,,,,,,,,,,,,,,,,,,,,,,,2015-12-14,2015.0,private jet bookings marketplace,bangalore
51.0,14/12/2015,Cabsguru,Cab search Comparison & Booking platform,New Delhi,Prashanth Ranganathan,Seed Funding,"200,000",,,,,,,,,,,,,,,,,,,,,,,,,200000.0,2015-12-14,2015.0,cab search comparison & booking platform,new delhi
52.0,14/12/2015,Whoop,Performance Optimization Platform for athletes,Boston,Infosys,Private Equity,"3,000,000",Series A,,,,,,,,,,,,,,,,,,,,,,,,3000000.0,2015-12-14,2015.0,performance optimization platform for athletes,boston
53.0,15/12/2015,BookEventz,Event Venue Booking Platform,Mumbai,"Mumbai Angels, Singapore Angel Network, Zishaan Hayath",Seed Funding,,,,,,,,,,,,,,,,,,,,,,,,,,,2015-12-15,2015.0,event venue booking platform,mumbai
54.0,15/12/2015,Deal Street Asia,Digital Media Platform,Singapore,"Vijay Shekhar Sharma, Singapore Angels Network",Seed Funding,,,,,,,,,,,,,,,,,,,,,,,,,,,2015-12-15,2015.0,digital media platform,singapore
55.0,15/12/2015,Streamoid,visual search and discovery platform,Bangalore / Palo Alto,Undisclosed,Seed Funding,"1,000,000",,,,,,,,,,,,,,,,,,,,,,,,,1000000.0,2015-12-15,2015.0,visual search and discovery platform,bangalore / palo alto
56.0,16/12/2015,Housejoy,Home services marketplace,Bangalore,"Amazon, Vertex Ventures, Qualcomm, Ru-Net Technology Partners, Matrix Partners",Private Equity,"22,500,000",Series B,,,,,,,,,,,,,,,,,,,,,,,,22500000.0,2015-12-16,2015.0,home services marketplace,bangalore
57.0,16/12/2015,Bluebirch,End to End reverse logistics Solution platform,Bangalore,"Chicago Capital Ventures, Sanjay Mehta, Others",Seed Funding,"2,000,000",,,,,,,,,,,,,,,,,,,,,,,,,2000000.0,2015-12-16,2015.0,end to end reverse logistics solution platform,bangalore
58.0,16/12/2015,MeraDoctor,Virtual Health consultation app,Mumbai,Unilazer,Private Equity,"1,200,000",Pre-Series A,,,,,,,,,,,,,,,,,,,,,,,,1200000.0,2015-12-16,2015.0,virtual health consultation app,mumbai
59.0,16/12/2015,STAGE 3,Online Renting platform,New Delhi,"Nisha Sharma, Puneet Dalmia, Balaji Prabhakar",Seed Funding,,,,,,,,,,,,,,,,,,,,,,,,,,,2015-12-16,2015.0,online renting platform,new delhi
60.0,17/12/2015,Rivigo,Logistics Services Provider,Gurgaon,SAIF Partners and others,Private Equity,"30,000,000",Series B (includes Debt financing),,,,,,,,,,,,,,,,,,,,,,,,30000000.0,2015-12-17,2015.0,logistics services provider,gurgaon
61.0,17/12/2015,Springboard,Data Science & UX design Learning platform,Bangalore,"Allen Blue, John Katzman, Naveen Tewari, Kartik Hosanagar, Kashyap Deorah, 500 Startups, Blue Fog Capital",Seed Funding,"1,700,000",,,,,,,,,,,,,,,,,,,,,,,,,1700000.0,2015-12-17,2015.0,data science & ux design learning platform,bangalore
62.0,17/12/2015,Eatfresh,Online marketplace for Chef Meals,Bangalore,Kalaari Capital,Private Equity,,,,,,,,,,,,,,,,,,,,,,,,,,,2015-12-17,2015.0,online marketplace for chef meals,bangalore
63.0,18/12/2015,Ampere Vehicles,Electric Bike Manufacturers,Coimbatore,Kris Gopalakrishnan & Others,Seed Funding,"1,200,000",,,,,,,,,,,,,,,,,,,,,,,,,1200000.0,2015-12-18,2015.0,electric bike manufacturers,coimbatore
64.0,18/12/2015,Focus Digit,ECommerce platform solutions,New Delhi,Turning Ideas,Seed Funding,,,,,,,,,,,,,,,,,,,,,,,,,,,2015-12-18,2015.0,ecommerce platform solutions,new delhi
65.0,18/12/2015,The News Minute,Online Media Publication,Bangalore,Quintillion Media,Seed Funding,,,,,,,,,,,,,,,,,,,,,,,,,,,2015-12-18,2015.0,online media publication,bangalore
66.0,18/12/2015,CBREX,International Hiring Platform,Mumbai / NY,"Prahlad Rao, Sundara Rajan, Vikram Chachra",Seed Funding,"200,000",,,,,,,,,,,,,,,,,,,,,,,,,200000.0,2015-12-18,2015.0,international hiring platform,mumbai / ny
67.0,21/12/2015,TruckMandi,Logistics Service Provider Marketplace,New Delhi,"Ritesh Dwivedy, Ramakant Sharma, Mount Nathan Advisors",Private Equity,"2,000,000",Pre-Series A,,,,,,,,,,,,,,,,,,,,,,,,2000000.0,2015-12-21,2015.0,logistics service provider marketplace,new delhi
68.0,21/12/2015,Peppertap,Hyperlocal  Grocery Delivery Service,Gurgaon,Innoven Capital,Private Equity,"4,000,000",part of $40M Series B round,,,,,,,,,,,,,,,,,,,,,,,,4000000.0,2015-12-21,2015.0,hyperlocal  grocery delivery service,gurgaon
69.0,21/12/2015,KOOH Sports,Sports Education Platform,Mumbai,"TCS, HDFC, Faering Capital, Elevate Sports",Private Equity,"2,000,000",Series A,,,,,,,,,,,,,,,,,,,,,,,,2000000.0,2015-12-21,2015.0,sports education platform,mumbai
70.0,22/12/2015,RentOnGo,"Bike, Appliances Renting marketplace",Bangalore,"Anand Chandrasekaran, Rajesh Sawhney, Kalpana Tatavarti, Shivanandan Pare",Seed Funding,,,,,,,,,,,,,,,,,,,,,,,,,,,2015-12-22,2015.0,"bike, appliances renting marketplace",bangalore
71.0,22/12/2015,Industrybuying,Online Marketplace for Industrial Goods,New Delhi,"Murugappa Group, TVS Group, Vellayan Subbiah, Arathi Krishna, Arun Venkatachalam",Seed Funding,,,,,,,,,,,,,,,,,,,,,,,,,,,2015-12-22,2015.0,online marketplace for industrial goods,new delhi
72.0,22/12/2015,Zapr,Reward points mobile app,Gurgaon,Dinesh Agarwal,Seed Funding,,,,,,,,,,,,,,,,,,,,,,,,,,,2015-12-22,2015.0,reward points mobile app,gurgaon
73.0,22/12/2015,LatestOne,Mobile accessories online store,Hyderabad,Palred Technologies Ltd,Private Equity,"3,000,000",Additional investment from parent company,,,,,,,,,,,,,,,,,,,,,,,,3000000.0,2015-12-22,2015.0,mobile accessories online store,hyderabad
74.0,22/12/2015,PlanetGogo,Content Discovery & reward points platform,Gurgaon,HT Digital Media Holdings Ltd,Seed Funding,,,,,,,,,,,,,,,,,,,,,,,,,,,2015-12-22,2015.0,content discovery & reward points platform,gurgaon
75.0,22/12/2015,Arya.ai,Artificial Intelligence platform,Mumbai,"YourNest Angel Fund, Venture Nursery",Private Equity,"750,000",Series A,,,,,,,,,,,,,,,,,,,,,,,,750000.0,2015-12-22,2015.0,artificial intelligence platform,mumbai
76.0,22/12/2015,Doctor Insta,Medical Consultation & Doctor appointment booking platform,Gurgaon,"Rishi Parti, BrahmaX Ventures",Private Equity,"500,000",pre-Series A,,,,,,,,,,,,,,,,,,,,,,,,500000.0,2015-12-22,2015.0,medical consultation & doctor appointment booking platform,gurgaon
77.0,22/12/2015,MobieFit,Mobile Fitness App,Goa,Medi Assist,Private Equity,"1,000,000",Strategic Investment,,,,,,,,,,,,,,,,,,,,,,,,1000000.0,2015-12-22,2015.0,mobile fitness app,goa
78.0,23/12/2015,LafaLafa,"Digital Coupons, Deal & Cashback aggregator app",Mumbai,Vectr Ventures,Private Equity,,,,,,,,,,,,,,,,,,,,,,,,,,,2015-12-23,2015.0,"digital coupons, deal & cashback aggregator app",mumbai
79.0,23/12/2015,Mech Mocha,Mobile Game development & Design platform,Bangalore,"Blume Ventures, Flipkart",Seed Funding,"1,000,000",,,,,,,,,,,,,,,,,,,,,,,,,1000000.0,2015-12-23,2015.0,mobile game development & design platform,bangalore
80.0,23/12/2015,Shotang.com,B2B eCommerce Marketplace,Bangalore,"Exfinity Venture Partners, Unitus Impact Livelihoods Fund",Private Equity,"5,000,000",Series A,,,,,,,,,,,,,,,,,,,,,,,,5000000.0,2015-12-23,2015.0,b2b ecommerce marketplace,bangalore
81.0,23/12/2015,CityFurnish,Furniture and appliances rental platform,Gurgaon,Jitendra Gupta,Seed Funding,,,,,,,,,,,,,,,,,,,,,,,,,,,2015-12-23,2015.0,furniture and appliances rental platform,gurgaon
82.0,24/12/2015,Black White Orange,B2B Merchandize platform,Mumbai,Collaborative Licensing Ventures LLP,Seed Funding,"303,000",,,,,,,,,,,,,,,,,,,,,,,,,303000.0,2015-12-24,2015.0,b2b merchandize platform,mumbai
83.0,24/12/2015,Kolabro,Real Estate focused Tech platform,Gurgaon,"Umang Kumar, Ruchir Arora & others",Seed Funding,,,,,,,,,,,,,,,,,,,,,,,,,,,2015-12-24,2015.0,real estate focused tech platform,gurgaon
84.0,24/12/2015,Canvera,Photographer Online search & booking platform,Bangalore,Info Edge (India) Ltd,Private Equity,"2,200,000",,,,,,,,,,,,,,,,,,,,,,,,,2200000.0,2015-12-24,2015.0,photographer online search & booking platform,bangalore
85.0,28/12/2015,Town Essentials,Grocery Delivery platform,Bangalore,"Sharad Hegde, Girish Reddy, Siddharth Patil, Shrikant Patil",Seed Funding,"1,000,000",,,,,,,,,,,,,,,,,,,,,,,,,1000000.0,2015-12-28,2015.0,grocery delivery platform,bangalore
86.0,28/12/2015,Bumper,Mobile Car Servicing appointment app,Bangalore,SAIF Partners,Seed Funding,"500,000",,,,,,,,,,,,,,,,,,,,,,,,,500000.0,2015-12-28,2015.0,mobile car servicing appointment app,bangalore
87.0,29/12/2015,Hotify,New Curation Mobile App,Bangalore,Mahavir Pratap Sharma,Seed Funding,"150,000",,,,,,,,,,,,,,,,,,,,,,,,,150000.0,2015-12-29,2015.0,new curation mobile app,bangalore
88.0,29/12/2015,MobiKwik,Mobile Wallet,Gurgaon,"Sequoia Capital, Tree Line Asia, Innoven Capital",Private Equity,"6,600,000",Additional Funding,,,,,,,,,,,,,,,,,,,,,,,,6600000.0,2015-12-29,2015.0,mobile wallet,gurgaon
89.0,30/12/2015,Intelligent Interfaces,Interface development platform for Government officials,Bangalore,Yuvraj Singh,Seed Funding,,Yet to Launch,,,,,,,,,,,,,,,,,,,,,,,,,2015-12-30,2015.0,interface development platform for government officials,bangalore
1.0,02/02/2015,Faaya,,,Group of Angel Investors,SeedFunding,"16,600",At the 10 minute million event,,,,,,,,,,,,,,,,,,,,,,,,16600.0,2015-02-02,2015.0,,
2.0,02/02/2015,InstaBounce,,,Group of Angel Investors,SeedFunding,"16,600",At the 10 minute million event,,,,,,,,,,,,,,,,,,,,,,,,16600.0,2015-02-02,2015.0,,
3.0,02/02/2015,Chloroplast Foods,,,Group of Angel Investors,SeedFunding,"16,600",At the 10 minute million event,,,,,,,,,,,,,,,,,,,,,,,,16600.0,2015-02-02,2015.0,,
4.0,02/02/2015,Dealwithus,,,Group of Angel Investors,SeedFunding,"16,600",At the 10 minute million event,,,,,,,,,,,,,,,,,,,,,,,,16600.0,2015-02-02,2015.0,,
5.0,02/02/2015,CleverSharks,,,Group of Angel Investors,SeedFunding,"16,600",At the 10 minute million event,,,,,,,,,,,,,,,,,,,,,,,,16600.0,2015-02-02,2015.0,,
6.0,02/02/2015,Leaf,,,Group of Angel Investors,SeedFunding,"16,600",At the 10 minute million event,,,,,,,,,,,,,,,,,,,,,,,,16600.0,2015-02-02,2015.0,,
7.0,02/02/2015,SmartPocket,,,"Sol Primero, Rajiv Mehta",SeedFunding,"250,000",For mobile app,,,,,,,,,,,,,,,,,,,,,,,,250000.0,2015-02-02,2015.0,,
8.0,02/02/2015,Yumist,,,Orios Venture Partner,Private Equity,"1,000,000",,,,,,,,,,,,,,,,,,,,,,,,,1000000.0,2015-02-02,2015.0,,
9.0,02/02/2015,NowFloats,,,Omidyar Network,Private Equity,,Series A,,,,,,,,,,,,,,,,,,,,,,,,,2015-02-02,2015.0,,
10.0,02/02/2015,FirstCry,,,Valiant Capital Partners,Private Equity,"26,000,000",Series D,,,,,,,,,,,,,,,,,,,,,,,,26000000.0,2015-02-02,2015.0,,
11.0,02/02/2015,HolaChef,,,India Quotient,SeedFunding,"325,000",,,,,,,,,,,,,,,,,,,,,,,,,325000.0,2015-02-02,2015.0,,
12.0,03/02/2015,Frsh.co.in,,,"India Quotient, Kae Capital",SeedFunding,"518,000",,,,,,,,,,,,,,,,,,,,,,,,,518000.0,2015-03-02,2015.0,,
13.0,03/02/2015,Manthan,,,"Temasek, Norwest Venture Partners",Private Equity,"60,000,000",Series D,,,,,,,,,,,,,,,,,,,,,,,,60000000.0,2015-03-02,2015.0,,
14.0,05/02/2015,Kobster.com,,,Splice Advisors,SeedFunding,,,,,,,,,,,,,,,,,,,,,,,,,,,2015-05-02,2015.0,,
15.0,05/02/2015,Culture Machine,,,"Tiger Global, Times Internet, Zodius Capital",Private Equity,"18,000,000",Series B,,,,,,,,,,,,,,,,,,,,,,,,18000000.0,2015-05-02,2015.0,,
16.0,05/02/2015,Paytm,,,Ant Financial Services (Alipay),Private Equity,,Strategic Investment (25% stake),,,,,,,,,,,,,,,,,,,,,,,,,2015-05-02,2015.0,,
17.0,05/02/2015,Aisle.co,,,"Anand Vijay, Shashank Mehrotra & Others",SeedFunding,"100,000",,,,,,,,,,,,,,,,,,,,,,,,,100000.0,2015-05-02,2015.0,,
18.0,06/02/2015,FreeCharge,,,"Valiant Capital, Tybourne Capital, Sequoia Capital, RuNet and Sofina",Private Equity,"80,000,000",Series C,,,,,,,,,,,,,,,,,,,,,,,,80000000.0,2015-06-02,2015.0,,
19.0,06/02/2015,NewsHunt,,,"Falcon Edge Capital, Matrix Partners India, Sequoia Capital India and Omidyar Network",Private Equity,"40,000,000",Series C,,,,,,,,,,,,,,,,,,,,,,,,40000000.0,2015-06-02,2015.0,,
20.0,09/02/2015,MyNoticePeriod,,,IDG Ventures,Private Equity,"3,000,000",Series A,,,,,,,,,,,,,,,,,,,,,,,,3000000.0,2015-09-02,2015.0,,
21.0,09/02/2015,CarDekho.com,,,Ratan Tata,Private Equity,,,,,,,,,,,,,,,,,,,,,,,,,,,2015-09-02,2015.0,,
22.0,09/02/2015,Faaso’s,,,Lightbox Ventures,Private Equity,"20,000,000",Series B,,,,,,,,,,,,,,,,,,,,,,,,20000000.0,2015-09-02,2015.0,,
23.0,10/02/2015,CarTrade.com,,,Chip Perry,Private Equity,,,,,,,,,,,,,,,,,,,,,,,,,,,2015-10-02,2015.0,,
24.0,10/02/2015,StoreKing,,,Mangrove Capital Partners,Private Equity,,,,,,,,,,,,,,,,,,,,,,,,,,,2015-10-02,2015.0,,
25.0,11/02/2015,Capital Float,,,"SAIF Partners, Sequoia Capital, Aspada",Private Equity,"13,000,000",Series A,,,,,,,,,,,,,,,,,,,,,,,,13000000.0,2015-11-02,2015.0,,
26.0,11/02/2015,Nimble Wireless,,,AngelPrime,SeedFunding,"3,000,000",,,,,,,,,,,,,,,,,,,,,,,,,3000000.0,2015-11-02,2015.0,,
27.0,11/02/2015,Townscript,,,Group of Angel Investors,SeedFunding,,,,,,,,,,,,,,,,,,,,,,,,,,,2015-11-02,2015.0,,
28.0,11/02/2015,FindYahan,,,"Karan Bajwa, Parvesh Bareja , Sunjay Kapur, Amanpreet Bajaj",SeedFunding,,,,,,,,,,,,,,,,,,,,,,,,,,,2015-11-02,2015.0,,
29.0,12/02/2015,Stayzilla,,,"Nexus Venture Partners, Matrix Partners",Private Equity,"20,000,000",Series B,,,,,,,,,,,,,,,,,,,,,,,,20000000.0,2015-12-02,2015.0,,
30.0,12/02/2015,Practo,,,"Sequoia Capital, Matrix Partners",Private Equity,"30,000,000",Series B,,,,,,,,,,,,,,,,,,,,,,,,30000000.0,2015-12-02,2015.0,,
31.0,13/02/2015,CimplyFive,,,"Suresh Senapaty, TV Mohandas Pai",SeedFunding,,,,,,,,,,,,,,,,,,,,,,,,,,,2015-02-13,2015.0,,
32.0,13/02/2015,20Dresses,,,"Srinivas Aluri, Srinivas Modukury, BS Nagesh",SeedFunding,"1,000,000",,,,,,,,,,,,,,,,,,,,,,,,,1000000.0,2015-02-13,2015.0,,
33.0,13/02/2015,Itzcash,,,Ashok Goel (promoter),Private Equity,"16,500,000",Promoter Commitment,,,,,,,,,,,,,,,,,,,,,,,,16500000.0,2015-02-13,2015.0,,
34.0,16/02/2015,NewsInShorts,,,"Tiger Global, Rebright Partners, Sachin and Binny Bansal",Private Equity,"4,150,000",Series A,,,,,,,,,,,,,,,,,,,,,,,,4150000.0,2015-02-16,2015.0,,
35.0,16/02/2015,iTraveller.com,,,ah! Ventures,Private Equity,"1,000,000",Series A,,,,,,,,,,,,,,,,,,,,,,,,1000000.0,2015-02-16,2015.0,,
36.0,17/02/2015,NextGen,,,Mumbai Angels & Group of other investors,SeedFunding,,,,,,,,,,,,,,,,,,,,,,,,,,,2015-02-17,2015.0,,
37.0,18/02/2015,Wooplr.com,,,Helion Venture Partners,Private Equity,"5,000,000",Series A,,,,,,,,,,,,,,,,,,,,,,,,5000000.0,2015-02-18,2015.0,,
38.0,19/05/2015,Springleap,,,Cross Border Angels,SeedFunding,"800,000",,,,,,,,,,,,,,,,,,,,,,,,,800000.0,2015-05-19,2015.0,,
39.0,20/02/2015,Klip.in,,,"Calcutta Angels, Venture Nursery Angels Mumbai Angels",SeedFunding,"500,000",,,,,,,,,,,,,,,,,,,,,,,,,500000.0,2015-02-20,2015.0,,
40.0,20/02/2015,Renderlogy,,,Brick Eagle,Private Equity,"1,600,000",Series A,,,,,,,,,,,,,,,,,,,,,,,,1600000.0,2015-02-20,2015.0,,
41.0,21/02/2015,Appbase,,,"DA-IICT, Techstars, Carnegie Mellon University, Startup Brasil program",SeedFunding,"290,000",Grant + Seed funding,,,,,,,,,,,,,,,,,,,,,,,,290000.0,2015-02-21,2015.0,,
42.0,23/02/2015,HomeLane,,,"Sequoia Capital, Ranjan Pai, Mohandas Pai & others",Private Equity,"4,500,000",Series A,,,,,,,,,,,,,,,,,,,,,,,,4500000.0,2015-02-23,2015.0,,
43.0,23/02/2015,Trip38,,,"InterGlobe Technology Quotient, Lantern Capital",Private Equity,"1,000,000",Series A,,,,,,,,,,,,,,,,,,,,,,,,1000000.0,2015-02-23,2015.0,,
44.0,23/02/2015,Smartairtrip.com,,,Undisclosed,Private Equity,"10,000,000",Series A,,,,,,,,,,,,,,,,,,,,,,,,10000000.0,2015-02-23,2015.0,,
45.0,23/02/2015,NoBroker,,,"SAIF Partners, Fulcrum Ventures",Private Equity,"3,000,000",Series A,,,,,,,,,,,,,,,,,,,,,,,,3000000.0,2015-02-23,2015.0,,
46.0,24/02/2015,Caravan Craft Retail,,,"Unitus Seed FundNarayan Ramachandran, Bijou Kurien",SeedFunding,"500,000",,,,,,,,,,,,,,,,,,,,,,,,,500000.0,2015-02-24,2015.0,,
47.0,25/02/2015,SquadRun,,,"Amit Ranjan, Deepinder Goyal, Zishaan Hayath, Powai Lake Ventures",SeedFunding,,,,,,,,,,,,,,,,,,,,,,,,,,,2015-02-25,2015.0,,
48.0,25/02/2015,Clonect Solutions,,,"V Balakrishnan, T V Mohandas Pai, BC Prabhakar",SeedFunding,"250,000",,,,,,,,,,,,,,,,,,,,,,,,,250000.0,2015-02-25,2015.0,,
49.0,25/02/2015,TaxSutra,,,"V Balakrishnan, T V Mohandas Pai",SeedFunding,"160,000",,,,,,,,,,,,,,,,,,,,,,,,,160000.0,2015-02-25,2015.0,,
50.0,25/02/2015,PepperTap,,,Sequoia Capital,SeedFunding,,,,,,,,,,,,,,,,,,,,,,,,,,,2015-02-25,2015.0,,
51.0,25/02/2015,Sattviko,,,"Sumit Jain, Rajat Jain, Sanjay Bhasin",SeedFunding,"320,000",,,,,,,,,,,,,,,,,,,,,,,,,320000.0,2015-02-25,2015.0,,
52.0,25/02/2015,IndustryBuying,,,SAIF Partners,Private Equity,"2,000,000",Series A,,,,,,,,,,,,,,,,,,,,,,,,2000000.0,2015-02-25,2015.0,,
53.0,26/02/2015,FreshWorld,,,"Kris Gopalakrishnan, Nagaraja Prakasam",SeedFunding,,,,,,,,,,,,,,,,,,,,,,,,,,,2015-02-26,2015.0,,
54.0,26/02/2015,TinyOwl,,,"Matrix Partners, Sequoia Capital, Nexus Venture Partners",Private Equity,"16,000,000",Series B,,,,,,,,,,,,,,,,,,,,,,,,16000000.0,2015-02-26,2015.0,,
55.0,27/02/2015,Momoe,,,"IDG Ventures India, Jungle Ventures, India Quotient.",SeedFunding,"1,200,000",,,,,,,,,,,,,,,,,,,,,,,,,1200000.0,2015-02-27,2015.0,,
56.0,27/02/2015,Grofers,,,"Tiger Global Management, Sequoia Capital India",Private Equity,"10,000,000",Series A,,,,,,,,,,,,,,,,,,,,,,,,10000000.0,2015-02-27,2015.0,,
57.0,,,,,,,,,,,,,,,,,,,,,,,,,,,,,,,,,,,,
1.0,02/01/2015,LensKart,,,"TPG Growth, TR Capital, IDG Ventures",Private Equity,"2,150,000",,,,,,,,,,,,,,,,,,,,,,,,,2150000.0,2015-02-01,2015.0,,
2.0,02/01/2015,VioletStreet,,,"Venkat Vallabhneni, Sudhakar Reddy, Srinivasa Rao Paturi",SeedFunding,"315,000",,,,,,,,,,,,,,,,,,,,,,,,,315000.0,2015-02-01,2015.0,,
3.0,05/01/2015,Lookup,,,"DeNA Co., Japan & Teruhide Sato (in Addition to MKS Switzerland & Kris GopalKrishnan)",SeedFunding,"380,000",,,,,,,,,,,,,,,,,,,,,,,,,380000.0,2015-05-01,2015.0,,
4.0,05/01/2015,#Fame,,,TO THE NEW Ventures,Private Equity,"10,000,000",,,,,,,,,,,,,,,,,,,,,,,,,10000000.0,2015-05-01,2015.0,,
5.0,05/01/2015,Gympik,,,"Tom Clausen, Rohan Ajila, Haldyn Glass",Seed Funding,"135,000",,,,,,,,,,,,,,,,,,,,,,,,,135000.0,2015-05-01,2015.0,,
6.0,06/01/2015,Near.in,,,"Anupam Mittal, Manish Vij, Prashant Tandon, Gaurav Agarwal, Akash Agarwal, Himanshu Aggarwal, Kevin Parikh",Seed Funding,"285,000",,,,,,,,,,,,,,,,,,,,,,,,,285000.0,2015-06-01,2015.0,,
7.0,06/01/2015,Purplle.com,,,IvyCap Ventures,Private Equity,,,,,,,,,,,,,,,,,,,,,,,,,,,2015-06-01,2015.0,,
8.0,06/01/2015,NumberMall,,,SRI Capital,Private Equity,"10,000,000",,,,,,,,,,,,,,,,,,,,,,,,,10000000.0,2015-06-01,2015.0,,
9.0,06/01/2015,Tookitaki,,,"Jungle Ventures, Redbright Partners, Blume Ventures",PrivateEquity,"1,000,000",,,,,,,,,,,,,,,,,,,,,,,,,1000000.0,2015-06-01,2015.0,,
10.0,06/01/2015,Frankly,,,Matrix Partners,Seed Funding,"600,000",,,,,,,,,,,,,,,,,,,,,,,,,600000.0,2015-06-01,2015.0,,
11.0,07/01/2015,Faircent,,,"Devesh Sachdev, Ashish Tiwari",Seed Funding,,Valuation at $4M,,,,,,,,,,,,,,,,,,,,,,,,,2015-07-01,2015.0,,
12.0,07/01/2015,Nurturey,,,Seedrs Crowd funding platform,Crowd funding,"125,000",,,,,,,,,,,,,,,,,,,,,,,,,125000.0,2015-07-01,2015.0,,
13.0,07/01/2015,Bewakoof,,,"Rohit Bansal, Kunal Bahl, Nikhil Vora",Seed Funding,,,,,,,,,,,,,,,,,,,,,,,,,,,2015-07-01,2015.0,,
14.0,07/01/2015,Stridalyzer,,,Kickstarter,Crowd Funding,"30,768",,,,,,,,,,,,,,,,,,,,,,,,,30768.0,2015-07-01,2015.0,,
15.0,07/01/2015,Commonfloor,,,Google Capital,Private Equity,"5,000,000",3rd Round,,,,,,,,,,,,,,,,,,,,,,,,5000000.0,2015-07-01,2015.0,,
16.0,09/01/2015,Sokrati,,,"IvyCap Ventures, Inventus Capital",Private Equity,,Series B,,,,,,,,,,,,,,,,,,,,,,,,,2015-09-01,2015.0,,
17.0,09/01/2015,YepMe,,,"JS Capital, Helion Venture Partners, Capricorn Investment Group",Private Equity,"13,000,000",Series A,,,,,,,,,,,,,,,,,,,,,,,,13000000.0,2015-09-01,2015.0,,
18.0,09/01/2015,TapCibo,,,Alok Goel,Seed Funding,,,,,,,,,,,,,,,,,,,,,,,,,,,2015-09-01,2015.0,,
19.0,12/01/2015,Verayu,,,"GWB Group, Blume Ventures",Private Equity,,,,,,,,,,,,,,,,,,,,,,,,,,,2015-12-01,2015.0,,
20.0,12/01/2015,MyDreamStore,,,Undisclosed Investors,Seed Funding,"290,000",,,,,,,,,,,,,,,,,,,,,,,,,290000.0,2015-12-01,2015.0,,
21.0,13/01/2015,AppVirality,,,"Rajan Anandan, Mike Galgon, Ashim Mehra, Mohit Saxena, Ravi Gururaj, TNN Capital & IIG",Seed Funding,,,,,,,,,,,,,,,,,,,,,,,,,,,2015-01-13,2015.0,,
22.0,14/01/2015,RateGain,,,TA Associates,Private Equity,"50,000,000",,,,,,,,,,,,,,,,,,,,,,,,,50000000.0,2015-01-14,2015.0,,
23.0,15/01.2015,Wishberry,,,"Rajan Anandan, Shankar Mahadevan, Deep Kalra & Others",Seed Funding,"650,000",,,,,,,,,,,,,,,,,,,,,,,,,650000.0,2015-01-15,2015.0,,
24.0,16/01/2015,eKincare,,,Adroitent Pvt. Ltd.,Seed Funding,"161,000",,,,,,,,,,,,,,,,,,,,,,,,,161000.0,2015-01-16,2015.0,,
25.0,18/01/2015,ShopClues,,,Tiger Global & Other investors,Private Equity,"100,000,000",More Details,,,,,,,,,,,,,,,,,,,,,,,,100000000.0,2015-01-18,2015.0,,
26.0,19/01/2015,Refiral,,,Cogent E Services,Seed Funding,"330,000",,,,,,,,,,,,,,,,,,,,,,,,,330000.0,2015-01-19,2015.0,,
27.0,19/01/2015,Ping Digital,,,Consortium of Angel Investors,Seed Funding,,,,,,,,,,,,,,,,,,,,,,,,,,,2015-01-19,2015.0,,
28.0,19/01/2015,HealthyWorld.in,,,Group of Angel Investors,Seed Funding,"200,000",,,,,,,,,,,,,,,,,,,,,,,,,200000.0,2015-01-19,2015.0,,
29.0,19/01/2015,Hostel Dunia,,,Hyderabad Angels (at Startup Heroes event),Seed Funding,"16,000",,,,,,,,,,,,,,,,,,,,,,,,,16000.0,2015-01-19,2015.0,,
30.0,19/01/2015,Play your sport,,,Hyderabad Angels (at Startup Heroes event),Seed Funding,"16,000",,,,,,,,,,,,,,,,,,,,,,,,,16000.0,2015-01-19,2015.0,,
31.0,19/01/2015,Yo Grad,,,Hyderabad Angels (at Startup Heroes event),Seed Funding,"16,000",,,,,,,,,,,,,,,,,,,,,,,,,16000.0,2015-01-19,2015.0,,
32.0,19/01/2015,Enabli,,,Hyderabad Angels (at Startup Heroes event),Seed Funding,"16,000",,,,,,,,,,,,,,,,,,,,,,,,,16000.0,2015-01-19,2015.0,,
33.0,19/01/2015,CBS,,,Hyderabad Angels (at Startup Heroes event),Seed Funding,"16,000",,,,,,,,,,,,,,,,,,,,,,,,,16000.0,2015-01-19,2015.0,,
34.0,20/01/2015,Hopscotch,,,Eduardo Saverin & Velos Capital,Private Equity,"11,000,000",,,,,,,,,,,,,,,,,,,,,,,,,11000000.0,2015-01-20,2015.0,,
35.0,20/01/2015,Amagi Media Labs,,,Premji Invest & Mayfield Fund,Private Equity,,,,,,,,,,,,,,,,,,,,,,,,,,,2015-01-20,2015.0,,
36.0,20/01/2015,HealthyWorld.in,,,Group of Angel Investors,Seed Funding,"200,000",,,,,,,,,,,,,,,,,,,,,,,,,200000.0,2015-01-20,2015.0,,
37.0,21/01/2015,Simplilearn,,,"Mayfield India, Kalaari Capital, Helion Ventures",Private Equity,"14,750,000",,,,,,,,,,,,,,,,,,,,,,,,,14750000.0,2015-01-21,2015.0,,
38.0,21/01/2015,MyDreamStore,,,Undisclosed Investors,Seed Funding,"325,000",,,,,,,,,,,,,,,,,,,,,,,,,325000.0,2015-01-21,2015.0,,
39.0,21/05/2015,Knit,,,"Rohit Jain, Amit Rambhia & Others",Seed Funding,,,,,,,,,,,,,,,,,,,,,,,,,,,2015-05-21,2015.0,,
40.0,21/05/2015,Villgro,,,Michael & Susan Dell Foundation,Seed Funding,"3,250,000",To fund edu startups,,,,,,,,,,,,,,,,,,,,,,,,3250000.0,2015-05-21,2015.0,,
41.0,22/01//2015,Corporate360,,,Group of Angel Investors,Seed Funding,"200,000",,,,,,,,,,,,,,,,,,,,,,,,,200000.0,,,,
42.0,22/01/2015,Freshmonk,,,"August Capital Partners, Michael Blakey",Seed Funding,,,,,,,,,,,,,,,,,,,,,,,,,,,2015-01-22,2015.0,,
43.0,22/01/2015,Englishleap.com,,,ANALEC,Private Equity,,Majority Stake,,,,,,,,,,,,,,,,,,,,,,,,,2015-01-22,2015.0,,
44.0,22/01/2015,Antuit,,,"Goldman Sachs, Zodius Capital",Private Equity,"56,000,000",,,,,,,,,,,,,,,,,,,,,,,,,56000000.0,2015-01-22,2015.0,,
45.0,22/01/2015,Caratlane.com,,,Tiger Global,Private Equity,"31,000,000",Series D,,,,,,,,,,,,,,,,,,,,,,,,31000000.0,2015-01-22,2015.0,,
46.0,24/01/2015,Aasaanjobs,,,"Inventus Capital Partners, IDG Ventures",Seed Funding,"1,500,000",,,,,,,,,,,,,,,,,,,,,,,,,1500000.0,2015-01-24,2015.0,,
47.0,24/01/2015,Impartus,,,Kaizen Private Equity,Private Equity,,Series A,,,,,,,,,,,,,,,,,,,,,,,,,2015-01-24,2015.0,,
48.0,25/01/2015,Thrill App,,,People Group (Shaadi.com),Private Equity,"1,000,000",Strategic Funding,,,,,,,,,,,,,,,,,,,,,,,,1000000.0,2015-01-25,2015.0,,
49.0,27/01/2015,CarDekho.com,,,"Hillhouse Capital, Tybourne Capital",Private Equity,"50,000,000",Series B,,,,,,,,,,,,,,,,,,,,,,,,50000000.0,2015-01-27,2015.0,,
50.0,28/01/2015,Grabhouse.com,,,"Kalaari Capital, Sequoia Capital",Private Equity,"2,500,000",Series A,,,,,,,,,,,,,,,,,,,,,,,,2500000.0,2015-01-28,2015.0,,
51.0,29/01/2015,Printvenue,,,Asia Pacific Internet Group,Private Equity,"4,500,000",,,,,,,,,,,,,,,,,,,,,,,,,4500000.0,2015-01-29,2015.0,,
52.0,29/01/2015,Graphene,,,KARSEMVEN Fund,Private Equity,"825,000",Govt backed VC Fund,,,,,,,,,,,,,,,,,,,,,,,,825000.0,2015-01-29,2015.0,,
53.0,30/01/2015,Mad Street Den,,,"Exfinity Fund, GrowX Ventures.",Private Equity,"1,500,000",,,,,,,,,,,,,,,,,,,,,,,,,1500000.0,2015-01-30,2015.0,,
54.0,30/01/2015,Simplotel,,,MakeMyTrip,Private Equity,,"Strategic Funding, Minority stake",,,,,,,,,,,,,,,,,,,,,,,,,2015-01-30,2015.0,,
55.0,31/01/2015,couponmachine.in,,,UK based Group of Angel Investors,Seed Funding,"140,000",,,,,,,,,,,,,,,,,,,,,,,,,140000.0,2015-01-31,2015.0,,
,,,,,,,,,,,,,,,,,,,,,,,,,,,,,,,,,,,,
1.0,01/07/2015,Parcelled,Online Logistics Platform,Bangalore,"Delhivery, Tracxn Labs",Seed Funding,,,,,,,,,,,,,,,,,,,,,,,,,,,2015-01-07,2015.0,online logistics platform,bangalore
2.0,01/07/2015,Retigence Technologies,Business IT Intelligence Services,Mumbai,Omnivore Partners,Private Equity,,Series A,,,,,,,,,,,,,,,,,,,,,,,,,2015-01-07,2015.0,business it intelligence services,mumbai
3.0,01/07/2015,Cloudcherry Analytics,CRM / Analytics platform,Chennai,"The Chennai Angels, IDG Ventures India",Seed Funding,"1,000,000",,,,,,,,,,,,,,,,,,,,,,,,,1000000.0,2015-01-07,2015.0,crm / analytics platform,chennai
4.0,01/07/015,HandyHome,Hyperlocal Electronics repair Service,Mumbai,"Bessemer Ventures, Kae Capital",Seed Funding,"630,000",,,,,,,,,,,,,,,,,,,,,,,,,630000.0,,,hyperlocal electronics repair service,mumbai
5.0,01/07/2015,iDreamCareer,Ed-Tech Platform,New Delhi,"ah! Ventures, Vivek Joshi, Mohit Satyanand & others",Seed Funding,,,,,,,,,,,,,,,,,,,,,,,,,,,2015-01-07,2015.0,ed-tech platform,new delhi
6.0,01/07/2015,Ola Cabs,Cab rental Mobile app,Bangalore,Ratan Tata,Private Equity,,Personal Investment,,,,,,,,,,,,,,,,,,,,,,,,,2015-01-07,2015.0,cab rental mobile app,bangalore
7.0,01/07/2015,NxtGen,IT infrastructure & Data Center services,Bangalore,"IFC, Axon Partners, Intel Capital",Private Equity,"13,500,000",Series A,,,,,,,,,,,,,,,,,,,,,,,,13500000.0,2015-01-07,2015.0,it infrastructure & data center services,bangalore
8.0,02/07/2015,BankBazaar,Online Financial Services,Chennai,"Amazon, Fidelity Growth Partners, Mousse Partners",Private Equity,"60,000,000",Series C(More here),,,,,,,,,,,,,,,,,,,,,,,,60000000.0,2015-02-07,2015.0,online financial services,chennai
9.0,02/07/2015,Gozoomo,Used Car Marketplace,Bangalore,SAIF Partners,Private Equity,"5,000,000",Series A,,,,,,,,,,,,,,,,,,,,,,,,5000000.0,2015-02-07,2015.0,used car marketplace,bangalore
10.0,02/07/2015,Zenatix,Internet of Things platform,Gurgaon,"Rajan Anandan, Kunal Bahl, Rohit Bansal, Rahul Khanna",Seed Funding,"161,000",,,,,,,,,,,,,,,,,,,,,,,,,161000.0,2015-02-07,2015.0,internet of things platform,gurgaon
11.0,03/07/2015,CultureAlley,Language Learning App,Jaipur,Tiger Global,Private Equity,"6,500,000",Series A,,,,,,,,,,,,,,,,,,,,,,,,6500000.0,2015-03-07,2015.0,language learning app,jaipur
12.0,03/07/2015,Goqii,Mobile Fitness Marketplace,Mumbai,Vijay Shekhar Sharma,Private Equity,,Pre-Series A,,,,,,,,,,,,,,,,,,,,,,,,,2015-03-07,2015.0,mobile fitness marketplace,mumbai
13.0,03/07/2015,Gingercrush,Custom Merchandize platform,Ahmedabad,"Gokul Jaykrishna, Brand Capital",Seed Funding,"1,000,000",,,,,,,,,,,,,,,,,,,,,,,,,1000000.0,2015-03-07,2015.0,custom merchandize platform,ahmedabad
14.0,04/07/2015,Elanic,P2P Pre-owned goods marketplace,Bangalore,"Rebright Partners, Tracxn Labs, Aneesh Reddy",Seed Funding,,,,,,,,,,,,,,,,,,,,,,,,,,,2015-04-07,2015.0,p2p pre-owned goods marketplace,bangalore
15.0,04/07/2015,Stitchwood,Custom Furniture Marketplace,Mumbai,"Powai Lake Ventures, Ajeet Khurana & others",Seed Funding,"395,000",,,,,,,,,,,,,,,,,,,,,,,,,395000.0,2015-04-07,2015.0,custom furniture marketplace,mumbai
16.0,05/07/2015,Urban Tailor,Online Tailoring Services,Bangalore,Group of angel investors,Seed Funding,,,,,,,,,,,,,,,,,,,,,,,,,,,2015-05-07,2015.0,online tailoring services,bangalore
17.0,06/07/2015,ConfirmtTkt,Rail Ticket Confirmation predictor,Bangalore,Pravin Agarwala & others,Seed Funding,,,,,,,,,,,,,,,,,,,,,,,,,,,2015-06-07,2015.0,rail ticket confirmation predictor,bangalore
18.0,06/07/2015,Paper Boat,Ethnic Beverages manufacturer,Gurgaon,"Sofina, Hillhouse Capital",Private Equity,"30,000,000",Series B,,,,,,,,,,,,,,,,,,,,,,,,30000000.0,2015-06-07,2015.0,ethnic beverages manufacturer,gurgaon
19.0,06/07/2015,getNow,Hyperlocal Goods marketplace,Nagpur,Atulya Mittal,Seed Funding,,,,,,,,,,,,,,,,,,,,,,,,,,,2015-06-07,2015.0,hyperlocal goods marketplace,nagpur
20.0,07/07/2015,Wudstay,Budget Accommodation aggregator,Gurgaon,"Mangroves Capital Partners, Vikas Saxena",Private Equity,"3,000,000",Series A,,,,,,,,,,,,,,,,,,,,,,,,3000000.0,2015-07-07,2015.0,budget accommodation aggregator,gurgaon
21.0,07/07/2015,Liases Foras,Real Estate Rating & Analysis,New Delhi,DMG information Asia Pacific,Private Equity,"5,000,000",Series A,,,,,,,,,,,,,,,,,,,,,,,,5000000.0,2015-07-07,2015.0,real estate rating & analysis,new delhi
22.0,07/07/2015,Eatlo,Food Delivery platform,Bangalore,"Powai Lake Ventures, Globeinvestor, Abhishekh Goyal",Seed Funding,,,,,,,,,,,,,,,,,,,,,,,,,,,2015-07-07,2015.0,food delivery platform,bangalore
23.0,07/07/2015,IndiaLends,Financial Tech,New Delhi,"DSG Consumer Partners, Siddharth Parekh",Private Equity,,Pre-Series A,,,,,,,,,,,,,,,,,,,,,,,,,2015-07-07,2015.0,financial tech,new delhi
24.0,08/07/2015,Quinto,Food Discovery App,Pune,Jaydeep Barman,Seed Funding,,,,,,,,,,,,,,,,,,,,,,,,,,,2015-08-07,2015.0,food discovery app,pune
25.0,08/07/2015,Saavn,Music Streaming App,Mumbai,"Tiger Global Management, Bertelsmann India, Steadview Capital, Liberty Media, Mousse Partners, Quilvest",Private Equity,"100,000,000",Series C,,,,,,,,,,,,,,,,,,,,,,,,100000000.0,2015-08-07,2015.0,music streaming app,mumbai
26.0,08/07/2015,Flytxt,Big Data & Analytics platform,Mumbai / Global,"Sunrise Capital GmBH, Big Data Investments B.V",Private Equity,"11,000,000",Series A,,,,,,,,,,,,,,,,,,,,,,,,11000000.0,2015-08-07,2015.0,big data & analytics platform,mumbai / global
27.0,08/07/2015,Axtria,Big Data & Analytics platform,India / US,"Helion Venture Partners,Amarpreet Sawhney, Deshpande Foundation, Fred Khosravi, Richard S. Braddock",Private Equity,"30,000,000",Series C,,,,,,,,,,,,,,,,,,,,,,,,30000000.0,2015-08-07,2015.0,big data & analytics platform,india / us
28.0,08/07/2015,33Coupons,Coupon Aggregator Platform,Kanpur,Not Disclosed,Seed Funding,"20,000",,,,,,,,,,,,,,,,,,,,,,,,,20000.0,2015-08-07,2015.0,coupon aggregator platform,kanpur
29.0,08/07/2015,Ampere,Electric Scooter manufacturer,Coimbatore,Ratan Tata,Seed Funding,,,,,,,,,,,,,,,,,,,,,,,,,,,2015-08-07,2015.0,electric scooter manufacturer,coimbatore
30.0,08/07/2015,Hopping Chef,Online Food-Tech Platform,Mumbai,Mirah Hospitality,Seed Funding,"470,000",Strategic Investment,,,,,,,,,,,,,,,,,,,,,,,,470000.0,2015-08-07,2015.0,online food-tech platform,mumbai
31.0,08/07/2015,Collectabillia,Celebrity Fashion Brand,Bangalore,Accel Partners,Private Equity,"7,500,000",Series B,,,,,,,,,,,,,,,,,,,,,,,,7500000.0,2015-08-07,2015.0,celebrity fashion brand,bangalore
32.0,08/07/2015,Lendingkart,Online Finance lending platform,Ahmedabad,"Saama Capital, Mayfield, Ashvin Chadha, Shailesh Mehta",Private Equity,"10,000,000",Series A,,,,,,,,,,,,,,,,,,,,,,,,10000000.0,2015-08-07,2015.0,online finance lending platform,ahmedabad
33.0,08/07/2015,Lybrate,Healthcare Mobile App,New Delhi,"Tiger Global Management, Ratan Tata, Nexus Venture Partners",Private Equity,"10,200,000",Series A,,,,,,,,,,,,,,,,,,,,,,,,10200000.0,2015-08-07,2015.0,healthcare mobile app,new delhi
34.0,08/07/2015,Zoomcar,Self-driven vehicle rental,Bangalore,"Sequoia Capital, Empire Angels, NGP",Private Equity,"11,000,000",Series B,,,,,,,,,,,,,,,,,,,,,,,,11000000.0,2015-08-07,2015.0,self-driven vehicle rental,bangalore
35.0,09/7/2015,News in shorts,News Aggregator mobile app,Noida,Tiger Global,Private Equity,"20,000,000",Series B,,,,,,,,,,,,,,,,,,,,,,,,20000000.0,2015-09-07,2015.0,news aggregator mobile app,noida
36.0,09/7/2015,Bluestone,Online Jewellery Store,Bangalore,"IvyCap Ventures, Accel Partners, Dragoneer Investment Group",Private Equity,"16,200,000",,,,,,,,,,,,,,,,,,,,,,,,,16200000.0,2015-09-07,2015.0,online jewellery store,bangalore
37.0,09/7/2015,Shopsity,Fashion Info Aggregator App,Gurgaon,"Sandeep Aggarwal, Teruhide Sato",Seed Funding,,,,,,,,,,,,,,,,,,,,,,,,,,,2015-09-07,2015.0,fashion info aggregator app,gurgaon
38.0,09/7/2015,Notesgen,Online Study Notes Marketplace,New Delhi,"Rajeev Saraf, Arvind Jha, R. Satya Narayanan",Seed Funding,,,,,,,,,,,,,,,,,,,,,,,,,,,2015-09-07,2015.0,online study notes marketplace,new delhi
39.0,10/7/2015,Infinity Assurance,Warranty Programs Service Administration,New Delhi,Indian Angel Network,Seed Funding,"600,000",,,,,,,,,,,,,,,,,,,,,,,,,600000.0,2015-10-07,2015.0,warranty programs service administration,new delhi
40.0,10/7/2015,Footprints Education,Pre-School Chain,Gurgaon,"LetsVenture, Kumar Bansal, Kshitij Jain",Seed Funding,"685,000",,,,,,,,,,,,,,,,,,,,,,,,,685000.0,2015-10-07,2015.0,pre-school chain,gurgaon
41.0,10/7/2015,Loylty Rewards,Premium Loyalty Rewards Point Management,Mumbai,IndianIdeas.com,Private Equity,"19,350,000",Late Stage,,,,,,,,,,,,,,,,,,,,,,,,19350000.0,2015-10-07,2015.0,premium loyalty rewards point management,mumbai
42.0,13/7/2015,Ameyo,Contact Center Software Platform,Gurgaon,Forum Synergies PE Fund,Private Equity,"5,000,000",Series A,,,,,,,,,,,,,,,,,,,,,,,,5000000.0,2015-07-13,2015.0,contact center software platform,gurgaon
43.0,13/7/2015,Mamagoto,Casual Dining restaurant Chain,New Delhi,Goldman Sachs,Private Equity,"10,000,000",Series A,,,,,,,,,,,,,,,,,,,,,,,,10000000.0,2015-07-13,2015.0,casual dining restaurant chain,new delhi
44.0,13/7/2015,Satvacart,Online Grocery Delivery,Gurgaon,Palaash Ventures,Seed Funding,,,,,,,,,,,,,,,,,,,,,,,,,,,2015-07-13,2015.0,online grocery delivery,gurgaon
45.0,14/7/2015,MySmartPrice,Online comparison engine,Hyderabad,"Accel Partners, Helion Venture Partners",Private Equity,"10,000,000",Series B,,,,,,,,,,,,,,,,,,,,,,,,10000000.0,2015-07-14,2015.0,online comparison engine,hyderabad
46.0,14/7/2015,Zenify,Residential Rental management platform,Bangalore,Atul Jalan,Seed Funding,,,,,,,,,,,,,,,,,,,,,,,,,,,2015-07-14,2015.0,residential rental management platform,bangalore
47.0,14/7/2015,Boxmyspace,Physical Storage warehouses,Mumbai,"Ritesh Veera, Singapore Angel Network, Orios Venture Partners,",Seed Funding,"300,000",,,,,,,,,,,,,,,,,,,,,,,,,300000.0,2015-07-14,2015.0,physical storage warehouses,mumbai
48.0,14/7/2015,HackerRank,Tech Recruitment platform,Bangalore,HR Technology fund,Private Equity,"7,500,000",Series C,,,,,,,,,,,,,,,,,,,,,,,,7500000.0,2015-07-14,2015.0,tech recruitment platform,bangalore
49.0,14/7/2015,WickedRide,Bike Rental Platform,Bangalore,Undisclosed,Seed Funding,"790,000",,,,,,,,,,,,,,,,,,,,,,,,,790000.0,2015-07-14,2015.0,bike rental platform,bangalore
50.0,14/7/2015,WoWexpress,Tech enabled logistics platform,Mumbai,Tamarind Family Private Trust,Seed Funding,"500,000",,,,,,,,,,,,,,,,,,,,,,,,,500000.0,2015-07-14,2015.0,tech enabled logistics platform,mumbai
51.0,15/7/2015,Oyo Rooms,Budget Hotel Accommodation,Gurgaon,"Softbank, Sequoia Capital",Private Equity,"100,000,000",Series B,,,,,,,,,,,,,,,,,,,,,,,,100000000.0,2015-07-15,2015.0,budget hotel accommodation,gurgaon
52.0,15/7/2015,Mobikon,Restaurant customer engagement platform,Pune,Jungle Ventures,Private Equity,"2,300,000",Series B,,,,,,,,,,,,,,,,,,,,,,,,2300000.0,2015-07-15,2015.0,restaurant customer engagement platform,pune
53.0,15/7/2015,InstaLively.com,Live video streaming app,New Delhi,"Anupam Mittal, Anand Chandrasekaran, Uday Shankar, Chetan Bhagat",Seed Funding,,,,,,,,,,,,,,,,,,,,,,,,,,,2015-07-15,2015.0,live video streaming app,new delhi
54.0,15/7/2015,Roadrunnr,Hyper local logistics platform,Bangalore,"Sequoia Capital, Nexus Venture Partners, Blume Ventures",Private Equity,"11,000,000",Series A,,,,,,,,,,,,,,,,,,,,,,,,11000000.0,2015-07-15,2015.0,hyper local logistics platform,bangalore
55.0,16/7/2015,Ketto,Crowd Funding Platform,Mumbai,"Pradyumna Dalmia, Sudhir Rao & Others",Seed Funding,"700,000",,,,,,,,,,,,,,,,,,,,,,,,,700000.0,2015-07-16,2015.0,crowd funding platform,mumbai
56.0,17/7/2015,QuikWallet,F&B sector Mobile Payment platform,Mumbai,Snow Leopard Technology Ventures,Private Equity,"1,600,000",Follow on Funding,,,,,,,,,,,,,,,,,,,,,,,,1600000.0,2015-07-17,2015.0,f&b sector mobile payment platform,mumbai
57.0,17/7/2015,Omnikart,Industrial Supplies B2B ecommerce,Mumbai,"Sumit Gandhi, Manish Gandhi",Seed Funding,"100,000",,,,,,,,,,,,,,,,,,,,,,,,,100000.0,2015-07-17,2015.0,industrial supplies b2b ecommerce,mumbai
58.0,20/7/2015,Zo Rooms,Online budget hotel chain,New Delhi,"Tiger Global, Orios Venture Partners.",Private Equity,"15,000,000",No confirmation,,,,,,,,,,,,,,,,,,,,,,,,15000000.0,2015-07-20,2015.0,online budget hotel chain,new delhi
59.0,20/7/2015,Innoviti,Payment Solutions platform,Bangalore,"Catamaran Ventures, New India Investment Corporation",Private Equity,"4,850,000",Series A,,,,,,,,,,,,,,,,,,,,,,,,4850000.0,2015-07-20,2015.0,payment solutions platform,bangalore
60.0,21/7/2015,ZenRadius,Online Hiring Platform,Bangalore,"Tracxn Labs, Deepak Singh",Seed Funding,,,,,,,,,,,,,,,,,,,,,,,,,,,2015-07-21,2015.0,online hiring platform,bangalore
61.0,21/7/2015,Joy by nature,Organic Food ecommerce,New Delhi,"Mumbai Angels, Vriddhi Fund, Others",Private Equity,"1,000,000",Series A,,,,,,,,,,,,,,,,,,,,,,,,1000000.0,2015-07-21,2015.0,organic food ecommerce,new delhi
62.0,22/7/2015,Iqlect,Big Data & Analytics platform,Bangalore,Exfinity Venture Partners,Private Equity,"2,000,000",Series A,,,,,,,,,,,,,,,,,,,,,,,,2000000.0,2015-07-22,2015.0,big data & analytics platform,bangalore
63.0,22/7/2015,deGustibus,Fine Dining Restaurant Chain,Mumbai,India Value Fund Advisors,Private Equity,"30,000,000",Late Stage,,,,,,,,,,,,,,,,,,,,,,,,30000000.0,2015-07-22,2015.0,fine dining restaurant chain,mumbai
64.0,23/7/2015,Nestaway,Luxury Rental Homes,Bangalore,"Flipkart, Tiger Global",Private Equity,"12,750,000",Series A,,,,,,,,,,,,,,,,,,,,,,,,12750000.0,2015-07-23,2015.0,luxury rental homes,bangalore
65.0,23/7/2015,Mswipe,Mobile Point of Sale payment solution,,"Falcon Edge Capital, Meru Capital, Ola, Matrix Partners, DSG Consumer Partners, Axis Bank",Private Equity,"25,000,000",Series B,,,,,,,,,,,,,,,,,,,,,,,,25000000.0,2015-07-23,2015.0,mobile point of sale payment solution,
66.0,23/7/2015,Myonsto,Online Grocers,Ahmedabad,Jayant Bokadia,Seed Funding,"320,000",,,,,,,,,,,,,,,,,,,,,,,,,320000.0,2015-07-23,2015.0,online grocers,ahmedabad
67.0,23/7/2015,iCrushiFlush,Casual Dating App,Mumbai,IDG Ventures India,Seed Funding,,,,,,,,,,,,,,,,,,,,,,,,,,,2015-07-23,2015.0,casual dating app,mumbai
68.0,23/7/2015,MedGenome,Clinical Genomics Provider,Bangalore,Sequoia Capital,Private Equity,"20,000,000",Series B,,,,,,,,,,,,,,,,,,,,,,,,20000000.0,2015-07-23,2015.0,clinical genomics provider,bangalore
69.0,23/7/2015,HolidayIQ,Travel information portal,Bangalore,MakeMyTrip,Private Equity,"15,000,000",Strategic Investment,,,,,,,,,,,,,,,,,,,,,,,,15000000.0,2015-07-23,2015.0,travel information portal,bangalore
70.0,23/7/2015,Fitternity,Fitness Marketplace,Mumbai,Exfinity Venture Partners,Private Equity,"1,000,000",Series A,,,,,,,,,,,,,,,,,,,,,,,,1000000.0,2015-07-23,2015.0,fitness marketplace,mumbai
71.0,23/7/2015,Quikr,Online & Mobile classified listings,Mumbai,"AB Kinnevik, Falcon Edge Capital, Coatue Management",Private Equity,"60,000,000",Late Stage,,,,,,,,,,,,,,,,,,,,,,,,60000000.0,2015-07-23,2015.0,online & mobile classified listings,mumbai
72.0,23/7/2015,JetSetGo,Private Jet/ Helicopter Marketplace,New Delhi,YourWeCan Ventures,Seed Funding,,,,,,,,,,,,,,,,,,,,,,,,,,,2015-07-23,2015.0,private jet/ helicopter marketplace,new delhi
73.0,24/7/2015,BroEx,Real Estate Broker network App,Gurgaon,Lightspeed India,Private Equity,"1,000,000",Bridge round,,,,,,,,,,,,,,,,,,,,,,,,1000000.0,2015-07-24,2015.0,real estate broker network app,gurgaon
74.0,25/7/2015,Shopatplaces,Ethnic/ Traditional Fashion Store,New Delhi,Indian Angel Network,Seed Funding,,,,,,,,,,,,,,,,,,,,,,,,,,,2015-07-25,2015.0,ethnic/ traditional fashion store,new delhi
75.0,25/7/2015,CredR,Used Bikes Marketplace,Mumbai,Fidelity Growth Partners,Private Equity,"15,000,000",Series A,,,,,,,,,,,,,,,,,,,,,,,,15000000.0,2015-07-25,2015.0,used bikes marketplace,mumbai
76.0,27/7/2015,ManageMySpa,Spa & Salon Management Software,Hyderabad,Accel Partners,Private Equity,"6,000,000",Series A,,,,,,,,,,,,,,,,,,,,,,,,6000000.0,2015-07-27,2015.0,spa & salon management software,hyderabad
77.0,27/7/2015,Townrush,B2B logistics delivery platform,Bangalore,Lightspeed Venture Partners,Seed Funding,,,,,,,,,,,,,,,,,,,,,,,,,,,2015-07-27,2015.0,b2b logistics delivery platform,bangalore
78.0,27/7/2015,Locus,Logistics Automation Platform,Bangalore,"growX ventures,  Manish Singhal",Seed Funding,,,,,,,,,,,,,,,,,,,,,,,,,,,2015-07-27,2015.0,logistics automation platform,bangalore
79.0,27/7/2015,Bevy,Online Hiring Platform,Bangalore,Varun Agarwal & Others,Seed Funding,,,,,,,,,,,,,,,,,,,,,,,,,,,2015-07-27,2015.0,online hiring platform,bangalore
80.0,28/7/2015,Pepperfry,Online home décor marketplace,Mumbai,"Goldman Sachs, Zodius Technology Fund, Bertelsmann India Investments Norwest Venture Partners.",Private Equity,"100,000,000",Series D,,,,,,,,,,,,,,,,,,,,,,,,100000000.0,2015-07-28,2015.0,online home décor marketplace,mumbai
81.0,28/7/2015,Flipkart.com,Online Marketplace,Bangalore,Steadview Capital and existing investors,Private Equity,"700,000,000","Late Stage, 10th RoundMore here",,,,,,,,,,,,,,,,,,,,,,,,700000000.0,2015-07-28,2015.0,online marketplace,bangalore
82.0,28/7/2015,Opinio,Hyperlocal food & grocery store,Bangalore,"Accel Partners, Traxcn Labs & Others",Seed Funding,"1,300,000",,,,,,,,,,,,,,,,,,,,,,,,,1300000.0,2015-07-28,2015.0,hyperlocal food & grocery store,bangalore
83.0,28/7/2015,Zoctr,Health-Tech platform,Mumbai,"Sandeep Parwal, Krishan Gupta & Others",Seed Funding,"1,000,000",,,,,,,,,,,,,,,,,,,,,,,,,1000000.0,2015-07-28,2015.0,health-tech platform,mumbai
84.0,29/7/2015,Zimmber,Hyperlocal Handyman Services,Mumbai,"IDG Ventures India, Omidyar Network, Sherpalo Ventures,  Mohandas Pai",Private Equity,"2,000,000",Series A,,,,,,,,,,,,,,,,,,,,,,,,2000000.0,2015-07-29,2015.0,hyperlocal handyman services,mumbai
85.0,29/7/2015,trueHb,Medical Tech Instruments,New Delhi,"Sachin and Binny Bansal, Malvinder and Shivinder Singh, Gurpreet Singh & others",Seed Funding,"2,400,000",,,,,,,,,,,,,,,,,,,,,,,,,2400000.0,2015-07-29,2015.0,medical tech instruments,new delhi
86.0,29/7/2015,Zovi.com/ Little App,Hyperlocal Deals Marketplace,Bangalore,"Paytm, SAIF Partners,  Tiger Global Management & others",Private Equity,"50,000,000",Series A,,,,,,,,,,,,,,,,,,,,,,,,50000000.0,2015-07-29,2015.0,hyperlocal deals marketplace,bangalore
87.0,29/7/2015,Swajal,Innovative Water Solutions,Gurgaon,Abhishek Gupta,Private Equity,"1,200,000",Series A,,,,,,,,,,,,,,,,,,,,,,,,1200000.0,2015-07-29,2015.0,innovative water solutions,gurgaon
88.0,30/7/2015,Pipa Bella,Online Jewelry Store,Mumbai,LionRock Capital,Private Equity,"600,000",Pre-Series A,,,,,,,,,,,,,,,,,,,,,,,,600000.0,2015-07-30,2015.0,online jewelry store,mumbai
89.0,30/7/2015,Pragmatix,Business intelligence & Analytics,Mumbai,SIDBI Venture Capital Ltd,Private Equity,"2,400,000",Series A,,,,,,,,,,,,,,,,,,,,,,,,2400000.0,2015-07-30,2015.0,business intelligence & analytics,mumbai
90.0,30/7/2015,Droom.in,Used Vehicle Marketplace,New Delhi,"Lightbox Ventures, Beenos",Private Equity,"16,000,000",Series A,,,,,,,,,,,,,,,,,,,,,,,,16000000.0,2015-07-30,2015.0,used vehicle marketplace,new delhi
91.0,30/7/2015,MadRat Games,Educational Board Games,Bangalore,"Kunal Bahl, Rohit Bansal",Seed Funding,"168,000",,,,,,,,,,,,,,,,,,,,,,,,,168000.0,2015-07-30,2015.0,educational board games,bangalore
92.0,30/7/2015,Noodle Play,Chinese food delivery,Mumbai,"Elliot Stechman, Gautam Sinha, Ambarish Ray",Seed Funding,"168,000",,,,,,,,,,,,,,,,,,,,,,,,,168000.0,2015-07-30,2015.0,chinese food delivery,mumbai
93.0,30/7/2015,Wassup,On-Demand Laundry & Dry cleaning App,Chennai,B S Nagesh,Private Equity,,Pre-Series A,,,,,,,,,,,,,,,,,,,,,,,,,2015-07-30,2015.0,on-demand laundry & dry cleaning app,chennai
94.0,30/7/2015,Cartisan,On-Demand Car services App,Bangalore,"YouWeCan Ventures,  Aprameya Radhakrishna",Seed Funding,,,,,,,,,,,,,,,,,,,,,,,,,,,2015-07-30,2015.0,on-demand car services app,bangalore
95.0,31/7/2015,LazyLad,Hyperlocal Grocery App,Gurgaon,"Jai Choi, Kiyohiro Sugashita, Hirokazu",Private Equity,"500,000",pre-Series A,,,,,,,,,,,,,,,,,,,,,,,,500000.0,2015-07-31,2015.0,hyperlocal grocery app,gurgaon
96.0,31/7/2015,TripFactory,Online Curated Holiday package bookings,Bangalore,"Aarin Capital Partners,",Private Equity,,Series A,,,,,,,,,,,,,,,,,,,,,,,,,2015-07-31,2015.0,online curated holiday package bookings,bangalore
97.0,31/7/2015,Prothom,Hasbro Toy Manufacturer,Pune,Oliphabs Capital,Private Equity,"2,000,000",Series A,,,,,,,,,,,,,,,,,,,,,,,,2000000.0,2015-07-31,2015.0,hasbro toy manufacturer,pune
98.0,31/7/2015,Bona Vita,Travel Tech,Gurgaon,MakeMyTrip,Private Equity,"5,000,000",Strategic Investment,,,,,,,,,,,,,,,,,,,,,,,,5000000.0,2015-07-31,2015.0,travel tech,gurgaon
99.0,,,,,,,,,,,,,,,,,,,,,,,,,,,,,,,,,,,,
100.0,,,,,,,,,,,,,,,,,,,,,,,,,,,,,,,,,,,,
,,,,,,,,,,,,,,,,,,,,,,,,,,,,,,,,,,,,
1.0,01/06/2015,Vyomo,Beauty and Wellness Platform,New Delhi,Aprameya Radhakrishna,Seed Funding,,,,,,,,,,,,,,,,,,,,,,,,,,,2015-01-06,2015.0,beauty and wellness platform,new delhi
2.0,01/06/2015,Veeba Foods,Healthy Food Manufacturer,New Delhi,"DSG Consumer Partners, Saama Capital.",Private Equity,"6,000,000",Series B,,,,,,,,,,,,,,,,,,,,,,,,6000000.0,2015-01-06,2015.0,healthy food manufacturer,new delhi
3.0,01/06/2015,Truebil,Used Car Marketplace,Mumbai,"Kae Capital, Anupam Mittal",Seed Funding,"500,000",,,,,,,,,,,,,,,,,,,,,,,,,500000.0,2015-01-06,2015.0,used car marketplace,mumbai
4.0,01/06/2015,Meritnation,Online Learning Platform,New Delhi,InfoEdge,Private Equity,"4,000,000",Series C,,,,,,,,,,,,,,,,,,,,,,,,4000000.0,2015-01-06,2015.0,online learning platform,new delhi
5.0,01/06/2015,Eattreatonline,Healthy Food Online Community,New Delhi,Group of 15 Angel Investors,Seed Funding,"350,000",,,,,,,,,,,,,,,,,,,,,,,,,350000.0,2015-01-06,2015.0,healthy food online community,new delhi
6.0,01/06/2015,CredR,Used two-wheeler Marketplace,Mumbai,GrowthStory,Seed Funding,,,,,,,,,,,,,,,,,,,,,,,,,,,2015-01-06,2015.0,used two-wheeler marketplace,mumbai
7.0,01/06/2015,Glamrs,Online Fashion Video Portal,Mumbai,"Ventureworks India, Blume Ventures, Batlivala & Karani Securities, Nikunj Jhaveri",Private Equity,"1,000,000",Pre-Series A,,,,,,,,,,,,,,,,,,,,,,,,1000000.0,2015-01-06,2015.0,online fashion video portal,mumbai
8.0,01/06/2015,Proviera,Probiotic Technology Products Manufacturer,Chennai,Infuse Ventures,Private Equity,"550,000",,,,,,,,,,,,,,,,,,,,,,,,,550000.0,2015-01-06,2015.0,probiotic technology products manufacturer,chennai
9.0,01/06/2015,Arth DesignBuild,Architectural Design & Consulting,Hyderabad,Srinivas Tirupati,Seed Funding,"500,000",,,,,,,,,,,,,,,,,,,,,,,,,500000.0,2015-01-06,2015.0,architectural design & consulting,hyderabad
10.0,02/06/2015,Saama,Big Data & Analytics Services,Pune / US,Carrick Capital Partners,Private Equity,"35,000,000",Series A,,,,,,,,,,,,,,,,,,,,,,,,35000000.0,2015-02-06,2015.0,big data & analytics services,pune / us
11.0,02/06/2015,AllIzHealth,Preventive Healthcare Services,Pune,Mumbai Angels & Other angel investors,Seed Funding,"350,000",,,,,,,,,,,,,,,,,,,,,,,,,350000.0,2015-02-06,2015.0,preventive healthcare services,pune
12.0,02/06/2015,Karma Healthcare,Tech-enabled Rural Healthcare Services,Udaipur,Ennovent Impact Investment Holding,Private Equity,,Series A,,,,,,,,,,,,,,,,,,,,,,,,,2015-02-06,2015.0,tech-enabled rural healthcare services,udaipur
13.0,03/06/2015,Entropy Innovations,Engineering Innovations,Mumbai,Mark Mobius & 9 Other Angel investors,Seed Funding,,,,,,,,,,,,,,,,,,,,,,,,,,,2015-03-06,2015.0,engineering innovations,mumbai
14.0,03/06/2015,Propstack,Real Estate Intelligence Platform,Mumbai,DMG Information,Private Equity,"3,000,000",Series A,,,,,,,,,,,,,,,,,,,,,,,,3000000.0,2015-03-06,2015.0,real estate intelligence platform,mumbai
15.0,03/06/2015,MyTaxiIndia,Online Car Rental Affiliates,New Delhi,Green House Ventures,Seed Funding,"100,000",,,,,,,,,,,,,,,,,,,,,,,,,100000.0,2015-03-06,2015.0,online car rental affiliates,new delhi
16.0,03/06/2015,Arkin Net,Data Center Software platform,Pune / US,Nexus Venture Partners,Private Equity,"15,000,000",Series B,,,,,,,,,,,,,,,,,,,,,,,,15000000.0,2015-03-06,2015.0,data center software platform,pune / us
17.0,03/06/2015,Little Black Book Delhi,Online City & Lifestyle Guide,New Delhi,"Rajan Anandan, Niraj Singh, Sachin Bhatia, Singapore Angel Network & Aseem Vadehra",Seed Funding,"150,000",,,,,,,,,,,,,,,,,,,,,,,,,150000.0,2015-03-06,2015.0,online city & lifestyle guide,new delhi
18.0,03/06/2015,MyPoolin,P2P Payments platform,New Delhi,"Sharad Sharma, Rajan Anandan, Sunil Kalra, Amit Ranjan, Rohan Malhotra,  Arjun Malhotra, Gautam Gandhi",Seed Funding,,,,,,,,,,,,,,,,,,,,,,,,,,,2015-03-06,2015.0,p2p payments platform,new delhi
19.0,03/06/2015,iCustomadeit,Bespoke Merchandize Marketplace,Pune,"Virendra Shahney, Dr Paresh Doshi",Seed Funding,"250,000",,,,,,,,,,,,,,,,,,,,,,,,,250000.0,2015-03-06,2015.0,bespoke merchandize marketplace,pune
20.0,03/06/2015,KAARYAH,Women Lifestyle Marketplace,Gurgaon,Ratan Tata,Seed Funding,,,,,,,,,,,,,,,,,,,,,,,,,,,2015-03-06,2015.0,women lifestyle marketplace,gurgaon
21.0,04/06/2015,Ecom Express,Logistics Solution Provider,New Delhi,Warburg Pincus,Private Equity,"137,000,000",Series C,,,,,,,,,,,,,,,,,,,,,,,,137000000.0,2015-04-06,2015.0,logistics solution provider,new delhi
22.0,04/06/2015,Vidooly,Video Intelligence Platform,Noida,Bessemer Venture Partners,Private Equity,"1,000,000",Pre-Series A,,,,,,,,,,,,,,,,,,,,,,,,1000000.0,2015-04-06,2015.0,video intelligence platform,noida
32.0,04/06/2015,Zopper,Hyperlocal Shopping App,Mumbai,"Tiger Global,  Nirvana Ventures Advisors",Private Equity,"20,000,000",Series C,,,,,,,,,,,,,,,,,,,,,,,,20000000.0,2015-04-06,2015.0,hyperlocal shopping app,mumbai
24.0,04/06/2015,Flipkart,eCommerce platform,Bangalore,Morgan Stanley,Private Equity,"50,000,000",Late Stage,,,,,,,,,,,,,,,,,,,,,,,,50000000.0,2015-04-06,2015.0,ecommerce platform,bangalore
25.0,05/06/2015,kWatt Solutions,Renewable energy solutions,Mumbai,,Seed Funding,"500,000",,,,,,,,,,,,,,,,,,,,,,,,,500000.0,2015-05-06,2015.0,renewable energy solutions,mumbai
26.0,05/06/2015,Medwell Ventures,HealthcareService provider,Bangalore,"Fidelity Growth Partners, Fidelity Biosciences",Private Equity,"10,000,000",Series A,,,,,,,,,,,,,,,,,,,,,,,,10000000.0,2015-05-06,2015.0,healthcareservice provider,bangalore
27.0,05/06/2015,Jugnoo,Auto Rickshaw Based Services,Chandigarh,"Snow Leopard, Paytm",Private Equity,"5,000,000",Series A,,,,,,,,,,,,,,,,,,,,,,,,5000000.0,2015-05-06,2015.0,auto rickshaw based services,chandigarh
28.0,08/06/2015,PosterGully,Artist / Designer Marketplace,New Delhi,"Natarajan Iyer,Rajesh Sawhney,  & other Angel investors.",Seed Funding,,,,,,,,,,,,,,,,,,,,,,,,,,,2015-08-06,2015.0,artist / designer marketplace,new delhi
29.0,08/06/2015,Applied Solar Technologies,Off-grid Solar Power,Mumbai,"Future Fund,Bessemer Venture, Capricorn Investment and IFC",Private Equity,"40,000,000",Series B,,,,,,,,,,,,,,,,,,,,,,,,40000000.0,2015-08-06,2015.0,off-grid solar power,mumbai
30.0,09/06/2015,Clovia,Private Label lingerie Ecommerce,New Delhi,IvyCap Ventures,Private Equity,"5,000,000",Series A,,,,,,,,,,,,,,,,,,,,,,,,5000000.0,2015-09-06,2015.0,private label lingerie ecommerce,new delhi
31.0,09/06/2015,Swiggy,Online Food Ordering,Bangalore,"Norwest Venture Partners, SAIF Partners, Accel Partners",Private Equity,"16,500,000",Series B,,,,,,,,,,,,,,,,,,,,,,,,16500000.0,2015-09-06,2015.0,online food ordering,bangalore
32.0,09/06/2015,PayMango,Mobile Commerce Platform,Gurgaon,Group of Angel Investors,Seed Funding,"234,000",,,,,,,,,,,,,,,,,,,,,,,,,234000.0,2015-09-06,2015.0,mobile commerce platform,gurgaon
33.0,09/06/2015,Printland,Online Printing Services,New Delhi,SIDBI Venture Capital Ltd,Private Equity,,Series A,,,,,,,,,,,,,,,,,,,,,,,,,2015-09-06,2015.0,online printing services,new delhi
34.0,09/06/2015,Teritree,Digital Marketing Services,Bangalore,KCL,Seed Funding,"140,000",,,,,,,,,,,,,,,,,,,,,,,,,140000.0,2015-09-06,2015.0,digital marketing services,bangalore
35.0,10/06/2015,Guiddoo,Travel Guide Mobile App,Mumbai,"Pawan Borle, SVP Fly Dubai & Others",Seed Funding,,,,,,,,,,,,,,,,,,,,,,,,,,,2015-10-06,2015.0,travel guide mobile app,mumbai
36.0,10/06/2015,Voonik,Fashion Ecommerce store,Bangalore,"Sequoia Capital, Seedfund",Private Equity,"5,000,000",Series A,,,,,,,,,,,,,,,,,,,,,,,,5000000.0,2015-10-06,2015.0,fashion ecommerce store,bangalore
37.0,11/06/2015,AdStringO,Mobile Compression Software,Mumbai,"Arihant Patni, Vishal Khare,  Viswanath Ramachandran",Seed Funding,"350,000",,,,,,,,,,,,,,,,,,,,,,,,,350000.0,2015-11-06,2015.0,mobile compression software,mumbai
38.0,11/06/2015,Faircent.com,Peer to Peer Lending platform,Gurgaon,M&S Partners Pte. Ltd,Seed Funding,"250,000",Pre-Series A,,,,,,,,,,,,,,,,,,,,,,,,250000.0,2015-11-06,2015.0,peer to peer lending platform,gurgaon
39.0,12/06/2015,La Renon,Global Healthcare products,Ahmedabad,Sequoia Capital,Private Equity,"16,000,000",Series A,,,,,,,,,,,,,,,,,,,,,,,,16000000.0,2015-12-06,2015.0,global healthcare products,ahmedabad
40.0,15/06/2015,Homelane,Home Furnishing Solutions,Bangalore,Sequoia Capital,Private Equity,"50,000,000",Series B,,,,,,,,,,,,,,,,,,,,,,,,50000000.0,2015-06-15,2015.0,home furnishing solutions,bangalore
41.0,15/06/2015,iSTAR,Skill Training & Placement Platform,Bangalore,Unitus Seed Fund,Private Equity,,Series A,,,,,,,,,,,,,,,,,,,,,,,,,2015-06-15,2015.0,skill training & placement platform,bangalore
42.0,15/06/2015,Shippr,Intra-City Logistics service,Bangalore,i2india Pvt Ltd,Seed Funding,"500,000",,,,,,,,,,,,,,,,,,,,,,,,,500000.0,2015-06-15,2015.0,intra-city logistics service,bangalore
43.0,16/06/2015,FoodAbhi,online tiffin service aggregator,Mumbai,Group of angel investors,Seed Funding,,,,,,,,,,,,,,,,,,,,,,,,,,,2015-06-16,2015.0,online tiffin service aggregator,mumbai
44.0,16/06/2015,Karma Recycling,Electronic Goods recycling service,Delhi,"Infuse Ventures, Low Carbon Enterprise Fund",Private Equity,,Series A,,,,,,,,,,,,,,,,,,,,,,,,,2015-06-16,2015.0,electronic goods recycling service,delhi
45.0,16/06/2015,CouponRaja,Online Coupon & comparison platform,Mumbai,"Mahesh Pratapneni, Pallab Chatterjee & others",Seed Funding,"500,000",,,,,,,,,,,,,,,,,,,,,,,,,500000.0,2015-06-16,2015.0,online coupon & comparison platform,mumbai
46.0,17/06/2015,Babychakra,Parents & Kids Online platform,Mumbai,"Mumbai Angels, Patni Family Office, Singapore Angel Network, Karan Maheshwari, Jatin Aneja, Kishor Ganji, Roopa Nath",Seed Funding,,,,,,,,,,,,,,,,,,,,,,,,,,,2015-06-17,2015.0,parents & kids online platform,mumbai
47.0,17/06/2015,Jiffstore,Online Grocery platform,Bangalore,"Unitus Seed Fund, Times Internet",Seed Funding,,additional funding round,,,,,,,,,,,,,,,,,,,,,,,,,2015-06-17,2015.0,online grocery platform,bangalore
48.0,17/06/2015,MyDentist,Dental Clinic chain,Mumbai,"LGT Group, Asian Healthcare fund, Seedfund",Private Equity,"8,200,000",Series C,,,,,,,,,,,,,,,,,,,,,,,,8200000.0,2015-06-17,2015.0,dental clinic chain,mumbai
49.0,18/06/2015,Moovo,On-Demand Logistics Service,New Delhi,YouWeCan Ventures,Seed Funding,,,,,,,,,,,,,,,,,,,,,,,,,,,2015-06-18,2015.0,on-demand logistics service,new delhi
50.0,18/06/2015,Fracktal Works,3D Printer Manufacturer,Bangalore,Neoteric Infomatique Limited,Private Equity,"3,000,000",Series A,,,,,,,,,,,,,,,,,,,,,,,,3000000.0,2015-06-18,2015.0,3d printer manufacturer,bangalore
51.0,18/06/2015,Hansa Customer Equity,IT / Customer Engagement Consulting,Mumbai,ASK Pravi,Private Equity,"5,000,000",Series A,,,,,,,,,,,,,,,,,,,,,,,,5000000.0,2015-06-18,2015.0,it / customer engagement consulting,mumbai
52.0,18/06/2015,HealthifyMe,Health & Fitness App,Bangalore,"Gopal Srinivasan, Sashi Reddy, Amit Gupta, Pallav Nadhani",Private Equity,,Series A,,,,,,,,,,,,,,,,,,,,,,,,,2015-06-18,2015.0,health & fitness app,bangalore
53.0,18/06/2015,CAKART.in,Online Education Marketplace,Bangalore,Sunil Maheshwari & group of investors,Seed Funding,,,,,,,,,,,,,,,,,,,,,,,,,,,2015-06-18,2015.0,online education marketplace,bangalore
54.0,19/06/2015,Housejoy,Home services marketplace,Bangalore,Matrix Partners,Private Equity,"4,000,000",Series A,,,,,,,,,,,,,,,,,,,,,,,,4000000.0,2015-06-19,2015.0,home services marketplace,bangalore
55.0,19/06/2015,FundsIndia.com,Financial Services Platform,Chennai,"Faering Capital, Foundation Capital, Inventus Capital Partners",Private Equity,"11,000,000",Series C,,,,,,,,,,,,,,,,,,,,,,,,11000000.0,2015-06-19,2015.0,financial services platform,chennai
56.0,20/06/2015,Cupick,Social Network for Artists,Bangalore,Group of Angel Investors from US/India,Seed Funding,"120,000",,,,,,,,,,,,,,,,,,,,,,,,,120000.0,2015-06-20,2015.0,social network for artists,bangalore
57.0,20/06/2015,Tracxn,Startup funding platform,Bangalore,"Sachin Bansal, Bunny Bansal & other investors",Private Equity,"10,000,000",Series A,,,,,,,,,,,,,,,,,,,,,,,,10000000.0,2015-06-20,2015.0,startup funding platform,bangalore
58.0,21/06/2015,Holachef,Food Delivery Platform,Mumbai,"Kalaari Capital, India Quotient",Private Equity,"3,100,000",Series A,,,,,,,,,,,,,,,,,,,,,,,,3100000.0,2015-06-21,2015.0,food delivery platform,mumbai
59.0,22/06/2015,belong,Data Driven recruitment recommendation,Bangalore,"Kunal Bahl, Rohit Bansal, Blume Ventures, Phanindra Sama, Raju Reddy",Private Equity,"5,000,000",Series A,,,,,,,,,,,,,,,,,,,,,,,,5000000.0,2015-06-22,2015.0,data driven recruitment recommendation,bangalore
60.0,22/06/2015,Ixigo,Travel Search Engine,Gurgaon,Micromax Informatics,Private Equity,,Strategic Investment,,,,,,,,,,,,,,,,,,,,,,,,,2015-06-22,2015.0,travel search engine,gurgaon
61.0,22/06/2015,SkillAngels,Brain Games Platform,Chennai,Sprout Angels LLP,Seed Funding,,,,,,,,,,,,,,,,,,,,,,,,,,,2015-06-22,2015.0,brain games platform,chennai
62.0,22/06/2015,Vidgyor,Video Advertisement Platform,Bangalore,AngelPrime,Seed Funding,"500,000",,,,,,,,,,,,,,,,,,,,,,,,,500000.0,2015-06-22,2015.0,video advertisement platform,bangalore
63.0,22/06/2015,Banihal,Algorithmic Match Making Platform,New Delhi / California,Dr David Cheriton,Seed Funding,,,,,,,,,,,,,,,,,,,,,,,,,,,2015-06-22,2015.0,algorithmic match making platform,new delhi / california
64.0,23/06/2015,Goodservice,Mobile Chat based concierge service,New Delhi,Sequoia Capital,Private Equity,"1,600,000",Series A,,,,,,,,,,,,,,,,,,,,,,,,1600000.0,2015-06-23,2015.0,mobile chat based concierge service,new delhi
65.0,23/06/2015,Treebo,Online Budget Hotel Booking Service,Bangalore,"Matrix Partners India, SAIF Partners",Private Equity,"6,000,000",Series A,,,,,,,,,,,,,,,,,,,,,,,,6000000.0,2015-06-23,2015.0,online budget hotel booking service,bangalore
66.0,23/06/2015,EduKart,Online education marketplace,New Delhi,"Holostik Group, YouWeCan Ventures, 500 Startups, Vijay Shekhar Sharma, Manish Kheterpal, Amit Patni",Private Equity,"1,000,000",Series A,,,,,,,,,,,,,,,,,,,,,,,,1000000.0,2015-06-23,2015.0,online education marketplace,new delhi
67.0,23/06/2015,Healthians.com,Preventive healthcare services,Hyderabad,YouWeCan Ventures,Seed Funding,,,,,,,,,,,,,,,,,,,,,,,,,,,2015-06-23,2015.0,preventive healthcare services,hyderabad
68.0,24/06/2015,LabInApp,Science Learning App,Bangalore,Unitus Seed Fund,Seed Funding,,,,,,,,,,,,,,,,,,,,,,,,,,,2015-06-24,2015.0,science learning app,bangalore
69.0,24/06/2015,Syona Cosmetics,Beauty and Wellness platform,Chennai,Chennai Angels,Seed Funding,,,,,,,,,,,,,,,,,,,,,,,,,,,2015-06-24,2015.0,beauty and wellness platform,chennai
70.0,24/06/2015,Sigrid Education,Online Education Platform,Noida,Oliphans Capital,Seed Funding,,,,,,,,,,,,,,,,,,,,,,,,,,,2015-06-24,2015.0,online education platform,noida
71.0,24/06/2015,Indix,SaaS product intelligence platform,,"Nokia Growth Partners, Nexus Venture Partners, Avalon Ventures",Private Equity,"15,000,000",Series C,,,,,,,,,,,,,,,,,,,,,,,,15000000.0,2015-06-24,2015.0,saas product intelligence platform,
72.0,24/06/2015,The Porter,Logistics Tech,Mumbai,"Sequoia Capital, Kae Capital, Anupam Mittal, Sandeep Tandon",Private Equity,"5,500,000",Series A,,,,,,,,,,,,,,,,,,,,,,,,5500000.0,2015-06-24,2015.0,logistics tech,mumbai
73.0,24/06/2015,Retention.ai,App Analytics platform,Bangalore,"Mercury Fund, Anshu Sharma, Pratyush Prasanna, Robert Winters & others",Seed Funding,"500,000",,,,,,,,,,,,,,,,,,,,,,,,,500000.0,2015-06-24,2015.0,app analytics platform,bangalore
74.0,25/06/2015,Fusion Microfinance,Micro Finance Platform,New Delhi,"Development finance institution Belgian Investment Company, Oikocredit",Private Equity,"8,600,000",Series C,,,,,,,,,,,,,,,,,,,,,,,,8600000.0,2015-06-25,2015.0,micro finance platform,new delhi
75.0,25/06/2015,Zinka,Freight logistics platform,Bangalore,"Accel Partners, Flipkart",Private Equity,"6,000,000",Series A,,,,,,,,,,,,,,,,,,,,,,,,6000000.0,2015-06-25,2015.0,freight logistics platform,bangalore
76.0,26/06/2015,CreditMantri,Credit Management Services,Chennai,"IDG Ventures India, Elevar Equity, Accion Venture Lab",Private Equity,"2,500,000",Series A,,,,,,,,,,,,,,,,,,,,,,,,2500000.0,2015-06-26,2015.0,credit management services,chennai
77.0,26/06/2015,GetMyPeon,Hyperlocal Handyman Services,Mumbai,Undisclosed investors,Seed Funding,"250,000",,,,,,,,,,,,,,,,,,,,,,,,,250000.0,2015-06-26,2015.0,hyperlocal handyman services,mumbai
78.0,29/06/2015,UrbanClap,Hyperlocal services marketplace,New Delhi,"SAIF Partners,  Accel Partners",Private Equity,"10,000,000",Series A,,,,,,,,,,,,,,,,,,,,,,,,10000000.0,2015-06-29,2015.0,hyperlocal services marketplace,new delhi
79.0,29/06/2015,StayGlad,Beauty services Mobile Marketplace,Bangalore,"Tracxn Labs, Sahil Barua",Seed Funding,,,,,,,,,,,,,,,,,,,,,,,,,,,2015-06-29,2015.0,beauty services mobile marketplace,bangalore
80.0,29/06/2015,AdWyze,Marketing / Advertising Automation platform,Bangalore,Mape Advisory,Seed Funding,"1,000,000",,,,,,,,,,,,,,,,,,,,,,,,,1000000.0,2015-06-29,2015.0,marketing / advertising automation platform,bangalore
81.0,29/06/2015,Zimmber,Hyperlocal Handyman Services,Mumbai,"Naveen Tiwari, Mohit Saxena, Amit Gupta, Piyush Shah, Manish Dugar",Seed Funding,"400,000",,,,,,,,,,,,,,,,,,,,,,,,,400000.0,2015-06-29,2015.0,hyperlocal handyman services,mumbai
82.0,30/06/2015,Buttercups,Online Lingerie platform,Bangalore,"Kanwaljit Singh, Angie Mahtaney, Manoj Varghese",Seed Funding,,,,,,,,,,,,,,,,,,,,,,,,,,,2015-06-30,2015.0,online lingerie platform,bangalore
83.0,30/06/2015,RailYatri,Railways Information Mobile app,Bangalore,"Helion Ventures, Omidiyar Network, Blume Ventures and Ujama",Private Equity,,Pre-Series A,,,,,,,,,,,,,,,,,,,,,,,,,2015-06-30,2015.0,railways information mobile app,bangalore
84.0,30/06/2015,aagaar.com,Hyperlocal grocery delivery,Gurgaon,Group of Investors,Seed Funding,,,,,,,,,,,,,,,,,,,,,,,,,,,2015-06-30,2015.0,hyperlocal grocery delivery,gurgaon
85.0,30/06/2015,Flatchat,Flat rental Mobile App,Bangalore,Commonfloor,Private Equity,"2,500,000",Strategic Funding,,,,,,,,,,,,,,,,,,,,,,,,2500000.0,2015-06-30,2015.0,flat rental mobile app,bangalore
86.0,30/06/2015,MyCFO,Wealth Management Platform,Mumbai,Sameer Koticha,Private Equity,"1,500,000",Series A,,,,,,,,,,,,,,,,,,,,,,,,1500000.0,2015-06-30,2015.0,wealth management platform,mumbai
,,,,,,,,,,,,,,,,,,,,,,,,,,,,,,,,,,,,
1.0,02/03/2015,TrulyMadly.com,,,"Helion Venture Partners, Kae Capital",Private Equity,"5,500,000",Series A,,,,,,,,,,,,,,,,,,,,,,,,5500000.0,2015-02-03,2015.0,,
2.0,02/03/2015,InstaLively,,,Group of Angel Investors,Seed Funding,"120,000",,,,,,,,,,,,,,,,,,,,,,,,,120000.0,2015-02-03,2015.0,,
3.0,03/03/2015,Vserv,,,"Maverick Capital, IDG Ventures India",Private Equity,"15,000,000",,,,,,,,,,,,,,,,,,,,,,,,,15000000.0,2015-03-03,2015.0,,
4.0,03/03/2015,Intruo.com,,,"Ashutosh Lawania, Alok Goel & others",Seed Funding,,,,,,,,,,,,,,,,,,,,,,,,,,,2015-03-03,2015.0,,
5.0,05/03/2015,Niffler,,,SAIF Partners,Seed Funding,"1,000,000",,,,,,,,,,,,,,,,,,,,,,,,,1000000.0,2015-05-03,2015.0,,
6.0,05/03/2015,CustomFurnish.com,,,"Madhukar Gangadi, Satish Reddy, Srini Raju, Srini Koppolu & SIDBI",Private Equity,"2,500,000",,,,,,,,,,,,,,,,,,,,,,,,,2500000.0,2015-05-03,2015.0,,
7.0,06/03/2015,MapMyGenome,,,Rajan Anandan & other angel investors,Private Equity,"1,200,000",,,,,,,,,,,,,,,,,,,,,,,,,1200000.0,2015-06-03,2015.0,,
8.0,09/03/2015,Crowdfire(formerly Justunfollow),,,Kalaari Capital,Private Equity,"2,500,000",,,,,,,,,,,,,,,,,,,,,,,,,2500000.0,2015-09-03,2015.0,,
9.0,09/03/2015,Bite Club,,,"Powai Lake Ventures, Aneesh Reddy, Ashish Kashyap, Alok Mittal",Seed Funding,"500,000",,,,,,,,,,,,,,,,,,,,,,,,,500000.0,2015-09-03,2015.0,,
10.0,10/03/2015,Localbanya,,,Shrem Strategies,Private Equity,,Series B,,,,,,,,,,,,,,,,,,,,,,,,,2015-10-03,2015.0,,
11.0,11/03/2015,Appedo,,,Undisclosed Investors,Seed Funding,"1,000,000",,,,,,,,,,,,,,,,,,,,,,,,,1000000.0,2015-11-03,2015.0,,
12.0,11/03/2015,Fitraq.com,,,Tarun Arora,Seed Funding,"150,000",,,,,,,,,,,,,,,,,,,,,,,,,150000.0,2015-11-03,2015.0,,
13.0,11/03/2015,ChargeBee,,,"Tiger Global, Accel Partners",Private Equity,"5,000,000",Series B,,,,,,,,,,,,,,,,,,,,,,,,5000000.0,2015-11-03,2015.0,,
14.0,11/03/2015,Groupon India,,,Sequoia Capital,Private Equity,"20,000,000",,,,,,,,,,,,,,,,,,,,,,,,,20000000.0,2015-11-03,2015.0,,
15.0,12/03/2015,Process 9,,,"IAN Ventures, Alok Sharma, Kris Gopalakrishnan, Saurabh Srivastava, Ajai Chowdhry",Seed Funding,,,,,,,,,,,,,,,,,,,,,,,,,,,2015-12-03,2015.0,,
16.0,12/03/2015,MoonFrog Labs,,,"Tiger Global, Sequoia Capital.",Private Equity,"15,000,000",Series A,,,,,,,,,,,,,,,,,,,,,,,,15000000.0,2015-12-03,2015.0,,
17.0,13/03/2015,Foodpanda,,,Rocket Internet AG & others,Private Equity,"110,000,000",Series C,,,,,,,,,,,,,,,,,,,,,,,,110000000.0,2015-03-13,2015.0,,
18.0,13/03/2015,Paytm,,,Ratan Tata,Private Equity,,More details,,,,,,,,,,,,,,,,,,,,,,,,,2015-03-13,2015.0,,
19.0,13/03/2015,DiabetOmics,,,"VentureEast,  Varaprasad Reddy",Private Equity,"5,000,000",Series C,,,,,,,,,,,,,,,,,,,,,,,,5000000.0,2015-03-13,2015.0,,
20.0,13/03/2015,Qyk,,,"Powai Lake Ventures, Zishan Hayath, Abhishek Goyal, Sahil Barua",Seed Funding,,,,,,,,,,,,,,,,,,,,,,,,,,,2015-03-13,2015.0,,
21.0,14/03/2015,Daily Rounds,,,"Kae Capital, GSF, Teruhide Sato",Seed Funding,"500,000",,,,,,,,,,,,,,,,,,,,,,,,,500000.0,2015-03-14,2015.0,,
22.0,14/03/2015,Orobind,,,"Zishaan Hayath, Lalit Mangal, Harpreet Singh Grover",Seed Funding,"200,000",,,,,,,,,,,,,,,,,,,,,,,,,200000.0,2015-03-14,2015.0,,
23.0,14/03/2015,Routofy,,,"Kunal Bahl, Rohit Bansal",Seed Funding,,,,,,,,,,,,,,,,,,,,,,,,,,,2015-03-14,2015.0,,
24.0,16/03/2015,Digital Gorkha,,,Ramesh kavediya,Seed Funding,"166,000",,,,,,,,,,,,,,,,,,,,,,,,,166000.0,2015-03-16,2015.0,,
25.0,16/03/2015,NestAway,,,"IDG Ventures, Naveen Tewari",Seed Funding,"1,300,000",,,,,,,,,,,,,,,,,,,,,,,,,1300000.0,2015-03-16,2015.0,,
26.0,16/03/2015,The Better India,,,I-cube-N,Seed Funding,"166,000",,,,,,,,,,,,,,,,,,,,,,,,,166000.0,2015-03-16,2015.0,,
27.0,16/03/2015,Meru Cabs,,,Value Fund Advisors,Private Equity,"50,000,000",,,,,,,,,,,,,,,,,,,,,,,,,50000000.0,2015-03-16,2015.0,,
28.0,17/03/2015,GolfLAN,,,YourNest Angel Fund,Seed Funding,,,,,,,,,,,,,,,,,,,,,,,,,,,2015-03-17,2015.0,,
29.0,18/03/2015,Drivestream,,,Wipro,Private Equity,"5,000,000",,,,,,,,,,,,,,,,,,,,,,,,,5000000.0,2015-03-18,2015.0,,
30.0,18/03/2015,wWhere,,,Group of Angel Investors,Seed Funding,"200,000",,,,,,,,,,,,,,,,,,,,,,,,,200000.0,2015-03-18,2015.0,,
31.0,18/03/2015,GoJavas,,,Snapdeal,Private Equity,,"Minority stake, Strategic",,,,,,,,,,,,,,,,,,,,,,,,,2015-03-18,2015.0,,
32.0,19/03/2015,Tripoto,,,"IDG Ventures, Outbox Ventures",Private Equity,"2,000,000",Pre-Series A,,,,,,,,,,,,,,,,,,,,,,,,2000000.0,2015-03-19,2015.0,,
33.0,19/03/2015,Graphic India,,,"CA Media LP,  Start Media.",Seed Funding,"2,800,000",,,,,,,,,,,,,,,,,,,,,,,,,2800000.0,2015-03-19,2015.0,,
34.0,20/03/2015,Harness Handitouch,,,Armat Group,Private Equity,,Series A,,,,,,,,,,,,,,,,,,,,,,,,,2015-03-20,2015.0,,
35.0,20/03/2015,Lets Corp,,,Wu Chay Chin,Seed Funding,"3,000,000",,,,,,,,,,,,,,,,,,,,,,,,,3000000.0,2015-03-20,2015.0,,
36.0,20/03/2015,CollateBox,,,LetsVenture,Seed Funding,"180,000",,,,,,,,,,,,,,,,,,,,,,,,,180000.0,2015-03-20,2015.0,,
37.0,20/03/2015,Mahindra First Choice,,,Valiant Capital,Private Equity,"15,000,000",Series B,,,,,,,,,,,,,,,,,,,,,,,,15000000.0,2015-03-20,2015.0,,
38.0,21/03/2015,Round One,,,"HT Media, Arun Duggal",Seed Funding,,,,,,,,,,,,,,,,,,,,,,,,,,,2015-03-21,2015.0,,
39.0,23/03/2015,RazorPay,,,Y Combinator,Seed Funding,"120,000",,,,,,,,,,,,,,,,,,,,,,,,,120000.0,2015-03-23,2015.0,,
40.0,23/03/2015,Mosambee,,,RVCF and SIDBI,Private Equity,,Series B,,,,,,,,,,,,,,,,,,,,,,,,,2015-03-23,2015.0,,
41.0,24/03/2015,Furlenco,,,LightBox Ventures,Private Equity,"6,000,000",Series A,,,,,,,,,,,,,,,,,,,,,,,,6000000.0,2015-03-24,2015.0,,
42.0,24/03/2015,Cubito,,,Sol Primero,Seed Funding,"160,000",,,,,,,,,,,,,,,,,,,,,,,,,160000.0,2015-03-24,2015.0,,
43.0,25/03/2015,Teabox,,,"JAFCO Asia, Keystone Group, Dragoneer Investment, Accel Partners",Private Equity,"6,000,000",Series A,,,,,,,,,,,,,,,,,,,,,,,,6000000.0,2015-03-25,2015.0,,
44.0,25/03/2015,Artoo,,,"Accion Venture Labs, Rianta Capital",Private Equity,"500,000",Series A,,,,,,,,,,,,,,,,,,,,,,,,500000.0,2015-03-25,2015.0,,
45.0,25/03/2015,Fxkart.com,,,"Dr Mushtaq Shah, Dr Faraz Naqvi",Seed Funding,"2,000,000",,,,,,,,,,,,,,,,,,,,,,,,,2000000.0,2015-03-25,2015.0,,
46.0,25/03/2015,Rozgar Mela,,,"Impact Investment Holding, Upaya Social Ventures",Seed Funding,,,,,,,,,,,,,,,,,,,,,,,,,,,2015-03-25,2015.0,,
47.0,25/03/2015,OYO Rooms,,,"Greenoaks capital, Sequoia Capital, LightSpeed Ventures",Private Equity,"25,000,000",Series A,,,,,,,,,,,,,,,,,,,,,,,,25000000.0,2015-03-25,2015.0,,
48.0,26/03/2015,Roposo.com,,,"Tiger Global Management, Indian Quotient, Binny Bansal",Private Equity,"5,000,000",Series A,,,,,,,,,,,,,,,,,,,,,,,,5000000.0,2015-03-26,2015.0,,
49.0,26/03/2015,Teewe,,,"Sequoia Capital, India Quotient",Seed Funding,"1,750,000",,,,,,,,,,,,,,,,,,,,,,,,,1750000.0,2015-03-26,2015.0,,
50.0,26/03/2015,ePoise,,,Undisclosed,Seed Funding,,,,,,,,,,,,,,,,,,,,,,,,,,,2015-03-26,2015.0,,
51.0,27/03/2015,Urjas,,,Solidarity Venture Capital & others,Seed Funding,"100,000",,,,,,,,,,,,,,,,,,,,,,,,,100000.0,2015-03-27,2015.0,,
52.0,27/03/2015,Chargein,,,Pittie Group,Seed Funding,"100,000",,,,,,,,,,,,,,,,,,,,,,,,,100000.0,2015-03-27,2015.0,,
53.0,28/03/2015,Yogurt Labs,,,"Nick Adams, Kiran Bhat, Family Pot Investments LLP",Seed Funding,"115,000",,,,,,,,,,,,,,,,,,,,,,,,,115000.0,2015-03-28,2015.0,,
54.0,28/03/2015,LimeRoad.com,,,"Tiger Global, Matrix Partners, Lightspeed Venture Partners",Private Equity,"30,000,000",,,,,,,,,,,,,,,,,,,,,,,,,30000000.0,2015-03-28,2015.0,,
55.0,28/03/2015,Team Indus,,,"Nandan Nilekani, Rajiv Mody, Ajai Chowdhary",Private Equity,"1,500,000",Pre-Series A,,,,,,,,,,,,,,,,,,,,,,,,1500000.0,2015-03-28,2015.0,,
56.0,30/03/2015,Arohan Financial Services,,,Tano Capital,Private Equity,"10,000,000",,,,,,,,,,,,,,,,,,,,,,,,,10000000.0,2015-03-30,2015.0,,
57.0,30/03/2015,BillDesk,,,TA Associates,Private Equity,"75,000,000",Incremental Capital,,,,,,,,,,,,,,,,,,,,,,,,75000000.0,2015-03-30,2015.0,,
58.0,31/03/2015,Triphobo,,,"Mayfield Ventures, Kalaari Capital",Private Equity,"3,000,000",Series B (More Here),,,,,,,,,,,,,,,,,,,,,,,,3000000.0,2015-03-31,2015.0,,
59.0,31/03/2015,Aryaka,,,"Trinity Ventures, InterWest Partners, Mohr Davidow Ventures, Presidio Ventures",Private Equity,"16,000,000",Series D,,,,,,,,,,,,,,,,,,,,,,,,16000000.0,2015-03-31,2015.0,,
60.0,31/03/2015,Appsdaily,,,"Zodius Capital, Ru-Net, Kalaari Capital,  Qualcomm Ventures",Private Equity,"16,000,000",Series C,,,,,,,,,,,,,,,,,,,,,,,,16000000.0,2015-03-31,2015.0,,
,,,,,,,,,,,,,,,,,,,,,,,,,,,,,,,,,,,,
1.0,01/05/2015,Foodpanda,Online Food Delivery,Gurgaon,"Goldman Sachs, Rocket Internet",Private Equity,"100,000,000",Series D,,,,,,,,,,,,,,,,,,,,,,,,100000000.0,2015-01-05,2015.0,online food delivery,gurgaon
2.0,01/05/2015,Termsheet,Fund Raising Platform,Chennai,"Anand Vijay, Nipun Dureja, Satyajit Heeralal, Keith Rodricks, Gaurav Lochan, Azmul Haque, Nikhil Bagri",Seed Funding,"100,000",,,,,,,,,,,,,,,,,,,,,,,,,100000.0,2015-01-05,2015.0,fund raising platform,chennai
3.0,04/05/2015,Applicate,Workforce Management Software,Bangalore,"Rishi Vasudev, Amit Gupta, Rajiv Nayan",Seed Funding,"550,000",,,,,,,,,,,,,,,,,,,,,,,,,550000.0,2015-04-05,2015.0,workforce management software,bangalore
4.0,04/05/2015,World Art Community,Online Art Marketplace,Gurgaon,Viraj Tyagi & others,Seed Funding,"200,000",,,,,,,,,,,,,,,,,,,,,,,,,200000.0,2015-04-05,2015.0,online art marketplace,gurgaon
5.0,04/05/2015,SpoonJoy,Online Food Delivery,Bangalore,SAIF Partners,Seed Funding,"1,000,000",,,,,,,,,,,,,,,,,,,,,,,,,1000000.0,2015-04-05,2015.0,online food delivery,bangalore
6.0,05/05/2015,Seed Schools,Affordable Education,Hyderabad,Acumen Fund,Seed Funding,"650,000",,,,,,,,,,,,,,,,,,,,,,,,,650000.0,2015-05-05,2015.0,affordable education,hyderabad
7.0,05/05/2015,Ignis Careers,Career Development,Hyderabad,Acumen Fund,Seed Funding,"250,000",,,,,,,,,,,,,,,,,,,,,,,,,250000.0,2015-05-05,2015.0,career development,hyderabad
8.0,05/05/2015,Square Yards,Real Estate Advisory,Gurgaon,Undisclosed Investors,Private Equity,"6,000,000",pre-Series A,,,,,,,,,,,,,,,,,,,,,,,,6000000.0,2015-05-05,2015.0,real estate advisory,gurgaon
9.0,05/05/2015,Fintellix,Banking Analytics Platform,Bangalore,"IDG Ventures, Sequoia Capital",Private Equity,"15,000,000",Series C,,,,,,,,,,,,,,,,,,,,,,,,15000000.0,2015-05-05,2015.0,banking analytics platform,bangalore
10.0,05/05/2015,Customer360,Customer Engagement Platform,Mumbai,Vishwas Patel,Seed Funding,,,,,,,,,,,,,,,,,,,,,,,,,,,2015-05-05,2015.0,customer engagement platform,mumbai
11.0,06/05/2015,Delhivery,Ecommerce Logistics,Gurgaon,"Tiger Global Management, Multiples Alternate Asset Management, Nexus Venture Partners, Times Internet",Private Equity,"85,000,000",Series D,,,,,,,,,,,,,,,,,,,,,,,,85000000.0,2015-06-05,2015.0,ecommerce logistics,gurgaon
12.0,06/05/2015,Swiggy,Online Food Delivery,Bangalore,Norwest Venture Partners,Private Equity,"15,000,000",Series B,,,,,,,,,,,,,,,,,,,,,,,,15000000.0,2015-06-05,2015.0,online food delivery,bangalore
13.0,07/05/2015,Uniphore,Speech Recognition Solutions,Chennai,"IDG Ventures, Kris Gopalakrishnan",Private Equity,,Series A,,,,,,,,,,,,,,,,,,,,,,,,,2015-07-05,2015.0,speech recognition solutions,chennai
14.0,07/05/2015,Box8,Online Food Delivery,Mumbai,Mayfield Ventures,Private Equity,"3,500,000",Series A,,,,,,,,,,,,,,,,,,,,,,,,3500000.0,2015-07-05,2015.0,online food delivery,mumbai
15.0,07/05/2015,Toppr,Online Education Platform,Mumbai,"Fidelity Growth Partners India, SAIF Partners,  Helion Ventures",Private Equity,"10,000,000",Series B,,,,,,,,,,,,,,,,,,,,,,,,10000000.0,2015-07-05,2015.0,online education platform,mumbai
16.0,07/05/2015,Vedantu,Online Education Platform,Bangalore,"Accel Partners, Tiger Global Management",Private Equity,"5,000,000",Series A,,,,,,,,,,,,,,,,,,,,,,,,5000000.0,2015-07-05,2015.0,online education platform,bangalore
17.0,08/05/2015,BuyHatke,Online Product Comparison,Bangalore,"S.Gopalakrishnan, Beenos",Seed Funding,"1,000,000",,,,,,,,,,,,,,,,,,,,,,,,,1000000.0,2015-08-05,2015.0,online product comparison,bangalore
18.0,08/05/2015,KleverKid,Online Education Platform,New Delhi,Aarin Capital Partners,Seed Funding,,,,,,,,,,,,,,,,,,,,,,,,,,,2015-08-05,2015.0,online education platform,new delhi
19.0,08/05/2015,Uniken,Online Security Platform,Pune,Exfinity Ventures,Private Equity,"2,000,000",Bridge Round Pre-Series B,,,,,,,,,,,,,,,,,,,,,,,,2000000.0,2015-08-05,2015.0,online security platform,pune
20.0,08/05/2015,GrandOpinion,Online Medical Diagnostic,New Delhi,Florida based Angel investor,Seed Funding,"150,000",,,,,,,,,,,,,,,,,,,,,,,,,150000.0,2015-08-05,2015.0,online medical diagnostic,new delhi
21.0,08/05/2015,HealthifyMe,Health & Fitness App,Bangalore,Micromax Informatics,Private Equity,,Strategic Investment,,,,,,,,,,,,,,,,,,,,,,,,,2015-08-05,2015.0,health & fitness app,bangalore
22.0,12/05/2015,ZapStitch,Cloud Data Integration Platform,Bangalore,"Helion Venture Partners, Orios Venture Partners",Private Equity,"2,000,000",Pre-Series A,,,,,,,,,,,,,,,,,,,,,,,,2000000.0,2015-12-05,2015.0,cloud data integration platform,bangalore
23.0,12/05/2015,Wassup,Mobile Laundry Cleaning Service,Chennai,"Arun Chandra Mohan, Praveen Sinha",Private Equity,"2,000,000",Pre-Series A,,,,,,,,,,,,,,,,,,,,,,,,2000000.0,2015-12-05,2015.0,mobile laundry cleaning service,chennai
24.0,12/05.2015,Mobiefit,Mobile Fitness App,Goa,Prototyze,Seed Funding,,,,,,,,,,,,,,,,,,,,,,,,,,,2015-12-05,2015.0,mobile fitness app,goa
25.0,12/05.2015,Plancess,Online Education Platform,Mumbai,"Rajendra Gogri,  Chandrakant Gogri",Seed Funding,"2,000,000",,,,,,,,,,,,,,,,,,,,,,,,,2000000.0,2015-12-05,2015.0,online education platform,mumbai
26.0,12/05/2015,WorkHorse,Service-On-Demand Mobile App,Mumbai,Undisclosed Investors,Seed Funding,,,,,,,,,,,,,,,,,,,,,,,,,,,2015-12-05,2015.0,service-on-demand mobile app,mumbai
27.0,13/05/2015,Innovaccer,Intelligent Data Analytics,Noida,"Rajan Anandan, Teru Sato, Aneesh Reddy, Venkatesh Valluri",Seed Funding,,,,,,,,,,,,,,,,,,,,,,,,,,,2015-05-13,2015.0,intelligent data analytics,noida
28.0,13/05/2015,MyCuteOffice,Online Office Rental,Mumbai,Lead Angels,Seed Funding,,,,,,,,,,,,,,,,,,,,,,,,,,,2015-05-13,2015.0,online office rental,mumbai
29.0,14/05/2015,IndianRoots.com,Lifestyle Ecommerce Portal,Gurgaon,KJS Group,Private Equity,"5,000,000",Series B,,,,,,,,,,,,,,,,,,,,,,,,5000000.0,2015-05-14,2015.0,lifestyle ecommerce portal,gurgaon
30.0,14/05/2015,RedPolka,Online Fashion Aggregator,Mumbai,Undisclosed Investors,Seed Funding,"250,000",,,,,,,,,,,,,,,,,,,,,,,,,250000.0,2015-05-14,2015.0,online fashion aggregator,mumbai
31.0,15/05/2015,Venturesity,Online Job skills Showcase,Bangalore,"Phanindra Sama, Jay Sethuram, Hemant Kanakia, Ravi Trivedi",Seed Funding,"270,000",,,,,,,,,,,,,,,,,,,,,,,,,270000.0,2015-05-15,2015.0,online job skills showcase,bangalore
32.0,18/05/2015,TheBetterIndia.com,Online News Media,Bangalore,Mohandas Pai,Seed Funding,,Pre-Series Bridge,,,,,,,,,,,,,,,,,,,,,,,,,2015-05-18,2015.0,online news media,bangalore
33.0,18/05/2015,Awaaz De,Enterprise Communication Platform,Ahmedabad,Samir Shah,Seed Funding,,,,,,,,,,,,,,,,,,,,,,,,,,,2015-05-18,2015.0,enterprise communication platform,ahmedabad
34.0,19/05/2015,Chaayos,Offline Tea Chain,New Delhi,Tiger Global Management,Private Equity,"1,000,000",Series A,,,,,,,,,,,,,,,,,,,,,,,,1000000.0,2015-05-19,2015.0,offline tea chain,new delhi
35.0,19/05/2015,Akosha,Business Messaging App,New Delhi,Sequoia Capital,Private Equity,"16,000,000",Series B,,,,,,,,,,,,,,,,,,,,,,,,16000000.0,2015-05-19,2015.0,business messaging app,new delhi
36.0,19/05/2015,Cooey,Health Mobile App,Bangalore,Subhash Goyal,Seed Funding,"470,000",,,,,,,,,,,,,,,,,,,,,,,,,470000.0,2015-05-19,2015.0,health mobile app,bangalore
37.0,19/05/2015,MeetUniv,Online Ed-Tech Platform,Noida,Peesh Venture Capital,Seed Funding,"1,000,000",,,,,,,,,,,,,,,,,,,,,,,,,1000000.0,2015-05-19,2015.0,online ed-tech platform,noida
38.0,19/05/2015,Inspirock,Online Travel Planning,,MakeMyTrip Innovation Fund,Private Equity,,,,,,,,,,,,,,,,,,,,,,,,,,,2015-05-19,2015.0,online travel planning,
39.0,19/05/2015,Crown-it,Hyperlocal Mobile Marketplace,Gurgaon,"Accel Partners, Helion Venture Partners",Private Equity,"5,500,000",Series A,,,,,,,,,,,,,,,,,,,,,,,,5500000.0,2015-05-19,2015.0,hyperlocal mobile marketplace,gurgaon
40.0,19/05/2015,Trucksfirst,Trucking Logistic Operations,Gurgaon,SAIF partners,Private Equity,"10,000,000",Series A,,,,,,,,,,,,,,,,,,,,,,,,10000000.0,2015-05-19,2015.0,trucking logistic operations,gurgaon
41.0,20/05/2015,Lookup,B2C Messaging App,Bangalore,Biz Stone,Private Equity,"3,000,000",Series A,,,,,,,,,,,,,,,,,,,,,,,,3000000.0,2015-05-20,2015.0,b2c messaging app,bangalore
42.0,21/05/2015,SunTerrace,Rooftop Solar Plants,New Delhi,Sunergy Investors,Private Equity,,,,,,,,,,,,,,,,,,,,,,,,,,,2015-05-21,2015.0,rooftop solar plants,new delhi
43.0,22/05/2015,Nudgespot,Customer Engagement Platform,Bangalore,"Kae Capital, Anoop Goyal, Mike Shah, VA Sastry",Seed Funding,"625,000",,,,,,,,,,,,,,,,,,,,,,,,,625000.0,2015-05-22,2015.0,customer engagement platform,bangalore
44.0,22/05/2015,CarDekho,Online Car Portal,Jaipur,HDFC Bank,Private Equity,,1% stake,,,,,,,,,,,,,,,,,,,,,,,,,2015-05-22,2015.0,online car portal,jaipur
45.0,22/05/2015,EveningFlavors,Online Table Reservation,Bangalore,Sandiep Shrivatsava,Seed Funding,"500,000",,,,,,,,,,,,,,,,,,,,,,,,,500000.0,2015-05-22,2015.0,online table reservation,bangalore
46.0,25/05/2015,Razorpay,Online Payment Gateway,Bangalore,Punit Soni,Seed Funding,,,,,,,,,,,,,,,,,,,,,,,,,,,2015-05-25,2015.0,online payment gateway,bangalore
47.0,25/05/2015,ZenParent,Parents focused Web Content,Bangalore,i2india Ventures,Seed Funding,"500,000",,,,,,,,,,,,,,,,,,,,,,,,,500000.0,2015-05-25,2015.0,parents focused web content,bangalore
48.0,25/05/2015,Newgen Payments,Payments Solution Provider,New Delhi,Jan Manten,Seed Funding,,,,,,,,,,,,,,,,,,,,,,,,,,,2015-05-25,2015.0,payments solution provider,new delhi
49.0,26/05/2015,UrbanPro,On-demand Service marketplace,Bangalore,Nirvana Venture Advisors,Private Equity,"2,000,000",Series A,,,,,,,,,,,,,,,,,,,,,,,,2000000.0,2015-05-26,2015.0,on-demand service marketplace,bangalore
50.0,26/05/2015,Goodbox,On-Demand Business messaging,Bangalore,Manipal Group,Seed Funding,"200,000",,,,,,,,,,,,,,,,,,,,,,,,,200000.0,2015-05-26,2015.0,on-demand business messaging,bangalore
51.0,26/05/2015,Renderlogy,Online Home Décor,Hyderabad,Astarc Ventures,Private Equity,"1,000,000",Series A,,,,,,,,,,,,,,,,,,,,,,,,1000000.0,2015-05-26,2015.0,online home décor,hyderabad
52.0,27/05/2015,Postman,API Workflow platform,Bangalore,Nexus Venture Partners,Seed Funding,"1,000,000",Series A,,,,,,,,,,,,,,,,,,,,,,,,1000000.0,2015-05-27,2015.0,api workflow platform,bangalore
53.0,27/05/2015,Casa2inns,Affordable Hotel Booking Online,New Delhi,"Accel Partners, Kalaari Capital",Private Equity,"5,000,000",Series A,,,,,,,,,,,,,,,,,,,,,,,,5000000.0,2015-05-27,2015.0,affordable hotel booking online,new delhi
54.0,27/05/2015,FleetRover,Logistics Intelligence,Goa,"Tim Chen, Sanjay Venkat",Seed Funding,"180,000",,,,,,,,,,,,,,,,,,,,,,,,,180000.0,2015-05-27,2015.0,logistics intelligence,goa
56.0,28/05/2015,TheKarrier,Last Mile Logistics,Bangalore,"Sol Primero, Outbox Ventures, Nikunj Jain",Seed Funding,"240,000",,,,,,,,,,,,,,,,,,,,,,,,,240000.0,2015-05-28,2015.0,last mile logistics,bangalore
57.0,28/05/2015,Zoomcar,Self-driven Car rental,Bangalore,Sequoia Capital,Private Equity,"5,000,000",Series B Interim Funding,,,,,,,,,,,,,,,,,,,,,,,,5000000.0,2015-05-28,2015.0,self-driven car rental,bangalore
58.0,28/05/2015,Truweight,Weight Management Service,Hyderabad,Kalaari Capital,Private Equity,,Series A,,,,,,,,,,,,,,,,,,,,,,,,,2015-05-28,2015.0,weight management service,hyderabad
59.0,30/05/2015,Ather Energy,Electric Scooter Manufacturer,Bangalore,Tiger Global,Private Equity,"12,000,000",Series A,,,,,,,,,,,,,,,,,,,,,,,,12000000.0,2015-05-30,2015.0,electric scooter manufacturer,bangalore
60.0,,,,,,,,,,,,,,,,,,,,,,,,,,,,,,,,,,,,
,,,,,,,,,,,,,,,,,,,,,,,,,,,,,,,,,,,,
1.0,02/11/2015,Twigly,Online Food Ordering & Delivery platform,Gurgaon,"Amit Gupta, Sahil Barua, Mukul Singhal, Tracxn Labs",Seed Funding,"200,000",,,,,,,,,,,,,,,,,,,,,,,,,200000.0,2015-02-11,2015.0,online food ordering & delivery platform,gurgaon
2.0,02/11/2015,CityFlo,Bus Aggregation and rental mobile app,Mumbai,IDG Ventures,Seed Funding,"750,000",,,,,,,,,,,,,,,,,,,,,,,,,750000.0,2015-02-11,2015.0,bus aggregation and rental mobile app,mumbai
3.0,03/11/2015,Findyahan,hyperlocal online Services platform,Noida,Times Group Brand Capital,Private Equity,,Bridge funding,,,,,,,,,,,,,,,,,,,,,,,,,2015-03-11,2015.0,hyperlocal online services platform,noida
4.0,03/11/2015,Sabse,WiFi – first Cloud communication platform,Mumbai,Ratan Tata,Private Equity,,,,,,,,,,,,,,,,,,,,,,,,,,,2015-03-11,2015.0,wifi – first cloud communication platform,mumbai
5.0,03/11/2015,Pokkt,Alternate Mobile Monetization platform,Mumbai,"Segnel Venture, Shinji Kimura, Sundar Chanrai, JAFCO Asia, SingTel’s Innov8, Jungle Ventures, K Ganesh",Private Equity,"5,000,000",Series B,,,,,,,,,,,,,,,,,,,,,,,,5000000.0,2015-03-11,2015.0,alternate mobile monetization platform,mumbai
6.0,03/11/2015,boibanit,Online Food Ordering Marketplace,Vadodara,"Varun Ahuja, Anubhav Verma",Seed Funding,"150,000",,,,,,,,,,,,,,,,,,,,,,,,,150000.0,2015-03-11,2015.0,online food ordering marketplace,vadodara
7.0,03/11/2015,Stuffed,Quick Service Restaurant & Online Delivery,Mumbai,Riqueza Capital,Seed Funding,"385,000",Funding happened in Sept 2015,,,,,,,,,,,,,,,,,,,,,,,,385000.0,2015-03-11,2015.0,quick service restaurant & online delivery,mumbai
8.0,03/11/2015,LoanBaba,Online Loans Marketplace,Mumbai,,Seed Funding,"320,000",,,,,,,,,,,,,,,,,,,,,,,,,320000.0,2015-03-11,2015.0,online loans marketplace,mumbai
9.0,03/11/2015,Deyor Rooms,Budget Hotels Aggregator,New Delhi,Dheeraj Jain & Others,Seed Funding,"500,000",,,,,,,,,,,,,,,,,,,,,,,,,500000.0,2015-03-11,2015.0,budget hotels aggregator,new delhi
10.0,03/11/2015,Bidgely,Efficient Energy Management platform,USA/India,"Constellation Technology Ventures (Exelon Corporation), E.ON, RWE, Khosla Ventures",Private Equity,"16,600,000",Series B,,,,,,,,,,,,,,,,,,,,,,,,16600000.0,2015-03-11,2015.0,efficient energy management platform,usa/india
11.0,04/11/2015,Shirsa Labs,Digital Intelligent learning platform,Mumbai,ah! Ventures,Seed Funding,"250,000",,,,,,,,,,,,,,,,,,,,,,,,,250000.0,2015-04-11,2015.0,digital intelligent learning platform,mumbai
12.0,04/11/2015,Paytunes,Voice Call incentivization mobile app,New Delhi,CIO Angel Network,Seed Funding,,,,,,,,,,,,,,,,,,,,,,,,,,,2015-04-11,2015.0,voice call incentivization mobile app,new delhi
13.0,04/11/2015,YourDOST,Online Counselling and psychological support platform,Gwalior,"Phanindra Sama, Aprameya Radhakrishna, Aneesh Reddy, Neeraj Jawalkar, Sanjay Anandaram, Pavan Ongole, Venk Krishnan",Seed Funding,"400,000",,,,,,,,,,,,,,,,,,,,,,,,,400000.0,2015-04-11,2015.0,online counselling and psychological support platform,gwalior
14.0,05/11/2015,BookMyBai,Domestic Help Aggregation platform,Mumbai,Vineel Nalla & Others,Seed Funding,"150,000",,,,,,,,,,,,,,,,,,,,,,,,,150000.0,2015-05-11,2015.0,domestic help aggregation platform,mumbai
15.0,05/11/2015,MyIndianStay,Home Stay & room rentals platform,Goa,Undisclosed investors,Seed Funding,"200,000",,,,,,,,,,,,,,,,,,,,,,,,,200000.0,2015-05-11,2015.0,home stay & room rentals platform,goa
16.0,05/11/2015,Bobble,Selfie Mobile App,New Delhi,SAIF Partners & others,Private Equity,,Series A,,,,,,,,,,,,,,,,,,,,,,,,,2015-05-11,2015.0,selfie mobile app,new delhi
17.0,06/11/2015,RepUp,Online Reputation Management Platform,Gurgaon,Indian Angel Network,Seed Funding,,,,,,,,,,,,,,,,,,,,,,,,,,,2015-06-11,2015.0,online reputation management platform,gurgaon
18.0,06/11/2015,Satvacart,Online Grocery platform,Gurgaon,Undisclosed HNIs,Private Equity,"1,800,000",Pre-Series A Bridge,,,,,,,,,,,,,,,,,,,,,,,,1800000.0,2015-06-11,2015.0,online grocery platform,gurgaon
19.0,06/11/2015,POPxo.com,Online content platform for women,New Delhi,"IDG Ventures India, Kalaari Capital, 500 Startups",Private Equity,"2,000,000",Series A,,,,,,,,,,,,,,,,,,,,,,,,2000000.0,2015-06-11,2015.0,online content platform for women,new delhi
20.0,06/11/2015,SparesHub,Online Vehicle Spare Parts etailer,Pune,"Hyderabad Angels, M&S Partners",Seed Funding,"460,000",Pre-Series A,,,,,,,,,,,,,,,,,,,,,,,,460000.0,2015-06-11,2015.0,online vehicle spare parts etailer,pune
21.0,06/11/2015,Explara,Event Ticketing platform,Pune,"Hyderabad Angels, Singapore Angel Network, Ness Wadia",Private Equity,"490,000",Pre-Series A,,,,,,,,,,,,,,,,,,,,,,,,490000.0,2015-06-11,2015.0,event ticketing platform,pune
22.0,06/11/2015,Soothe Healthcare,affordable Personal Healthcare Products,Noida,Saina Nehwal,Seed Funding,,2nd seed funding,,,,,,,,,,,,,,,,,,,,,,,,,2015-06-11,2015.0,affordable personal healthcare products,noida
23.0,06/11/2015,Yuvi Hospitality,Premium dining Lounges & restaurants,Gurgaon,Chandralekha Construction Pvt. Ltd.,Private Equity,"15,000,000",Series A,,,,,,,,,,,,,,,,,,,,,,,,15000000.0,2015-06-11,2015.0,premium dining lounges & restaurants,gurgaon
24.0,09/11/2015,AppVirality,Mobile Growth HackingPlatform,Hyderabad,"Rajan Anandan, Mike Galgon, Ravi Gururaj, Ashim Mehra,  Mohit Saxena, Internet Group, TNN Capital and others",Seed Funding,"500,000",Pre-Series A,,,,,,,,,,,,,,,,,,,,,,,,500000.0,2015-09-11,2015.0,mobile growth hackingplatform,hyderabad
25.0,09/11/2015,iStar Skill Development,Skill Training Startup,Bangalore,"Michael & Susan Dell Foundation, Unitus Seed Fund",Private Equity,"1,500,000",Series A,,,,,,,,,,,,,,,,,,,,,,,,1500000.0,2015-09-11,2015.0,skill training startup,bangalore
26.0,09/11/2015,BigStylist.com,Beauty and Wellness Marketplace,Mumbai,Info Edge,Private Equity,"1,000,000",Pre-Series A,,,,,,,,,,,,,,,,,,,,,,,,1000000.0,2015-09-11,2015.0,beauty and wellness marketplace,mumbai
27.0,09/11/2015,Zilingo,Marketplace App for Bangkok,Bangalore/ Bangkok,"Sequoia India, BEENEXT Ventures, Kunal Shah & Sandeep Tandon",Private Equity,"1,900,000",Series A,,,,,,,,,,,,,,,,,,,,,,,,1900000.0,2015-09-11,2015.0,marketplace app for bangkok,bangalore/ bangkok
28.0,09/11/2015,Didi,On-demand Maids Service Provider,Mumbai,"Jozef Bardik, Leo Wang Sangeeth Ram",Seed Funding,"150,000",,,,,,,,,,,,,,,,,,,,,,,,,150000.0,2015-09-11,2015.0,on-demand maids service provider,mumbai
29.0,09/11/2015,Skoov.com,eCommerce Product Search Engine,Mumbai,undisclosed investor,Seed Funding,"150,000",,,,,,,,,,,,,,,,,,,,,,,,,150000.0,2015-09-11,2015.0,ecommerce product search engine,mumbai
30.0,10/11/2015,Chefs Basket,Ready to cook packaged Foods,Mumbai,"SAIF Partners, Haresh Chawla",Private Equity,"6,000,000",Series A,,,,,,,,,,,,,,,,,,,,,,,,6000000.0,2015-10-11,2015.0,ready to cook packaged foods,mumbai
31.0,11/11/2015,Gingercrush,Product Customization Platform,Vadodara,TV Mohandas Pai’s family office,Seed Funding,,,,,,,,,,,,,,,,,,,,,,,,,,,2015-11-11,2015.0,product customization platform,vadodara
32.0,11/11/2015,Delight Foods,Branded Food products online sales,Bangalore,"Lensbridge Capital, Mape Advisory Group, Fireside Ventures",Private Equity,"600,000",Series A,,,,,,,,,,,,,,,,,,,,,,,,600000.0,2015-11-11,2015.0,branded food products online sales,bangalore
33.0,11/11/2015,6Degree,Talent platform for Fashion professionals,Goa/Hyderabad,"Centre For Incubation & Business Acceleration (CIBA), Goa",Seed Funding,,,,,,,,,,,,,,,,,,,,,,,,,,,2015-11-11,2015.0,talent platform for fashion professionals,goa/hyderabad
34.0,11/11/2015,RenewBuy,Auto Insurance Online platform,Gurgaon,Mount Nathan Advisors Pte Ltd,Seed Funding,"500,000",,,,,,,,,,,,,,,,,,,,,,,,,500000.0,2015-11-11,2015.0,auto insurance online platform,gurgaon
35.0,11/11/2015,Grab,Hyperlocal Logistics Service Provider,Mumbai,Sixth Sense Ventures,Seed Funding,,,,,,,,,,,,,,,,,,,,,,,,,,,2015-11-11,2015.0,hyperlocal logistics service provider,mumbai
36.0,12/11/2015,Hitwicket,Cricket Management Mobile Game,Hyderabad,Chennai Angels,Seed Funding,"250,000",,,,,,,,,,,,,,,,,,,,,,,,,250000.0,2015-12-11,2015.0,cricket management mobile game,hyderabad
37.0,13/11/2015,Flashdoor,On Demand Laundry Service platform,Bangalore,"Sujeet Kumar, Ankit Nagori, Traxcn Labs",Seed Funding,,,,,,,,,,,,,,,,,,,,,,,,,,,2015-11-13,2015.0,on demand laundry service platform,bangalore
38.0,16/11/2015,Cashkaro.com,Ecommerce Discount & Cashback coupons platform,Gurgaon,Kalaari Capital,Private Equity,"3,700,000",Series A,,,,,,,,,,,,,,,,,,,,,,,,3700000.0,2015-11-16,2015.0,ecommerce discount & cashback coupons platform,gurgaon
39.0,16/11/2015,Absentia,Virtual Reality Headset creator,Bangalore,"Astarc Ventures, 50K Ventures & others",Seed Funding,"180,000",,,,,,,,,,,,,,,,,,,,,,,,,180000.0,2015-11-16,2015.0,virtual reality headset creator,bangalore
40.0,16/11/2015,Renowala,Home Improvement Service platform,Hyderabad,Logtally,Seed Funding,,,,,,,,,,,,,,,,,,,,,,,,,,,2015-11-16,2015.0,home improvement service platform,hyderabad
41.0,16/11/2015,TaskBucks,mobile-only tasks marketplace,New Delhi,Times Internet,Private Equity,"15,000,000",Strategic Investment,,,,,,,,,,,,,,,,,,,,,,,,15000000.0,2015-11-16,2015.0,mobile-only tasks marketplace,new delhi
42.0,17/11/2015,CraftsVilla,Women Ethnic Wear  Online Marketplace,Mumbai,"Sequoia India, Lightspeed Venture Partners, Nexus Venture Partners, Global Founders Capital, Apoletto",Private Equity,"34,000,000",Series C,,,,,,,,,,,,,,,,,,,,,,,,34000000.0,2015-11-17,2015.0,women ethnic wear  online marketplace,mumbai
43.0,17/11/2015,Julia Computing,Numerical Computing & Data Science Platform,Bangalore,Gordon and Betty Moore Foundation,Seed Funding,"600,000",,,,,,,,,,,,,,,,,,,,,,,,,600000.0,2015-11-17,2015.0,numerical computing & data science platform,bangalore
44.0,17/11/2015,StyleTag,Designer fashion Jewellery Marketplace,Bangalore,Jitu Virwani,Seed Funding,"7,500,000",,,,,,,,,,,,,,,,,,,,,,,,,7500000.0,2015-11-17,2015.0,designer fashion jewellery marketplace,bangalore
45.0,17/11/2015,Smytten,Online Products Discovery Platform,Gurgaon,"Rimpal Chawla, Anuj Srivastava",Seed Funding,"200,000",,,,,,,,,,,,,,,,,,,,,,,,,200000.0,2015-11-17,2015.0,online products discovery platform,gurgaon
46.0,17/11/2015,BiBox,Kids Tool kit for Innovation platform,Bangalore,Ravi Krishnamurthy,Seed Funding,"530,000",,,,,,,,,,,,,,,,,,,,,,,,,530000.0,2015-11-17,2015.0,kids tool kit for innovation platform,bangalore
47.0,17/11/2015,Convegenius,Mobile Learning Solutions,Noida / Singapore,Enablers platform,Seed Funding,"300,000",,,,,,,,,,,,,,,,,,,,,,,,,300000.0,2015-11-17,2015.0,mobile learning solutions,noida / singapore
48.0,18/11/2015,Ola,Car Aggregator & Retail Mobile App,Bangalore,"Baillie Gifford, Falcon Edge Capital, Tiger Global, SoftBank Group, DST Global, Didi Kuaidi",Private Equity,"500,000,000",Series F (More Details Here),,,,,,,,,,,,,,,,,,,,,,,,500000000.0,2015-11-18,2015.0,car aggregator & retail mobile app,bangalore
49.0,18/11/2015,Goodbox,conversational commerce mobile app,Bangalore,Nexus Venture Partners,Private Equity,"2,500,000",Series A,,,,,,,,,,,,,,,,,,,,,,,,2500000.0,2015-11-18,2015.0,conversational commerce mobile app,bangalore
50.0,18/11/2015,ScoopWhoop,Viral Content web Platform,New Delhi,Kalaari Capital,Private Equity,"4,000,000",Series A,,,,,,,,,,,,,,,,,,,,,,,,4000000.0,2015-11-18,2015.0,viral content web platform,new delhi
51.0,18/11/2015,Hipship,Express local delivery platform,Bangalore,"Inara Capital , Rishi Khiani",Seed Funding,,,,,,,,,,,,,,,,,,,,,,,,,,,2015-11-18,2015.0,express local delivery platform,bangalore
52.0,18/11/2015,Pickrr,On-Demand Local Logistics provider,New Delhi,Palaash Ventures,Seed Funding,,,,,,,,,,,,,,,,,,,,,,,,,,,2015-11-18,2015.0,on-demand local logistics provider,new delhi
53.0,18/11/2015,Truelancer,Curated Freelancer Marketplace,New Delhi,"Blackstone Valley Group, Raghu Vohra, Aditya Dev Sood, Kamal Bansal",Seed Funding,,,,,,,,,,,,,,,,,,,,,,,,,,,2015-11-18,2015.0,curated freelancer marketplace,new delhi
54.0,19/11/2015,AHA Taxis,Online Taxi Rental Platform,Noida,ah! Ventures,Seed Funding,,,,,,,,,,,,,,,,,,,,,,,,,,,2015-11-19,2015.0,online taxi rental platform,noida
55.0,19/11/2015,UrbanClap,Mobile Services Marketplace,Gurgaon,"Bessemer Venture Partner, Accel, SAIF Partners",Private Equity,"25,000,000",Series B,,,,,,,,,,,,,,,,,,,,,,,,25000000.0,2015-11-19,2015.0,mobile services marketplace,gurgaon
56.0,19/11/2015,SenseGiz,Smartwatch Maker,Belgaum,Karnataka Semiconductor Venture Capital firm,Seed Funding,"500,000",,,,,,,,,,,,,,,,,,,,,,,,,500000.0,2015-11-19,2015.0,smartwatch maker,belgaum
57.0,19/11/2015,PlaceofOrigin,Online Gourmet Food Marketplace,Bangalore,"S.D. Shibulal, Kris Gopalakrishnan, Srinath Batni, Professor Tarun Khanna,  Ganapathy Venugopal.",Seed Funding,,,,,,,,,,,,,,,,,,,,,,,,,,,2015-11-19,2015.0,online gourmet food marketplace,bangalore
58.0,19/11/2015,Fourseven,Online Jewellery etailer,New Delhi,Indian Angel Network,Seed Funding,"455,000",,,,,,,,,,,,,,,,,,,,,,,,,455000.0,2015-11-19,2015.0,online jewellery etailer,new delhi
59.0,20/11/2015,MindTickle,Sales & Productivity Software,Pune / US,New Enterprise Associates,Private Equity,"12,500,000",Series A,,,,,,,,,,,,,,,,,,,,,,,,12500000.0,2015-11-20,2015.0,sales & productivity software,pune / us
60.0,20/11/2015,Shopsense,ecommerce related software product platform,Mumbai,"Kae Capital, Kunal Bahl, Rohit Bansal",Seed Funding,,Pre-Series A,,,,,,,,,,,,,,,,,,,,,,,,,2015-11-20,2015.0,ecommerce related software product platform,mumbai
61.0,20/11/2015,Medinfi,Health-Tech platform,Bangalore,"Ram Kumar Kakani, Pradeep K Jaisingh, Sunil T V, Vijay Ghadge, Hemant Kaul, Gurmeet Chahal & Others",Seed Funding,"305,000",,,,,,,,,,,,,,,,,,,,,,,,,305000.0,2015-11-20,2015.0,health-tech platform,bangalore
62.0,20/11/2015,OUWT,Nightlife Discovery Mobile App,Mumbai,Undisclosed investors,Seed Funding,"150,000",,,,,,,,,,,,,,,,,,,,,,,,,150000.0,2015-11-20,2015.0,nightlife discovery mobile app,mumbai
63.0,20/11/2015,HeyPillow,Online Real Estate Marketplace,Bangalore,Hampton Capital,Private Equity,"3,000,000",Series A,,,,,,,,,,,,,,,,,,,,,,,,3000000.0,2015-11-20,2015.0,online real estate marketplace,bangalore
64.0,21/11/2015,Healers At Home,"Home Healthcare Services platform,",New Delhi,"Daljit Singh, Dr. Pramath Raj Sinha, BVR Mohan Reddy",Seed Funding,,,,,,,,,,,,,,,,,,,,,,,,,,,2015-11-21,2015.0,"home healthcare services platform,",new delhi
65.0,21/11/2015,Caravan Craft,Indian Ethnic Crafts Etailer,Bangalore,"Unitus Seed Fund, Bijou Kurien, Narayan Ramachandran",Private Equity,"1,200,000",Series A,,,,,,,,,,,,,,,,,,,,,,,,1200000.0,2015-11-21,2015.0,indian ethnic crafts etailer,bangalore
66.0,21/11/2015,Talkoot,Social platform for traders and investors,Bangalore,Undisclosed investors,Seed Funding,"100,000",,,,,,,,,,,,,,,,,,,,,,,,,100000.0,2015-11-21,2015.0,social platform for traders and investors,bangalore
67.0,23/11/2015,RentoMojo,"Online Furniture, Home Appliances Rental Platform",Bangalore,"IDG Ventures India,  Accel Partners India",Private Equity,"2,000,000",Series A,,,,,,,,,,,,,,,,,,,,,,,,2000000.0,2015-11-23,2015.0,"online furniture, home appliances rental platform",bangalore
68.0,23/11/2015,Medikoe,Healthcare Services Discovery platform,Bangalore,Anil Menon,Seed Funding,"100,000",,,,,,,,,,,,,,,,,,,,,,,,,100000.0,2015-11-23,2015.0,healthcare services discovery platform,bangalore
69.0,24/11/2015,Stylofie,Health and Beauty Services Marketplace,Gurgaon,Swastika,Seed Funding,"250,000",,,,,,,,,,,,,,,,,,,,,,,,,250000.0,2015-11-24,2015.0,health and beauty services marketplace,gurgaon
70.0,24/11/2015,ServX,Automotive Services platform,New Delhi,Manish Gupta,Seed Funding,,,,,,,,,,,,,,,,,,,,,,,,,,,2015-11-24,2015.0,automotive services platform,new delhi
71.0,24/11/2015,Naaptol,Online and TV Shopping Marketplace,Mumbai,"Mitsui & Co., New Enterprise Associates, Canaan Partners, Silicon Valley Bank",Private Equity,"52,000,000",Late Stage,,,,,,,,,,,,,,,,,,,,,,,,52000000.0,2015-11-24,2015.0,online and tv shopping marketplace,mumbai
72.0,24/11/2015,Crayon Data,Big Data Analytics Platform,Chennai/ Singapore,Ratan Tata,Private Equity,,,,,,,,,,,,,,,,,,,,,,,,,,,2015-11-24,2015.0,big data analytics platform,chennai/ singapore
73.0,25/11/2015,EarlySalary.com,Mobile App based Loan disbursement platform,Mumbai,Ashok Agarwal,Seed Funding,"1,500,000",,,,,,,,,,,,,,,,,,,,,,,,,1500000.0,2015-11-25,2015.0,mobile app based loan disbursement platform,mumbai
74.0,25/11/2015,Tooler,On Demand Laundry Services App,New Delhi,"Raghu Khanna, Sameer Gupta",Seed Funding,"110,000",,,,,,,,,,,,,,,,,,,,,,,,,110000.0,2015-11-25,2015.0,on demand laundry services app,new delhi
75.0,25/11/2015,S Chand,Education Content Provider,New Delhi,IFC Everstone Group,Private Equity,"27,000,000",,,,,,,,,,,,,,,,,,,,,,,,,27000000.0,2015-11-25,2015.0,education content provider,new delhi
76.0,26/11/2015,Stelae,Content Management Software Solutions,Chennai,Earlsfield Capital,Private Equity,,Pre-Series A,,,,,,,,,,,,,,,,,,,,,,,,,2015-11-26,2015.0,content management software solutions,chennai
77.0,26/11/2015,GoQii,Fitness Tracking Management Solutions,Mumbai,"New Enterprise Associates, Cheetah Mobile",Private Equity,"13,400,000",Series B,,,,,,,,,,,,,,,,,,,,,,,,13400000.0,2015-11-26,2015.0,fitness tracking management solutions,mumbai
78.0,26/11/2015,Grofers,Hyper-local Grocery Delivery platform,Gurgaon,"Softbank, Tiger Global, Sequoia Capital, Apoletto Managers",Private Equity,"120,000,000",Late Stage,,,,,,,,,,,,,,,,,,,,,,,,120000000.0,2015-11-26,2015.0,hyper-local grocery delivery platform,gurgaon
79.0,26/11/2015,Pluss,Hyperlocal healthcare product Delivery Service provider,Gurgaon,"IDG Ventures, M & S partners, Powerhouse Ventures (USA).",Private Equity,"1,000,000",Pre-Series A,,,,,,,,,,,,,,,,,,,,,,,,1000000.0,2015-11-26,2015.0,hyperlocal healthcare product delivery service provider,gurgaon
80.0,26/11/2015,KountMoney,Online Lending Marketplace,Bangalore,"Tracxn, Ashish Goenka & Others",Seed Funding,,,,,,,,,,,,,,,,,,,,,,,,,,,2015-11-26,2015.0,online lending marketplace,bangalore
81.0,27/11/2015,StayGlad,On Demand Beauty Services Platform,Bangalore,"Bessemer Venture Partners, Anil Chopra",Private Equity,,Series A,,,,,,,,,,,,,,,,,,,,,,,,,2015-11-27,2015.0,on demand beauty services platform,bangalore
82.0,27/11/2015,JustRide,Self Driven Rental Car Platform,Mumbai,,Private Equity,"2,000,000",Pre-Series A bridge round,,,,,,,,,,,,,,,,,,,,,,,,2000000.0,2015-11-27,2015.0,self driven rental car platform,mumbai
83.0,27/11/2015,Fastudent,Education Content etailer,Noida,Ashish Gupta,Seed Funding,,,,,,,,,,,,,,,,,,,,,,,,,,,2015-11-27,2015.0,education content etailer,noida
84.0,27/11/2015,LearnOn,Clud based Learning platform,Chennai,JMR Infotech India Pvt Ltd,Seed Funding,,,,,,,,,,,,,,,,,,,,,,,,,,,2015-11-27,2015.0,clud based learning platform,chennai
85.0,27/11/2015,Talentrack,Talent Exchange & Talent Services Marketplace,New Delhi,Unigrowth Inc,Seed Funding,,,,,,,,,,,,,,,,,,,,,,,,,,,2015-11-27,2015.0,talent exchange & talent services marketplace,new delhi
86.0,28/11/2015,M-TAXI,Two-Wheeler Taxi Service,Gurgaon,"Mandeep Singh, Jairaj Singh",Seed Funding,,,,,,,,,,,,,,,,,,,,,,,,,,,2015-11-28,2015.0,two-wheeler taxi service,gurgaon
87.0,30/11/2015,Baxi,Two-Wheeler Taxi Service,Gurgaon,"Manish Kheterpal, Alok Mittal,  Puneet Dalmia,",Seed Funding,"1,450,000",,,,,,,,,,,,,,,,,,,,,,,,,1450000.0,2015-11-30,2015.0,two-wheeler taxi service,gurgaon
88.0,30/11/2015,Superhero Brands,character merchandize sales platform,Mumbai,DSG Consumer Partners,Seed Funding,"540,000",,,,,,,,,,,,,,,,,,,,,,,,,540000.0,2015-11-30,2015.0,character merchandize sales platform,mumbai
89.0,30/11/2015,MoMagic,Mobile Application Developer,New Delhi,FIH Mobile Ltd,Private Equity,,Strategic Investment,,,,,,,,,,,,,,,,,,,,,,,,,2015-11-30,2015.0,mobile application developer,new delhi
90.0,30/11/2015,QikPod,Ecommerce Delivery locker services,Bangalore,"Flipkart, Accel Partners, Delhivery, Foxconn",Private Equity,"9,000,000",Series A,,,,,,,,,,,,,,,,,,,,,,,,9000000.0,2015-11-30,2015.0,ecommerce delivery locker services,bangalore
91.0,30/11/2015,Butterfly Interactive,extra curricular activities marketplace app,New Delhi,Undisclosed investors,Seed Funding,,,,,,,,,,,,,,,,,,,,,,,,,,,2015-11-30,2015.0,extra curricular activities marketplace app,new delhi
92.0,30/11/2015,Bro4U,Hyperlocal Online Home services provider,Bangalore,Sargod Ventures,Seed Funding,,,,,,,,,,,,,,,,,,,,,,,,,,,2015-11-30,2015.0,hyperlocal online home services provider,bangalore
93.0,,,,,,,,,,,,,,,,,,,,,,,,,,,,,,,,,,,,
1.0,01/10/2015,Indifi,Easy Business Loans platform,Gurgaon,"Accel Partners, Elevar Equity, Pramod Bhasin, Rajan Anandan, Gaurav Dalmia, Abhishek Goyal, Gagan Hasteer , Arun Tadanki",Seed Funding,,,,,,,,,,,,,,,,,,,,,,,,,,,2015-01-10,2015.0,easy business loans platform,gurgaon
2.0,01/10/2015,Wydr,Performance based Wholesale Marketplace,New Delhi,Sandeep Aggarwal,Seed Funding,,,,,,,,,,,,,,,,,,,,,,,,,,,2015-01-10,2015.0,performance based wholesale marketplace,new delhi
3.0,01/10/2015,EasyFix,Professional Services Marketplace,Gurgaon,Axilor Ventures,Seed Funding,,,,,,,,,,,,,,,,,,,,,,,,,,,2015-01-10,2015.0,professional services marketplace,gurgaon
4.0,01/10/2015,Muvizz,Movie-on-demand platform,Singapore,"Ashish Todi, Abhinav Patodia, Kumar Shwetabh",Seed Funding,"350,000",,,,,,,,,,,,,,,,,,,,,,,,,350000.0,2015-01-10,2015.0,movie-on-demand platform,singapore
5.0,01/10/2015,Abhibus,bus ticketing and fleet management platform,Hyderabad,Paytm (One97 communications),Private Equity,,Strategic Investment,,,,,,,,,,,,,,,,,,,,,,,,,2015-01-10,2015.0,bus ticketing and fleet management platform,hyderabad
6.0,01/10/2015,Cleartax,Online Income Tax Filing platform,New Delhi,Paytm (One97 communications),Private Equity,,,,,,,,,,,,,,,,,,,,,,,,,,,2015-01-10,2015.0,online income tax filing platform,new delhi
7.0,02/10/2015,Shopalyst,Product discovery & recommendation platform,Bangalore,Kalaari Capital,Private Equity,"2,000,000",Series A,,,,,,,,,,,,,,,,,,,,,,,,2000000.0,2015-02-10,2015.0,product discovery & recommendation platform,bangalore
8.0,03/10/2015,Chillr,Mobile Payments App,Mumbai,Sequoia Capital,Private Equity,"6,000,000",Series A,,,,,,,,,,,,,,,,,,,,,,,,6000000.0,2015-03-10,2015.0,mobile payments app,mumbai
9.0,05/10/2015,Nykaa,Beauty & Wellness Products e-tailer,Mumbai,"Harsh Mariwala, Atul Nishar, Dalip Pathak, Michael Carlos",Private Equity,"9,500,000",Series B,,,,,,,,,,,,,,,,,,,,,,,,9500000.0,2015-05-10,2015.0,beauty & wellness products e-tailer,mumbai
10.0,05/10/2015,Voylla,Fashion jewelry and accessories e-tailer,Jaipur,Peepul Capital,Private Equity,"15,000,000",Series B,,,,,,,,,,,,,,,,,,,,,,,,15000000.0,2015-05-10,2015.0,fashion jewelry and accessories e-tailer,jaipur
11.0,05/10/2015,IndiaLends,Online Consumer Lending platform,New Delhi,"DSG consumer Partners, Paragon Partners",Private Equity,"1,000,000",Pre-Series A Bridge round,,,,,,,,,,,,,,,,,,,,,,,,1000000.0,2015-05-10,2015.0,online consumer lending platform,new delhi
12.0,05/10/2015,Rock N Shop,Premium Apparel shopping portal,New Delhi,High Networth Individuals (undisclosed),Seed Funding,"150,000",,,,,,,,,,,,,,,,,,,,,,,,,150000.0,2015-05-10,2015.0,premium apparel shopping portal,new delhi
13.0,06/10/2015,DocPlexus,Exclusive Platform for Doctors & Healthcare professionals,Pune,"Uniqorn ventures, ASP Consulting",Seed Funding,"700,000",,,,,,,,,,,,,,,,,,,,,,,,,700000.0,2015-06-10,2015.0,exclusive platform for doctors & healthcare professionals,pune
14.0,06/10/2015,WorkIndia,Job Board,Mumbai,"Satyen Kothari, Keshav Sanghi, Riddhesh Gandhi & Others",Seed Funding,"500,000",Pre-Series A,,,,,,,,,,,,,,,,,,,,,,,,500000.0,2015-06-10,2015.0,job board,mumbai
15.0,06/10/2015,SportzVillage,Sports Management & Physical Education Business,Bangalore,Gaja Capital Private Equity Fund,Private Equity,"10,000,000",Series B,,,,,,,,,,,,,,,,,,,,,,,,10000000.0,2015-06-10,2015.0,sports management & physical education business,bangalore
16.0,06/10/2015,SportyBeans,multi-sport program for preschoolers,Pune,YouWeCan Ventures,Seed Funding,,,,,,,,,,,,,,,,,,,,,,,,,,,2015-06-10,2015.0,multi-sport program for preschoolers,pune
17.0,06/10/2015,Burger Singh,QSR & Online delivery portal,Gurgaon,"Ashvin Chadha, Avtar Monga, Udaan Angels, Dheeraj Jain",Seed Funding,"500,000",Bridge Round,,,,,,,,,,,,,,,,,,,,,,,,500000.0,2015-06-10,2015.0,qsr & online delivery portal,gurgaon
18.0,06/10/2015,Welcome Cure,Online Homeopathy Clinic,Mumbai,Unnamed Media house and HNIs,Private Equity,"6,000,000",Pre-Series A,,,,,,,,,,,,,,,,,,,,,,,,6000000.0,2015-06-10,2015.0,online homeopathy clinic,mumbai
19.0,07/10/2015,SchoolGuru,E-Learning Service Provider,Mumbai,High Networth Individuals from India & USA,Private Equity,"3,000,000",Series A,,,,,,,,,,,,,,,,,,,,,,,,3000000.0,2015-07-10,2015.0,e-learning service provider,mumbai
20.0,07/10/2015,Naturally Yours,Organic Food etailer,Mumbai,Sanjay Mehta,Seed Funding,,,,,,,,,,,,,,,,,,,,,,,,,,,2015-07-10,2015.0,organic food etailer,mumbai
32.0,07/10/2015,GoJavas,Delivery & Logistics Service provider,Gurgaon,Snapdeal,Private Equity,"20,000,000",Strategic Funding (Series C),,,,,,,,,,,,,,,,,,,,,,,,20000000.0,2015-07-10,2015.0,delivery & logistics service provider,gurgaon
33.0,07/10/2015,Scandid,Product Discovery & comparison App,Pune,Micromax Informatics,Private Equity,,Strategic Funding,,,,,,,,,,,,,,,,,,,,,,,,,2015-07-10,2015.0,product discovery & comparison app,pune
34.0,07/10/2015,StalkBuyLove,Online Apparels Fashion brand,New Delhi,"Mato Peric, Peter Kabel & others",Private Equity,,Series A,,,,,,,,,,,,,,,,,,,,,,,,,2015-07-10,2015.0,online apparels fashion brand,new delhi
35.0,08/10/2015,ZuperMeal,Home Cooked Food marketplace & Delivery,Mumbai,"Sanjeev Kapoor,  Ravi Saxena & Others",Private Equity,"2,000,000",Series A,,,,,,,,,,,,,,,,,,,,,,,,2000000.0,2015-08-10,2015.0,home cooked food marketplace & delivery,mumbai
36.0,08/10/2015,Cube26,Gesture based Mobile Development,New Delhi,"Tiger Global Management, Flipkart",Private Equity,"7,700,000",Series A,,,,,,,,,,,,,,,,,,,,,,,,7700000.0,2015-08-10,2015.0,gesture based mobile development,new delhi
37.0,08/10/2015,Mobikon,Hotel Mobile CRM Software platform,Pune / Singapore,"Life.SREDA, Qualgro",Private Equity,,Series B,,,,,,,,,,,,,,,,,,,,,,,,,2015-08-10,2015.0,hotel mobile crm software platform,pune / singapore
38.0,08/10/2015,Grabhouse,Rental Accommodation Search platform,Bangalore,Sequoia and Kalaari Capital.,Private Equity,"10,000,000",Series B,,,,,,,,,,,,,,,,,,,,,,,,10000000.0,2015-08-10,2015.0,rental accommodation search platform,bangalore
39.0,08/10/2015,Quifers,Logistics Tech Platform,Mumbai,"Vikas Agarwal, Vishal Khare, Sanjeev Kakkar, Smile Group",Seed Funding,"310,000",,,,,,,,,,,,,,,,,,,,,,,,,310000.0,2015-08-10,2015.0,logistics tech platform,mumbai
40.0,09/10/2015,Stockroom.io,Developer Portfolio Showcase platform,Hyderabad,Undisclosed Investors,Seed Funding,"70,000",,,,,,,,,,,,,,,,,,,,,,,,,70000.0,2015-09-10,2015.0,developer portfolio showcase platform,hyderabad
41.0,09/10/2015,Curofy,Doctors Network Mobile App,New Delhi,RoundGlass Partners,Private Equity,,Pre-Series A,,,,,,,,,,,,,,,,,,,,,,,,,2015-09-10,2015.0,doctors network mobile app,new delhi
42.0,09/10/2015,Cloud Lending,End-to-End Lending platform,Bangalore / San Mateo,SF Capital Group,Private Equity,"8,000,000",Series A,,,,,,,,,,,,,,,,,,,,,,,,8000000.0,2015-09-10,2015.0,end-to-end lending platform,bangalore / san mateo
43.0,09/10/2015,Inayo,on-demand healthcare marketplace,Mumbai,"Kemark Ventures, Amit Ranjan, Zishaan Hayath and Others",Seed Funding,"300,000",,,,,,,,,,,,,,,,,,,,,,,,,300000.0,2015-09-10,2015.0,on-demand healthcare marketplace,mumbai
44.0,09/10/2015,WoNoBo,360-degree view creating platform,Bangalore,Quikr,Private Equity,,Strategic Funding,,,,,,,,,,,,,,,,,,,,,,,,,2015-09-10,2015.0,360-degree view creating platform,bangalore
45.0,09/10/2015,Kulzy,Advertising & Marketing Community Networking platform,New Delhi,"Seedfund, Bedrock Ventures",Seed Funding,"1,000,000",,,,,,,,,,,,,,,,,,,,,,,,,1000000.0,2015-09-10,2015.0,advertising & marketing community networking platform,new delhi
46.0,09/10/2015,Zeppery,Food Ordering & Delivery App,New Delhi,Suyash Sharma,Seed Funding,"77,000",,,,,,,,,,,,,,,,,,,,,,,,,77000.0,2015-09-10,2015.0,food ordering & delivery app,new delhi
47.0,12/10/2015,Zify,Ride Sharing platform,Hyderabad,Sean O’Sullivan & Others,Seed Funding,"190,000",,,,,,,,,,,,,,,,,,,,,,,,,190000.0,2015-12-10,2015.0,ride sharing platform,hyderabad
48.0,12/10/2015,Faircent,Online P2P lending marketplace,Gurgaon,Aarin Capital Partners,Private Equity,,Series A,,,,,,,,,,,,,,,,,,,,,,,,,2015-12-10,2015.0,online p2p lending marketplace,gurgaon
49.0,12/10/2015,Bizongo,B2B marketplace for industrial goods,Mumbai,Accel Partners,Seed Funding,,,,,,,,,,,,,,,,,,,,,,,,,,,2015-12-10,2015.0,b2b marketplace for industrial goods,mumbai
50.0,12/10/2015,Gridle,Cloud Based Collaboration platform,Ahmedabad,LetsVenture,Seed Funding,"100,000",,,,,,,,,,,,,,,,,,,,,,,,,100000.0,2015-12-10,2015.0,cloud based collaboration platform,ahmedabad
51.0,12/10/2015,Tripoto,global community for travellers,New Delhi,"500 Startups, IDG Ventures & Advantedge fund, Neeraj Arora, Leon Seynave",Private Equity,,Series A,,,,,,,,,,,,,,,,,,,,,,,,,2015-12-10,2015.0,global community for travellers,new delhi
52.0,12/10/2015,Mubble,Prepaid Bill manager App,Bangalore,Accel Partners,Private Equity,,Series A,,,,,,,,,,,,,,,,,,,,,,,,,2015-12-10,2015.0,prepaid bill manager app,bangalore
53.0,13/10/2015,Voodoo,Mobile Only Shopping Assistant,New Delhi,SAIF Partners,Seed Funding,"1,000,000",,,,,,,,,,,,,,,,,,,,,,,,,1000000.0,2015-10-13,2015.0,mobile only shopping assistant,new delhi
54.0,13/10/2015,Lookup,Mobile Messaging Assistant App,Bangalore,"Khosla Impact, Biz Stone, Catamaran Ventures, Global Founders Capital, European investment fund",Private Equity,"2,500,000",Series A,,,,,,,,,,,,,,,,,,,,,,,,2500000.0,2015-10-13,2015.0,mobile messaging assistant app,bangalore
55.0,14/10/2015,AskMyGift,Personalized Wish List creator app,Noida,Turning Ideas,Seed Funding,"50,000",,,,,,,,,,,,,,,,,,,,,,,,,50000.0,2015-10-14,2015.0,personalized wish list creator app,noida
56.0,14/10/2015,Gaana.com,Music Streaming mobile app,Mumbai,Micromax Informatics Ltd,Private Equity,,Strategic Funding,,,,,,,,,,,,,,,,,,,,,,,,,2015-10-14,2015.0,music streaming mobile app,mumbai
57.0,14/10/2015,Zappfresh,Raw Meat & Ready to eat food etailer,Gurgaon,Undisclosed Investors,Seed Funding,"77,000",,,,,,,,,,,,,,,,,,,,,,,,,77000.0,2015-10-14,2015.0,raw meat & ready to eat food etailer,gurgaon
58.0,14/10/2015,GymTrekker,Gym Discovery platform,Mumbai,"Dewang Neralla,Roopak Taneja, Manisha Gupta",Seed Funding,,,,,,,,,,,,,,,,,,,,,,,,,,,2015-10-14,2015.0,gym discovery platform,mumbai
59.0,15/10/2015,Bounty App,Online Purchase rewards app,Bangalore,"Fireside Ventures, Mumbai Angels MAPE Advisory Group.",Seed Funding,,,,,,,,,,,,,,,,,,,,,,,,,,,2015-10-15,2015.0,online purchase rewards app,bangalore
60.0,16/10/2015,Homers.in,Home rental platform,Gurgaon,"Devesh Rai G, Rajesh Aggarwal, Amitpal Bhutani",Seed Funding,,,,,,,,,,,,,,,,,,,,,,,,,,,2015-10-16,2015.0,home rental platform,gurgaon
61.0,16/10/2015,mShipper,Crowdsourced Delivery platform,New Delhi,Vijai Laxmi,Seed Funding,,,,,,,,,,,,,,,,,,,,,,,,,,,2015-10-16,2015.0,crowdsourced delivery platform,new delhi
62.0,16/10/2015,BolRealty,Real Estate Insights platform,New Delhi,Manpreet Singh,Seed Funding,,,,,,,,,,,,,,,,,,,,,,,,,,,2015-10-16,2015.0,real estate insights platform,new delhi
63.0,17/10/2015,S-Cube Futuretech,Structural & Civil Engg Service Automation,Mumbai,Parampara Capital,Private Equity,"1,000,000",Series A,,,,,,,,,,,,,,,,,,,,,,,,1000000.0,2015-10-17,2015.0,structural & civil engg service automation,mumbai
64.0,19/10/2015,LetsVenture,Startup Funding Marketplace,Bangalore,"Accel Partners, Anupam Mittal & other marquee investors",Private Equity,,Series A,,,,,,,,,,,,,,,,,,,,,,,,,2015-10-19,2015.0,startup funding marketplace,bangalore
65.0,19/10/2015,Citrus Payment,Payments Solution platform,Mumbai,"Sequoia Capital, Ascent Capital, eContext Asia, Beenos Asia",Private Equity,"25,000,000",Series C,,,,,,,,,,,,,,,,,,,,,,,,25000000.0,2015-10-19,2015.0,payments solution platform,mumbai
66.0,19/10/2015,Holidify,Travel Destination Discovery platform,New Delhi,Aarti Group,Seed Funding,"100,000",,,,,,,,,,,,,,,,,,,,,,,,,100000.0,2015-10-19,2015.0,travel destination discovery platform,new delhi
67.0,20/10/2015,PrimaSeller,Order Fulfillment SAAS platform,Bangalore,"Dr. Aniruddha Malpani Manish Gupta, M&S Partners & others",Seed Funding,,,,,,,,,,,,,,,,,,,,,,,,,,,2015-10-20,2015.0,order fulfillment saas platform,bangalore
68.0,20/10/2015,Opinio,Last Mile Delivery Service,Bangalore,"Delhivery, Sands Capital and Accel Partners",Private Equity,"7,000,000",Series A,,,,,,,,,,,,,,,,,,,,,,,,7000000.0,2015-10-20,2015.0,last mile delivery service,bangalore
69.0,20/10/2015,Attune Technologies,Healthcare IT Solutions & services,Chennai,"Qualcomm Venture, Norwest Venture Partners",Private Equity,"10,000,000",Series B,,,,,,,,,,,,,,,,,,,,,,,,10000000.0,2015-10-20,2015.0,healthcare it solutions & services,chennai
70.0,20/10/2015,iChef.in,Gourmet Meals Delivery,Mumbai,Springboard Ventures,Private Equity,,,,,,,,,,,,,,,,,,,,,,,,,,,2015-10-20,2015.0,gourmet meals delivery,mumbai
71.0,21/10/2015,Jiyo Natural,Healthy Meals Food delivery platform,Bangalore,Indian Angel Network,Seed Funding,,,,,,,,,,,,,,,,,,,,,,,,,,,2015-10-21,2015.0,healthy meals food delivery platform,bangalore
72.0,21/10/2015,AgentDesks,Real Estate Mobile CRM,New York/ India,"Sierra Ventures, Cota Capital, Vegas Tech Fund",Seed Funding,"2,950,000",,,,,,,,,,,,,,,,,,,,,,,,,2950000.0,2015-10-21,2015.0,real estate mobile crm,new york/ india
73.0,21/10/2015,White Owl Brewery,Micro-Brewery,Mumbai,"Arihant Patni, RAAY Global Investments",Private Equity,"1,530,000",Series A,,,,,,,,,,,,,,,,,,,,,,,,1530000.0,2015-10-21,2015.0,micro-brewery,mumbai
74.0,21/10/2015,MealHopper,Home Made Food Marketplace,Gurgaon,"Alok Bajpai, Rajnish Kumar, Amit Dey",Seed Funding,"100,000",,,,,,,,,,,,,,,,,,,,,,,,,100000.0,2015-10-21,2015.0,home made food marketplace,gurgaon
75.0,21/10/2015,Zenify.in,residential rental management platform,Bangalore,"Atul Jalan, Shrikanth & Bharath",Seed Funding,"640,000",,,,,,,,,,,,,,,,,,,,,,,,,640000.0,2015-10-21,2015.0,residential rental management platform,bangalore
76.0,21/10/2015,Stockal,Personalized Stock Intelligence Platform,Bangalore,"R Natarajan, Mohan Alexander",Seed Funding,,,,,,,,,,,,,,,,,,,,,,,,,,,2015-10-21,2015.0,personalized stock intelligence platform,bangalore
77.0,23/10/2015,Medd,Personal Diagnostic Mobile App,Mumbai,Group of Angel investors,Seed Funding,"150,000",Bridge Round,,,,,,,,,,,,,,,,,,,,,,,,150000.0,2015-10-23,2015.0,personal diagnostic mobile app,mumbai
78.0,23/10/2015,Leaping Caravan,Online food ordering & Delivery service,Gurgaon,Group of Angel investors,Seed Funding,"150,000",,,,,,,,,,,,,,,,,,,,,,,,,150000.0,2015-10-23,2015.0,online food ordering & delivery service,gurgaon
79.0,23/10/2015,Frsh,Online food ordering & Delivery service,Gurgaon,"Mumbai Angels, Mayank Bhangdia, Kae Capital",Private Equity,"1,000,000",Bridge Round,,,,,,,,,,,,,,,,,,,,,,,,1000000.0,2015-10-23,2015.0,online food ordering & delivery service,gurgaon
80.0,23/10/2015,Qik Stay,Hotel Aggregator & booking platform,New Delhi,ID Enablers Pvt Ltd,Seed Funding,"250,000",,,,,,,,,,,,,,,,,,,,,,,,,250000.0,2015-10-23,2015.0,hotel aggregator & booking platform,new delhi
81.0,26/10/2015,Parcelled,Online Logistics Platform,Bangalore,Delhivery,Private Equity,"5,000,000",,,,,,,,,,,,,,,,,,,,,,,,,5000000.0,2015-10-26,2015.0,online logistics platform,bangalore
82.0,26/10/2015,AlmaMapper,Online Student & Campus Social Networking platform,Ahmedabad,Oswal Techno Ventures LLP,Seed Funding,"400,000",,,,,,,,,,,,,,,,,,,,,,,,,400000.0,2015-10-26,2015.0,online student & campus social networking platform,ahmedabad
83.0,26/10/2015,Flexing It,Professionals & Project Search Marketplace,New Delhi,undisclosed private investors,Seed Funding,"500,000",,,,,,,,,,,,,,,,,,,,,,,,,500000.0,2015-10-26,2015.0,professionals & project search marketplace,new delhi
84.0,26/10/2015,Netmeds.com,Online Pharmacy,Chennai,"OrbiMed, Pradip Dadha Group",Private Equity,"50,000,000",Series A,,,,,,,,,,,,,,,,,,,,,,,,50000000.0,2015-10-26,2015.0,online pharmacy,chennai
85.0,26/10/2015,Razorpay,Online Payment Gateway,Jaipur,"Tiger Global Management, Matrix Partners",Private Equity,"9,000,000",Series A,,,,,,,,,,,,,,,,,,,,,,,,9000000.0,2015-10-26,2015.0,online payment gateway,jaipur
86.0,27/10/2015,Jombay,Psychometric Test Online Software,Pune,Ventureworks India,Private Equity,,,,,,,,,,,,,,,,,,,,,,,,,,,2015-10-27,2015.0,psychometric test online software,pune
87.0,27/10/2015,Happitoo,Location based Nightlife recommendation  Platform,Mumbai,Unnamed investor,Seed Funding,"77,000",,,,,,,,,,,,,,,,,,,,,,,,,77000.0,2015-10-27,2015.0,location based nightlife recommendation  platform,mumbai
88.0,27/10/2015,Care24,Professional Health Services Platform,Mumbai,India Quotient,Seed Funding,"350,000",,,,,,,,,,,,,,,,,,,,,,,,,350000.0,2015-10-27,2015.0,professional health services platform,mumbai
89.0,27/10/2015,Roadrunnr,Hyperlocal Logistics Service,Bangalore,"Sequoia Capital, Nexus Venture Partners",Private Equity,"10,000,000",Series B,,,,,,,,,,,,,,,,,,,,,,,,10000000.0,2015-10-27,2015.0,hyperlocal logistics service,bangalore
90.0,27/10/2015,Simpli5d,Online user engagement platform,Gurgaon,"Redcliffe Capital, YourNest Angel Fund",Private Equity,,Bridge Funding,,,,,,,,,,,,,,,,,,,,,,,,,2015-10-27,2015.0,online user engagement platform,gurgaon
91.0,28/10/2015,ORIGA Leasing,Asset Financing platform,Mumbai,"ah! Ventures, 500 Startups & Other HNIs",Seed Funding,"1,100,000",,,,,,,,,,,,,,,,,,,,,,,,,1100000.0,2015-10-28,2015.0,asset financing platform,mumbai
92.0,28/10/2015,Smartivity.in,Virtual Reality activity based learning platform,New Delhi,S Chand and Co Pvt Ltd,Seed Funding,"200,000",,,,,,,,,,,,,,,,,,,,,,,,,200000.0,2015-10-28,2015.0,virtual reality activity based learning platform,new delhi
93.0,28/10/2015,UrDoorStep,Online Grocery Store,Bangalore,Jupiter Capital,Private Equity,,Series A,,,,,,,,,,,,,,,,,,,,,,,,,2015-10-28,2015.0,online grocery store,bangalore
94.0,29/10/2015,Tavaga,Investment management platform,Mumbai,Tracxn Syndicate,Seed Funding,,,,,,,,,,,,,,,,,,,,,,,,,,,2015-10-29,2015.0,investment management platform,mumbai
95.0,29/10/2015,Moglix,Industrial Toons Marketplace,Noida,"Accel Partner, Jungle Ventures",Private Equity,,pre-Series A,,,,,,,,,,,,,,,,,,,,,,,,,2015-10-29,2015.0,industrial toons marketplace,noida
96.0,29/10/2015,ZopHop,Public Commute helper App,Mumbai,"Amit Singhal, PK Gulati & others",Seed Funding,"450,000",,,,,,,,,,,,,,,,,,,,,,,,,450000.0,2015-10-29,2015.0,public commute helper app,mumbai
97.0,30/10/2015,Niki.ai,Artificial Intelligence Ecommerce Chatbot,Bangalore,Unilazer Ventures,Seed Funding,,,,,,,,,,,,,,,,,,,,,,,,,,,2015-10-30,2015.0,artificial intelligence ecommerce chatbot,bangalore
98.0,30/10/2015,Instavans,Truck Aggregator & Logistics service,Bangalore,Suresh Vaswani,Seed Funding,,,,,,,,,,,,,,,,,,,,,,,,,,,2015-10-30,2015.0,truck aggregator & logistics service,bangalore
100.0,30/10/2015,LiftO,Ridesharing Mobile app,Mumbai,"Rajesh Bhatia, Dheeraj Mehta & Others",Seed Funding,"130,000",,,,,,,,,,,,,,,,,,,,,,,,,130000.0,2015-10-30,2015.0,ridesharing mobile app,mumbai
101.0,30/10/2015,TinyOwl,Food Discovery & Delivery Mobile app,Mumbai,"Sequoia Capital, Matrix Partners",Private Equity,"7,500,000",Series B,,,,,,,,,,,,,,,,,,,,,,,,7500000.0,2015-10-30,2015.0,food discovery & delivery mobile app,mumbai
102.0,30/10/2015,Toppr.com,Competitive exam learning platform,Mumbai,InnoVen Capital,Private Equity,"2,000,000",Series C,,,,,,,,,,,,,,,,,,,,,,,,2000000.0,2015-10-30,2015.0,competitive exam learning platform,mumbai
103.0,30/10/2015,Kleeto,Document Digitization platform,Gurgaon,GREX,Seed Funding,"230,000",pre-Series A,,,,,,,,,,,,,,,,,,,,,,,,230000.0,2015-10-30,2015.0,document digitization platform,gurgaon
104.0,30/10/2015,BeaconsTalk,proximity marketing & Mobile Advertising platform,Mumbai,Puneet Bhatia & others,Seed Funding,"80,000",,,,,,,,,,,,,,,,,,,,,,,,,80000.0,2015-10-30,2015.0,proximity marketing & mobile advertising platform,mumbai
105.0,31/10/2015,Jugnoo,Autorickshaw Aggregator & Booking platform,Chandigarh,Paytm,Private Equity,"10,000,000",Series B,,,,,,,,,,,,,,,,,,,,,,,,10000000.0,2015-10-31,2015.0,autorickshaw aggregator & booking platform,chandigarh
1.0,01/09/2015,TOFlo,FinTech Startup Incubation platform,Mumbai,Tania Johny Palathinkal,Seed Funding,"100,000",,,,,,,,,,,,,,,,,,,,,,,,,100000.0,2015-01-09,2015.0,fintech startup incubation platform,mumbai
2.0,01/09/2015,FXMartIndia,Payment Services platform,Chandigarh,Flipkart,Private Equity,,Strategic Investment (Majority Stake),,,,,,,,,,,,,,,,,,,,,,,,,2015-01-09,2015.0,payment services platform,chandigarh
3.0,01/09/2015,Stylecracker,Personalized Styling platform,Mumbai,Group of HNI investors,Private Equity,"1,000,000",Series A,,,,,,,,,,,,,,,,,,,,,,,,1000000.0,2015-01-09,2015.0,personalized styling platform,mumbai
4.0,01/09/2015,Luxuryhues,Luxury goods  Shopping Platform,Gurgaon,Reliance Capital,Private Equity,"900,000",Series A,,,,,,,,,,,,,,,,,,,,,,,,900000.0,2015-01-09,2015.0,luxury goods  shopping platform,gurgaon
5.0,02/09/2015,HolaChef,Food Delivery Platform,Mumbai,Ratan Tata,Private Equity,,Part of Series A raised inJune 2015,,,,,,,,,,,,,,,,,,,,,,,,,2015-02-09,2015.0,food delivery platform,mumbai
6.0,02/09/2015,Zivame,Online Lingerie Marketplace,Bangalore,"Zodius Technology Fund, Khazanah Nasional Berhad",Private Equity,"40,000,000",Series C,,,,,,,,,,,,,,,,,,,,,,,,40000000.0,2015-02-09,2015.0,online lingerie marketplace,bangalore
7.0,02/09/2015,Capillary Tech,Cloud software solutions,New Delhi,"Warburg Pincus, Sequoia Capital, Norwest Venture Partners",Private Equity,"45,000,000",Series D,,,,,,,,,,,,,,,,,,,,,,,,45000000.0,2015-02-09,2015.0,cloud software solutions,new delhi
8.0,03/09/2015,Jobspire,Job Search Platform,Bangalore,Purvi Capital,Seed Funding,"260,000",,,,,,,,,,,,,,,,,,,,,,,,,260000.0,2015-03-09,2015.0,job search platform,bangalore
9.0,03/09/2015,MeraDoctor,Doctor consultancy Mobile App,Mumbai,India Quotient & other investors,Seed Funding,,,,,,,,,,,,,,,,,,,,,,,,,,,2015-03-09,2015.0,doctor consultancy mobile app,mumbai
10.0,03/09/2015,Vistaar Finance,Small Business Financing (NBFC),Bangalore,"WestBridge Capital, Omidyar Network, Elevar Equity, Saama Capital,  Lok Capital",Private Equity,"40,000,000",,,,,,,,,,,,,,,,,,,,,,,,,40000000.0,2015-03-09,2015.0,small business financing (nbfc),bangalore
11.0,03/09/2015,HiJinny,Beauty & Wellness Services Marketplace,Mumbai,CMYK Health Boutique Pvt Ltd & Other individual investors,Seed Funding,,,,,,,,,,,,,,,,,,,,,,,,,,,2015-03-09,2015.0,beauty & wellness services marketplace,mumbai
12.0,04/09/2015,Clapsnslaps,Online Movie Review Platform,Mumbai,R M Picture Company Pvt. Ltd.,Seed Funding,"150,000",,,,,,,,,,,,,,,,,,,,,,,,,150000.0,2015-04-09,2015.0,online movie review platform,mumbai
13.0,04/09/2015,Blubox,ECommerce Brands’ Full Service Agency,Mumbai,Ashish Jhalani,Seed Funding,"100,000",,,,,,,,,,,,,,,,,,,,,,,,,100000.0,2015-04-09,2015.0,ecommerce brands’ full service agency,mumbai
14.0,04/09/2015,RoomCentral,Cloud-based Hotel Booking Platform,Bangalore,Karanpal Singh,Seed Funding,"2,000,000",,,,,,,,,,,,,,,,,,,,,,,,,2000000.0,2015-04-09,2015.0,cloud-based hotel booking platform,bangalore
15.0,07/09/2015,YouthKiAwaaz,Community Driven News/Views Platform,New Delhi,"Raghav Bahl, Ritu Kapur",Seed Funding,"600,000",,,,,,,,,,,,,,,,,,,,,,,,,600000.0,2015-07-09,2015.0,community driven news/views platform,new delhi
16.0,07/09/2015,Prozo,Study Material Marketplace,New Delhi,"Nalin Jain, Shomil Pant, Dinesh Kundu & others",Seed Funding,"205,000",,,,,,,,,,,,,,,,,,,,,,,,,205000.0,2015-07-09,2015.0,study material marketplace,new delhi
17.0,07/09/2015,Zomato,Restaurant Ratings & Reviews platform,Gurgaon,"Temasek, Vy Capital",Private Equity,"60,000,000",Late Stage,,,,,,,,,,,,,,,,,,,,,,,,60000000.0,2015-07-09,2015.0,restaurant ratings & reviews platform,gurgaon
18.0,07/09/2015,Sahayog Dairy,Dairy Based Product Manufacturer,Bhopal,Acumen Fund,Private Equity,"1,800,000",Series A,,,,,,,,,,,,,,,,,,,,,,,,1800000.0,2015-07-09,2015.0,dairy based product manufacturer,bhopal
19.0,08/09/2015,MockBank,Government Test Preparation platform,Bangalore,Blume Ventures,Seed Funding,"400,000",,,,,,,,,,,,,,,,,,,,,,,,,400000.0,2015-08-09,2015.0,government test preparation platform,bangalore
20.0,08/09/2015,ReportBee,Smart Report Cards for Schools,Chennai,India Educational Investment Fund,Seed Funding,,,,,,,,,,,,,,,,,,,,,,,,,,,2015-08-09,2015.0,smart report cards for schools,chennai
21.0,08/09/2015,GuruG Learning,Teacher empowerment platform,Bangalore,India Educational Investment Fund,Seed Funding,,,,,,,,,,,,,,,,,,,,,,,,,,,2015-08-09,2015.0,teacher empowerment platform,bangalore
22.0,10/09/2015,OnlineTyari,Multilingual Test Preparation Platform,Gurgaon,"500 Startups, TV Mohandas Pai, Tandem Capital, Vikram Chachra, Aloke Bajpai",Private Equity,"770,000",Series A,,,,,,,,,,,,,,,,,,,,,,,,770000.0,2015-10-09,2015.0,multilingual test preparation platform,gurgaon
23.0,10/09/2015,IndustryBuying,Industrial Tools Marketplace,New Delhi,"Kalaari Capital, SAIF Partners, Beenextan investment fund",Private Equity,"9,200,000",Series B,,,,,,,,,,,,,,,,,,,,,,,,9200000.0,2015-10-09,2015.0,industrial tools marketplace,new delhi
24.0,10/09/2015,The/Nudge Foundation,Non Profit Organization to alleviate poverty,Bangalore,"Nanadan Nilekani, InMobi, Paytm",Seed Funding,"315,000",,,,,,,,,,,,,,,,,,,,,,,,,315000.0,2015-10-09,2015.0,non profit organization to alleviate poverty,bangalore
25.0,11/09/2015,FitMeIn,Gym & Fitness Studios Subscription platform,New Delhi,Green House Ventures,Seed Funding,"100,000",,,,,,,,,,,,,,,,,,,,,,,,,100000.0,2015-11-09,2015.0,gym & fitness studios subscription platform,new delhi
26.0,11/09/2015,Envoged,pre-used luxury item Marketplace,Mumbai,"Ankush Nijhawan, Manish Dhingra, Gaurav Bhatnagar",Seed Funding,,,,,,,,,,,,,,,,,,,,,,,,,,,2015-11-09,2015.0,pre-used luxury item marketplace,mumbai
27.0,11/09/2015,Zapyle,pre-used apparel shopping mobile app,Bangalore,,Seed Funding,"1,000,000",,,,,,,,,,,,,,,,,,,,,,,,,1000000.0,2015-11-09,2015.0,pre-used apparel shopping mobile app,bangalore
28.0,11/09/2015,Renomania,Home Design & Décor platform,New Delhi,Subodh Gupta,Seed Funding,,,,,,,,,,,,,,,,,,,,,,,,,,,2015-11-09,2015.0,home design & décor platform,new delhi
29.0,12/09/2015,CredR,Used Vehicles Marketplace,Mumbai,Eight Road Ventures,Private Equity,"15,000,000",Series A,,,,,,,,,,,,,,,,,,,,,,,,15000000.0,2015-12-09,2015.0,used vehicles marketplace,mumbai
30.0,12/09/2015,YatraGenie,Online Bus & Cab ticketing platform,Hyderabad,Ash Bhardwaj,Private Equity,,Series A,,,,,,,,,,,,,,,,,,,,,,,,,2015-12-09,2015.0,online bus & cab ticketing platform,hyderabad
31.0,14/09/2015,CanvasFlip,Mobile App testing platform,Hyderabad,Bessemer Venture Partners,Seed Funding,"1,200,000",,,,,,,,,,,,,,,,,,,,,,,,,1200000.0,2015-09-14,2015.0,mobile app testing platform,hyderabad
32.0,14/09/2015,Shadowfax,Hyperlocal Delivery Services,Gurgaon,Eight Roads Ventures,Private Equity,"9,000,000",Series A,,,,,,,,,,,,,,,,,,,,,,,,9000000.0,2015-09-14,2015.0,hyperlocal delivery services,gurgaon
33.0,14/09/2015,UE Life Sciences,Early Cancer Detection Solutions,US/India,"Aarin Capital, Unitus Seed Fund",Private Equity,"3,000,000",Series A,,,,,,,,,,,,,,,,,,,,,,,,3000000.0,2015-09-14,2015.0,early cancer detection solutions,us/india
34.0,14/09/2015,Ola Cabs,Cab rental Mobile app,Bangalore,"Falcon Edge Capital, NY based Hedge Fund, Tiger Global, Softbank",Private Equity,"225,000,000",Late Stage,,,,,,,,,,,,,,,,,,,,,,,,225000000.0,2015-09-14,2015.0,cab rental mobile app,bangalore
35.0,15/09/2015,Coverfox,Online Insurance Distribution Platform,Mumbai,Cataraman Ventures,Private Equity,"2,000,000",Part of $12M Series B funding,,,,,,,,,,,,,,,,,,,,,,,,2000000.0,2015-09-15,2015.0,online insurance distribution platform,mumbai
36.0,15/09/2015,MoEngage,Mobile Marketing Automation Platform,Bangalore,"Helion Venture Partners, Exfinity Ventures",Private Equity,"4,250,000",Series A,,,,,,,,,,,,,,,,,,,,,,,,4250000.0,2015-09-15,2015.0,mobile marketing automation platform,bangalore
37.0,15/09/2015,Mubble,Prepaid Mobile Bill Manager App,Bangalore,Nandan Nilekani,Seed Funding,,,,,,,,,,,,,,,,,,,,,,,,,,,2015-09-15,2015.0,prepaid mobile bill manager app,bangalore
38.0,15/09/2015,Tea Trails,Chain of Tea Café’s,Mumbai,"Anil Matai, Vikram Tandon, Shyam Sundar R & others",Seed Funding,"1,000,000",,,,,,,,,,,,,,,,,,,,,,,,,1000000.0,2015-09-15,2015.0,chain of tea café’s,mumbai
39.0,15/09/2015,Room on Call,Branded Budget Hotel Marketplace,Noida,Payal Syal,Seed Funding,"300,000",,,,,,,,,,,,,,,,,,,,,,,,,300000.0,2015-09-15,2015.0,branded budget hotel marketplace,noida
40.0,15/09/2015,FYNE,Home Fitting & Fixtures Marketplace,Bangalore,Sandeep Dama & Others,Seed Funding,,Pre-Series A,,,,,,,,,,,,,,,,,,,,,,,,,2015-09-15,2015.0,home fitting & fixtures marketplace,bangalore
41.0,16/09/2015,ChaiPoint,Food Subscription platform,Bangalore,Eight Roads Ventures,Private Equity,"10,000,000",Series A,,,,,,,,,,,,,,,,,,,,,,,,10000000.0,2015-09-16,2015.0,food subscription platform,bangalore
42.0,16/09/2015,WedmeGood.com,Wedding Planning Platform,Gurgaon,Indian Angel Network,Seed Funding,"410,000",,,,,,,,,,,,,,,,,,,,,,,,,410000.0,2015-09-16,2015.0,wedding planning platform,gurgaon
43.0,16/09/2015,XSTOK,B2B Mobile Auction Marketplace,Mumbai,Oliphans Capital,Seed Funding,"450,000",,,,,,,,,,,,,,,,,,,,,,,,,450000.0,2015-09-16,2015.0,b2b mobile auction marketplace,mumbai
44.0,17/09/2015,UniLog,ECommerce Data Analytics Platform,Bangalore,Kalaari Capital,Private Equity,,,,,,,,,,,,,,,,,,,,,,,,,,,2015-09-17,2015.0,ecommerce data analytics platform,bangalore
45.0,17/09/2015,Paintcollar,Designer Merchandize Marketplace,Mumbai,Applyifi,Seed Funding,,Bridge Funding,,,,,,,,,,,,,,,,,,,,,,,,,2015-09-17,2015.0,designer merchandize marketplace,mumbai
46.0,17/09/2015,YepMe,Private label Fashion eTailer,Gurgaon,"Khazanah Nasional Berhad, Helion Venture Partners",Private Equity,"75,000,000",Series D,,,,,,,,,,,,,,,,,,,,,,,,75000000.0,2015-09-17,2015.0,private label fashion etailer,gurgaon
47.0,17/09/2015,Bueno,Online Food ordering & delivery,Gurgaon,High Networth Individuals (No details),Seed Funding,"600,000",,,,,,,,,,,,,,,,,,,,,,,,,600000.0,2015-09-17,2015.0,online food ordering & delivery,gurgaon
48.0,18/09/2015,Plabro,Real Estate Broker Platform App,New Delhi,"Sachin Bansal & Binny Bansal, Sol Primero, Outbox Ventures, Sangram Singh",Seed Funding,"350,000",,,,,,,,,,,,,,,,,,,,,,,,,350000.0,2015-09-18,2015.0,real estate broker platform app,new delhi
49.0,18/09/2015,CureJoy,Online Health & Wellness platform,Bangalore,"Accel Partners, Subrata Mitra, Larry Braitman, Venk Krishna",Private Equity,"1,150,000",Pre-Series A,,,,,,,,,,,,,,,,,,,,,,,,1150000.0,2015-09-18,2015.0,online health & wellness platform,bangalore
50.0,18/09/2015,Briston Technomach,Internet of Things platform,New Delhi,Undisclosed,Seed Funding,"150,000",,,,,,,,,,,,,,,,,,,,,,,,,150000.0,2015-09-18,2015.0,internet of things platform,new delhi
51.0,18/09/2015,LabStreet,Diagnostic Labs aggregator platform,Gurgaon,Multiple investors,Seed Funding,"150,000",,,,,,,,,,,,,,,,,,,,,,,,,150000.0,2015-09-18,2015.0,diagnostic labs aggregator platform,gurgaon
52.0,19/09/2015,DailyNinja,Hyperlocal Delivery Platform,Bangalore,"Aprameya Radhakrishna, Naman Sarawagi, Afsal Salu,",Seed Funding,,,,,,,,,,,,,,,,,,,,,,,,,,,2015-09-19,2015.0,hyperlocal delivery platform,bangalore
53.0,21/09/2015,Portea Medical,Home Medical Care Services,Bangalore,"Accel Partners, International Finance Corporation (IFC), Qualcomm Ventures, Ventureast",Private Equity,"37,500,000",,,,,,,,,,,,,,,,,,,,,,,,,37500000.0,2015-09-21,2015.0,home medical care services,bangalore
54.0,21/09/2015,Neotrade Analytics,Real-Time stock data platform,Bangalore,Rainmatter,Seed Funding,"235,000",,,,,,,,,,,,,,,,,,,,,,,,,235000.0,2015-09-21,2015.0,real-time stock data platform,bangalore
55.0,21/09/2015,DishCo,Food discovery & table booking app,Mumbai,"Anand Mahindra, Uday Punj, Ashish Hemrajani, Sanjeev Mehra",Seed Funding,,,,,,,,,,,,,,,,,,,,,,,,,,,2015-09-21,2015.0,food discovery & table booking app,mumbai
56.0,21/09/2015,LafaLafa,coupons and cashback aggregator app,Mumbai,500 Startups,Seed Funding,"125,000",thru Accelerator,,,,,,,,,,,,,,,,,,,,,,,,125000.0,2015-09-21,2015.0,coupons and cashback aggregator app,mumbai
57.0,21/09/2015,ConnectAbank,Financial Products lead generation platform,Mumbai,Prakhar Bumb,Seed Funding,,,,,,,,,,,,,,,,,,,,,,,,,,,2015-09-21,2015.0,financial products lead generation platform,mumbai
58.0,22/09/2015,VillFarm,Sustainable Agri-inputs Firm,Bangalore,"Unitus Seed Fund, Rianta Capital, R Ramaraj, Sunil Edwards",Seed Funding,,,,,,,,,,,,,,,,,,,,,,,,,,,2015-09-22,2015.0,sustainable agri-inputs firm,bangalore
59.0,22/09/2015,Bestdealfinance,Financial Services Portal,Mumbai,"Kalaari Capital, YourNest Angel Fund",Private Equity,"3,000,000",Series A,,,,,,,,,,,,,,,,,,,,,,,,3000000.0,2015-09-22,2015.0,financial services portal,mumbai
60.0,22/09/2015,GameXS.in,Pre-owned games Marketplace,New Delhi,Lead Angels,Seed Funding,,,,,,,,,,,,,,,,,,,,,,,,,,,2015-09-22,2015.0,pre-owned games marketplace,new delhi
61.0,22/09/2015,The Man Company,Content-based Subscription eCommerce platform,New Delhi,"Karan Bajwa, Amanpreet Bajaj, Manish Vij",Seed Funding,,,,,,,,,,,,,,,,,,,,,,,,,,,2015-09-22,2015.0,content-based subscription ecommerce platform,new delhi
62.0,22/09/2015,Virtual Logic,"virtual reality, 3d simulation and stereoscopic products",Bangalore,Swarnim Multiventures,Private Equity,"800,000",Pre-Series A,,,,,,,,,,,,,,,,,,,,,,,,800000.0,2015-09-22,2015.0,"virtual reality, 3d simulation and stereoscopic products",bangalore
63.0,22/09/2015,Furdo,Online Interior Designing platform,Bangalore,Bhavdeep Reddy,Seed Funding,"400,000",,,,,,,,,,,,,,,,,,,,,,,,,400000.0,2015-09-22,2015.0,online interior designing platform,bangalore
64.0,22/09/2015,LogiNext,End-to-end Logistics platform,Mumbai,Paytm,Private Equity,"10,000,000",Series A,,,,,,,,,,,,,,,,,,,,,,,,10000000.0,2015-09-22,2015.0,end-to-end logistics platform,mumbai
65.0,22/09/2015,Korra,Private Label Apparel sales,New Delhi,Asha Jadeja Motwani & Others,Seed Funding,"300,000",,,,,,,,,,,,,,,,,,,,,,,,,300000.0,2015-09-22,2015.0,private label apparel sales,new delhi
66.0,23/09/2015,Credihealth,Healthcare Consulting platform,Gurgaon,Rajat Malhotra,Seed Funding,,,,,,,,,,,,,,,,,,,,,,,,,,,2015-09-23,2015.0,healthcare consulting platform,gurgaon
67.0,23/09/2015,Amigobulls,Stock Market Portal,Bangalore,"Sharad Sharma, Vijay Anand, Mohandas Pai. Pallav Nadhani, Singapore Angels Network & others",Seed Funding,,,,,,,,,,,,,,,,,,,,,,,,,,,2015-09-23,2015.0,stock market portal,bangalore
68.0,23/09/2015,SilverPush,Cross-device retargeting platform,Gurgaon / SFO,M&S Partners,Private Equity,"1,200,000",Series A,,,,,,,,,,,,,,,,,,,,,,,,1200000.0,2015-09-23,2015.0,cross-device retargeting platform,gurgaon / sfo
69.0,23/09/2015,Juggernaut,Digital & Physical Publishing platform,New Delhi,"William Bissell, Neeraj Aggarwal, Nandan Nilekani",Private Equity,"2,250,000",Series A,,,,,,,,,,,,,,,,,,,,,,,,2250000.0,2015-09-23,2015.0,digital & physical publishing platform,new delhi
70.0,23/09/2015,InnerChef,Food Delivery Platform,New Delhi,"Phanindra Sama, Anupam Mittal, Vijay Shekhar Sharma, Vishal Gondal, Sateesh Andara & others",Private Equity,"1,750,000",pre-Series A,,,,,,,,,,,,,,,,,,,,,,,,1750000.0,2015-09-23,2015.0,food delivery platform,new delhi
71.0,24/09/2015,Quintype,Data Driven Publishing platform,Bangalore,Raghav Bahl,Private Equity,"3,300,000",,,,,,,,,,,,,,,,,,,,,,,,,3300000.0,2015-09-24,2015.0,data driven publishing platform,bangalore
72.0,24/09/2015,Capabiliti,Employee OnBoarding & Orientation platform,Noida,"500 Startups, Smile Multimedia, Kunal Bahl, Rohit Bansal, Girish Matrubootham",Seed Funding,"400,000",,,,,,,,,,,,,,,,,,,,,,,,,400000.0,2015-09-24,2015.0,employee onboarding & orientation platform,noida
73.0,24/09/2015,Fourth Partner Energy,Solar Power Solutions company,Hyderabad,"Infuse Ventures, The Chennai Angels",Private Equity,"2,000,000",Series A,,,,,,,,,,,,,,,,,,,,,,,,2000000.0,2015-09-24,2015.0,solar power solutions company,hyderabad
74.0,24/09/2015,Licious,Online Meat Ordering platform,Bangalore,"Kanwaljit Singh, TV Mohandas Pai",Seed Funding,"1,000,000",,,,,,,,,,,,,,,,,,,,,,,,,1000000.0,2015-09-24,2015.0,online meat ordering platform,bangalore
75.0,25/09/2015,TravelKhana,online meal-booking platform for train travelers,New Delhi,Astarc Ventures & Others,Seed Funding,,Pre-Series A,,,,,,,,,,,,,,,,,,,,,,,,,2015-09-25,2015.0,online meal-booking platform for train travelers,new delhi
76.0,28/09/2015,Quickli,hyperlocal delivery platform,New Delhi,"500 Startups, Mato Peric & Others",Seed Funding,,,,,,,,,,,,,,,,,,,,,,,,,,,2015-09-28,2015.0,hyperlocal delivery platform,new delhi
77.0,28/09/2015,Ola Cabs,Cab Booking app platform,Bangalore,Didi Kuaidi,Private Equity,"30,000,000",late Stage (part of $500M funding rnd),,,,,,,,,,,,,,,,,,,,,,,,30000000.0,2015-09-28,2015.0,cab booking app platform,bangalore
78.0,29/09/2015,Paytm,E-Commerce & M-Commerce platform,New Delhi,"Alibaba Group, Ant Financial",Private Equity,"680,000,000",Late Stage (Alibaba @ 40% equity),,,,,,,,,,,,,,,,,,,,,,,,680000000.0,2015-09-29,2015.0,e-commerce & m-commerce platform,new delhi
79.0,29/09/2015,Inmobi,Mobile Advertising platform,Bangalore,Tennenbaum Capital Partners & Others,Private Equity,"100,000,000",Late Stage,,,,,,,,,,,,,,,,,,,,,,,,100000000.0,2015-09-29,2015.0,mobile advertising platform,bangalore
80.0,29/09/2015,Peppertap,Hyperlocal Grocery Delivery,Gurgaon,"Sequoia India, SAIF Partners.",Private Equity,"36,000,000",Series B,,,,,,,,,,,,,,,,,,,,,,,,36000000.0,2015-09-29,2015.0,hyperlocal grocery delivery,gurgaon
81.0,29/09/2015,Hugefly,Ecommerce Product recommendation platform,Pune,Mayank Singhal and others,Seed Funding,,,,,,,,,,,,,,,,,,,,,,,,,,,2015-09-29,2015.0,ecommerce product recommendation platform,pune
82.0,29/09/2015,Brigge,Activity Based Social Network,Chennai,The Chennai Angels,Seed Funding,,,,,,,,,,,,,,,,,,,,,,,,,,,2015-09-29,2015.0,activity based social network,chennai
83.0,29/09/2015,Zakoopi,Fashion Discovery platform,New Delhi,Uniqorn Ventures,Seed Funding,"350,000",,,,,,,,,,,,,,,,,,,,,,,,,350000.0,2015-09-29,2015.0,fashion discovery platform,new delhi
84.0,29/09/2015,LoanCircle,Consumer lending marketplace,Bangalore,"Zishaan Hayath, Rahul Khanna & Others",Seed Funding,,,,,,,,,,,,,,,,,,,,,,,,,,,2015-09-29,2015.0,consumer lending marketplace,bangalore
85.0,30/09/2015,Infoworks,Big Data Management Platform,Bangalore / USA,"Nexus Venture Partners, Knoll Ventures and others",Private Equity,"5,000,000",,,,,,,,,,,,,,,,,,,,,,,,,5000000.0,2015-09-30,2015.0,big data management platform,bangalore / usa
86.0,30/09/2015,RedDoorz,Budget Accommodation Platform,Noida,Jungle Ventures,Seed Funding,"1,000,000",,,,,,,,,,,,,,,,,,,,,,,,,1000000.0,2015-09-30,2015.0,budget accommodation platform,noida
87.0,30/09/2015,FirstTouch,Local Mobile OS,Gurgaon,"Kunal Bahl, Rohit Bansal, Pranay Chulet, Naveen Tiwari, Amit Gupta, Mayank Singhal",Seed Funding,,Super angel round,,,,,,,,,,,,,,,,,,,,,,,,,2015-09-30,2015.0,local mobile os,gurgaon
88.0,30/09/2015,Eywa Media,Digital Signal processing platform,Bangalore,"ah! Ventures,Viktor Koenig PE Fund, Mantra Ventures",Seed Funding,"1,000,000",,,,,,,,,,,,,,,,,,,,,,,,,1000000.0,2015-09-30,2015.0,digital signal processing platform,bangalore
89.0,,,,,,,,,,,,,,,,,,,,,,,,,,,,,,,,,,,,
90.0,,,,,,,,,,,,,,,,,,,,,,,,,,,,,,,,,,,,
,,,,,,,,,,,,,,,,,,,,,,,,,,,,,,,,,,,,
1.0,01/4/2016,Dil Mil,,SFO / Bangalore,"Nelstone Ventures, Transmedia Capital, Maiden Lane Ventures, CSC Upshot & Angel investors",,"2,700,000",,Consumer Internet,Matchmaking Mobile App,Private Equity,,,,,,,,,,,,,,,,,,,,,2700000.0,2016-01-04,2016.0,,sfo / bangalore
2.0,01/4/2016,PicsDream,,Delhi,Raman Roy,,,,Consumer Internet,Online Marketplace for Photographers,Seed Funding,,,,,,,,,,,,,,,,,,,,,,2016-01-04,2016.0,,delhi
3.0,01/4/2016,Process 9,,Gurgaon,"Indian Angel Network, Alok Sharma, Kris Gopalakrishnan, Saurabh Srivastava, and Ajai Chowdhry",,,,Consumer Internet,online translation and transliteration,Seed Funding,,,,,,,,,,,,,,,,,,,,,,2016-01-04,2016.0,,gurgaon
4.0,04/4/2016,Housing,,Mumbai,Vineet Singh,,,,Consumer Internet,Real Estate Portal,Private Equity,,,,,,,,,,,,,,,,,,,,,,2016-04-04,2016.0,,mumbai
5.0,04/4/2016,Roll Mafia,,Pune,Equentia Natural Resource & Other undisclosed investors,,,,Food & Beverage,Rolls & Biryanis QSR chain,Seed Funding,,,,,,,,,,,,,,,,,,,,,,2016-04-04,2016.0,,pune
6.0,04/4/2016,Hungama,,Mumbai,Xiaomi Inc,,"25,000,000",,Consumer Internet,Digital Media Entertainment Portal,Private Equity,,,,,,,,,,,,,,,,,,,,,25000000.0,2016-04-04,2016.0,,mumbai
7.0,04/4/2016,Highway Delite,,Bangalore,N.S. Raghavan Centre for Entrepreneurial Learning,,,,Consumer Internet,Various Highway Help Services,Seed Funding,,,,,,,,,,,,,,,,,,,,,,2016-04-04,2016.0,,bangalore
8.0,05/4/2016,Cult Fitness,,Bangalore,Mukesh Bansal,,,,Healthcare,Healthcare training programs,Seed Funding,,,,,,,,,,,,,,,,,,,,,,2016-05-04,2016.0,,bangalore
9.0,05/4/2016,Haptik,,Mumbai,Times Internet Ltd,,,,Technology,Personal Assistant App,Private Equity,,,,,,,,,,,,,,,,,,,,,,2016-05-04,2016.0,,mumbai
10.0,05/4/2016,Servify,,Mumbai,"Blume Ventures, Barkawi Holdings GmbH, TM Service Technology Holdings GmbH",,,,Consumer Internet,Gadget & Appliances Service App,Private Equity,,,,,,,,,,,,,,,,,,,,,,2016-05-04,2016.0,,mumbai
11.0,06/4/2016,Shipsy,,Gurgaon,DTDC Express Ltd,,"1,000,000",,Logistics,Logistics Solutions,Private Equity,,,,,,,,,,,,,,,,,,,,,1000000.0,2016-06-04,2016.0,,gurgaon
12.0,06/4/2016,gear6,,Bangalore,Ninestarter,,"500,000",,Consumer Internet,Online bike service and repairs platform,Seed Funding,,,,,,,,,,,,,,,,,,,,,500000.0,2016-06-04,2016.0,,bangalore
13.0,06/4/2016,MyGlamm,,Mumbai,L’Occitane,,"6,000,000",,Consumer Internet,Mobile based on-demand Beauty Services platform,Private Equity,,,,,,,,,,,,,,,,,,,,,6000000.0,2016-06-04,2016.0,,mumbai
14.0,06/4/2016,Petoo,,Bangalore,Axilor Ventures,,"1,000,000",,Consumer Internet,Online Food Delivery Platform,Private Equity,,,,,,,,,,,,,,,,,,,,,1000000.0,2016-06-04,2016.0,,bangalore
15.0,07/4/2016,Truly Social,,London,Nazara Technologies Pvt Ltd,,,,Consumer Internet,Mobile Gaming Studio,Private Equity,,,,,,,,,,,,,,,,,,,,,,2016-07-04,2016.0,,london
16.0,08/04/2016,Little Black Book,,New Delhi,"IDG, Indian Angel Network",,,,Consumer Internet,"Curated Food, event & Lifestyle guide",Seed Funding,,,,,,,,,,,,,,,,,,,,,,2016-08-04,2016.0,,new delhi
17.0,08/04/2016,Vahan,,Chennai,Villgro,,,,Education,Mobile Education Platform,Seed Funding,,,,,,,,,,,,,,,,,,,,,,2016-08-04,2016.0,,chennai
18.0,08/04/2016,imedilane,,New Delhi,"Mahendra Patel, Nilender Chauhan",,"40,000",,Consumer Internet,Online Health Diagnosis platform,Seed Funding,,,,,,,,,,,,,,,,,,,,,40000.0,2016-08-04,2016.0,,new delhi
19.0,11/04/2016,Living Local,,Mumbai,Rattan Chadha,,"200,000",,Consumer Internet,Social discovery platform,Seed Funding,,,,,,,,,,,,,,,,,,,,,200000.0,2016-11-04,2016.0,,mumbai
20.0,11/04/2016,Vegfru,,New Delhi,Wingify,,,,eCommerce,Online Fruit & Vegetable Marketplace,Seed Funding,,,,,,,,,,,,,,,,,,,,,,2016-11-04,2016.0,,new delhi
21.0,11/04/2016,Oyo,,New Delhi,"Softbank, Sequoia Capital, Lightspeed Venture Partners, Greenoaks Capital, DSG Consumer Partners and Venture Nursery",,"100,000,000",,Consumer Internet,Online Branded Budget Room Booking Service,Private Equity,,,,,,,,,,,,,,,,,,,,,100000000.0,2016-11-04,2016.0,,new delhi
22.0,11/04/2016,PriceRaja,,Gurgaon,Prashant Puri,,"300,000",,Consumer Internet,Price Comparison Portal,Seed Funding,,,,,,,,,,,,,,,,,,,,,300000.0,2016-11-04,2016.0,,gurgaon
23.0,12/04/2016,MagicX,,Bangalore,"Kris Gopalakrishnan, Dr. Ranjan Pai",,"1,000,000",,Consumer Internet,On-Demand Task Management App,Seed Funding,,,,,,,,,,,,,,,,,,,,,1000000.0,2016-12-04,2016.0,,bangalore
24.0,12/04/2016,Happydemic,,Mumbai,Shaan,,,,Consumer Internet,Artist Discovery & Booking platform,Seed Funding,,,,,,,,,,,,,,,,,,,,,,2016-12-04,2016.0,,mumbai
25.0,12/04/2016,LenDenClub,,Mumbai,"Anirudh Damani, Daud Ali, Narendra Karnavat, Vikas Kapoor, Vikram Lakhotia, Krishna Jhunjhunwaala, Jayesh Shah",,,,Finance,Peer-to-Peer Lending Platform,Seed Funding,,,,,,,,,,,,,,,,,,,,,,2016-12-04,2016.0,,mumbai
26.0,12/04/2016,Indi.com,,,Anil Kapoor,,,,Consumer Internet,Video Social Network,Seed Funding,,,,,,,,,,,,,,,,,,,,,,2016-12-04,2016.0,,
27.0,13/04/2016,Legalraasta,,New Delhi,"Pravin Khandelwal, Yatin Kumar Jain",,"1,000,000",,Consumer Internet,Online legal Services for Startups,Seed Funding,,,,,,,,,,,,,,,,,,,,,1000000.0,2016-04-13,2016.0,,new delhi
28.0,13/04/2016,RainCan,,Pune,Dr. Aniruddha Malpani,,"150,000",,Consumer Internet,Subscription-based grocery delivery Mobile App,Seed Funding,,,,,,,,,,,,,,,,,,,,,150000.0,2016-04-13,2016.0,,pune
29.0,13/04/2016,Hippily,,Mumbai,"Dr. Sridhar Ramaswamy, Rakesh Mathur",,"250,000",,eCommerce,Fashion ECommerce App,Seed Funding,,,,,,,,,,,,,,,,,,,,,250000.0,2016-04-13,2016.0,,mumbai
30.0,13/04/2016,kredX,,Bangalore,"Prime Venture Partners,",,"750,000",,eCommerce,Invoice discounting  Marketplace,Seed Funding,,,,,,,,,,,,,,,,,,,,,750000.0,2016-04-13,2016.0,,bangalore
31.0,14/04/2016,Wedwise,,New Delhi,StartUp Equity Partners,,,,Consumer Internet,Wedding related services community,Seed Funding,,,,,,,,,,,,,,,,,,,,,,2016-04-14,2016.0,,new delhi
32.0,14/04/2016,BeaconsTalk,,Mumbai,"Rajeev Agrawal, Prashant Gooty",,"100,000",,Technology,contextual mobile advertising,Seed Funding,,,,,,,,,,,,,,,,,,,,,100000.0,2016-04-14,2016.0,,mumbai
33.0,15/04/2016,Deal 4Loans,,Noida,"Ram Shriram, Neeraj Arora, Puru Vashishtha",,,,Consumer Internet,Loan Comparison Portal,Seed Funding,,,,,,,,,,,,,,,,,,,,,,2016-04-15,2016.0,,noida
34.0,15/04/2016,RenewBuy,,New Delhi,Mount Nathan Advisors,,"1,000,000",,Consumer Internet,Online Car & Bike Insurance Comparison portal,Seed Funding,,,,,,,,,,,,,,,,,,,,,1000000.0,2016-04-15,2016.0,,new delhi
35.0,15/04/2016,Blue Box Media,,Jaipur,"Mahavir Pratap Sharma, Ajay Data, Yogesh Chaudhary, Sanjay Phophaliya, Siddharth Agarwal, Kamal Kothari",,,,Consumer Internet,Online Tech Portals,Seed Funding,,,,,,,,,,,,,,,,,,,,,,2016-04-15,2016.0,,jaipur
36.0,15/04/2016,Vyomo,,New Delhi,Naturals Salon Chain,,"15,000,000",,Consumer Internet,On-Demand Beauty Service provider,Private Equity,,,,,,,,,,,,,,,,,,,,,15000000.0,2016-04-15,2016.0,,new delhi
37.0,15/04/2016,Organicshop,,Jaipur,"Vivek Nathani, Yogesh Chaudhary, Mahavir Pratap Sharma, Kamal Kothari, H C Jain",,,,eCommerce,Marketplace for organic products,Seed Funding,,,,,,,,,,,,,,,,,,,,,,2016-04-15,2016.0,,jaipur
38.0,15/04/2016,MInd Your Fleet,,Noida,Undisclosed Investors,,,,Consumer Internet,Car Rental Software,Seed Funding,,,,,,,,,,,,,,,,,,,,,,2016-04-15,2016.0,,noida
39.0,15/04/2016,NestAway,,Bangalore,Tiger Global,,"30,000,000",,Consumer Internet,Furnished Home Rental Platform,Private Equity,,,,,,,,,,,,,,,,,,,,,30000000.0,2016-04-15,2016.0,,bangalore
40.0,15/04/2016,Tapchief,,Bangalore,Vijay Shekhar Sharma,,"150,000",,Consumer Internet,Expert Advice Platform,Seed Funding,,,,,,,,,,,,,,,,,,,,,150000.0,2016-04-15,2016.0,,bangalore
41.0,18/04/2016,Rapido,,Bangalore,"Pawan Munjal, AdvantEdge Partners, Astarc Ventures",,,,Consumer Internet,Bike Aggregator App,Private Equity,,,,,,,,,,,,,,,,,,,,,,2016-04-18,2016.0,,bangalore
42.0,18/04/2016,Yufta,,Bangalore,Ajay Data & other HNIs,,,,eCommerce,Women’s Fashion ECommerce Portal,Seed Funding,,,,,,,,,,,,,,,,,,,,,,2016-04-18,2016.0,,bangalore
43.0,18/04/2016,Smytten,,Gurgaon,Rajan Anandan,,,,eCommerce,Online Discovery and Shopping Platform,Seed Funding,,,,,,,,,,,,,,,,,,,,,,2016-04-18,2016.0,,gurgaon
44.0,18/04/2016,Houssup,,Jaipur,"Mitin Patel, Gaurav Agarwal",,,,Consumer Internet,interior design and home furnishing portal,Seed Funding,,,,,,,,,,,,,,,,,,,,,,2016-04-18,2016.0,,jaipur
45.0,18/04/2016,Jugnoo,,Chandigarh,Paytm & existing investors,,"10,000,000",,Consumer Internet,On-demand Delivery & Logistics platform,Private Equity,,,,,,,,,,,,,,,,,,,,,10000000.0,2016-04-18,2016.0,,chandigarh
46.0,18/04/2016,Tork Motocycles,,Pune,"Bhavish Aggarwal, Ankit Bhati",,,,Auto,Electric Motorcycle Manufacturer,Seed Funding,,,,,,,,,,,,,,,,,,,,,,2016-04-18,2016.0,,pune
47.0,19/04/2016,Betaout,,Noida,"Stanford Angels, LetsVenture, Chennai Angels, Hyderabad Angels, Mumbai Angels",,"1,500,000",,eCommerce,customer intelligence and marketing automation platform,Private Equity,,,,,,,,,,,,,,,,,,,,,1500000.0,2016-04-19,2016.0,,noida
48.0,19/04/2016,DriversCart,,Chennai,ah! Ventures,,"450,000",,Consumer Internet,on-demand chauffeur provider,Seed Funding,,,,,,,,,,,,,,,,,,,,,450000.0,2016-04-19,2016.0,,chennai
49.0,19/04/2016,LensKart,,New Delhi,Ratan Tata,,,,eCommerce,Eyewear etailing platform,Private Equity,,,,,,,,,,,,,,,,,,,,,,2016-04-19,2016.0,,new delhi
50.0,19/04/2016,CollegeDekho,,New Delhi,Man Capital,,"2,000,000",,Consumer Internet,College & Student information platform,Private Equity,,,,,,,,,,,,,,,,,,,,,2000000.0,2016-04-19,2016.0,,new delhi
51.0,19/04/2016,OYOfit,,Bangalore,RN Agarwal,,,,Consumer Internet,Fitness Services Aggregator platform,Seed Funding,,,,,,,,,,,,,,,,,,,,,,2016-04-19,2016.0,,bangalore
52.0,19/04/2016,Oliveboard,,Bangalore,India Educational Investment Fund,,,,Consumer Internet,Online exam practice & preparation platform,Private Equity,,,,,,,,,,,,,,,,,,,,,,2016-04-19,2016.0,,bangalore
53.0,19/04/2016,Simplilearn,,Bangalore,Brand Capital,,,,Consumer Internet,Online certification platform,Private Equity,,,,,,,,,,,,,,,,,,,,,,2016-04-19,2016.0,,bangalore
54.0,20/04/2016,1mg,,Gurgaon,"Maverick Capital Ventures, Sequoia Capital, Omidyar Network",,"15,000,000",,eCommerce,Online Pharmacy,Private Equity,,,,,,,,,,,,,,,,,,,,,15000000.0,2016-04-20,2016.0,,gurgaon
55.0,20/04/2016,Fashalot,,New Delhi,"YourNest Angel Fund, Rajul Garg",,,,Consumer Internet,Fashion and Store discovery mobile app,Seed Funding,,,,,,,,,,,,,,,,,,,,,,2016-04-20,2016.0,,new delhi
56.0,20/04/2016,Broomberg,,New Delhi,Undisclosed Angel investors & HNIs,,,,Consumer Internet,Cleaning Services Provider,Seed Funding,,,,,,,,,,,,,,,,,,,,,,2016-04-20,2016.0,,new delhi
57.0,21/04/2016,m.paani,,Mumbai,"Blume Ventures, Adil Allana, Aprameya Radhakrishna, Gautam Ivatury, Signal Point Partners",,,,Consumer Internet,Loyalty rewards platform,Seed Funding,,,,,,,,,,,,,,,,,,,,,,2016-04-21,2016.0,,mumbai
58.0,21/04/2016,Yufta,,Jaipur,Ajay Data & undisclosed HNIs,,,,eCommerce,hyperlocal fashion retail platform,Seed Funding,,,,,,,,,,,,,,,,,,,,,,2016-04-21,2016.0,,jaipur
59.0,21/04/2016,mishTag,,New Delhi,"M&Y Partners, SVG Media, Anthil Ventures & others",,,,Consumer Internet,"Style, Fashion Discovery Mobile app",Seed Funding,,,,,,,,,,,,,,,,,,,,,,2016-04-21,2016.0,,new delhi
60.0,21/04/2016,Advanced Structures India,,Bangalore,GirnarSoft,,,,Auto,Automotive Design and Engineering company,Private Equity,,,,,,,,,,,,,,,,,,,,,,2016-04-21,2016.0,,bangalore
61.0,22/04/2016,Licious,,Bangalore,Mayfield India II Management Ltd,,"3,000,000",,eCommerce,Mobile based Meat ordering App,Private Equity,,,,,,,,,,,,,,,,,,,,,3000000.0,2016-04-22,2016.0,,bangalore
62.0,22/04/2016,Knolskae,,Bangalore,"Inventus Capital Partners, HR Fund",,,,Consumer Internet,Educational Gamification & Simulation platform,Private Equity,,,,,,,,,,,,,,,,,,,,,,2016-04-22,2016.0,,bangalore
63.0,22/04/2016,Druva,,Pune,"NTT Finance, Telephone Corporation",,,,Technology,Converged Backup & Data Protection Solutions for Enterprises,Private Equity,,,,,,,,,,,,,,,,,,,,,,2016-04-22,2016.0,,pune
64.0,22/04/2016,TOKO Innovation Studios,,New Delhi,Indian Angel network,,"450,000",,Consumer Internet,Children’s Entertainment Games & Products,Seed Funding,,,,,,,,,,,,,,,,,,,,,450000.0,2016-04-22,2016.0,,new delhi
65.0,25/04/2016,Commut,,Hyderabad,50K Ventures,,"200,000",,Consumer Internet,Shuttle Service Provider,Seed Funding,,,,,,,,,,,,,,,,,,,,,200000.0,2016-04-25,2016.0,,hyderabad
66.0,25/04/2016,intouchapp,,Pune,Blume Ventures,,,,Consumer Internet,Contact Management Mobile App,Seed Funding,,,,,,,,,,,,,,,,,,,,,,2016-04-25,2016.0,,pune
67.0,25/04/2016,Dropkaffe,,Bangalore,"GrowthStory, Apurva Salapuria, Hitesh Oberoi, Sidharth Pansari, Nirupa Shankar",,"550,000",,Food & Beverage,Ready-to-Drink Beverage Producer,Seed Funding,,,,,,,,,,,,,,,,,,,,,550000.0,2016-04-25,2016.0,,bangalore
68.0,26/04/2016,Transerv,,Mumbai,"IDFC SPICE Fund, Micromax Informatics",,"15,000,000",,Consumer Internet,Digital Payments platform,Private Equity,,,,,,,,,,,,,,,,,,,,,15000000.0,2016-04-26,2016.0,,mumbai
69.0,26/04/2016,ClearTax,,Bangalore,"Max Levchin, Scott Banister",,"1,300,000",,Consumer Internet,Online filing of Tax returns,Private Equity,,,,,,,,,,,,,,,,,,,,,1300000.0,2016-04-26,2016.0,,bangalore
70.0,26/04/2016,Roposo,,Gurgaon,Bertelsmann India Investments,,"15,000,000",,eCommerce,Social Fashion ECommerce Discovery platform,Private Equity,,,,,,,,,,,,,,,,,,,,,15000000.0,2016-04-26,2016.0,,gurgaon
71.0,27/04/2016,MilkBasket,,Gurgaon,EVC Ventures,,"500,000",,Consumer Internet,Micro Grocery Delivery Platform,Seed Funding,,,,,,,,,,,,,,,,,,,,,500000.0,2016-04-27,2016.0,,gurgaon
72.0,27/04/2016,CareonGO,,,"Farooq Oomerbhoy, Anupam Mittal, Anand Mittal, Ravi Garikipati, Vibhu Garg, Singapore Angel Network, Konglo Ventures",,,,Consumer Internet,Online Pharmacy,Seed Funding,,,,,,,,,,,,,,,,,,,,,,2016-04-27,2016.0,,
73.0,27/04/2016,RailYatri,,Noida,"Nandan Nilekani, Helion Ventures, Omidyar Networks, Blume Ventures",,,,Consumer Internet,Train Related Information portal,Private Equity,,,,,,,,,,,,,,,,,,,,,,2016-04-27,2016.0,,noida
74.0,27/04/2016,ICHR,,New Delhi,Undisclosed,,"450,000",,Consumer Internet,Mobile based Children health Information app,Seed Funding,,,,,,,,,,,,,,,,,,,,,450000.0,2016-04-27,2016.0,,new delhi
75.0,27/04/2016,Murgency,,Mumbai,Axilor Ventures,,,,Consumer Internet,Medical Emergency Response App,Private Equity,,,,,,,,,,,,,,,,,,,,,,2016-04-27,2016.0,,mumbai
76.0,28/04/2016,The Wedding Brigade,,Mumbai,Blume Ventures & Other unnamed Investors,,"600,000",,Consumer Internet,Online Wedding Information Portal,Seed Funding,,,,,,,,,,,,,,,,,,,,,600000.0,2016-04-28,2016.0,,mumbai
77.0,28/04/2016,DocsApp,,Bangalore,"Rebright Partners, Anand Rajaraman, Venky Harinarayan",,"1,200,000",,Consumer Internet,Online Doctor Discovery & Chat platform,Private Equity,,,,,,,,,,,,,,,,,,,,,1200000.0,2016-04-28,2016.0,,bangalore
78.0,29/04/2016,Impact Guru,,Mumbai,"RB Investments, Fundnel",,"500,000",,Consumer Internet,Online Crowdfunding platform for NGOs & Social Projects,Seed Funding,,,,,,,,,,,,,,,,,,,,,500000.0,2016-04-29,2016.0,,mumbai
79.0,29/04/2016,LetReach,,New Delhi,vCommission,,"100,000",,eCommerce,ECommerce SAAS Solutions,Private Equity,,,,,,,,,,,,,,,,,,,,,100000.0,2016-04-29,2016.0,,new delhi
80.0,29/04/2016,,,,,,,,,,,,,,,,,,,,,,,,,,,,,,,,2016-04-29,2016.0,,
81.0,,,,,,,,,,,,,,,,,,,,,,,,,,,,,,,,,,,,
1.0,01/8/2016,HealthKart,,Gurgaon,"Sequoia Capital India, Omidyar Network, Kae Capital",,"12,000,000",,eCommerce,Online Pharmacy & Health Marketplace,Private Equity,,,,,,,,,,,,,,,,,,,,,12000000.0,2016-01-08,2016.0,,gurgaon
2.0,01/8/2016,Medinfi,,Bangalore,"Mudit Saxena, Evan Lim",,"200,000",,Consumer Internet,Doctor & Clinic  Discovery Platform,Seed Funding,,,,,,,,,,,,,,,,,,,,,200000.0,2016-01-08,2016.0,,bangalore
3.0,01/08/2016,RepairEasy,,Pune,Undisclosed HNIs,,"275,000",,Consumer Internet,Gadget Repair Services Platform,Seed Funding,,,,,,,,,,,,,,,,,,,,,275000.0,2016-01-08,2016.0,,pune
4.0,01/08/2016,Voonik,,Bangalore,InnoVen Capital,,"3,000,000",,eCommerce,Online Women’s Fashion Marketplace,Private Equity,,,,,,,,,,,,,,,,,,,,,3000000.0,2016-01-08,2016.0,,bangalore
5.0,01/08/2016,Tokri,,Pune,Syska LED group,,"2,500,000",,Consumer Internet,Hyperlocal Grocery Delivery platform,Private Equity,,,,,,,,,,,,,,,,,,,,,2500000.0,2016-01-08,2016.0,,pune
6.0,02/08/2016,Sheroes,,Noida,"Lumis Partners, The HR Fund, Rajul Garg, Quintillion Media",,"1,800,000",,Consumer Internet,Online Job and Career Platform for Women,Private Equity,,,,,,,,,,,,,,,,,,,,,1800000.0,2016-02-08,2016.0,,noida
7.0,02/08/2016,Daily Ninja,,Bangalore,"Venk Krishnan, Aprameya Radhakrishna, Anupam Mittal, Kunal Shah, Tracxn Labs, Subramanya SV, Ravi Garkipati",,,,Consumer Internet,Hyperlocal daily needs Products delivery platform,Seed Funding,,,,,,,,,,,,,,,,,,,,,,2016-02-08,2016.0,,bangalore
8.0,02/08/2016,Yumlane,,Mumbai,"Binny Bansal, Anupam Mittal, Sachin Bhatia, Darius Pandole, Kunal Khattar, Dheerag Jain",,"1,000,000",,Food & Beverage,Retail Food & Snack Offline centres,Seed Funding,,,,,,,,,,,,,,,,,,,,,1000000.0,2016-02-08,2016.0,,mumbai
9.0,03/08/2016,Xcode,,Chennai,RoundGlass Partners,,,,Healthcare,Personal Genomics,Private Equity,,,,,,,,,,,,,,,,,,,,,,2016-03-08,2016.0,,chennai
10.0,03/08/2016,ExtraCarbon,,Gurgaon,Brand Capital,,"225,000",,Consumer Internet,Waste Recycle Management platform,Seed Funding,,,,,,,,,,,,,,,,,,,,,225000.0,2016-03-08,2016.0,,gurgaon
11.0,03/08/2016,FlickBay,,Mumbai,Paul Roy,,"890,000",,Consumer Internet,Mobile Based Bollywood Discovery platform,Seed Funding,,,,,,,,,,,,,,,,,,,,,890000.0,2016-03-08,2016.0,,mumbai
12.0,04/08/2016,Petoo,,Bangalore,Existing Investors,,"500,000",,Consumer Internet,Food Delivery Platform,Seed Funding,,,,,,,,,,,,,,,,,,,,,500000.0,2016-04-08,2016.0,,bangalore
13.0,04/08/2016,lehlehsports,,New Delhi,Anglian Omega Network,,,,Others,Sports Arena discovery,Seed Funding,,,,,,,,,,,,,,,,,,,,,,2016-04-08,2016.0,,new delhi
14.0,05/08/2016,Tricog,,Bangalore,"Inventus Capital Partners, Blume Ventures & Others",,,,Healthcare,Healthcare Analytics Platform,Private Equity,,,,,,,,,,,,,,,,,,,,,,2016-05-08,2016.0,,bangalore
15.0,06/08/2016,VST Travels,,Kerala,Promatus Group,,"27,000",,Technology,Travel Ticket Booking Software,Seed Funding,,,,,,,,,,,,,,,,,,,,,27000.0,2016-06-08,2016.0,,kerala
16.0,08/08/2016,AdPushUp,,New Delhi,"Geniee, Inc, Purvi Capital",,,,Technology,Ad optimization Platform,Private Equity,,,,,,,,,,,,,,,,,,,,,,2016-08-08,2016.0,,new delhi
17.0,08/08/2016,Wefly Indoor Skydiving,,Mumbai,Swastika Company Ltd.,,"40,000",,Others,Indoor Skydiving Sports Provider,Seed Funding,,,,,,,,,,,,,,,,,,,,,40000.0,2016-08-08,2016.0,,mumbai
18.0,08/08/2016,Mojarto,,Gurgaon,Undisclosed Investors,,"445,000",,eCommerce,"Original Art, Digital Prints etailer",Seed Funding,,,,,,,,,,,,,,,,,,,,,445000.0,2016-08-08,2016.0,,gurgaon
19.0,08/08/2016,Zipgrid,,Mumbai,1Crowd (through crowd funding),,"200,000",,Consumer Internet,Community services platform,Seed Funding,,,,,,,,,,,,,,,,,,,,,200000.0,2016-08-08,2016.0,,mumbai
20.0,09/08/2016,MobiDent,,Bangalore,Centre for Innovation Incubation and Entrepreneurship (CIIE),,,,Healthcare,Dental Protection Solution,Seed Funding,,,,,,,,,,,,,,,,,,,,,,2016-09-08,2016.0,,bangalore
21.0,09/08/2016,Zeolr/RespirON,,New Delhi,Centre for Innovation Incubation and Entrepreneurship (CIIE),,,,Technology,Healthcare related IoT platform,Seed Funding,,,,,,,,,,,,,,,,,,,,,,2016-09-08,2016.0,,new delhi
22.0,10/08/2016,Vebbler,,Bangalore,"Anupam Mittal, Sharad Sharma & 14 others",,"500,000",,Consumer Internet,Photo Sharing Mobile App,Seed Funding,,,,,,,,,,,,,,,,,,,,,500000.0,2016-10-08,2016.0,,bangalore
23.0,10/08/2016,Bombay Shaving Company,,New Delhi,"Noshir Kaka, Subramanian Ramadorai, Kiran Deshpande, Pankaj Gupta, Ravi Nigam & Others",,"600,000",,eCommerce,Men’s Grooming Product etailer,Seed Funding,,,,,,,,,,,,,,,,,,,,,600000.0,2016-10-08,2016.0,,new delhi
24.0,11/08/2016,Travelyaari,,Bangalore,"Gujarat Venture Finance Limited (GVFL), Bennett Coleman & Co. Ltd",,"7,000,000",,Consumer Internet,Online ticket booking platform,Private Equity,,,,,,,,,,,,,,,,,,,,,7000000.0,2016-11-08,2016.0,,bangalore
25.0,11/08/2016,91SpringBoard,,Mumbai,"Khattar Holdings, ThirtyThree Investments, Soumitra Sharma, Deepak Sharma, Sumit Dayal and others",,,,Consumer Internet,Co-Working Spaces Discovery & Booking platform,Private Equity,,,,,,,,,,,,,,,,,,,,,,2016-11-08,2016.0,,mumbai
26.0,11/08/2016,Genextstudents,,Mumbai,1Crowd (through crowdfunding),,"209,000",,Consumer Internet,Online Tutoring Service provider,Seed Funding,,,,,,,,,,,,,,,,,,,,,209000.0,2016-11-08,2016.0,,mumbai
27.0,11/08/2016,Zenoti,,Hyderabad,"Norwest Venture Partners, Accel India",,"15,000,000",,Technology,Cloud Based Software Solutions Provider,Private Equity,,,,,,,,,,,,,,,,,,,,,15000000.0,2016-11-08,2016.0,,hyderabad
28.0,12/08/2016,Crofarm,,Gurgaon,"Mukul Singhal, Rohit Jain, Himanshu Aggrawal, Sunil Goyal Ashish Gupta,",,"1,500,000",,Technology,Agri-Tech supply chain Solution provider,Private Equity,,,,,,,,,,,,,,,,,,,,,1500000.0,2016-12-08,2016.0,,gurgaon
29.0,12/08/2016,Faircent.com,,Gurgaon,Brand Capital,,"1,500,000",,Consumer Internet,peer-to-peer lending platform,Private Equity,,,,,,,,,,,,,,,,,,,,,1500000.0,2016-12-08,2016.0,,gurgaon
30.0,12/08/2016,Innovaccer,,Noida,Westbridge Capital Partners,,"15,600,000",,Technology,Integrated Enterprise Analytics Platform,Private Equity,,,,,,,,,,,,,,,,,,,,,15600000.0,2016-12-08,2016.0,,noida
31.0,12/08/2016,Cuberoot,,Gurgaon,Undisclosed Investors,,"500,000",,Technology,Data Analytics & Audience Management Platform,Seed Funding,,,,,,,,,,,,,,,,,,,,,500000.0,2016-12-08,2016.0,,gurgaon
32.0,12/08/2016,Funcastic,,New Delhi,"HT Media Ltd, North Base Media",,,,Consumer Internet,B2C vernacular podcast aggregator platform,Seed Funding,,,,,,,,,,,,,,,,,,,,,,2016-12-08,2016.0,,new delhi
33.0,15/08/2016,Buttercups,,Bangalore,"Anand Chandrasekaran, Kanwaljit Singh, Manoj Varghese",,,,ECommerce,Women Intimate Wear eTailer,Seed Funding,,,,,,,,,,,,,,,,,,,,,,2016-08-15,2016.0,,bangalore
34.0,16/08/2016,Zappfresh,,Gurgaon,Ashvin Chadha,,,,ECommerce,Raw Meat Products eTailer,Seed Funding,,,,,,,,,,,,,,,,,,,,,,2016-08-16,2016.0,,gurgaon
35.0,16/08/2016,OyoRooms,,New Delhi,SoftBank Group,,"62,000,000",,Consumer Internet,Budget Hotels Aggregator,Private Equity,,,,,,,,,,,,,,,,,,,,,62000000.0,2016-08-16,2016.0,,new delhi
36.0,16/08/2016,Hike,,New Delhi,"Tencent Holdings, Foxconn Technology Group, Tiger Global, SoftBank Group, Bharti Enterprises",,"175,000,000",,Consumer Internet,Mobile Messaging App,Private Equity,,,,,,,,,,,,,,,,,,,,,175000000.0,2016-08-16,2016.0,,new delhi
37.0,16/08/2016,Joolz,,Mumbai,"Powerhouse Ventures, M&S Partners",,"500,000",,eCommerce,Online Jewellery Store,Private Equity,,,,,,,,,,,,,,,,,,,,,500000.0,2016-08-16,2016.0,,mumbai
38.0,16/08/2016,SaleBhai,,Ahmedabad,Brand Capital,,"1,500,000",,eCommerce,"Sweets, Dry Fruits & Handicrafts etailer",Private Equity,,,,,,,,,,,,,,,,,,,,,1500000.0,2016-08-16,2016.0,,ahmedabad
39.0,16/08/2016,Makkajai,,Pune,"Anand Chandrasekaran, Ananth Narayanan, Mekin Maheshwari, Ravi Garikipati, Divyesh Shah, Swastika Company Ltd",,"250,000",,Technology,Online & Mobile learning for kids,Seed Funding,,,,,,,,,,,,,,,,,,,,,250000.0,2016-08-16,2016.0,,pune
40.0,16/08/2016,Gradopedia,,Mumbai,Undisclosed Dubai based HNIs,,,,Consumer Internet,Career progression Portal,Seed Funding,,,,,,,,,,,,,,,,,,,,,,2016-08-16,2016.0,,mumbai
41.0,17/08/2016,MaalGaadi,,Indore,"Swan Angel Network,Sachin Khandelwal and others",,"375,000",,Logistics,Online Logistics Marketplace,Seed Funding,,,,,,,,,,,,,,,,,,,,,375000.0,2016-08-17,2016.0,,indore
42.0,17/08/2016,ZiPi,,Bangalore,Swan Angel Network,,,,Technology,Mobile Chatbot App,Seed Funding,,,,,,,,,,,,,,,,,,,,,,2016-08-17,2016.0,,bangalore
43.0,17/08/2016,Appknox,,Bangalore,"SeedPlus, Infocomm Investments, Accel Partners RNT Associates",,"675,000",,Technology,Mobile security solutions,Private Equity,,,,,,,,,,,,,,,,,,,,,675000.0,2016-08-17,2016.0,,bangalore
44.0,17/08/2016,Pikkol,,Bangalore,Indian Angel Network,,,,Logistics,Packers & Movers,Seed Funding,,,,,,,,,,,,,,,,,,,,,,2016-08-17,2016.0,,bangalore
45.0,18/08/2016,Meesho,,Bangalore,"Kashyap Deorah, Rajul Garg, Maninder Gulati",,,,eCommerce,Mobile based eCommerce SAAS platform,Seed Funding,,,,,,,,,,,,,,,,,,,,,,2016-08-18,2016.0,,bangalore
46.0,18/08/2016,Sesame Software,,Kozhikode,Speridian Technologies,,,,Technology,Financial Technology Solutions Provider,Private Equity,,,,,,,,,,,,,,,,,,,,,,2016-08-18,2016.0,,kozhikode
47.0,19/08/2016,Quikr,,Mumbai,Brand Capital,,"20,000,000",,Consumer Internet,Classified Listings platform,Private Equity,,,,,,,,,,,,,,,,,,,,,20000000.0,2016-08-19,2016.0,,mumbai
48.0,19/08/2016,Digio,,Bangalore,Rainmatter,,"375,000",,Technology,Aadhar based Document Signing platform,Private Equity,,,,,,,,,,,,,,,,,,,,,375000.0,2016-08-19,2016.0,,bangalore
49.0,19/08/2016,Ziffity,,Chennai,Aspire Systems,,,,Technology,Full Service Ecommerce Agency,Private Equity,,,,,,,,,,,,,,,,,,,,,,2016-08-19,2016.0,,chennai
50.0,22/08/2016,Zzungry,,Bangalore,"Satish Vasudeva, Madhusudhan Jujare & Others",,,,Consumer Internet,Food Delivery platform,Seed Funding,,,,,,,,,,,,,,,,,,,,,,2016-08-22,2016.0,,bangalore
51.0,22/08/2016,Puro Wellness,,Mumbai,Torrent Group,,"37,000,000",,healthcare,"Organic,  Natural  Food substitute manufacturer",Private Equity,,,,,,,,,,,,,,,,,,,,,37000000.0,2016-08-22,2016.0,,mumbai
52.0,22/08/2016,Fitternity,,Mumbai,"Saha Fund, Exfinity Venture Partners & Others",,,,Consumer Internet,Fitness Gym & Services Discovery platform,Private Equity,,,,,,,,,,,,,,,,,,,,,,2016-08-22,2016.0,,mumbai
53.0,23/08/2016,TAC Security,,New Delhi,Vijay Kedia,,,,Technology,Cyber-Security Solutions Provider,Seed Funding,,,,,,,,,,,,,,,,,,,,,,2016-08-23,2016.0,,new delhi
54.0,23/08/2016,Notesgen,,New Delhi,"Riju Gupta, Kamal Chabra",,"100,000",,Consumer Internet,Online Notes Sharing Portal,Seed Funding,,,,,,,,,,,,,,,,,,,,,100000.0,2016-08-23,2016.0,,new delhi
55.0,23/08/2016,NearU,,Mumbai,Dr. Goutam Challagalla,,,,Consumer Internet,Marketing app for retailers,Seed Funding,,,,,,,,,,,,,,,,,,,,,,2016-08-23,2016.0,,mumbai
56.0,23/08/2016,Octo.ai,,New Delhi,"Outbox Ventures, Jaspreet Bindra, Arjun Malhotra, Rohan Malhotra, Sidharth Rao, Rakesh Agrawal",,"200,000",,Technology,Artificial Intelligence based marketing platform,Seed Funding,,,,,,,,,,,,,,,,,,,,,200000.0,2016-08-23,2016.0,,new delhi
57.0,24/08/2016,ShaadiSaga,,New Delhi,"ah! Ventures, Anupam Mittal, Kunal Shah, Sandeep Tandon, Dheeraj Jain, Rohit Chokhani",,,,Consumer Internet,Wedding Website Creator,Seed Funding,,,,,,,,,,,,,,,,,,,,,,2016-08-24,2016.0,,new delhi
58.0,24/08/2016,UnaAcademy,,Bangalore,"Blume Ventures, Sachin Bansal, Vijay Shekhar Sharma, Binny Bansal,  Kunal Shah, Sandeep Tandon, Ashish Tulsian",,"1,000,000",,Consumer Internet,Free Interactive education platform,Private Equity,,,,,,,,,,,,,,,,,,,,,1000000.0,2016-08-24,2016.0,,bangalore
59.0,24/08/2016,Advenio,,Chandigarh,Kalaari Capital,,"100,000",,Technology,Clinical Imaging Solution Provider,Seed Funding,,,,,,,,,,,,,,,,,,,,,100000.0,2016-08-24,2016.0,,chandigarh
60.0,24/08/2016,Guarented,,Bangalore,Kalaari Capital,,"500,000",,eCommerce,Home Furnishing rental marketplace,Seed Funding,,,,,,,,,,,,,,,,,,,,,500000.0,2016-08-24,2016.0,,bangalore
61.0,24/08/2016,Beyond Evolution,,Gurgaon,"Vineet Taneja, Kamal Puri",,,,Technology,Mobile Apps & Tech Services provider,Seed Funding,,,,,,,,,,,,,,,,,,,,,,2016-08-24,2016.0,,gurgaon
62.0,24/08/2016,Uber Dreams,,Mumbai,Mohit Lalvani,,"500,000",,eCommerce,Dreams fulfilling marketplace,Seed Funding,,,,,,,,,,,,,,,,,,,,,500000.0,2016-08-24,2016.0,,mumbai
63.0,24/08/2016,Convegenius,,Noida,Michael and Susan Dell Foundation,,"900,000",,Education,Edutainment platform,Private Equity,,,,,,,,,,,,,,,,,,,,,900000.0,2016-08-24,2016.0,,noida
64.0,24/08/2016,UrbanLadder,,Mumbai,Trifecta Capital,,"3,000,000",,eCommerce,Online Furniture Store,Private Equity,,,,,,,,,,,,,,,,,,,,,3000000.0,2016-08-24,2016.0,,mumbai
65.0,24/08/2016,enCashea,,Bangalore,"Kunal Shah, Sandeep Tandon, Tracxn Labs",,,,Consumer Internet,Scrap Collection and Recycling platform,Seed Funding,,,,,,,,,,,,,,,,,,,,,,2016-08-24,2016.0,,bangalore
66.0,25/08/2016,EngineerBabu,,Indore,Scale Ventures,,,,Technology,Mobile App & Web Development company,Seed Funding,,,,,,,,,,,,,,,,,,,,,,2016-08-25,2016.0,,indore
67.0,25/08/2016,Cult,,Bangalore,CureFit,,"3,000,000",,Healthcare,Health and Fitness Centres,Private Equity,,,,,,,,,,,,,,,,,,,,,3000000.0,2016-08-25,2016.0,,bangalore
68.0,25/08/2016,WitWorks,,Bangalore,"Fireside Ventures, Investopad, P39 Capital, Anupam Mittal, Pranay Jivrajka, Maninder Gulati, Abhinav Sinha",,,,Technology,Consumer IoT Startup,Seed Funding,,,,,,,,,,,,,,,,,,,,,,2016-08-25,2016.0,,bangalore
69.0,25/08/2016,NearFox,,Mumbai,"Globevestor Angel Fund, Devendra Rane, Ravi Jain,  Arpan Nagdeve",,,,Consumer Internet,Local Lifestyle Content and Discovery Platform,Seed Funding,,,,,,,,,,,,,,,,,,,,,,2016-08-25,2016.0,,mumbai
70.0,25/08/2016,ZoomCar,,Bangalore,Ford Smart Mobility Llc,,"24,000,000",,Consumer Internet,Self-driven car booking platform,Private Equity,,,,,,,,,,,,,,,,,,,,,24000000.0,2016-08-25,2016.0,,bangalore
71.0,26/08/2016,Plix,,Gurgaon,Instalabs,,"500,000",,Consumer Internet,Photo and Video Sharing App,Seed Funding,,,,,,,,,,,,,,,,,,,,,500000.0,2016-08-26,2016.0,,gurgaon
72.0,26/08/2016,Mobikwik,,Gurgaon,Net1 UEPS Technologies Inc,,"40,000,000",,Consumer Internet,Digital Wallet platform,Private Equity,,,,,,,,,,,,,,,,,,,,,40000000.0,2016-08-26,2016.0,,gurgaon
73.0,26/08/2016,MyDidi,,Mumbai,Undisclosed Ex Mckinsey Directors and Partners,,"550,000",,Consumer Internet,"on-demand, hyper-local Cleaning services provider",Seed Funding,,,,,,,,,,,,,,,,,,,,,550000.0,2016-08-26,2016.0,,mumbai
74.0,26/08/2016,CrownIt,,Gurgaon,"Kunal Shah & Sandeep Tandon, Girish Mathrubootham, Anand Chandrasekaran",,,,Consumer Internet,Cashback Mobile app,Seed Funding,,,,,,,,,,,,,,,,,,,,,,2016-08-26,2016.0,,gurgaon
75.0,29/08/2016,LoanTap,,Mumbai,"Dr. Abhishek Pandey, Jaysukh Sapra",,"3,000,000",,Consumer Internet,Lending platform for Salaried professionals,Private Equity,,,,,,,,,,,,,,,,,,,,,3000000.0,2016-08-29,2016.0,,mumbai
76.0,29/08/2016,Runnr,,Bangalore,"Nexus Venture Partners, Blume Ventures",,"7,000,000",,Consumer Internet,hyperlocal Logistics services provider,Private Equity,,,,,,,,,,,,,,,,,,,,,7000000.0,2016-08-29,2016.0,,bangalore
77.0,29/08/2016,Zolo,,Noida,Hitouch AG,,,,Consumer Internet,on-demand online talent marketplace,Private Equity,,,,,,,,,,,,,,,,,,,,,,2016-08-29,2016.0,,noida
78.0,29/08/2016,Notion Press,,Chennai,Undisclosed HNI investors,,"1,000,000",,Consumer Internet,Self-Publishing books platform,Private Equity,,,,,,,,,,,,,,,,,,,,,1000000.0,2016-08-29,2016.0,,chennai
79.0,29/08/2016,LivSpace,,Bangalore,"Bessemer Venture Partners, Jungle Ventures, Helion Ventures",,"15,000,000",,Consumer Internet,Online portal for Home Design,Private Equity,,,,,,,,,,,,,,,,,,,,,15000000.0,2016-08-29,2016.0,,bangalore
80.0,30/8/2016,iAugmentor Labs,,Gurgaon,Rajasthan Angel Investor Network & Others,,"149,000",,Technology,Assessment & Learning Platform,Seed Funding,,,,,,,,,,,,,,,,,,,,,149000.0,2016-08-30,2016.0,,gurgaon
81.0,30/8/2016,DayBox,,New Delhi,"Ashutosh Lawania, Rajul Jain, Badal Malick, Rishi Gupta & Others",,"104,000",,Consumer Internet,Fruit & Vegetable Delivery platform,Seed Funding,,,,,,,,,,,,,,,,,,,,,104000.0,2016-08-30,2016.0,,new delhi
82.0,30/8/2016,Paytm,,Bangalore,MediaTek Inc.,,"60,000,000",,eCommerce,Mobile Wallet & ECommerce platform,Private Equity,,,,,,,,,,,,,,,,,,,,,60000000.0,2016-08-30,2016.0,,bangalore
83.0,30/8/2016,CropIn,,Bangalore,Sophia Investment ApS,,"2,000,000",,Technology,Agriculture Technology Solutions,Private Equity,,,,,,,,,,,,,,,,,,,,,2000000.0,2016-08-30,2016.0,,bangalore
84.0,30/8/2016,Canvera,,Bangalore,Info Edge (India) Ltd,,"3,000,000",,Consumer Internet,Photographer Discovery & Information platform,Private Equity,,,,,,,,,,,,,,,,,,,,,3000000.0,2016-08-30,2016.0,,bangalore
85.0,30/8/2016,Prime Focus Technologies,,Mumbai,Ambit Pragma,,,,Technology,Hybrid Cloud technology enabled Media ERP platform,Private Equity,,,,,,,,,,,,,,,,,,,,,,2016-08-30,2016.0,,mumbai
86.0,31/8/2016,Flyrobe,,Mumbai,"IDG Ventures, Sequoia Capital, GREE Ventures",,"5,300,000",,eCommerce,Online fashion rental platform,Private Equity,,,,,,,,,,,,,,,,,,,,,5300000.0,2016-08-31,2016.0,,mumbai
87.0,31/8/2016,inclov,,Mumbai,"Sarbvir Singh, Raghav Bahl",,,,Consumer Internet,Matchmaking App for Disabled,Seed Funding,,,,,,,,,,,,,,,,,,,,,,2016-08-31,2016.0,,mumbai
88.0,31/8/2016,,,,,,,,,,,,,,,,,,,,,,,,,,,,,,,,2016-08-31,2016.0,,
89.0,,,,,,,,,,,,,,,,,,,,,,,,,,,,,,,,,,,,
1.0,01/12/2016,SidQam,,Noida,"SQue Capital, Grace Capital Ventures, Soham Vencaps",,"1,200,000",,Technology,Healthcare Software System,Private Equity,,,,,,,,,,,,,,,,,,,,,1200000.0,2016-01-12,2016.0,,noida
2.0,01/12/2016,India Lends,,New Delhi,"DSG Consumer Partners, American Express Ventures, Cyber Carrier VC, AdvantEdge Partners",,"4,000,000",,Consumer Internet,Online Instant personal Loan provider,Private Equity,,,,,,,,,,,,,,,,,,,,,4000000.0,2016-01-12,2016.0,,new delhi
3.0,01/12/2016,Slide App,,New Delhi,Songhyun Investment,,"3,600,000",,Consumer Internet,Lock screen Rewards mobile app,Private Equity,,,,,,,,,,,,,,,,,,,,,3600000.0,2016-01-12,2016.0,,new delhi
4.0,02/12/2016,Badiyajobs,,New Delhi,Undisclosed,,"100,000",,Consumer Internet,Entry-Level job Seekers platform,Seed Funding,,,,,,,,,,,,,,,,,,,,,100000.0,2016-02-12,2016.0,,new delhi
5.0,02/12/2016,Streo,,Bangalore,"GEMs Advisory, Quarizon",,,,Consumer Internet,Live Music Streaming App,Seed Funding,,,,,,,,,,,,,,,,,,,,,,2016-02-12,2016.0,,bangalore
6.0,02/12/2016,TYGR,,Mumbai,Franchise India,,"3,000,000",,Technology,Transport and logistics mobile App,Private Equity,,,,,,,,,,,,,,,,,,,,,3000000.0,2016-02-12,2016.0,,mumbai
7.0,05/12/2016,Mr Hot Foods,,Indore,IvyCamp Ventures,,,,Consumer Internet,Online Food Ordering & Delivery Portal,Seed Funding,,,,,,,,,,,,,,,,,,,,,,2016-05-12,2016.0,,indore
8.0,05/12/2016,UrDoorStep,,Bangalore,Lakshmi Vilas Bank & undisclosed HNIs,,"1,400,000",,eCommerce,Online Grocery Store,Private Equity,,,,,,,,,,,,,,,,,,,,,1400000.0,2016-05-12,2016.0,,bangalore
9.0,05/12/2016,ONN Bikes,,Mumbai,Grace Capital Ventures,,,,eCommerce,"On-demand, self-drive bike rental platform",Seed Funding,,,,,,,,,,,,,,,,,,,,,,2016-05-12,2016.0,,mumbai
10.0,06/12/2016,Diro Labs,,New Delhi,Info Edge (India),,"147,000",,Consumer Internet,Mobile Contacts Management app,Seed Funding,,,,,,,,,,,,,,,,,,,,,147000.0,2016-06-12,2016.0,,new delhi
11.0,06/12/2016,THB,,Gurgaon,"Ajith Sukumaran, Currae Healthtech Fund",,,,Technology,Clinical research and data analytics,Seed Funding,,,,,,,,,,,,,,,,,,,,,,2016-06-12,2016.0,,gurgaon
12.0,07/12/2016,LookAtMe,,Singapore,Eros Labs,,,,Consumer Internet,Mobile App based Fashion Network,Seed Funding,,,,,,,,,,,,,,,,,,,,,,2016-07-12,2016.0,,singapore
13.0,07/12/2016,Netree,,New Delhi,"The Chennai Angels, LetsVenture",,,,eCommerce,Mobile-only Retailers Engagement Solution,Seed Funding,,,,,,,,,,,,,,,,,,,,,,2016-07-12,2016.0,,new delhi
14.0,07/12/2016,BookEventz,,Mumbai,Investors from Mumbai Angels & LetsVenture,,,,Consumer Internet,"Venue, Events Booking platform",Seed Funding,,,,,,,,,,,,,,,,,,,,,,2016-07-12,2016.0,,mumbai
15.0,07/12/2016,Tailslife,,Bangalore,"Mohan Kumar, V. Balakrishnan",,,,Consumer Internet,Pet Parenting mobile app,Seed Funding,,,,,,,,,,,,,,,,,,,,,,2016-07-12,2016.0,,bangalore
16.0,07/12/2016,Revv,,New Delhi,Edelweiss Private Equity,,"9,000,000",,Consumer Internet,Self-Driven Car Services booking portal,Private Equity,,,,,,,,,,,,,,,,,,,,,9000000.0,2016-07-12,2016.0,,new delhi
17.0,07/12/2016,WealthApp,,Bangalore,"Venk Krishnan, MJ Aravind, Vikram Kotak, Jayant Davar,  Ramkumar Nishtal, Arjun Sharmaa",,"440,000",,Consumer Internet,Online Investment Advisory platform,Seed Funding,,,,,,,,,,,,,,,,,,,,,440000.0,2016-07-12,2016.0,,bangalore
18.0,07/12/2016,Vehico,,Bangalore,"Calcutta Angel Network, Appliyifi",,,,Technology,Connected Transportation solutions,Seed Funding,,,,,,,,,,,,,,,,,,,,,,2016-07-12,2016.0,,bangalore
19.0,08/12/2016,Zest Money,,Mumbai,PayU,,"6,500,000",,Consumer Internet,Online Consumer Lending platform,Private Equity,,,,,,,,,,,,,,,,,,,,,6500000.0,2016-08-12,2016.0,,mumbai
20.0,08/12/2016,GoMechanic,,Gurgaon,Venture Catalysts,,"250,000",,Consumer Internet,Online Car servicing Booking platform,Seed Funding,,,,,,,,,,,,,,,,,,,,,250000.0,2016-08-12,2016.0,,gurgaon
21.0,09/12/2016,Stalk Buy Love,,New Delhi,Kalaari Capital,,"6,000,000",,eCommerce,Fashion Apparel eTailer,Private Equity,,,,,,,,,,,,,,,,,,,,,6000000.0,2016-09-12,2016.0,,new delhi
22.0,09/12/2016,Nykaa,,Mumbai,Max Ventures and Industries,,,,eCommerce,Beauty Products etailer,Private Equity,,,,,,,,,,,,,,,,,,,,,,2016-09-12,2016.0,,mumbai
23.0,09/12/2016,Wittyparot,,Bangalore,Mumbai Angels,,"450,000",,Technology,Content Management & Productivity platform,Seed Funding,,,,,,,,,,,,,,,,,,,,,450000.0,2016-09-12,2016.0,,bangalore
24.0,09/12/2016,NeuroEquilibrium,,Jaipur,Unicorn India Ventures,,"250,000",,Technology,Health-Tech platform,Seed Funding,,,,,,,,,,,,,,,,,,,,,250000.0,2016-09-12,2016.0,,jaipur
25.0,12/12/2016,Xseed Education,,Bangalore,Verlinvest SA,,"10,000,000",,Technology,Education & learning Tech platform,Private Equity,,,,,,,,,,,,,,,,,,,,,10000000.0,2016-12-12,2016.0,,bangalore
26.0,12/12/2016,Rupaiya Exchange,,New Delhi,Undisclosed Investors,,"200,000",,Consumer Internet,P2P Lending platform,Seed Funding,,,,,,,,,,,,,,,,,,,,,200000.0,2016-12-12,2016.0,,new delhi
27.0,12/12/2016,Doctor Insta,,Gurgaon,RoundGlass Partners,,"2,000,000",,Consumer Internet,Online Doctor Consulting platform,Private Equity,,,,,,,,,,,,,,,,,,,,,2000000.0,2016-12-12,2016.0,,gurgaon
28.0,12/12/2016,UrbanPiper,,Bangalore,"Axilor, undisclosed investors",,,,Consumer Internet,Self-Branded Websites & Apps for Ecommerce,Seed Funding,,,,,,,,,,,,,,,,,,,,,,2016-12-12,2016.0,,bangalore
29.0,12/12/2016,Fresh Food Concepts,,New Delhi,"Siddhartha Gupta, Ashvin Chadha",,"2,000,000",,Food & Beverage,Cold Press Juice manufacturer & seller,Seed Funding,,,,,,,,,,,,,,,,,,,,,2000000.0,2016-12-12,2016.0,,new delhi
30.0,13/12/2016,Indifi,,Gurgaon,Omidyar Network,,"10,000,000",,Consumer Internet,Online lending platform,Private Equity,,,,,,,,,,,,,,,,,,,,,10000000.0,2016-12-13,2016.0,,gurgaon
31.0,13/12/2016,GoComet,,Mumbai,"India Quotient, Rajul Garg, Rajesh Yabaji, Chanakya Hridaya, Ramasubramaniam B, Vishwanathan, Nobel House, Sunstone Capital",,,,Logistics,Marketplace for International Freight,Seed Funding,,,,,,,,,,,,,,,,,,,,,,2016-12-13,2016.0,,mumbai
32.0,13/12/2016,OfBusiness,,Gurgaon,"Zodius Technology Opportunities Fund, Matrix Partners",,"11,100,000",,eCommerce,Online business-to-business (B2B) marketplace,Private Equity,,,,,,,,,,,,,,,,,,,,,11100000.0,2016-12-13,2016.0,,gurgaon
33.0,14/12/2016,Fitmein,,New Delhi,"FiNC, GHV",,,,Consumer Internet,Fitness Discovery & Booking platform,Seed Funding,,,,,,,,,,,,,,,,,,,,,,2016-12-14,2016.0,,new delhi
34.0,14/12/2016,Qacco,,Gurgaon,"Lead Angels Network, Anbu Pandian, Prabhakar MR & Others",,"150,000",,Consumer Internet,Hotel Booking platform,Seed Funding,,,,,,,,,,,,,,,,,,,,,150000.0,2016-12-14,2016.0,,gurgaon
35.0,14/12/2016,Fitpass,,New Delhi,Mumbai Angels,,"1,000,000",,Consumer Internet,Fitness center aggregator & Booking mobile app,Seed Funding,,,,,,,,,,,,,,,,,,,,,1000000.0,2016-12-14,2016.0,,new delhi
36.0,14/12/2016,MoEngage,,Bangalore,Anand Chandrasekaran,,,,Technology,User analytics and engagement platform,Seed Funding,,,,,,,,,,,,,,,,,,,,,,2016-12-14,2016.0,,bangalore
37.0,14/12/2016,Ten3t Health,,Bangalore,"V. Krishna Prasad, Bhupen Shah & Others",,,,Technology,medical grade wearable patch maker,Seed Funding,,,,,,,,,,,,,,,,,,,,,,2016-12-14,2016.0,,bangalore
38.0,14/12/2016,Trading Bells,,Indore,Swastika Investmart Ltd,,"297,000",,Consumer Internet,Online Share & Commodity Broking platform,Seed Funding,,,,,,,,,,,,,,,,,,,,,297000.0,2016-12-14,2016.0,,indore
39.0,15/12/2016,SERV’D,,Pune,Digital Financial Service Lab,,"100,000",,Consumer Internet,Financial Services For Unorganized Workforce,Seed Funding,,,,,,,,,,,,,,,,,,,,,100000.0,2016-12-15,2016.0,,pune
40.0,15/12/2016,IdeaForge,,Mumbai,"WRV Capital and IndusAge Partners, Infosys Innovation Fund",,"10,000,000",,Technology,Drone Manufacturing,Private Equity,,,,,,,,,,,,,,,,,,,,,10000000.0,2016-12-15,2016.0,,mumbai
41.0,15/12/2016,Amagi Media Labs,,Mumbai,"Emerald Media, Premji Invest",,"35,000,000",,Technology,Media Technology Solutions,Private Equity,,,,,,,,,,,,,,,,,,,,,35000000.0,2016-12-15,2016.0,,mumbai
42.0,15/12/2016,Pocket Aces,,Mumbai,"Sequoia Capital India, North Base Media, Aarin Capital, 3one4 Capital, Axilor Ventures, Kunal Shah, Sandeep Tandon",,"3,000,000",,Technology,Digital Entertainment Company,Private Equity,,,,,,,,,,,,,,,,,,,,,3000000.0,2016-12-15,2016.0,,mumbai
43.0,16/12/2016,Pi Data Centers,,Hyderabad,Epsilon Venture Partners,,"23,000,000",,Technology,Cloud Data Center Solutions provider,Private Equity,,,,,,,,,,,,,,,,,,,,,23000000.0,2016-12-16,2016.0,,hyderabad
44.0,16/12/2016,TripShelf,,New Delhi,"GEMS Advisory, Quarizon",,"123,000",,Consumer Internet,Holiday Packages provider,Seed Funding,,,,,,,,,,,,,,,,,,,,,123000.0,2016-12-16,2016.0,,new delhi
45.0,19/12/2016,Events High,,Bangalore,Axilor Ventures,,,,Consumer Internet,Events & Activities Marketplace,Private Equity,,,,,,,,,,,,,,,,,,,,,,2016-12-19,2016.0,,bangalore
46.0,19/12/2016,NoBroker,,Bangalore,"KTB Network, SAIF Partners, BEENEXT, Digital Garage",,"7,400,000",,Consumer Internet,Rental property search portal,Private Equity,,,,,,,,,,,,,,,,,,,,,7400000.0,2016-12-19,2016.0,,bangalore
47.0,20/12/2016,VivoCarat,,Mumbai,Undisclosed Investors,,"50,000",,eCommerce,Online jewellery marketplace,Seed Funding,,,,,,,,,,,,,,,,,,,,,50000.0,2016-12-20,2016.0,,mumbai
48.0,20/12/2016,Tiyo,,Kolkata,Ajith Nair,,,,Consumer Internet,Doctor Search Mobile App,Seed Funding,,,,,,,,,,,,,,,,,,,,,,2016-12-20,2016.0,,kolkata
49.0,20/12/2016,Zoomcar,,Bangalore,Cyber Carrier CL,,,,Consumer Internet,Self-Driven Cab booking platform,Private Equity,,,,,,,,,,,,,,,,,,,,,,2016-12-20,2016.0,,bangalore
50.0,20/12/2016,BYJU’s,,Bangalore,International Financial Corporation,,"15,000,000",,Consumer Internet,Online Learning platform,Private Equity,,,,,,,,,,,,,,,,,,,,,15000000.0,2016-12-20,2016.0,,bangalore
51.0,21/12/2016,Supr Daily,,Mumbai,"Dr. Apoorv Ranjan Sharma, Anil Jain, Anuj Golecha, Krishna Jhunjhunwala, Anirudh Damani",,,,Consumer Internet,Daily Subscription based Delivery service,Seed Funding,,,,,,,,,,,,,,,,,,,,,,2016-12-21,2016.0,,mumbai
52.0,21/12/2016,The BlueBook,,Bangalore,"Indian Angel Network, Let’s Venture",,"500,000",,Consumer Internet,online to offline marketing platform,Seed Funding,,,,,,,,,,,,,,,,,,,,,500000.0,2016-12-21,2016.0,,bangalore
53.0,21/12/2016,MamaEarth,,New Delhi,Fireside Ventures & Others,,,,eCommerce,Babycare Products seller,Seed Funding,,,,,,,,,,,,,,,,,,,,,,2016-12-21,2016.0,,new delhi
54.0,21/12/2016,Vegetall,,Chennai,The Chennai Angels,,"162,000",,eCommerce,Online Vegetable eTailer,Seed Funding,,,,,,,,,,,,,,,,,,,,,162000.0,2016-12-21,2016.0,,chennai
55.0,22/12/2016,Innoplexus,,Pune,HCS Venture capital fund,,,,Technology,Data as a Service Provider,Private Equity,,,,,,,,,,,,,,,,,,,,,,2016-12-22,2016.0,,pune
56.0,22/12/2016,Mindler,,New Delhi,Taxmann,,"324,000",,Consumer Internet,Career Planning & Assessment platform,Seed Funding,,,,,,,,,,,,,,,,,,,,,324000.0,2016-12-22,2016.0,,new delhi
57.0,22/12/2016,MCaffeine,,Bangalore,"Kaushal Agarwal, Harminder Sahani, KK Mehra, Pranay Jivrajka, Navjot Saini",,"300,000",,eCommerce,Personal care product etailer,Seed Funding,,,,,,,,,,,,,,,,,,,,,300000.0,2016-12-22,2016.0,,bangalore
58.0,23/12/2016,enKast,,Bangalore,Ivy League Alumni Angel Network,,"2,000,000",,Technology,Cloud based CRM for Agencies,Private Equity,,,,,,,,,,,,,,,,,,,,,2000000.0,2016-12-23,2016.0,,bangalore
59.0,23/12/2016,ShopKirana,,Indore,"Incubate Fund, Lead Angels Group & Others",,,,eCommerce,B2B platform for Merchants & Retailers,Private Equity,,,,,,,,,,,,,,,,,,,,,,2016-12-23,2016.0,,indore
60.0,23/12/2016,MyAdvo,,New Delhi,"Pradyumna Dalmia, S. Somasegar & Others",,,,Consumer Internet,Legal Advice Platform,Seed Funding,,,,,,,,,,,,,,,,,,,,,,2016-12-23,2016.0,,new delhi
61.0,23/12/2016,Asocon,,Noida,Quarizon,,,,Technology,Process management startup,Seed Funding,,,,,,,,,,,,,,,,,,,,,,2016-12-23,2016.0,,noida
62.0,23/12/2016,LexComply,,New Delhi,Ajay Relan,,,,Consumer Internet,Compliance Management Software,Seed Funding,,,,,,,,,,,,,,,,,,,,,,2016-12-23,2016.0,,new delhi
63.0,26/12/2016,The Postbox,,Chennai,"The Chennai Angels, Ritesh Mehta, Aruna Ganesh Ram",,,,eCommerce,Art & Lifestyle ECommerce Store,Seed Funding,,,,,,,,,,,,,,,,,,,,,,2016-12-26,2016.0,,chennai
64.0,26/12/2016,Pandorum Technologies,,Bangalore,"Sachin Bansal, Binny Bansal",,,,Technology,3D printed experimental Human Liver tissue creator,Seed Funding,,,,,,,,,,,,,,,,,,,,,,2016-12-26,2016.0,,bangalore
65.0,26/12/2016,Dekkho,,Mumbai,undisclosed investors,,"1,200,000",,Consumer Internet,Video Streaming platform,Seed Funding,,,,,,,,,,,,,,,,,,,,,1200000.0,2016-12-26,2016.0,,mumbai
66.0,26/12/2016,Shadowfox,,Gurgaon,Eight Roads Ventures,,"10,000,000",,Logistics,On-Demand Delivery Service,Private Equity,,,,,,,,,,,,,,,,,,,,,10000000.0,2016-12-26,2016.0,,gurgaon
67.0,27/12/2016,ShopX,,Bangalore,Nandan Nilekani,,"5,000,000",,eCommerce,SAAS ECommerce Retail app,Private Equity,,,,,,,,,,,,,,,,,,,,,5000000.0,2016-12-27,2016.0,,bangalore
68.0,28/12/2016,BookEventz,,Mumbai,"Lead Angels, Mumbai Angels, LetsVenture, Girish Mathrubootham, Anbu Pandian",,,,Consumer Internet,Online event-booking platform,Seed Funding,,,,,,,,,,,,,,,,,,,,,,2016-12-28,2016.0,,mumbai
69.0,29/12/2016,Healthifyme,,Bangalore,NB Ventures,,"1,000,000",,Consumer Internet,Fitness Mobile App,Private Equity,,,,,,,,,,,,,,,,,,,,,1000000.0,2016-12-29,2016.0,,bangalore
70.0,29/12/2016,LetsMD,,New Delhi,"WaterBridge Ventures,",,,,Consumer Internet,Healthcare plan comparison platform,Seed Funding,,,,,,,,,,,,,,,,,,,,,,2016-12-29,2016.0,,new delhi
71.0,29/12/2016,Justbooks,,Bangalore,CoCreate Ventures,,,,Consumer Internet,Library Chain Aggregator,Seed Funding,,,,,,,,,,,,,,,,,,,,,,2016-12-29,2016.0,,bangalore
72.0,30/12/2016,InstantPay,,New Delhi,"RB Investments,  Kaleden Holdings",,,,Consumer Internet,Digital payments & recharge platform,Private Equity,,,,,,,,,,,,,,,,,,,,,,2016-12-30,2016.0,,new delhi
73.0,30/12/2016,,,,,,,,,,,,,,,,,,,,,,,,,,,,,,,,2016-12-30,2016.0,,
74.0,,,,,,,,,,,,,,,,,,,,,,,,,,,,,,,,,,,,
75.0,,,,,,,,,,,,,,,,,,,,,,,,,,,,,,,,,,,,
1.0,01/2/2016,Blue Tokai Coffee,,New Delhi,Snow Leopard Technology Ventures,,,,ECommerce,Specialty Coffee Etailer,Seed Funding,,,,,,,,,,,,,,,,,,,,,,2016-01-02,2016.0,,new delhi
2.0,02/2/2016,Altizone,,Pune,"Wipro Ventures,  Lumis Partners",,"4,000,000",,Technology,IoT & M2M Solutions,Private Equity,,,,,,,,,,,,,,,,,,,,,4000000.0,2016-02-02,2016.0,,pune
3.0,02/2/2016,Oust App,,Bangalore,"T V Mohandas Pai,  Aarin Capital",,,,Consumer Internet,Competitive Exam Preparation Platform,Seed Funding,,,,,,,,,,,,,,,,,,,,,,2016-02-02,2016.0,,bangalore
4.0,02/2/2016,Strike,,Bangalore,Multiple investors through Ten Minute Million competition,,"22,500",,Consumer Internet,Mobile Email productivity tool,Seed Funding,,,,,,,,,,,,,,,,,,,,,22500.0,2016-02-02,2016.0,,bangalore
5.0,02/2/2016,MaaxMarket,,,Multiple investors through Ten Minute Million competition,,"22,500",,Consumer Internet,Marketing Automation platform,Seed Funding,,,,,,,,,,,,,,,,,,,,,22500.0,2016-02-02,2016.0,,
6.0,02/2/2016,Gamooz,,Gurgaon,Multiple investors through Ten Minute Million competition,,"22,500",,Technology,Augmented Reality Solutions,Seed Funding,,,,,,,,,,,,,,,,,,,,,22500.0,2016-02-02,2016.0,,gurgaon
7.0,02/2/2016,SoundSurround,,Mumbai,Multiple investors through Ten Minute Million competition,,"22,500",,Technology,Audio Technology Solutions,Seed Funding,,,,,,,,,,,,,,,,,,,,,22500.0,2016-02-02,2016.0,,mumbai
8.0,03/2/2016,Mazkara,,Pune / Dubai,Dunamis Ventures Pte Ltd.,,"1,000,000",,Consumer Internet,Beauty & Wellness Platform,Seed Funding,,,,,,,,,,,,,,,,,,,,,1000000.0,2016-03-02,2016.0,,pune / dubai
9.0,03/2/2016,RoadGods,,New Delhi,Green House Ventures (GHV),,"100,000",,ECommerce,Auto Spare Parts eTailer,Seed Funding,,,,,,,,,,,,,,,,,,,,,100000.0,2016-03-02,2016.0,,new delhi
10.0,03/2/2016,Pindropmusic,,Noida,Green House Ventures (GHV),,"100,000",,Consumer Internet,Music Discovery Mobile App,Seed Funding,,,,,,,,,,,,,,,,,,,,,100000.0,2016-03-02,2016.0,,noida
11.0,03/2/2016,Woodpie,,Bangalore,Ingram Content Group,,"30,000",,Consumer Internet,Book Recommendation Service,Seed Funding,,,,,,,,,,,,,,,,,,,,,30000.0,2016-03-02,2016.0,,bangalore
12.0,04/02/2016,Perfumery,,New Delhi,Oranda Global & Others,,"30,000",,ECommerce,Fragrances & Perfume eTailer,Seed Funding,,,,,,,,,,,,,,,,,,,,,30000.0,2016-04-02,2016.0,,new delhi
13.0,05/02/2016,Magic Crate,,Bangalore,"TV Mohandas Pai, Aarin Capital",,,,Education,Children Education Platform,Seed Funding,,,,,,,,,,,,,,,,,,,,,,2016-05-02,2016.0,,bangalore
14.0,05/02/2016,ZenDrive,,Bangalore / SFO,"Sherpa Capital, Nyca Partners and Thomvest Ventures",,"13,500,000",,Technology,Safe Driving Data & Analytics platform,Private Equity,,,,,,,,,,,,,,,,,,,,,13500000.0,2016-05-02,2016.0,,bangalore / sfo
15.0,05/02/2016,Smartcooky,,New Delhi,"Vandana Luthra,",,,,ECommerce,Marketplace for Health Foods,Private Equity,,,,,,,,,,,,,,,,,,,,,,2016-05-02,2016.0,,new delhi
16.0,05/02/2016,Turtlemint,,Mumbai,Nexus Venture Partners,,,,Consumer Internet,online personalized insurance platform,Private Equity,,,,,,,,,,,,,,,,,,,,,,2016-05-02,2016.0,,mumbai
17.0,05/02/2016,BHIVE,,Bangalore,"Raghunandan G, Venturesity, Arihant Patni",,,,Real Estate,Workspace Rentals,Seed Funding,,,,,,,,,,,,,,,,,,,,,,2016-05-02,2016.0,,bangalore
18.0,05/02/2016,Gingercrush,,Vadodara,"Saha Fund, TV Mohandas Pai, Zia Mody, Mumbai Angels, Ananda Kallugadde, Rakesh Desai, Rakesh Malhotra",,"1,000,000",,Ecommerce,Personalized Products & Merchandize eTailer,Private Equity,,,,,,,,,,,,,,,,,,,,,1000000.0,2016-05-02,2016.0,,vadodara
19.0,05/02/2016,American Vision,,Pune,Undisclosed investors,,"81,000",,Consumer Internet,Optical Store Aggregator Platform,Seed Funding,,,,,,,,,,,,,,,,,,,,,81000.0,2016-05-02,2016.0,,pune
20.0,05/02/2016,DawaiLelo,,Varanasi,Undisclosed investors,,"52,000",,Consumer Internet,Healthcare Services & Online Pharmacy Mobile App,Seed Funding,,,,,,,,,,,,,,,,,,,,,52000.0,2016-05-02,2016.0,,varanasi
21.0,06/02/2016,Heads Up For Tails,,New Delhi,Undisclosed investors,,"1,000,000",,Ecommerce,Pet Products eTailer,Seed Funding,,,,,,,,,,,,,,,,,,,,,1000000.0,2016-06-02,2016.0,,new delhi
22.0,06/02/2016,LiveNutriFit,,New Delhi,"Mohit Goel, Vinod Jain & Others",,,,Healthcare,Weight loss & Healthcare Info portal,Seed Funding,,,,,,,,,,,,,,,,,,,,,,2016-06-02,2016.0,,new delhi
23.0,08/02/2016,Moglix,,New Delhi,Ratan Tata,,,,Ecommerce,Industrial & Home Products Marketplace,Private Equity,,,,,,,,,,,,,,,,,,,,,,2016-08-02,2016.0,,new delhi
24.0,08/02/2016,iStyleYou,,Gurgaon,Green House Ventures (GHV),,"100,000",,Consumer Internet,Personal Fashion Stylist App,Seed Funding,,,,,,,,,,,,,,,,,,,,,100000.0,2016-08-02,2016.0,,gurgaon
25.0,08/02/2016,AdUrCup,,New Delhi,Green House Ventures (GHV),,"100,000",,Consumer Internet,Ad Network,Seed Funding,,,,,,,,,,,,,,,,,,,,,100000.0,2016-08-02,2016.0,,new delhi
26.0,08/02/2016,Weddingz,,Mumbai,Sixth Sense Ventures,,,,Consumer Internet,online marketplace for wedding venues and vendors,Private Equity,,,,,,,,,,,,,,,,,,,,,,2016-08-02,2016.0,,mumbai
27.0,08/02/2016,Urban Dhobi,,Jaipur,"Vinod Bansal, Sanjeev Singhal",,,,Consumer Internet,On Demand Laundry Services,Seed Funding,,,,,,,,,,,,,,,,,,,,,,2016-08-02,2016.0,,jaipur
28.0,08/02/2016,Gray Routes,,Mumbai,"Mahesh Parasuraman, Rahul Gautam & Others",,,,Consumer Internet,Last mile logistics solutions,Seed Funding,,,,,,,,,,,,,,,,,,,,,,2016-08-02,2016.0,,mumbai
29.0,08/02/2016,Xpressbees,,Pune,"SAIF Partners, IDG Ventures India, Vertex Ventures, Valiant Capital",,"12,500,000",,ECommerce,ECommerce Logistics solutions,Private Equity,,,,,,,,,,,,,,,,,,,,,12500000.0,2016-08-02,2016.0,,pune
30.0,08/02/2016,Invictus Oncology,,New Delhi,Ratan Tata,,,,Healthcare,Cancer therapeutic Info & Solutions,Private Equity,,,,,,,,,,,,,,,,,,,,,,2016-08-02,2016.0,,new delhi
31.0,08/02/2016,Hansel.io,,Bangalore,"Endiya Partners, Mekin Maheshwari, Rajesh Sawhney",,,,Technology,Mobile App Tech Solutions,Seed Funding,,,,,,,,,,,,,,,,,,,,,,2016-08-02,2016.0,,bangalore
32.0,09/02/2016,Inc42,,New Delhi,"India Ventures, Aarin Capital & Others",,,,Consumer Internet,Startup Focused Media News Portal,Seed Funding,,,,,,,,,,,,,,,,,,,,,,2016-09-02,2016.0,,new delhi
33.0,09/02/2016,GOQii,,Mumbai,Edelweiss Financial Services,,,,Technology,Personalized fitness coaching & Fitness band,Private Equity,,,,,,,,,,,,,,,,,,,,,,2016-09-02,2016.0,,mumbai
34.0,10/02/2016,Capzest,,Mumbai,Lion Ventures,,"200,000",,Consumer Internet,Digital Lending Platform,Seed Funding,,,,,,,,,,,,,,,,,,,,,200000.0,2016-10-02,2016.0,,mumbai
35.0,10/02/2016,GlamStudios,,Noida,Aqeel Ahmed,,,,Consumer Internet,Online Salon Aggregator,Seed Funding,,,,,,,,,,,,,,,,,,,,,,2016-10-02,2016.0,,noida
36.0,10/02/2016,Affimity,,Bangalore,undisclosed investors,,"1,200,000",,Consumer Internet,Social Networking platform,Seed Funding,,,,,,,,,,,,,,,,,,,,,1200000.0,2016-10-02,2016.0,,bangalore
37.0,10/02/2016,Anandakanda,,Pune,undisclosed investors,,"150,000",,Technology,Medicine Intake Reminder System,Seed Funding,,,,,,,,,,,,,,,,,,,,,150000.0,2016-10-02,2016.0,,pune
38.0,10/02/2016,JoulestoWatts,,Bangalore,Manipal Global Education Services,,,,Technology,IT services & Talent collaboration services startup,Seed Funding,,,,,,,,,,,,,,,,,,,,,,2016-10-02,2016.0,,bangalore
39.0,10/02/2016,Shopkirana,,Indore,"Atul Jain, Anil Gelra, Jaikumar Nair",,,,Consumer Internet,Retailer Supply Chain platform,Seed Funding,,,,,,,,,,,,,,,,,,,,,,2016-10-02,2016.0,,indore
40.0,10/02/2016,Stylofie,,Gurgaon,Jaideep Mehta,,,,Consumer Internet,Online Beauty Parlour search & discovery Platform,Seed Funding,,,,,,,,,,,,,,,,,,,,,,2016-10-02,2016.0,,gurgaon
41.0,10/02/2016,OyBob,,Gurgaon,Sachin Dalal,,,,eCommerce,Hyperlocal Products & Services marketplace,Seed Funding,,,,,,,,,,,,,,,,,,,,,,2016-10-02,2016.0,,gurgaon
42.0,12/02/2016,ActOnMagic,,Bangalore,Jayabalan Subramanian,,"125,000",,Technology,Cloud Analytics and Management Products,Seed Funding,,,,,,,,,,,,,,,,,,,,,125000.0,2016-12-02,2016.0,,bangalore
43.0,12/02/2016,Bonhomia,,New Delhi,"Alok Rawat, Grey Orange Robotics",,"1,000,000",,Food & Beverage,premium Tea and Coffee,Seed Funding,,,,,,,,,,,,,,,,,,,,,1000000.0,2016-12-02,2016.0,,new delhi
44.0,12/02/2016,iGrenEnergi,,Mumbai,Sunil Mehta,,"1,000,000",,Technology,Solar Power Solutions,Seed Funding,,,,,,,,,,,,,,,,,,,,,1000000.0,2016-12-02,2016.0,,mumbai
45.0,12/02/2016,RKSV,,Mumbai,Kalaari Capital,,"4,000,000",,Consumer Internet,Online Stock Trading Platform,Private Equity,,,,,,,,,,,,,,,,,,,,,4000000.0,2016-12-02,2016.0,,mumbai
46.0,15/02/2016,Aasaanjobs,,Mumbai,"Aspada Advisors, IDG Ventures,  Inventus Capital",,"5,000,000",,Consumer Internet,Online Recruitment Marketplace,Private Equity,,,,,,,,,,,,,,,,,,,,,5000000.0,2016-02-15,2016.0,,mumbai
47.0,15/02/2016,Snapdeal,,New Delhi,Ontario Teachers’ Pension Plan & Others,,"200,000,000",,eCommerce,Horizontal Online Marketplace,Private Equity,,,,,,,,,,,,,,,,,,,,,200000000.0,2016-02-15,2016.0,,new delhi
48.0,15/02/2016,Jugnoo,,Chandigarh,Saumya Tandon,,,,Consumer Internet,Transportation & On-demand delivery aggregator,Private Equity,,,,,,,,,,,,,,,,,,,,,,2016-02-15,2016.0,,chandigarh
49.0,15/02/2016,Snapbizz,,Bangalore,Ratan Tata,,,,Technology,Connectivity platform for local grocery stores,Private Equity,,,,,,,,,,,,,,,,,,,,,,2016-02-15,2016.0,,bangalore
50.0,15/02/2016,GoYaNo,,Gurgaon,Mukesh Kumar Gupta,,"50,000",,Consumer Internet,Events & Restaurant Discovery Marketplace App,Seed Funding,,,,,,,,,,,,,,,,,,,,,50000.0,2016-02-15,2016.0,,gurgaon
51.0,15/02/2016,RentSher,,Bangalore,"Vaibhav Doshi, Abhay Singhal, Vibhu Garg, Joby Babu, Abhishek Acharya, Manish Shah",,"300,000",,Consumer Internet,Online Household Product Rental platform,Seed Funding,,,,,,,,,,,,,,,,,,,,,300000.0,2016-02-15,2016.0,,bangalore
52.0,15/02/2016,Buddy,,Bangalore,"Blume Ventures,  Tracxn Labs",,"500,000",,Finance,Micro Lending Platform for eCommerce purchases,Seed Funding,,,,,,,,,,,,,,,,,,,,,500000.0,2016-02-15,2016.0,,bangalore
53.0,15/02/2016,Legistify,,New Delhi,Ranjit Singh,,,,Consumer Internet,Online Legal services platform,Seed Funding,,,,,,,,,,,,,,,,,,,,,,2016-02-15,2016.0,,new delhi
54.0,16/02/2016,TableHero,,Bangalore,"GrowX Ventures, Kunal Shah, Sandeep Tandon, Haresh Chawla, Powai Lake Ventures, Globevestor",,"1,000,000",,Consumer Internet,Dynamic Restaurant Website creator,Seed Funding,,,,,,,,,,,,,,,,,,,,,1000000.0,2016-02-16,2016.0,,bangalore
55.0,16/02/2016,BetterPlace,,Bangalore,Unitus Seed Fund,,"970,000",,Technology,Data analytics based Verification services Platform,Seed Funding,,,,,,,,,,,,,,,,,,,,,970000.0,2016-02-16,2016.0,,bangalore
56.0,16/02/2016,Salebhai,,Ahmedabad,"Virendra Shekhawat, Deepak Chokhani, Yogesh Patel & Others",,,,eCommerce,"Sweets, Eatables, Handicrafts Online Marketplace",Seed Funding,,,,,,,,,,,,,,,,,,,,,,2016-02-16,2016.0,,ahmedabad
57.0,16/02/2016,icustommadeit,,Pune,"Brand Capital, Siddhivinayak Skyscrapers, Dinesh R. Challa",,"4,000,000",,eCommerce,Professional Custom creators Marketplace,Private Equity,,,,,,,,,,,,,,,,,,,,,4000000.0,2016-02-16,2016.0,,pune
58.0,16/02/2016,Tring,,Pune,Vishwadeep Bajaj & Others,,,,Consumer Internet,Instant Messaging App,Seed Funding,,,,,,,,,,,,,,,,,,,,,,2016-02-16,2016.0,,pune
59.0,16/02/2016,Medinfi,,Bangalore,"Rajnish Sinha, Prijit Debnath, Kanchan Ghoshal",,,,Consumer Internet,Doctor & Clinics Discovery platform,Seed Funding,,,,,,,,,,,,,,,,,,,,,,2016-02-16,2016.0,,bangalore
60.0,17/02/2016,Timemytask,,Mumbai,Lead Angels,,,,Consumer Internet,On-Demand home cleaning services,Seed Funding,,,,,,,,,,,,,,,,,,,,,,2016-02-17,2016.0,,mumbai
61.0,17/02/2016,GameZop,,New Delhi,"KWAN Entertainment & Marketing Solutions, Powerhouse Ventures & Others",,"350,000",,Technology,Mobile Gaming Platform,Seed Funding,,,,,,,,,,,,,,,,,,,,,350000.0,2016-02-17,2016.0,,new delhi
62.0,17/02/2016,Notary Mama,,Bangalore,"Dr Nandish Domlur, Amit Sandill",,,,Consumer Internet,On-demand Legal documentation and registration service,Seed Funding,,,,,,,,,,,,,,,,,,,,,,2016-02-17,2016.0,,bangalore
63.0,17/02/2016,The Viral Fever,,Mumbai,Tiger Global,,"10,000,000",,Consumer Internet,Independent Online Video production company,Private Equity,,,,,,,,,,,,,,,,,,,,,10000000.0,2016-02-17,2016.0,,mumbai
64.0,17/02/2016,Avanti Learning,,New Delhi,Michael & Susan Dell Foundation,,"5,000,000",,Education,Private Coaching Classes,Private Equity,,,,,,,,,,,,,,,,,,,,,5000000.0,2016-02-17,2016.0,,new delhi
65.0,17/02/2016,Bollant Industries,,Hyderabad,Ratan Tata,,,,Technology,Eco-friendly consumer & packaging products,Private Equity,,,,,,,,,,,,,,,,,,,,,,2016-02-17,2016.0,,hyderabad
66.0,18/02/2016,GetVee,,New Delhi,"Lightspeed Venture Partners, K Ganesh",,,,Consumer Internet,Matrimony & Couples only mobile platform,Private Equity,,,,,,,,,,,,,,,,,,,,,,2016-02-18,2016.0,,new delhi
67.0,18/02/2016,HealthKumbh,,Ahmedabad,Undisclosed investor,,"73,000",,Consumer Internet,Health related Information portal,Seed Funding,,,,,,,,,,,,,,,,,,,,,73000.0,2016-02-18,2016.0,,ahmedabad
68.0,18/02/2016,Unlaze,,Gurgaon,"Sujal Shah, Dino Morea",,,,Consumer Internet,Social Networking app for outdoor interests,Seed Funding,,,,,,,,,,,,,,,,,,,,,,2016-02-18,2016.0,,gurgaon
69.0,18/02/2016,Tracxn,,Bangalore,"Nandan Nilekani, Mohandas Pai, Neeraj Arora, Anand Rajaraman, Girish Mathrubootham, Aneesh Reddy & Teruhide Sato",,,,Technology,Indian Startup ecosystem trends analyzer & funding platform,Private Equity,,,,,,,,,,,,,,,,,,,,,,2016-02-18,2016.0,,bangalore
70.0,18/02/2016,Careongo,,New Delhi,Farooq Oomerbhoy & Other angel investors,,"300,000",,ECommerce,Online Pharmacy store,Seed Funding,,,,,,,,,,,,,,,,,,,,,300000.0,2016-02-18,2016.0,,new delhi
71.0,18/02/2016,Ark Robot,,Bangalore,Qualcomm (Through QPrize Contest),,"350,000",,Technology,Warehouse Automation,Seed Funding,,,,,,,,,,,,,,,,,,,,,350000.0,2016-02-18,2016.0,,bangalore
72.0,19/02/2016,Jaypore,,New Delhi,Aavishkaar,,"5,000,000",,ECommerce,Ethnic Products marketplace,Private Equity,,,,,,,,,,,,,,,,,,,,,5000000.0,2016-02-19,2016.0,,new delhi
73.0,19/02/2016,Finance Buddha,,Bangalore,Chennai Angels,,,,Consumer Internet,Online Loan Comparison & Discovery platform,Seed Funding,,,,,,,,,,,,,,,,,,,,,,2016-02-19,2016.0,,bangalore
74.0,19/02/2016,AlmaConnect,,New Delhi,"Mohandas Pai, Varun Aggarwal",,,,Consumer Internet,Alumni social network,Seed Funding,,,,,,,,,,,,,,,,,,,,,,2016-02-19,2016.0,,new delhi
75.0,19/02/2016,Advantage Club,,Gurgaon,Purvi Ventures & Others,,"400,000",,Consumer Internet,mobile platform for corporate employee benefits,Seed Funding,,,,,,,,,,,,,,,,,,,,,400000.0,2016-02-19,2016.0,,gurgaon
76.0,19/02/2016,LocalRamu,,Bangalore,3 undisclosed investors,,,,Consumer Internet,mobile based aggregator for local service providers,Seed Funding,,,,,,,,,,,,,,,,,,,,,,2016-02-19,2016.0,,bangalore
77.0,22/02/2016,Baby Berry,,Bangalore,Nitin Bagmane & Other undisclosed investors,,"1,000,000",,Consumer Internet,Parenting Mobile app,Seed Funding,,,,,,,,,,,,,,,,,,,,,1000000.0,2016-02-22,2016.0,,bangalore
78.0,22/02/2016,Magicpin,,New Delhi,Lightspeed India,,"3,000,000",,Consumer Internet,Hyperlocal Discover Mobile App,Private Equity,,,,,,,,,,,,,,,,,,,,,3000000.0,2016-02-22,2016.0,,new delhi
79.0,22/02/2016,First Eat,,New Delhi,Undisclosed investor,,"100,000",,Consumer Internet,Healthy Food Delivery platform,Seed Funding,,,,,,,,,,,,,,,,,,,,,100000.0,2016-02-22,2016.0,,new delhi
80.0,22/02/2016,SigTuple,,Bangalore,"Sachin Bansal, Binny Bansal, Accel Partners & Others",,,,Technology,Healthcare based Tech Solutions,Seed Funding,,,,,,,,,,,,,,,,,,,,,,2016-02-22,2016.0,,bangalore
81.0,22/02/2016,Taskbob,,Mumbai,"IvyCap Ventures, Orios Venture Partners, Mayfield India",,"4,500,000",,Consumer Internet,Hyperlocal Handyman services platform,Private Equity,,,,,,,,,,,,,,,,,,,,,4500000.0,2016-02-22,2016.0,,mumbai
82.0,22/02/2016,Styledotme,,New Delhi,Indian Angel Network,,"37,000",,Consumer Internet,Mobile Fashion App,Seed Funding,,,,,,,,,,,,,,,,,,,,,37000.0,2016-02-22,2016.0,,new delhi
83.0,22/02/2016,NewsLaundry,,New Delhi,"Omidyar Network,  Vikram Lal, Abhijit Bhandari, Mahesh Murthy, Shashank Bhagat",,,,Consumer Internet,Independent News Media Portal,Private Equity,,,,,,,,,,,,,,,,,,,,,,2016-02-22,2016.0,,new delhi
84.0,23/02/2016,CupoNation,,Gurgaon,"Rocket Internet AG, Holtzbrink Ventures, New Enterprise Associates (NEA), e.ventures, ru-Net, Deutsche Telekom Strategic Investments (DTSI), Silicon Valley Bank",,"11,000,000",,Consumer Internet,Deals and Discount platform,Private Equity,,,,,,,,,,,,,,,,,,,,,11000000.0,2016-02-23,2016.0,,gurgaon
85.0,23/02/2016,Aarav UAV,,Kanpur,"StartupXseed Ventures, The Phoenix Fund and others",,,,Technology,unmanned aerial vehicles creator,Seed Funding,,,,,,,,,,,,,,,,,,,,,,2016-02-23,2016.0,,kanpur
86.0,24/02/2016,Sayfix,,Bangalore,Yajnanarayana Kammaje,,"160,000",,Consumer Internet,Hyperlocal Home Services Provider,Seed Funding,,,,,,,,,,,,,,,,,,,,,160000.0,2016-02-24,2016.0,,bangalore
87.0,24/02/2016,LoanZen,,Bangalore,Tracxn Syndicate,,,,Consumer Internet,Peer to peer Lending marketplace,Seed Funding,,,,,,,,,,,,,,,,,,,,,,2016-02-24,2016.0,,bangalore
88.0,24/02/2016,NoBroker,,Bangalore,"Beenext, Digital Garage, Beenos, Qualgro, Mamoru Taniya, SAIF Partners",,"10,000,000",,Consumer Internet,Peer to peer property listing platform,Private Equity,,,,,,,,,,,,,,,,,,,,,10000000.0,2016-02-24,2016.0,,bangalore
89.0,24/02/2016,AppilyEver,,Hyderabad,"Varun Aggarwal, Suresh Venkat, Raj Y",,"400,000",,Consumer Internet,Online wedding services marketplace,Seed Funding,,,,,,,,,,,,,,,,,,,,,400000.0,2016-02-24,2016.0,,hyderabad
90.0,24/02/2016,Pocketin,,Noida,Swastika Company Ltd,,"150,000",,Consumer Internet,Hotel reservations & Deal platform,Seed Funding,,,,,,,,,,,,,,,,,,,,,150000.0,2016-02-24,2016.0,,noida
91.0,24/02/2016,FeetApart,,Bangalore,Vishal Bali & Others,,,,Consumer Internet,Employee engagements & Rewards platform,Seed Funding,,,,,,,,,,,,,,,,,,,,,,2016-02-24,2016.0,,bangalore
92.0,25/02/2016,OfBusiness,,Gurgaon,Matrix Partners India,,"5,000,000",,eCommerce,B2B commerce Marketplace,Private Equity,,,,,,,,,,,,,,,,,,,,,5000000.0,2016-02-25,2016.0,,gurgaon
93.0,25/02/2016,CarveNiche,,Bangalore,"Calcutta Angels, Lead Angels & Others",,,,Consumer Internet,Personalized Learning Solutions & products,Seed Funding,,,,,,,,,,,,,,,,,,,,,,2016-02-25,2016.0,,bangalore
94.0,25/02/2016,Juspay,,Bangalore,"Accel Partners, Ashish Hemrajani, Parikshit Dar, Rajesh Balpande",,"5,800,000",,Consumer Internet,Digital Payments solutions,Private Equity,,,,,,,,,,,,,,,,,,,,,5800000.0,2016-02-25,2016.0,,bangalore
95.0,25/02/2016,Funcart,,New Delhi,Undisclosed HNIs,,"70,000",,eCommerce,Party Supplies Etailer,Seed Funding,,,,,,,,,,,,,,,,,,,,,70000.0,2016-02-25,2016.0,,new delhi
96.0,26/02/2016,Freedom Smart Labs,,New Delhi,Kapil Goel,,"145,000",,Technology,IoT retail solutions,Seed Funding,,,,,,,,,,,,,,,,,,,,,145000.0,2016-02-26,2016.0,,new delhi
97.0,26/02/2016,EduBridge,,Mumbai,"Insitor Impact Asia Fund, Acumen Fund",,"2,500,000",,Consumer Internet,Skill development and vocational training platform,Private Equity,,,,,,,,,,,,,,,,,,,,,2500000.0,2016-02-26,2016.0,,mumbai
98.0,29/02/2016,Nestaway,,Bangalore,Ratan Tata,,,,Consumer Internet,Online Home Rental Marketplace,Private Equity,,,,,,,,,,,,,,,,,,,,,,2016-02-29,2016.0,,bangalore
99.0,29/02/2016,Hopscotch,,Mumbai,Eduardo Saverin,,"13,000,000",,eCommerce,Baby & Kids Products Online Flash sales platform,Private Equity,,,,,,,,,,,,,,,,,,,,,13000000.0,2016-02-29,2016.0,,mumbai
100.0,29/02/2016,PinClick,,Bangalore,Undisclosed investors,,,,Consumer Internet,Online real estate listings,Private Equity,,,,,,,,,,,,,,,,,,,,,,2016-02-29,2016.0,,bangalore
101.0,,,,,,,,,,,,,,,,,,,,,,,,,,,,,,,,,,,,
1.0,01/1/2016,Smartcooky,,New Delhi,"Rajan Anandan, Pramod Bhasin, Siddharth Pai, TV Mohandas Pai, Manvinder Singh Banga",,,,ECommerce,Health Food / Personal Care Marketplace,Seed Funding,,,,,,,,,,,,,,,,,,,,,,2016-01-01,2016.0,,new delhi
2.0,01/1/2016,Helpi,,Mumbai,Undisclosed Investors,,,,Consumer Internet,On Demand Cleaning Services Mobile App,Seed Funding,,,,,,,,,,,,,,,,,,,,,,2016-01-01,2016.0,,mumbai
3.0,04/1/2016,DogSpot,,Gurgaon,Ratan Tata,,,,ECommerce,Online Pet Store,Seed Funding,,,,,,,,,,,,,,,,,,,,,,2016-04-01,2016.0,,gurgaon
4.0,04/1/2016,Career360,,New Delhi,MeritTrac,,,,Education,College Education Portal,Private Equity,,,,,,,,,,,,,,,,,,,,,,2016-04-01,2016.0,,new delhi
5.0,04/1/2016,B9 Beverages,,New Delhi,"Sequoia Capital, Kunal Bahl, Rohit Bansal, Deepinder Goyal, Ashish Dhawan, Mayank Singhal",,"6,000,000",,Food & Beverage,Craft Beer manufacturing company,Private Equity,,,,,,,,,,,,,,,,,,,,,6000000.0,2016-04-01,2016.0,,new delhi
6.0,05/1/2016,WIMWI Foods,,Ahmedabad,Centre for Innovation Incubation and Entrepreneurship (CIIE),,,,Food & Beverage,Healthy food manufacturing & sales startup,Seed Funding,,,,,,,,,,,,,,,,,,,,,,2016-05-01,2016.0,,ahmedabad
7.0,05/1/2016,MyChild App,,Bhopal,"Samir Bangara, Anisha Mittal, Amit Gupta, Pallav Nadhani, Lalit Mangal, Arihant Patni, Dr. Ritesh Malik, Deobrat Singh, Saurab Paruthi, Singapore Angel Network.",,"100,000",,Education,Child Disorder Information & Education,Seed Funding,,,,,,,,,,,,,,,,,,,,,100000.0,2016-05-01,2016.0,,bhopal
8.0,05/1/2016,Instaproc,,Noida,Dinesh Agarwal,,,,ECommerce,B2B Procurement Marketplace for Office Products,Seed Funding,,,,,,,,,,,,,,,,,,,,,,2016-05-01,2016.0,,noida
9.0,05/1/2016,360Ride,,Bangalore,Undisclosed,,"150,000",,Consumer Internet,Ride Sharing platform,Seed Funding,,,,,,,,,,,,,,,,,,,,,150000.0,2016-05-01,2016.0,,bangalore
10.0,05/1/2016,AlefMobitech,,Mumbai,Tata Capital Innovation Fund,,"5,000,000",,Consumer Internet,Cloud Mobility Solutions,Private Equity,,,,,,,,,,,,,,,,,,,,,5000000.0,2016-05-01,2016.0,,mumbai
11.0,06/01/2016,Tracxn,,Bangalore,Ratan Tata,,,,BFSI,Startup Funding Deal Discovery & Execution platform,Seed Funding,,,,,,,,,,,,,,,,,,,,,,2016-06-01,2016.0,,bangalore
12.0,06/01/2016,Qdesq,,Gurgaon,"Dheeraj Jain, Jagdish Kumar, Bharat Gupta, Ankush Saigal, Praveen Saini",,,,Real Estate,Branded Workspaces Aggregator,Seed Funding,,,,,,,,,,,,,,,,,,,,,,2016-06-01,2016.0,,gurgaon
13.0,06/01/2016,Sensara,,Bangalore,"Lalitesh Katragadda,  Ganayantrika Systems",,"750,000",,Technology,"TV Search, Guide and Remote mobile app",Seed Funding,,,,,,,,,,,,,,,,,,,,,750000.0,2016-06-01,2016.0,,bangalore
14.0,06/01/2016,Zebpay,,Ahmedabad,"Arjun Handa, Amit Jindal, Nagendra Chaudhary",,"1,000,000",,Consumer Internet,Bitcoin Buying & Selling Mobile App,Private Equity,,,,,,,,,,,,,,,,,,,,,1000000.0,2016-06-01,2016.0,,ahmedabad
15.0,06/01/2016,PlanMyMedicalTrip,,Pune,"Bhanu Vikram Parsotam, Rohan Desai and Paras Patel",,"150,000",,Healthcare,Medical Tourism platform,Seed Funding,,,,,,,,,,,,,,,,,,,,,150000.0,2016-06-01,2016.0,,pune
16.0,06/01/2016,MyCity4Kids,,Gurgaon,"SIDBI Venture Capital Limited, YourNest Angel Fund",,"3,000,000",,Education,Children Education & Information platform,Private Equity,,,,,,,,,,,,,,,,,,,,,3000000.0,2016-06-01,2016.0,,gurgaon
17.0,06/01/2016,Justdakhila.com,,New Delhi,Ankur Gupta,,"750,000",,Education,School Student admissions platform,Seed Funding,,,,,,,,,,,,,,,,,,,,,750000.0,2016-06-01,2016.0,,new delhi
18.0,07/01/2016,PitStop,,Bangalore,Myntra/LivSpace Founders,,,,Consumer Internet,Automobile Service Booking App,Seed Funding,,,,,,,,,,,,,,,,,,,,,,2016-07-01,2016.0,,bangalore
19.0,07/01/2016,Bikxie,,Gurgaon,Undisclosed Investors,,,,Consumer Internet,Two Wheeler Taxi Service,Seed Funding,,,,,,,,,,,,,,,,,,,,,,2016-07-01,2016.0,,gurgaon
20.0,07/01/2016,Infurnia,,Bangalore,Idein Ventures,,"160,000",,Consumer Internet,Online Furniture Customization platform,Seed Funding,,,,,,,,,,,,,,,,,,,,,160000.0,2016-07-01,2016.0,,bangalore
21.0,07/01/2016,Myly,,Jaipur,Newbie Promoter Pvt Ltd,,"100,000",,Education,Mobile Based Education platform,Seed Funding,,,,,,,,,,,,,,,,,,,,,100000.0,2016-07-01,2016.0,,jaipur
22.0,07/01/2016,MakeMyTrip,,Gurgaon,Ctrip.com International Ltd,,"180,000,000",,Consumer Internet,Online Travel/Hotel Booking platform,Private Equity,,,,,,,,,,,,,,,,,,,,,180000000.0,2016-07-01,2016.0,,gurgaon
23.0,08/01/2016,Melorra,,Bangalore,Lightbox Ventures,,"5,000,000",,ECommerce,Online/ Mobile Jewellery Retailer,Private Equity,,,,,,,,,,,,,,,,,,,,,5000000.0,2016-08-01,2016.0,,bangalore
24.0,08/01/2016,ConfirmTKT,,Bangalore,"Krishna Jhujhunwala, Dr. Apoorv Ranjan Sharma, Anirudh Damani, Anand Ladsariya, Sanjay Mehta & Others",,"250,000",,Consumer Internet,Train PNR Status Prediction Platform,Seed Funding,,,,,,,,,,,,,,,,,,,,,250000.0,2016-08-01,2016.0,,bangalore
25.0,08/01/2016,Gyaanzone,,Mumbai,GBIM Technologies Pvt Ltd,,"45,000",,Education,Career Planning and Education Advisory Platform,Seed Funding,,,,,,,,,,,,,,,,,,,,,45000.0,2016-08-01,2016.0,,mumbai
26.0,08/01/2016,FlatFurnish,,Gurgaon,Arun Chandra Mohan,,,,Consumer Internet,Online Furnishing Rental Platform,Seed Funding,,,,,,,,,,,,,,,,,,,,,,2016-08-01,2016.0,,gurgaon
27.0,09/01/2016,Lumiere,,Bangalore,Undisclosed investors,,,,ECommerce,Organic Food eTailer,Private Equity,,,,,,,,,,,,,,,,,,,,,,2016-09-01,2016.0,,bangalore
28.0,11/01/2016,Koovs,,Gurgaon,"Nahata Family, Waheed Alli",,"5,400,000",,ECommerce,Online Fashion Apparel Retailer,Private Equity,,,,,,,,,,,,,,,,,,,,,5400000.0,2016-11-01,2016.0,,gurgaon
29.0,11/01/2016,Wishup,,New Delhi,"500 Startups, Mato Peric, TracxnLabs",,,,Consumer Internet,Mobile app based Concierge Service,Seed Funding,,,,,,,,,,,,,,,,,,,,,,2016-11-01,2016.0,,new delhi
30.0,11/01/2016,FreshMenu,,Bangalore,"Zodius Capital, Lightspeed Venture Partners",,"16,500,000",,Consumer Internet,Online / Mobile Food Ordering platform,Private Equity,,,,,,,,,,,,,,,,,,,,,16500000.0,2016-11-01,2016.0,,bangalore
31.0,11/01/2016,SavvyMob,,Bangalore,"TV Mohandas Pai, LetsVenture",,"1,000,000",,ECommerce,Last Minute Hotel Bookings mobile marketplace,Seed Funding,,,,,,,,,,,,,,,,,,,,,1000000.0,2016-11-01,2016.0,,bangalore
32.0,11/01/2016,Fashionablyin,,Mumbai,Ranjan Mahtani,,,,Consumer Internet,Mobile based Geo-target Fashion Marketplace,Seed Funding,,,,,,,,,,,,,,,,,,,,,,2016-11-01,2016.0,,mumbai
33.0,12/01/2016,Shopclues,,Gurgaon,"GIC, Tiger Global Management, Nexus Venture Partners",,"100,000,000",,ECommerce,ECommerce Marketplace,Private Equity,,,,,,,,,,,,,,,,,,,,,100000000.0,2016-12-01,2016.0,,gurgaon
34.0,12/01/2016,Hike Messenger,,New Delhi,"Matt Mullenweg, Adam D’Angelo, Aditya Agarwal,  Ruchi Sanghvi & Others",,,,Consumer Internet,P2P Messaging Service,Private Equity,,,,,,,,,,,,,,,,,,,,,,2016-12-01,2016.0,,new delhi
35.0,12/01/2016,iBus Networks,,Bangalore,"Vallabh Bhanshali, N Squared Management LLC, Jagdish & Sandeep Mehta Family Office",,"2,300,000",,Technology,Next Generation in-building connectivity,Private Equity,,,,,,,,,,,,,,,,,,,,,2300000.0,2016-12-01,2016.0,,bangalore
36.0,12/01/2016,Happy2Refer,,Mumbai,"Equity Crest, Vinners, Sparknext",,"250,000",,Consumer Internet,Mobile based Referral Platform,Seed Funding,,,,,,,,,,,,,,,,,,,,,250000.0,2016-12-01,2016.0,,mumbai
37.0,13/01/2016,CarTrade,,Mumbai,"Temasek Holdings, March Capital, Warburg Pincus",,"145,000,000",,Consumer Internet,Auto Classifieds Portal,Private Equity,,,,,,,,,,,,,,,,,,,,,145000000.0,2016-01-13,2016.0,,mumbai
38.0,13/01/2016,Rentomo,,Bangalore,Shiva Ashok & Other unnamed investors,,"100,000",,Consumer Internet,peer-to-peer renting Marketplace,Seed Funding,,,,,,,,,,,,,,,,,,,,,100000.0,2016-01-13,2016.0,,bangalore
39.0,13/01/2016,Roder,,New Delhi,Unicorn India Ventures,,"240,000",,Consumer Internet,inter-city cab aggregator,Seed Funding,,,,,,,,,,,,,,,,,,,,,240000.0,2016-01-13,2016.0,,new delhi
40.0,13/01/2016,Bucker,,Hyderabad,"50k Ventures, Munish Jauhar, Pulkit Jain, Rohit Narang",,,,Consumer Internet,Food Ordering Mobile App,Seed Funding,,,,,,,,,,,,,,,,,,,,,,2016-01-13,2016.0,,hyderabad
41.0,13/01/2016,Care24,,Mumbai,"SAIF Partners, India Quotient",,"4,000,000",,Healthcare,Professional Health Services Platform,Private Equity,,,,,,,,,,,,,,,,,,,,,4000000.0,2016-01-13,2016.0,,mumbai
42.0,13/01/2016,Obino,,Mumbai,RoundGlass Partners,,,,Healthcare,Weigh Loss Coaching,Private Equity,,,,,,,,,,,,,,,,,,,,,,2016-01-13,2016.0,,mumbai
43.0,14/01/2016,Snapshopr,,Bangalore,Amod Malviya,,,,Consumer Internet,Visual Search & Image Recognition Platform,Seed Funding,,,,,,,,,,,,,,,,,,,,,,2016-01-14,2016.0,,bangalore
44.0,14/01/2016,Buildkar,,Bangalore,"Mustafa Wajid, Umang Kumar & Others",,,,ECommerce,Construction Material Marketplace,Seed Funding,,,,,,,,,,,,,,,,,,,,,,2016-01-14,2016.0,,bangalore
45.0,14/01/2016,Orahi,,Gurgaon,Indian Angel Network,,"520,000",,Consumer Internet,Carpooling Mobile App,Seed Funding,,,,,,,,,,,,,,,,,,,,,520000.0,2016-01-14,2016.0,,gurgaon
46.0,14/01/2016,Zapr,,Gurgaon,"Flipkart, Saavn, Micromax, Dhiraj Rajaram, Ambiga Dhiraj, Dinesh Agarwal, Samir Bangara, Sanjay Nath, Arihant Patni",,,,Technology,TV to Mobile audience Platform,Seed Funding,,,,,,,,,,,,,,,,,,,,,,2016-01-14,2016.0,,gurgaon
47.0,15/01/2016,Remidio,,Bangalore,Cipher-Plexus Capital Advisors & Indian HNIs,,,,Healthcare,Healthcare Product Manufacturer,Private Equity,,,,,,,,,,,,,,,,,,,,,,2016-01-15,2016.0,,bangalore
48.0,15/01/2016,Fitso,,Gurgaon,"Varun Khurana, Samar Singla, Vinay Bansal,",,"200,000",,Consumer Internet,Fitness related Social Networking App & Forum,Seed Funding,,,,,,,,,,,,,,,,,,,,,200000.0,2016-01-15,2016.0,,gurgaon
49.0,15/01/2016,evibe.in,,Bangalore,"Hyderabad Angels, Lalit Mangal,  Vikas Malpani, Gaurav Bhalotia, LV Prasad",,,,Consumer Internet,Party Hall Booking platform,Seed Funding,,,,,,,,,,,,,,,,,,,,,,2016-01-15,2016.0,,bangalore
50.0,15/01/2016,Zoctr,,Mumbai,Times Group,,,,Consumer Internet,healthcare aggregator platform,Seed Funding,,,,,,,,,,,,,,,,,,,,,,2016-01-15,2016.0,,mumbai
51.0,15/01/2016,Jobick,,Noida,Abhinav Mathur,,,,Consumer Internet,Mobile app based Job Search,SeedFunding,,,,,,,,,,,,,,,,,,,,,,2016-01-15,2016.0,,noida
52.0,16/01/2016,Plick,,Mumbai,Sanjay Mehta,,,,Consumer Internet,Instant Content Transfer Mobile App,SeedFunding,,,,,,,,,,,,,,,,,,,,,,2016-01-16,2016.0,,mumbai
53.0,18/01/2016,Voice Friends,,Mumbai,Huzaifa Khorakiwala,,,,Consumer Internet,Dating & Singles Chat Platform,SeedFunding,,,,,,,,,,,,,,,,,,,,,,2016-01-18,2016.0,,mumbai
54.0,18/01/2016,Kartrocket,,New Delhi,"Bertelsmann India Investments, Nirvana Digital India Fund, Nirvana Digital Investment Holding, 500 Startups",,"6,000,000",,Consumer Internet,SAAS DIY  ECommerce Platform,Private Equity,,,,,,,,,,,,,,,,,,,,,6000000.0,2016-01-18,2016.0,,new delhi
55.0,19/01/2016,Swiggy,,Bangalore,"Harmony Partners, RB Investments & existing investors",,"35,000,000",,Consumer Internet,Online/Mobile food ordering platform,Private Equity,,,,,,,,,,,,,,,,,,,,,35000000.0,2016-01-19,2016.0,,bangalore
56.0,19/01/2016,TinyStep,,Bangalore,Flipkart,,,,Consumer Internet,Parenting Social Network,SeedFunding,,,,,,,,,,,,,,,,,,,,,,2016-01-19,2016.0,,bangalore
57.0,19/01/2016,Cashkaro,,Gurgaon,Ratan Tata,,,,Consumer Internet,Coupon & Cashback platform,Private Equity,,,,,,,,,,,,,,,,,,,,,,2016-01-19,2016.0,,gurgaon
58.0,19/01/2016,Gameezop,,New Delhi,Anand Chandrasekaran & Others,,,,Consumer Internet,Casual Gaming platform,SeedFunding,,,,,,,,,,,,,,,,,,,,,,2016-01-19,2016.0,,new delhi
59.0,19/01/2016,DailyObjects,,New Delhi,"Unilazer Fund,  Phanindra Sama, Peyush Bansal",,"1,400,000",,ECommerce,Mobile Accessories etailer,Private Equity,,,,,,,,,,,,,,,,,,,,,1400000.0,2016-01-19,2016.0,,new delhi
60.0,19/01/2016,Indus OS,,Mumbai,"Omidyar Network,",,"5,000,000",,Technology,Local language Mobile OS,Private Equity,,,,,,,,,,,,,,,,,,,,,5000000.0,2016-01-19,2016.0,,mumbai
61.0,19/01/2016,CollegeDunia,,New Delhi,Umang Kumar,,"445,000",,Consumer Internet,Educational College Search platform,SeedFunding,,,,,,,,,,,,,,,,,,,,,445000.0,2016-01-19,2016.0,,new delhi
62.0,19/01/2016,Villgro,,Chennai,"Lemelson Foundation, Michael and Susan Dell Foundation",,"3,500,000",,Finance,Social Business Incubator & Fund,Private Equity,,,,,,,,,,,,,,,,,,,,,3500000.0,2016-01-19,2016.0,,chennai
63.0,20/01/2016,Reddoorz,,New Delhi,500 Startups,,,,Consumer Internet,Budget Accomodation Aggregator,Private Equity,,,,,,,,,,,,,,,,,,,,,,2016-01-20,2016.0,,new delhi
64.0,20/01/2016,IndustryBuying,,New Delhi,Trifecta Capital,,"1,800,000",,ECommerce,B2B Industrial Goods Marketplace,Private Equity,,,,,,,,,,,,,,,,,,,,,1800000.0,2016-01-20,2016.0,,new delhi
65.0,20/01/2016,Just Buy Live,,Mumbai,Alpha Capital,,"20,000,000",,ECommerce,B2B Marketplace for Distributors,Private Equity,,,,,,,,,,,,,,,,,,,,,20000000.0,2016-01-20,2016.0,,mumbai
66.0,20/01/2016,IMbesharam,,New Delhi / US,Undisclosed US Based Investors,,"4,000,000",,ECommerce,Adult Products Etailers,Private Equity,,,,,,,,,,,,,,,,,,,,,4000000.0,2016-01-20,2016.0,,new delhi / us
67.0,20/01/2016,Moodoo,,Mumbai / UK,Saïd Business School Seed Fund.,,"40,000",,Consumer Internet,Social Meeting organizer App,SeedFunding,,,,,,,,,,,,,,,,,,,,,40000.0,2016-01-20,2016.0,,mumbai / uk
68.0,20/01/2016,Saral Designs,,Mumbai,"Farooq Adam, Ambi Parameswaran,",,,,Healthcare,Women Hygiene Product Manufacturer,SeedFunding,,,,,,,,,,,,,,,,,,,,,,2016-01-20,2016.0,,mumbai
69.0,21/01/2016,FirstCry,,Pune,Ratan Tata,,,,ECommerce,Kids Focused eTailer,Private Equity,,,,,,,,,,,,,,,,,,,,,,2016-01-21,2016.0,,pune
70.0,21/01/2016,Fisdom,,Bangalore,Rob Chandra,,"500,000",,Consumer Internet,Personal Finance Mobile App,SeedFunding,,,,,,,,,,,,,,,,,,,,,500000.0,2016-01-21,2016.0,,bangalore
71.0,21/01/2016,Easypolicy,,Noida,Unilazer Ventures,,"2,200,000",,Consumer Internet,Online insurance policy aggregator,Private Equity,,,,,,,,,,,,,,,,,,,,,2200000.0,2016-01-21,2016.0,,noida
72.0,21/01/2016,Housing.com,,Mumbai,SoftBank Corp,,"15,000,000",,Consumer Internet,Online Real Estate Portal,Private Equity,,,,,,,,,,,,,,,,,,,,,15000000.0,2016-01-21,2016.0,,mumbai
73.0,21/01/2016,CREO,,Bangalore,"Sequoia Capital, Beenext Ventures, India Quotient, Anand Chandrasekaran",,"3,000,000",,Technology,Smartphone OS Developer,Private Equity,,,,,,,,,,,,,,,,,,,,,3000000.0,2016-01-21,2016.0,,bangalore
74.0,22/01/2016,ShabdaNagari,,Kanpur,Kanpur Angels & Others,,"200,000",,Consumer Internet,Hindi Language Social Networking Portal,SeedFunding,,,,,,,,,,,,,,,,,,,,,200000.0,2016-01-22,2016.0,,kanpur
75.0,22/01/2016,Little,,Bangalore,GIC,,,,Consumer Internet,Deal Discovery App,Private Equity,,,,,,,,,,,,,,,,,,,,,,2016-01-22,2016.0,,bangalore
76.0,22/01/2016,SnapBizz,,Bangalore,"Jungle Ventures, Taurus Value Creation, Konly Venture, Blume Ventures",,"7,200,000",,ECommerce,Mobile based Retail Market Ecosystem,Private Equity,,,,,,,,,,,,,,,,,,,,,7200000.0,2016-01-22,2016.0,,bangalore
77.0,22/01/2016,Qlivery,,Gurgaon,Chandigarh Angels Funding,,,,Consumer Internet,on-demand concierge services,SeedFunding,,,,,,,,,,,,,,,,,,,,,,2016-01-22,2016.0,,gurgaon
78.0,22/01/2016,PlexusMD,,Ahmedabad,"Arihant Patni, Avnish Mehra, Pranay Adhvaryu, Ravi Sampat",,,,Consumer Internet,Social Network for Healthcare Professionals,SeedFunding,,,,,,,,,,,,,,,,,,,,,,2016-01-22,2016.0,,ahmedabad
79.0,22/01/2016,Silvan,,Bangalore,The Chennai Angels,,"515,000",,Technology,Home Automation & Security Solutions,SeedFunding,,,,,,,,,,,,,,,,,,,,,515000.0,2016-01-22,2016.0,,bangalore
80.0,22/01/2016,EPS,,Mumbai,APIS Partners,,"35,000,000",,Technology,Electronic Payments Solution Company,Private Equity,,,,,,,,,,,,,,,,,,,,,35000000.0,2016-01-22,2016.0,,mumbai
81.0,22/01/2016,Qubole,,Bangalore,"Institutional Venture Partners, Norwest Venture Partners, Lightspeed Venture Partners, CRV",,"30,000,000",,Technology,Enterprise Cloud Based Data Processing,Private Equity,,,,,,,,,,,,,,,,,,,,,30000000.0,2016-01-22,2016.0,,bangalore
82.0,22/01/2016,Gajty,,Gurgaon,Purvi Ventures,,,,Healthcare,Salons & Spa Chain,SeedFunding,,,,,,,,,,,,,,,,,,,,,,2016-01-22,2016.0,,gurgaon
83.0,25/01/2016,SIFTR Labs,,Mumbai,Venture Catalysts,,"150,000",,Consumer Internet,Photography curation & Aggregator platform,SeedFunding,,,,,,,,,,,,,,,,,,,,,150000.0,2016-01-25,2016.0,,mumbai
84.0,25/01/2016,Power2SME,,Gurgaon,"Nandan Nilekani, Accel Partners, Kalaari Capital and Inventus Capital",,"21,000,000",,Consumer Internet,SME Online Buying Hub,Private Equity,,,,,,,,,,,,,,,,,,,,,21000000.0,2016-01-25,2016.0,,gurgaon
85.0,25/01/2016,SkyCandle,,New Delhi,GPA group,,,,ECommerce,Home Décor Product etailer,Private Equity,,,,,,,,,,,,,,,,,,,,,,2016-01-25,2016.0,,new delhi
86.0,27/01/2016,Teabox.com,,Siliguri,Ratan Tata,,,,ECommerce,Specialty Tea ETailer,Private Equity,,,,,,,,,,,,,,,,,,,,,,2016-01-27,2016.0,,siliguri
87.0,27/01/2016,Buildzar,,Gurgaon,Puneet Dalmia,,"4,000,000",,ECommerce,Construction Material ETailer,Private Equity,,,,,,,,,,,,,,,,,,,,,4000000.0,2016-01-27,2016.0,,gurgaon
88.0,27/01/2016,Applicate,,Bangalore,Undisclosed investors,,"1,000,000",,Technology,"Sales, Market, Distribution & Data Analytics Platform",SeedFunding,,,,,,,,,,,,,,,,,,,,,1000000.0,2016-01-27,2016.0,,bangalore
89.0,27/01/2016,WhatsOnRent,,Bangalore,Lalit Mangal & Others,,,,ECommerce,Online Rental Marketplace,SeedFunding,,,,,,,,,,,,,,,,,,,,,,2016-01-27,2016.0,,bangalore
90.0,28/01/2016,Zebi(yet to launch),,Hyderabad,Un disclosed investors,,"1,000,000",,Technology,Data Intelligence & Analytics,SeedFunding,,,,,,,,,,,,,,,,,,,,,1000000.0,2016-01-28,2016.0,,hyderabad
91.0,28/01/2016,Truce,,Mumbai,"Anupam Mittal, Amit Gupta, Utsav Somani, Neeraj Goenka, Farooq Adam Mukadam",,"370,000",,FMCG,Vegetables & Fruits Supply Chain,SeedFunding,,,,,,,,,,,,,,,,,,,,,370000.0,2016-01-28,2016.0,,mumbai
92.0,28/01/2016,JustDoc,,Bangalore,"TV Mohandas Pai, Mohit Saxena, Raghunandan G, Singapore Angel Network, TracxnLabs",,,,Consumer Interne,Medical Video Consultation platform,SeedFunding,,,,,,,,,,,,,,,,,,,,,,2016-01-28,2016.0,,bangalore
93.0,28/01/2016,Myeglu,,Bangalore,Foxconn Technology Group & Others,,,,Technology,Connected Smart Home Solutions,SeedFunding,,,,,,,,,,,,,,,,,,,,,,2016-01-28,2016.0,,bangalore
94.0,29/01/2016,BitGiving,,New Delhi,"Harminder Sahni, Krishna Mehra, Sanjay Bakshi",,,,Consumer Internet,Crowd Funding Platform,SeedFunding,,,,,,,,,,,,,,,,,,,,,,2016-01-29,2016.0,,new delhi
95.0,29/01/2016,Qriyo,,Jodhpur,Idein Ventures,,"160,000",,Consumer Internet,Online Fitness & Educational information Aggregator,SeedFunding,,,,,,,,,,,,,,,,,,,,,160000.0,2016-01-29,2016.0,,jodhpur
96.0,29/01/2016,N.O.W,,Noida,Maple Capital Advisors,,,,Consumer Internet,Rental Bike Aggregator App,SeedFunding,,,,,,,,,,,,,,,,,,,,,,2016-01-29,2016.0,,noida
97.0,29/01/2016,Aisle,,Bangalore,"TermSheet, ah! Ventures",,"185,000",,Consumer Internet,Indians focused Matchmaking App,SeedFunding,,,,,,,,,,,,,,,,,,,,,185000.0,2016-01-29,2016.0,,bangalore
98.0,29/01/2016,FreshMenu,,Bangalore,"Zodius Technology Fund, Lightspeed Venture Partners",,"17,000,000",,Consumer Internet,Fresh Food Delivery platform,Private Equity,,,,,,,,,,,,,,,,,,,,,17000000.0,2016-01-29,2016.0,,bangalore
99.0,29/01/2016,Truebil,,Mumbai,"Kalaari Capital, Inventus Capital, Tekton Ventures, Kae Capital",,"5,150,000",,ECommerce,Online marketplace for cars,Private Equity,,,,,,,,,,,,,,,,,,,,,5150000.0,2016-01-29,2016.0,,mumbai
100.0,29/01/2016,Rare Media,,New Delhi,Info Edge (India) Ltd,,"1,100,000",,Technology,Mobile & Cloud based App developer,Private Equity,,,,,,,,,,,,,,,,,,,,,1100000.0,2016-01-29,2016.0,,new delhi
101.0,29/01/2016,TinMen,,Hyderabad,Lead Angel Network,,,,Consumer Internet,Food Delivery Platform,SeedFunding,,,,,,,,,,,,,,,,,,,,,,2016-01-29,2016.0,,hyderabad
102.0,29/01/2016,CodingLabs,,Hyderabad,Vineet Nalla,,,,Technology,Coding Skill Showcase & Resume Builder,SeedFunding,,,,,,,,,,,,,,,,,,,,,,2016-01-29,2016.0,,hyderabad
103.0,30/01/2016,FindUrClass,,Mumbai,"Amit Patni, Anirudh Damani, Samir Shah",,,,Consumer Internet,Hobby & Activity Class Aggregator,SeedFunding,,,,,,,,,,,,,,,,,,,,,,2016-01-30,2016.0,,mumbai
104.0,30/01/2016,DesignBids,,New Delhi,Indian Angel Network,,,,Consumer Internet,Interior Design Marketplace,SeedFunding,,,,,,,,,,,,,,,,,,,,,,2016-01-30,2016.0,,new delhi
,,,,,,,,,,,,,,,,,,,,,,,,,,,,,,,,,,,,
1.0,01/7/2016,RazorPay,,Bangalore,MasterCard,,,,Consumer Internet,Online Payment Gateway,Private Equity,,,,,,,,,,,,,,,,,,,,,,2016-01-07,2016.0,,bangalore
2.0,01/7/2016,DarwinBox,,Hyderabad,"3one4 Capital, Tracxn Labs, Aaruha Technology Fund, Endiya Partners",,,,Technology,HR Software Services Startup,Seed Funding,,,,,,,,,,,,,,,,,,,,,,2016-01-07,2016.0,,hyderabad
3.0,01/07/2016,Venture Catalysts,,Mumbai,Zaffiro Ventures,,"500,000",,Consumer Internet,Seed Investment & Innovation Platform,Seed Funding,,,,,,,,,,,,,,,,,,,,,500000.0,2016-01-07,2016.0,,mumbai
4.0,01/07/2016,PressPlay TV,,New Delhi,"Sequoia Capital, SD Ventures, Vistaar Investment Advisors Pvt. Ltd.",,,,Consumer Internet,Video Content Discovery Platform,Private Equity,,,,,,,,,,,,,,,,,,,,,,2016-01-07,2016.0,,new delhi
5.0,02/07/2016,Playment,,Bangalore,SAIF Partners,,"700,000",,Consumer Internet,Mobile Marketplace for Crowdsourced Work,Private Equity,,,,,,,,,,,,,,,,,,,,,700000.0,2016-02-07,2016.0,,bangalore
6.0,04/07/2016,WealthTrust,,Mumbai,India Quotient,,,,Consumer Internet,Wealth Management App,Seed Funding,,,,,,,,,,,,,,,,,,,,,,2016-04-07,2016.0,,mumbai
7.0,04/07/2016,Curefit,,Bangalore,"Accel Partners, IDG Ventures, Kalaari Capital",,"15,000,000",,Consumer Internet,Online Preventive Healthcare Platform,Private Equity,,,,,,,,,,,,,,,,,,,,,15000000.0,2016-04-07,2016.0,,bangalore
8.0,04/07/2016,StitchWood,,Mumbai,Deepak Gupta,,"200,000",,eCommerce,Custom Furniture Online,Seed Funding,,,,,,,,,,,,,,,,,,,,,200000.0,2016-04-07,2016.0,,mumbai
9.0,04/07/2016,Grab.in,,Mumbai,Aramex Ventures Llc,,"2,000,000",,Logistics,hyperlocal logistics service,Private Equity,,,,,,,,,,,,,,,,,,,,,2000000.0,2016-04-07,2016.0,,mumbai
10.0,04/07/2016,Fulfil.IO,,US,Rajan Anandan,,,,Consumer Internet,Cloud Based ERP Software,Seed Funding,,,,,,,,,,,,,,,,,,,,,,2016-04-07,2016.0,,us
11.0,04/07/2016,NeoGrowth,,Mumbai,"IIFL Wealth Management Seed Venture Fund, Omidyar Network, Khosla Impact, Aspada",,"16,000,000",,Finance,SME Lending platform,Private Equity,,,,,,,,,,,,,,,,,,,,,16000000.0,2016-04-07,2016.0,,mumbai
12.0,05/07/2016,SeeDoc,,Gurgaon,YourNest Angel Fund  & Others,,"1,000,000",,Consumer Internet,Video Based Doctor Consulting platform App,Private Equity,,,,,,,,,,,,,,,,,,,,,1000000.0,2016-05-07,2016.0,,gurgaon
13.0,05/07/2016,BookMyShow,,Mumbai,"Stripes Group, Network 18, Accel Partners, SAIF Partners",,"82,000,000",,Consumer Internet,Event & Movie Ticketing platform,Private Equity,,,,,,,,,,,,,,,,,,,,,82000000.0,2016-05-07,2016.0,,mumbai
14.0,05/07/2016,Flyrobe,,Mumbai,"Sequoia Capital, Rohit Bansal, Kunal Bahl, Sandeep Tandon, Kunal Shah, Zishaan Hayath,  Abhishek Jain",,"1,700,000",,eCommerce,Online fashion rental platform,Seed Funding,,,,,,,,,,,,,,,,,,,,,1700000.0,2016-05-07,2016.0,,mumbai
15.0,06/07/2016,HappilyUnmarried,,New Delhi,Info Edge (India) Ltd,,"740,000",,eCommerce,Online Merchandize etailer,Private Equity,,,,,,,,,,,,,,,,,,,,,740000.0,2016-06-07,2016.0,,new delhi
16.0,06/07/2016,Don’t Scratch Your Head,,Ahmedabad,"Gaurav Singhvi, Zaffiro Ventures",,"250,000",,Technology,Full Stack Offline & Online ERP Solution,Seed Funding,,,,,,,,,,,,,,,,,,,,,250000.0,2016-06-07,2016.0,,ahmedabad
17.0,06/07/2016,Wedding Wishlist,,Chennai,"Kirthiga Reddy, Renuka Ramanath,Cherry Tin",,"297,000",,Consumer Internet,"Wedding Wishlist, Gifts & Registry Creation platform",Seed Funding,,,,,,,,,,,,,,,,,,,,,297000.0,2016-06-07,2016.0,,chennai
18.0,07/07/2016,AppDaily,,Mumbai,"Kalaari Capital, Qualcomm Ventures, ru-Net, Zodius Technology Opportunities Fund,",,"2,000,000",,Technology,Mobile Security App development & Distribution,Private Equity,,,,,,,,,,,,,,,,,,,,,2000000.0,2016-07-07,2016.0,,mumbai
19.0,07/07/2016,Adytude,,New Delhi,Indian Angel Network,,"1,000,000",,Consumer Internet,Gamified Consumer Insights Portal,Private Equity,,,,,,,,,,,,,,,,,,,,,1000000.0,2016-07-07,2016.0,,new delhi
20.0,07/07/2016,Quickli,,Gurgaon,"AVG Group, 500 Startups",,,,Logistics,On-Demand Delivery Startup,Private Equity,,,,,,,,,,,,,,,,,,,,,,2016-07-07,2016.0,,gurgaon
21.0,07/07/2016,SpectraVR,,Mumbai,Rothenberg Ventures,,,,Technology,Virtual Reality Content Studio,Seed Funding,,,,,,,,,,,,,,,,,,,,,,2016-07-07,2016.0,,mumbai
22.0,08/07/2016,Pitstop,,Bangalore,"Alex Chua, Rahul Garg",,,,Consumer Internet,Online Car Repair and Servicing Booking platform,Seed Funding,,,,,,,,,,,,,,,,,,,,,,2016-08-07,2016.0,,bangalore
23.0,08/07/2016,HolaChef,,Mumbai,"Kalaari Capital, India Quotient",,"1,950,000",,Consumer Internet,Online Food Ordering & Delivery Platform,Private Equity,,,,,,,,,,,,,,,,,,,,,1950000.0,2016-08-07,2016.0,,mumbai
24.0,11/07/2016,Purplle,,Mumbai,"JSW Ventures, Blume Ventures & IvyCap Ventures",,"6,000,000",,eCommerce,Beauty Products Marketplace,Private Equity,,,,,,,,,,,,,,,,,,,,,6000000.0,2016-11-07,2016.0,,mumbai
25.0,11/07/2016,Trak N Tell,,Gurgaon,Brian Acton,,"3,500,000",,Technology,Car Tracking & Safety System,Private Equity,,,,,,,,,,,,,,,,,,,,,3500000.0,2016-11-07,2016.0,,gurgaon
26.0,11/07/2016,Overcart.com,,Gurgaon,"JSW Ventures, Omidyar Network, Sattva Capital, Venture Works",,"3,000,000",,eCommerce,Unboxed & refurbished electronic products marketplace,Private Equity,,,,,,,,,,,,,,,,,,,,,3000000.0,2016-11-07,2016.0,,gurgaon
27.0,12/07/2016,SirionLabs,,Gurgaon,Sequoia Capital,,"12,250,000",,Technology,SAAS based Service Agreement Management,Private Equity,,,,,,,,,,,,,,,,,,,,,12250000.0,2016-12-07,2016.0,,gurgaon
28.0,12/07/2016,GyanDhan,,New Delhi,"Stanford Angels & Entrepreneurs, Harvard Angels",,,,Consumer Internet,Education Focused Financing Platform,Seed Funding,,,,,,,,,,,,,,,,,,,,,,2016-12-07,2016.0,,new delhi
29.0,12/07/2016,MintM,,Bangalore,"Mumbai Angels,  Times Internet",,,,Consumer Internet,Digital Marketing & AdTech Platform,Private Equity,,,,,,,,,,,,,,,,,,,,,,2016-12-07,2016.0,,bangalore
30.0,12/07/2016,HitGrit,,Chandigarh,"Ashish Mahajan, Sarvesh Sharma",,,,Consumer Internet,Online Legal Consultation platform,Seed Funding,,,,,,,,,,,,,,,,,,,,,,2016-12-07,2016.0,,chandigarh
31.0,12/07/2016,Find My Stay,,New Delhi,"Rishi Parti, Yogesh Bansal",,,,Consumer Internet,Online Budget Hotel Aggregator & Booking Platform,Seed Funding,,,,,,,,,,,,,,,,,,,,,,2016-12-07,2016.0,,new delhi
32.0,13/07/2016,YAAP,,New Delhi,Rainmaker Ventures,,"5,000,000",,Consumer Internet,"Online Content Discovery, Creation & Distribution Platform",Private Equity,,,,,,,,,,,,,,,,,,,,,5000000.0,2016-07-13,2016.0,,new delhi
33.0,13/07/2016,Utoo Cabs,,Chennai,Ajay Piramal,,,,Consumer Internet,Cab aggregation & Rental platform,Seed Funding,,,,,,,,,,,,,,,,,,,,,,2016-07-13,2016.0,,chennai
34.0,13/07/2016,Twigly,,Gurgaon,"Tracxn Labs, Hyderabad Angels, Kunal Shah, Gaurav Bhalotia",,"600,000",,Consumer Internet,Online Food Ordering & Delivery Startup,Seed Funding,,,,,,,,,,,,,,,,,,,,,600000.0,2016-07-13,2016.0,,gurgaon
35.0,13/07/2016,ShareChat,,Bangalore,"SAIF Partners, India Quotient",,"1,350,000",,Consumer Internet,Vernacular Language Content Creation & Sharing App,Private Equity,,,,,,,,,,,,,,,,,,,,,1350000.0,2016-07-13,2016.0,,bangalore
36.0,13/07/2016,Urban Tailor,,Bangalore,Unitus Seed Fund,,,,Consumer Internet,E-Tailoring service provider,Private Equity,,,,,,,,,,,,,,,,,,,,,,2016-07-13,2016.0,,bangalore
37.0,13/07/2016,RentMojo,,Bangalore,"Accel Partners, IDG Ventures India",,"5,000,000",,Consumer Internet,Online Furniture Renting Platform,Private Equity,,,,,,,,,,,,,,,,,,,,,5000000.0,2016-07-13,2016.0,,bangalore
38.0,13/07/2016,CityFurnish,,Gurgaon,Brand Capital,,,,Consumer Internet,Online Furniture Renting Platform,Seed Funding,,,,,,,,,,,,,,,,,,,,,,2016-07-13,2016.0,,gurgaon
39.0,13/07/2016,HEAL Institute,,Mumbai,"Jaspal Bindra, Parth Jindal",,,,Healthcare,Sports Focused Healthcare Startup,Seed Funding,,,,,,,,,,,,,,,,,,,,,,2016-07-13,2016.0,,mumbai
40.0,14/07/2016,Augrav,,Coimbatore,Keiretsu Forum,,"450,000",,eCommerce,Personalized precious Jewellery etailer,Seed Funding,,,,,,,,,,,,,,,,,,,,,450000.0,2016-07-14,2016.0,,coimbatore
41.0,14/07/2016,ShoppinPal,,Pune,"Plug and Play Tech Center, Steelhead Ventures & Others",,"1,070,000",,Technology,M-Commerce Solutions for Retail Stores,Private Equity,,,,,,,,,,,,,,,,,,,,,1070000.0,2016-07-14,2016.0,,pune
42.0,14/07/2016,TransTutors/AskIITians,,New Delhi,500 Startups,,,,Consumer Internet,Online Education & Tutoring portals,Private Equity,,,,,,,,,,,,,,,,,,,,,,2016-07-14,2016.0,,new delhi
43.0,15/07/2016,WorkApps,,Pune,SRI Capital,,"1,000,000",,Technology,Enterprise Work Management Software,Seed Funding,,,,,,,,,,,,,,,,,,,,,1000000.0,2016-07-15,2016.0,,pune
44.0,15/07/2016,BankerBay,,Bangalore,undisclosed investors,,"2,000,000",,Consumer Internet,Online Investment Banking platform,Private Equity,,,,,,,,,,,,,,,,,,,,,2000000.0,2016-07-15,2016.0,,bangalore
45.0,15/07/2016,BaggOut,,New Delhi,"Sumit Jain, Sumit Jain, Anurag Gupta, Varun Khanna, Faraz Khan",,,,eCommerce,Women’s Fashion etailer,Seed Funding,,,,,,,,,,,,,,,,,,,,,,2016-07-15,2016.0,,new delhi
46.0,15/07/2016,TripShelf,,New Delhi,GEMS group,,"250,000",,eCommerce,Travel Package Marketplace,Seed Funding,,,,,,,,,,,,,,,,,,,,,250000.0,2016-07-15,2016.0,,new delhi
47.0,15/07/2016,SatvaCart,,New Delhi,"Abhijit Avasthi, Karan Chellani, SP Vijay",,,,eCommerce,Online Grocers,Seed Funding,,,,,,,,,,,,,,,,,,,,,,2016-07-15,2016.0,,new delhi
48.0,15/07/2016,Ridlr,,Mumbai,"Times Internet,Innoven Capital, Matrix Partners India, Qualcomm Ventures",,"6,000,000",,Consumer Internet,Public Transport Mobile App,Private Equity,,,,,,,,,,,,,,,,,,,,,6000000.0,2016-07-15,2016.0,,mumbai
49.0,18/07/2016,Yellowdig,,Pune,SRI Capital,,"650,000",,Consumer Internet,Online Learning Platform,Seed Funding,,,,,,,,,,,,,,,,,,,,,650000.0,2016-07-18,2016.0,,pune
50.0,18/07/2016,Zuppler,,New Delhi,SRI Capital,,"650,000",,Consumer Internet,Online Food Ordering platform,Seed Funding,,,,,,,,,,,,,,,,,,,,,650000.0,2016-07-18,2016.0,,new delhi
51.0,18/07/2016,BlueStone,,Mumbai,"IIFL and Accel Partners, Kalaari Capital, IvyCap Ventures, RB Investments",,"30,000,000",,eCommerce,Jewellery Etailer,Private Equity,,,,,,,,,,,,,,,,,,,,,30000000.0,2016-07-18,2016.0,,mumbai
52.0,18/07/2016,underDOGS,,Mumbai,Intelli Reboot Digital Pvt. Ltd,,,,Technology,Game Development Startup,Private Equity,,,,,,,,,,,,,,,,,,,,,,2016-07-18,2016.0,,mumbai
53.0,18/07/2016,ImageProVision,,Pune,Satish Jamdar,,,,Technology,Image Analysis Solutions,Seed Funding,,,,,,,,,,,,,,,,,,,,,,2016-07-18,2016.0,,pune
54.0,19/07/2016,Sagacito,,New Delhi,Star India Pvt. Ltd,,"10,000,000",,Technology,Cloud-Based Enterprise Solutions,Private Equity,,,,,,,,,,,,,,,,,,,,,10000000.0,2016-07-19,2016.0,,new delhi
55.0,19/07/2016,Deal4Loans/Wishfin,,Noida,Franklin Templeton International Services Pvt. Ltd,,"15,000,000",,Consumer Internet,Loans Comparison platform,Private Equity,,,,,,,,,,,,,,,,,,,,,15000000.0,2016-07-19,2016.0,,noida
56.0,19/07/2016,NiYO Solutions,,Bangalore,Prime Venture Partners,,"1,000,000",,Technology,Payroll & Benefits Software solutions,Private Equity,,,,,,,,,,,,,,,,,,,,,1000000.0,2016-07-19,2016.0,,bangalore
57.0,19/07/2016,AppLop,,Gurgaon,Green House Ventures Accelerator,,"250,000",,Consumer Internet,Mobile Apps SaaS Platform,Seed Funding,,,,,,,,,,,,,,,,,,,,,250000.0,2016-07-19,2016.0,,gurgaon
58.0,20/07/2016,Tax2Win,,Jaipur,Undisclosed Investors,,"1,000,000",,Consumer Internet,Online Tax Filing Portal,Private Equity,,,,,,,,,,,,,,,,,,,,,1000000.0,2016-07-20,2016.0,,jaipur
59.0,20/07/2016,Truckola,,Mumbai,"Abhishek Agarwal, Krishnakumar Nataraj, Sarath Sura, Shanti Mohan, Sarthak and Nihit Agarwal, Suramya Gupta",,"595,000",,Logistics,Tech-focused cargo transport startup,Seed Funding,,,,,,,,,,,,,,,,,,,,,595000.0,2016-07-20,2016.0,,mumbai
60.0,20/07/2016,iServe Financial,,Pune,Nilesh Shah,,,,Consumer Internet,Loan Comparison & Deals platform,Seed Funding,,,,,,,,,,,,,,,,,,,,,,2016-07-20,2016.0,,pune
61.0,21/07/2016,MyTaxiIndia,,New Delhi,Nihon Kotsu Co,,"1,000,000",,Consumer Internet,Online Car rental booking platform,Private Equity,,,,,,,,,,,,,,,,,,,,,1000000.0,2016-07-21,2016.0,,new delhi
62.0,21/07/2016,AbeRuk,,Bangalore,Swastika Company Pvt Ltd,,,,eCommerce,Online Marketplace for books,Seed Funding,,,,,,,,,,,,,,,,,,,,,,2016-07-21,2016.0,,bangalore
63.0,21/07/2016,Wiwigo,,Bangalore,Indian Angel Network,,"595,000",,Consumer Internet,Inter-City Taxi Booking platform,Seed Funding,,,,,,,,,,,,,,,,,,,,,595000.0,2016-07-21,2016.0,,bangalore
64.0,21/07/2016,Drums Food,,Mumbai,"Verlinvest, DSG Consumer Partners",,"6,600,000",,Food & Beverage,Yogurt and Ice Cream maker,Private Equity,,,,,,,,,,,,,,,,,,,,,6600000.0,2016-07-21,2016.0,,mumbai
65.0,22/07/2016,Treebo Hotels,,Bangalore,"Bertelsmann India Investments, SAIF Partners, Matrix Partners India.",,"16,700,000",,Consumer Internet,Budget Hotel Aggregator & Booking platform,Private Equity,,,,,,,,,,,,,,,,,,,,,16700000.0,2016-07-22,2016.0,,bangalore
66.0,22/07/2016,Skrilo,,Gurgaon,"Anuj Srivastava, Arvind Tiku",,"1,500,000",,Consumer Internet,Mobile Marketing & Rewards Platform,Seed Funding,,,,,,,,,,,,,,,,,,,,,1500000.0,2016-07-22,2016.0,,gurgaon
67.0,22/07/2016,UrDoorStep,,Bangalore,CP Murali,,"300,000",,Consumer Internet,On-demand Grocery delivery portal,Seed Funding,,,,,,,,,,,,,,,,,,,,,300000.0,2016-07-22,2016.0,,bangalore
68.0,22/07/2016,SimplyMoveIn,,Bangalore,Swastika Company Ltd,,,,eCommerce,online marketplace for curated rental properties,Seed Funding,,,,,,,,,,,,,,,,,,,,,,2016-07-22,2016.0,,bangalore
69.0,25/07/2016,QwikCilver,,Bangalore,"Sistema Asia Fund, Amazon Asia-Pacific, Accel India, Helion Venture Partners",,"10,000,000",,Consumer Internet,Gift Card Services Provider,Private Equity,,,,,,,,,,,,,,,,,,,,,10000000.0,2016-07-25,2016.0,,bangalore
70.0,25/07/2016,QDesk,,New Delhi,"Anuraag Jaipuria, Rishi Kajaria, Ruchirans Jaipuria, Dheeraj Jain, Ankush Nijhawan, Gaurav Bhatnagar, Manish Dhingra",,,,Consumer Internet,Online Workspace provider,Seed Funding,,,,,,,,,,,,,,,,,,,,,,2016-07-25,2016.0,,new delhi
71.0,25/07/2016,10i Commerce Services,,Bangalore,Nandan Nilekani,,,,Technology,ECommerce Technology Solutions,Seed Funding,,,,,,,,,,,,,,,,,,,,,,2016-07-25,2016.0,,bangalore
72.0,25/07/2016,Lucideus,,New Delhi,Sanjay Baweja,,,,Technology,Cyber Security Solutions,Seed Funding,,,,,,,,,,,,,,,,,,,,,,2016-07-25,2016.0,,new delhi
73.0,26/07/2016,WakoW,,New Delhi,Undisclosed Investor,,"141,000",,Consumer Internet,Hyperlocal Interest based Mobile Social Network,Seed Funding,,,,,,,,,,,,,,,,,,,,,141000.0,2016-07-26,2016.0,,new delhi
74.0,26/07/2016,Zoom Car,,Bangalore,"Ford Motor Company, Sequoia Capital, Reliance Ventures",,"25,000,000",,Consumer Internet,Self Driver Car Rentals,Private Equity,,,,,,,,,,,,,,,,,,,,,25000000.0,2016-07-26,2016.0,,bangalore
75.0,26/07/2016,e27,,Singapore,TechTemple Group,,"2,200,000",,Consumer Internet,Online Tech Media Portal,Private Equity,,,,,,,,,,,,,,,,,,,,,2200000.0,2016-07-26,2016.0,,singapore
76.0,26/07/2016,Big Deal,,New Delhi,EVC Ventures,,"100,000",,Consumer Internet,Student Deals Discovery Platform,Seed Funding,,,,,,,,,,,,,,,,,,,,,100000.0,2016-07-26,2016.0,,new delhi
77.0,27/07/2016,Square Plums,,Bangalore,Indian Angel Network,,"446,000",,Consumer Internet,Shared Accommodation Discovery platform,Seed Funding,,,,,,,,,,,,,,,,,,,,,446000.0,2016-07-27,2016.0,,bangalore
78.0,27/07/2016,IStyleyou,,Gurgaon,Rannvijay Singh,,,,Consumer Internet,Online Fashion Styling & Chat app,Seed Funding,,,,,,,,,,,,,,,,,,,,,,2016-07-27,2016.0,,gurgaon
79.0,27/07/2016,Mezi,,SFO,"Nexus Venture Partners, Saama Capital, American Express Ventures",,"9,000,000",,Consumer Internet,AI based personal Shopping Assistant,Private Equity,,,,,,,,,,,,,,,,,,,,,9000000.0,2016-07-27,2016.0,,sfo
80.0,27/07/2016,Byndr,,Hyderabad,Education Design Studio,,"700,000",,Consumer Internet,Mobile learning management platform,Seed Funding,,,,,,,,,,,,,,,,,,,,,700000.0,2016-07-27,2016.0,,hyderabad
81.0,28/07/2016,Modasta,,Bangalore,Undisclosed HNIs,,"1,500,000",,Consumer Internet,Multi-lingual health content portal,Seed Funding,,,,,,,,,,,,,,,,,,,,,1500000.0,2016-07-28,2016.0,,bangalore
82.0,28/07/2016,MaxWholesale,,New Delhi,"Maple Capital Advisors, Abhinav Grover",,"150,000",,eCommerce,B2B Wholesale Marketplace,Seed Funding,,,,,,,,,,,,,,,,,,,,,150000.0,2016-07-28,2016.0,,new delhi
83.0,28/07/2016,Neuron,,New Delhi,"Harvinder Singh Bhatia, TLabs Accelerator",,"200,000",,Technology,Machine Learning Platform,Seed Funding,,,,,,,,,,,,,,,,,,,,,200000.0,2016-07-28,2016.0,,new delhi
84.0,28/07/2016,Tiyo,,Kolkata,"Anish K, Ajith Nair",,"120,000",,Consumer Internet,Doctor Discovery & healthcare info platform,Seed Funding,,,,,,,,,,,,,,,,,,,,,120000.0,2016-07-28,2016.0,,kolkata
85.0,29/07/2016,GoCoop,,Bangalore,"Kris Gopalakrishnan, Saha Fund",,"830,000",,eCommerce,Social Marketplace for Cooperative Enterprises,Private Equity,,,,,,,,,,,,,,,,,,,,,830000.0,2016-07-29,2016.0,,bangalore
86.0,29/07/2016,Lemon Leaf,,New Delhi,"Saurabh Sahni, Tushar Gupta",,"133,000",,Technology,Fresh Fruit and Vegetable Supply Chain Tech Builder,Seed Funding,,,,,,,,,,,,,,,,,,,,,133000.0,2016-07-29,2016.0,,new delhi
87.0,29/07/2016,Appsay,,Pune,"Shreyans Shah, Mayank Shah",,"150,000",,Consumer Internet,Customer Engagement Platform,Seed Funding,,,,,,,,,,,,,,,,,,,,,150000.0,2016-07-29,2016.0,,pune
88.0,29/07/2016,Fella Homes,,Gurgaon,Undisclosed investors,,"2,000,000",,Consumer Internet,Home Rental discovery & Booking platform,Seed Funding,,,,,,,,,,,,,,,,,,,,,2000000.0,2016-07-29,2016.0,,gurgaon
89.0,29/07/2016,HelloDhobi,,Pune,Swastika Company Ltd,,,,Consumer Internet,On-Demand Laundry & Dry cleaning Services,Seed Funding,,,,,,,,,,,,,,,,,,,,,,2016-07-29,2016.0,,pune
90.0,,,,,,,,,,,,,,,,,,,,,,,,,,,,,,,,,,,,
,,,,,,,,,,,,,,,,,,,,,,,,,,,,,,,,,,,,
,,,,,,,,,,,,,,,,,,,,,,,,,,,,,,,,,,,,
1.0,01/6/2016,Chikoop,,Indore,Undisclosed Investors,,,,Consumer Internet,Free Ad based Voice Calling,Seed Funding,,,,,,,,,,,,,,,,,,,,,,2016-01-06,2016.0,,indore
2.0,01/6/2016,BRIDGEi2I,,Bangalore,Edelweiss Private Equity,,,,Technology,Data Analytics Platform,Private Equity,,,,,,,,,,,,,,,,,,,,,,2016-01-06,2016.0,,bangalore
3.0,02/6/2016,Droom,,New Delhi,"Beenext, Digital Garage, Lightbox, Beenos",,,,eCommerce,Online marketplace for used automobiles,Private Equity,,,,,,,,,,,,,,,,,,,,,,2016-02-06,2016.0,,new delhi
4.0,02/6/2016,Visit,,New Delhi,MapmyIndia,,,,Consumer Internet,On-Demand Healthcare Service provider,Seed Funding,,,,,,,,,,,,,,,,,,,,,,2016-02-06,2016.0,,new delhi
5.0,02/6/2016,Atomberg,,Mumbai,Parampara Capital,,"1,000,000",,Technology,"smart, energy efficient home appliance manufacturer",Private Equity,,,,,,,,,,,,,,,,,,,,,1000000.0,2016-02-06,2016.0,,mumbai
6.0,02/6/2016,Coutloot,,Mumbai,Venture Catalysts,,,,eCommerce,Fashion Re-Commerce Platform,Seed Funding,,,,,,,,,,,,,,,,,,,,,,2016-02-06,2016.0,,mumbai
7.0,02/6/2016,Limo,,Mumbai,Rainmaker Ventures,,"1,000,000",,Consumer Internet,Bus Aggregator Mobile app,Private Equity,,,,,,,,,,,,,,,,,,,,,1000000.0,2016-02-06,2016.0,,mumbai
8.0,03/6/2016,iCliniq,,Bangalore,MadhanKumar Madathupalayam,,,,Consumer Internet,Doctor Consultation platform,Seed Funding,,,,,,,,,,,,,,,,,,,,,,2016-03-06,2016.0,,bangalore
9.0,03/6/2016,GoGo Truck,,Chennai,Undisclosed Investor,,"75,000",,Consumer Internet,Truck Aggregator & Booking platform,Seed Funding,,,,,,,,,,,,,,,,,,,,,75000.0,2016-03-06,2016.0,,chennai
10.0,03/6/2016,Vyome Biosciences,,New Delhi,Romulus Capital,,"2,000,000",,Healthcare,Treatment Development for Antibiotic-resistant diseases,Private Equity,,,,,,,,,,,,,,,,,,,,,2000000.0,2016-03-06,2016.0,,new delhi
11.0,06/6/2016,SillyMonks,,Hyderabad,Sreenivasa Reddy Musani,,"448,000",,Consumer Internet,Digital Media and Entertainment Startup,Seed Funding,,,,,,,,,,,,,,,,,,,,,448000.0,2016-06-06,2016.0,,hyderabad
12.0,07/06/2016,CueMath,,Bangalore,"Sequoia Capital, Unitus Seed Fund",,"4,000,000",,Education,K-12 Maths Learning Courses,Private Equity,,,,,,,,,,,,,,,,,,,,,4000000.0,2016-07-06,2016.0,,bangalore
13.0,07/06/2016,KrazyBee,,Bangalore,"Yeahmobi, Fenqile",,"2,000,000",,Consumer Internet,Student Micro-Loan platform,Private Equity,,,,,,,,,,,,,,,,,,,,,2000000.0,2016-07-06,2016.0,,bangalore
14.0,07/06/2016,Intgrea,,Bangalore,Undisclosed Investor,,"100,000",,Technology,Post merger Integration Partners,Seed Funding,,,,,,,,,,,,,,,,,,,,,100000.0,2016-07-06,2016.0,,bangalore
15.0,07/06/2016,HelpShift,,Pune,"Microsoft Ventures, Salesforce Ventures",,"23,000,000",,Technology,Mobile CRM Platform,Private Equity,,,,,,,,,,,,,,,,,,,,,23000000.0,2016-07-06,2016.0,,pune
16.0,07/06/2016,CreditVidya,,Mumbai,Kalaari Capital,,"1,000,000",,Technology,Credit Scoring Platform,Private Equity,,,,,,,,,,,,,,,,,,,,,1000000.0,2016-07-06,2016.0,,mumbai
17.0,08/06/2016,Grey Campus,,Hyderabad,Sarath Sura,,"1,000,000",,Consumer Internet,Online Learning Platform,Seed Funding,,,,,,,,,,,,,,,,,,,,,1000000.0,2016-08-06,2016.0,,hyderabad
18.0,08/06/2016,ListUp,,Mumbai,"Kae Capital, Kunal Shah, Sandeep Tandon",,"500,000",,eCommerce,Location based Classified Mobile app,Seed Funding,,,,,,,,,,,,,,,,,,,,,500000.0,2016-08-06,2016.0,,mumbai
19.0,08/06/2016,6Degree,,Mumbai,Indian Angel Network,,"200,000",,Technology,Tech-enabled Fashion Talent platform,Seed Funding,,,,,,,,,,,,,,,,,,,,,200000.0,2016-08-06,2016.0,,mumbai
20.0,08/06/2016,Shopwati,,Gurgaon,Sanjiv Rai,,,,Consumer Internet,Online Fashion Discussion Community,Seed Funding,,,,,,,,,,,,,,,,,,,,,,2016-08-06,2016.0,,gurgaon
21.0,08/06/2016,Cookifi,,Bangalore,"Kunal Shah, Aneesh Reddy, Tracxn Labs, Venkat Tadanki, Krishna Mehra, Amit Rathore",,,,Consumer Internet,Online Chef Discovery & Booking Service,Seed Funding,,,,,,,,,,,,,,,,,,,,,,2016-08-06,2016.0,,bangalore
22.0,08/06/2016,StoreKing,,Bangalore,Axiata Digital,,"16,000,000",,eCommerce,Connecting Small Town Consumers to E-Commerce,Private Equity,,,,,,,,,,,,,,,,,,,,,16000000.0,2016-08-06,2016.0,,bangalore
23.0,08/06/2016,Wired Hub,,Jaipur,"Ankit Maheshwari, Anand Singh",,,,Real Estate,Co-Working Spaces,Seed Funding,,,,,,,,,,,,,,,,,,,,,,2016-08-06,2016.0,,jaipur
24.0,08/06/2016,MySeniorDoctor,,Gurgaon,BlackJag Partners,,"200,000",,Consumer Internet,Online medical support platform,Seed Funding,,,,,,,,,,,,,,,,,,,,,200000.0,2016-08-06,2016.0,,gurgaon
25.0,09/06/2016,Teabox,,Siliguri,Cameron Jones,,,,eCommerce,Online Tea Store,Seed Funding,,,,,,,,,,,,,,,,,,,,,,2016-09-06,2016.0,,siliguri
26.0,09/06/2016,ExtraaEdge,,Pune,"Ritesh Dwivedy, Priti Padhy",,,,Consumer Internet,Student Acquisition Platform,Seed Funding,,,,,,,,,,,,,,,,,,,,,,2016-09-06,2016.0,,pune
27.0,09/06/2016,EPayLater,,Mumbai,3 undisclosed HNIs,,"2,000,000",,Technology,Fin-Tech Platform,Seed Funding,,,,,,,,,,,,,,,,,,,,,2000000.0,2016-09-06,2016.0,,mumbai
28.0,10/06/2016,Kyazoonga,,Mumbai,Ratan Tata,,,,eCommerce,Online event ticketing Platform,Seed Funding,,,,,,,,,,,,,,,,,,,,,,2016-10-06,2016.0,,mumbai
29.0,10/06/2016,Paytunes,,New Delhi,"CIO Angel Network, Indian Angel Network",,"500,000",,Consumer Internet,Mobile based rewards platform,Private Equity,,,,,,,,,,,,,,,,,,,,,500000.0,2016-10-06,2016.0,,new delhi
30.0,10/06/2016,Kickstart Jobs,,Gurgaon,"Vivek Joshi, Mohit Satyanand, Amit Banati, Arun Khanna",,,,Technology,Entry level hiring platform,Seed Funding,,,,,,,,,,,,,,,,,,,,,,2016-10-06,2016.0,,gurgaon
31.0,10/06/2016,Freshee,,Mumbai,Edelweiss Private Equity,,,,FMCG,Household packaging & Storage product manufacturer,Private Equity,,,,,,,,,,,,,,,,,,,,,,2016-10-06,2016.0,,mumbai
32.0,10/06/2016,MadRat Games,,Bangalore,"Ratan Tata, Bhavish Aggarwal, Ankit Bhati, Binny Bansal, Girish Mathrubootham",,,,Technology,Wearable Gaming Platform,Seed Funding,,,,,,,,,,,,,,,,,,,,,,2016-10-06,2016.0,,bangalore
33.0,11/06/2016,Jazzmyride,,New Delhi,TVS Automobile Solutions Ltd,,,,eCommerce,Auto Parts & Accessories eTailer,Private Equity,,,,,,,,,,,,,,,,,,,,,,2016-11-06,2016.0,,new delhi
34.0,11/06/2016,AutoSense,,New Delhi,TVS Automobile Solutions Ltd,,,,Technology,Data Analytics based Customer Management Services,Private Equity,,,,,,,,,,,,,,,,,,,,,,2016-11-06,2016.0,,new delhi
35.0,11/06/2016,Redsun Telematics,,Chennai,TVS Automobile Solutions Ltd,,,,Consumer Internet,Internet of Things Platform,Private Equity,,,,,,,,,,,,,,,,,,,,,,2016-11-06,2016.0,,chennai
36.0,13/06/2016,KhanaGadi,,Jaipur,50K Ventures,,,,Consumer Internet,Online Food Delivery for Train Travelers,Seed Funding,,,,,,,,,,,,,,,,,,,,,,2016-06-13,2016.0,,jaipur
37.0,13/06/2016,Bombay Shirt Company,,Mumbai,undisclosed investor,,"1,000,000",,eCommerce,Online custom Shirt retailer,Private Equity,,,,,,,,,,,,,,,,,,,,,1000000.0,2016-06-13,2016.0,,mumbai
38.0,13/06/2016,Matrubharti,,,Viridian Capital,,"30,000",,Consumer Internet,e-Book Publisher,Seed Funding,,,,,,,,,,,,,,,,,,,,,30000.0,2016-06-13,2016.0,,
39.0,14/06/2016,EdTechReview,,New Delhi,EVC Ventures,,,,Consumer Internet,Education based online portal,Seed Funding,,,,,,,,,,,,,,,,,,,,,,2016-06-14,2016.0,,new delhi
40.0,14/06/2016,Bonhomia,,New Delhi,Valpro Capital and existing investors,,,,Food & Beverage,Premium Tea & Coffee Capsules maker,Private Equity,,,,,,,,,,,,,,,,,,,,,,2016-06-14,2016.0,,new delhi
41.0,14/06/2016,Gobolt,,New Delhi,MCube8,,,,Logistics,B2B Logistics provider,Seed Funding,,,,,,,,,,,,,,,,,,,,,,2016-06-14,2016.0,,new delhi
42.0,14/06/2016,Jivox,,Bangalore,"You & Mr Jones, Fortisure Ventures, Diaz Nesamoney",,"6,000,000",,Technology,Data Driven Advertising platform,Private Equity,,,,,,,,,,,,,,,,,,,,,6000000.0,2016-06-14,2016.0,,bangalore
43.0,14/06/2016,Sminq,,Pune,"Saama Capital, Blume Ventures & Vaibhav Domkundwar",,"1,000,000",,Consumer Internet,Queue management Mobile app,Seed Funding,,,,,,,,,,,,,,,,,,,,,1000000.0,2016-06-14,2016.0,,pune
44.0,14/06/2016,CureJoy,,Bangalore,Accel Partners India,,"4,400,000",,Consumer Internet,Online Alternative health community platform,Private Equity,,,,,,,,,,,,,,,,,,,,,4400000.0,2016-06-14,2016.0,,bangalore
45.0,15/06/2016,Oneway.cab,,Vadodara,Indian Angel Network,,"450,000",,Consumer Internet,Taxi Rental Platform,Seed Funding,,,,,,,,,,,,,,,,,,,,,450000.0,2016-06-15,2016.0,,vadodara
46.0,15/06/2016,GrabOnRent,,Bangalore,IvyCap Ventures and Unicorn India Ventures,,,,eCommerce,On-demand product rental marketplace,Private Equity,,,,,,,,,,,,,,,,,,,,,,2016-06-15,2016.0,,bangalore
47.0,16/06/2016,Diro Labs,,New Delhi,Info Edge (India) Ltd,,"450,000",,Consumer Internet,Contact Management Mobile App,Private Equity,,,,,,,,,,,,,,,,,,,,,450000.0,2016-06-16,2016.0,,new delhi
48.0,16/06/2016,Unnati Helpers,,Gurgaon,Info Edge (India) Ltd,,"600,000",,Consumer Internet,Help Hiring Platform,Private Equity,,,,,,,,,,,,,,,,,,,,,600000.0,2016-06-16,2016.0,,gurgaon
49.0,16/06/2016,Athletto,,Bangalore,Atul Ingle,,,,Consumer Internet,Sports Venue discovery and booking platform,Seed Funding,,,,,,,,,,,,,,,,,,,,,,2016-06-16,2016.0,,bangalore
50.0,16/06/2016,Saavn,,USA,Guy Oseary,,,,Consumer Internet,Web/Mobile Music Streaming service,Private Equity,,,,,,,,,,,,,,,,,,,,,,2016-06-16,2016.0,,usa
51.0,16/06/2016,Voonik,,Bangalore,Sequoia Capital,,"20,000,000",,eCommerce,Online Women’s Fashion Marketplace,Private Equity,,,,,,,,,,,,,,,,,,,,,20000000.0,2016-06-16,2016.0,,bangalore
52.0,16/06/2016,ThinkPhi,,Mumbai,Nimmagadda Prasad,,,,Technology,Sustainable Green Tech Solution developer,Seed Funding,,,,,,,,,,,,,,,,,,,,,,2016-06-16,2016.0,,mumbai
53.0,17/06/2016,Cleartax,,New Delhi,"Ravi Adusumalli, SAIF Partners",,"12,000,000",,Consumer Internet,Online Tax Filing Platform,Private Equity,,,,,,,,,,,,,,,,,,,,,12000000.0,2016-06-17,2016.0,,new delhi
54.0,17/06/2016,Silvan Innovation Labs,,Bangalore,Infuse Ventures,,"900,000",,Technology,Home Automation Solutions,Private Equity,,,,,,,,,,,,,,,,,,,,,900000.0,2016-06-17,2016.0,,bangalore
55.0,17/06/2016,GreytHR,,Bangalore,"New Enterprise Associates (NEA), Blume Ventures",,"5,200,000",,Technology,Payroll & HR Software Developer,Private Equity,,,,,,,,,,,,,,,,,,,,,5200000.0,2016-06-17,2016.0,,bangalore
56.0,17/06/2016,Duffl,,Bangalore,BetOnIndia Technology Pvt Ltd,,,,eCommerce,Fashion Rental Marketplace,Seed Funding,,,,,,,,,,,,,,,,,,,,,,2016-06-17,2016.0,,bangalore
57.0,17/06/2016,BYG,,Bangalore,"Sanjay Verma, Amit Khanna (LetsVenture)",,,,Consumer Internet,Fitness centre Discovery & Booking Mobile app,Seed Funding,,,,,,,,,,,,,,,,,,,,,,2016-06-17,2016.0,,bangalore
58.0,20/06/2016,Dipper,,New Delhi,Undisclosed investor,,,,eCommerce,Freight Logistics Marketplace,Seed Funding,,,,,,,,,,,,,,,,,,,,,,2016-06-20,2016.0,,new delhi
59.0,20/06/2016,Qonfuse,,New Delhi,Hamraj Kumar,,,,Consumer Internet,Online Test Papers for competitive exams,Seed Funding,,,,,,,,,,,,,,,,,,,,,,2016-06-20,2016.0,,new delhi
60.0,20/06/2016,The Indian IRIS,,Ahmedabad,Timbru Ventures,,,,Consumer Internet,Govt Policy Research & Information portal,Seed Funding,,,,,,,,,,,,,,,,,,,,,,2016-06-20,2016.0,,ahmedabad
61.0,21/06/2016,Onspoon,,Mumbai,Swan Angel Network,,"150,000",,Consumer Internet,Online Platform for Event Sponsorship,Seed Funding,,,,,,,,,,,,,,,,,,,,,150000.0,2016-06-21,2016.0,,mumbai
62.0,21/06/2016,REstate,,Bangalore,Idein Ventures,,,,Consumer Internet,Real Estate Platform,Seed Funding,,,,,,,,,,,,,,,,,,,,,,2016-06-21,2016.0,,bangalore
63.0,21/06/2016,Cleartrip,,Mumbai,"Concur Technologies, Gund Investment",,,,Consumer Internet,Online Travel Agency,Private Equity,,,,,,,,,,,,,,,,,,,,,,2016-06-21,2016.0,,mumbai
64.0,21/06/2016,ProcMart,,Noida,IndiaMart,,,,Consumer Internet,Online Procurement Marketplace,Private Equity,,,,,,,,,,,,,,,,,,,,,,2016-06-21,2016.0,,noida
65.0,21/06/2016,Celerix,,Bangalore,Bitkemy Ventures,,"400,000",,Technology,Fintech Product Development & Services Startup,Seed Funding,,,,,,,,,,,,,,,,,,,,,400000.0,2016-06-21,2016.0,,bangalore
66.0,21/06/2016,NatureNama,,Mumbai,Unicorn Venture,,"225,000",,Consumer Internet,Online Outdoors & travel,Seed Funding,,,,,,,,,,,,,,,,,,,,,225000.0,2016-06-21,2016.0,,mumbai
67.0,21/06/2016,CyclopsMedtech,,Bangalore,CP Bothra,,,,Technology,Medical Technology Provider,Seed Funding,,,,,,,,,,,,,,,,,,,,,,2016-06-21,2016.0,,bangalore
68.0,21/06/2016,Syona Cosmetics,,Chennai,The Chennai Angels,,"150,000",,FMCG,Beauty Products & Training to Salons & Spas,Seed Funding,,,,,,,,,,,,,,,,,,,,,150000.0,2016-06-21,2016.0,,chennai
69.0,21/06/2016,PrettySecrets,,Mumbai,"RB Investments PTE Ltd, Orios Venture Partners",,"6,000,000",,eCommerce,Women Lingerie Store,Private Equity,,,,,,,,,,,,,,,,,,,,,6000000.0,2016-06-21,2016.0,,mumbai
70.0,22/06/2016,SpiderG,,Pune,"Rahul Kirloskar, Fusion Tech Ventures, Adi Saravanan, Pravin Dongre, Mahendra Doshi",,"150,000",,Consumer Internet,Online invoice app for SMEs,Seed Funding,,,,,,,,,,,,,,,,,,,,,150000.0,2016-06-22,2016.0,,pune
71.0,23/06/2016,FarEye,,New Delhi,Saif Partners,,"3,500,000",,Technology,Logistics Management Software,Private Equity,,,,,,,,,,,,,,,,,,,,,3500000.0,2016-06-23,2016.0,,new delhi
72.0,23/06/2016,The Uolo,,Bangalore,"Purvi Ventures, Rajul Garg, Vipin Arora",,"210,000",,Consumer Internet,School Parent Communication App,Seed Funding,,,,,,,,,,,,,,,,,,,,,210000.0,2016-06-23,2016.0,,bangalore
73.0,23/06/2016,Staqu,,Gurgaon,Indian Angel Network,,,,Technology,Artificial Intelligence based search platform,Seed Funding,,,,,,,,,,,,,,,,,,,,,,2016-06-23,2016.0,,gurgaon
74.0,23/06/2016,Padhopadhao,,New Delhi,Rise India,,,,Consumer Internet,Home Tutors search & Discovery,Private Equity,,,,,,,,,,,,,,,,,,,,,,2016-06-23,2016.0,,new delhi
75.0,24/06/2016,Drivify,,Mumbai,"Jitendra Gupta, Pankaj Tripathi",,"50,000",,Consumer Internet,Professional Driver discovery & Booking Mobile app,Seed Funding,,,,,,,,,,,,,,,,,,,,,50000.0,2016-06-24,2016.0,,mumbai
76.0,24/06/2016,PratiLipi,,Bangalore,Nexus Venture Partners,,,,Consumer Internet,Multi-Lingual self-publishing platform,Seed Funding,,,,,,,,,,,,,,,,,,,,,,2016-06-24,2016.0,,bangalore
77.0,24/06/2016,ParaBlu,,Bangalore,Kalaari Capital,,"500,000",,Technology,Cloud Data Security & Privacy Solutions,Seed Funding,,,,,,,,,,,,,,,,,,,,,500000.0,2016-06-24,2016.0,,bangalore
78.0,24/06/2016,Schedulers Logistics,,Mumbai,GVFL,,"6,000,000",,Logistics,Cold Storage Logistics solutions,Private Equity,,,,,,,,,,,,,,,,,,,,,6000000.0,2016-06-24,2016.0,,mumbai
79.0,24/06/2016,LEAP India,,Mumbai,Mayfield Ventures,,"3,000,000",,Others,Supply Chain Equipment & Services provider,Private Equity,,,,,,,,,,,,,,,,,,,,,3000000.0,2016-06-24,2016.0,,mumbai
80.0,24/06/2016,KabadiExpress,,New Delhi,Undisclosed investor,,"148,000",,Others,Free Door Step Scrap Pickup Service,Seed Funding,,,,,,,,,,,,,,,,,,,,,148000.0,2016-06-24,2016.0,,new delhi
81.0,27/06/2016,YourDost,,Bangalore,"SAIF Partners, Aprameya Radhakrishnan, Phanindra Sama, Subba Rao Telidevara, Vibhu Garg, Paula Ravindra Mariwala, Gaurav Bhalotia",,"1,200,000",,Consumer Internet,Online counselling & Personal coaching platform,Seed Funding,,,,,,,,,,,,,,,,,,,,,1200000.0,2016-06-27,2016.0,,bangalore
82.0,27/06/2016,Gomalon,,Bangalore,Undisclosed investor,,"100,000",,Consumer Internet,Online Spa & Salon discovery & Booking platform,Seed Funding,,,,,,,,,,,,,,,,,,,,,100000.0,2016-06-27,2016.0,,bangalore
83.0,27/06/2016,Voler Cars,,New Delhi,"Kanodia family, Amit Banka",,,,Consumer Internet,Self-Driven Car rental platform,Seed Funding,,,,,,,,,,,,,,,,,,,,,,2016-06-27,2016.0,,new delhi
84.0,27/06/2016,Travelyaari,,Bangalore,GVFL Ltd,,"3,000,000",,Consumer Internet,Online ticket booking platform,Private Equity,,,,,,,,,,,,,,,,,,,,,3000000.0,2016-06-27,2016.0,,bangalore
85.0,28/06/2016,FabHotels,,Gurgaon,"Accel Partners, RB Investments",,"8,000,000",,Consumer Internet,Online Hotel aggregator & Booking platform,Private Equity,,,,,,,,,,,,,,,,,,,,,8000000.0,2016-06-28,2016.0,,gurgaon
86.0,28/06/2016,Locanix,,Ahmedabad,Undisclosed investors,,"300,000",,Technology,GPS based SaaS Solutions,Seed Funding,,,,,,,,,,,,,,,,,,,,,300000.0,2016-06-28,2016.0,,ahmedabad
87.0,28/06/2016,LendingKart,,Ahmedabad,"Bertelsmann India Investments, Mayfield India, Saama Capital, India Quotient",,"32,000,000",,Consumer Internet,Online Working Capital Business Loans Platform,Private Equity,,,,,,,,,,,,,,,,,,,,,32000000.0,2016-06-28,2016.0,,ahmedabad
88.0,28/06/2016,Hello Tax,,New Delhi,Sanjeev Sinha,,"295,000",,Consumer Internet,Online Tax Filing Platform,Seed Funding,,,,,,,,,,,,,,,,,,,,,295000.0,2016-06-28,2016.0,,new delhi
89.0,28/06/2016,MySuperBrain,,Hyderabad,Soniks Consulting,,,,Consumer Internet,Online Talent Discovery Platform for Kids,Seed Funding,,,,,,,,,,,,,,,,,,,,,,2016-06-28,2016.0,,hyderabad
90.0,28/06/2016,BlogBeats,,Bangalore,Undisclosed Investor,,,,Consumer Internet,Online Blogging Platform,Seed Funding,,,,,,,,,,,,,,,,,,,,,,2016-06-28,2016.0,,bangalore
92.0,29/06/2016,LetReach,,New Delhi,vCommission,,"100,000",,eCommerce,ECommerce SAAS Solutions,Private Equity,,,,,,,,,,,,,,,,,,,,,100000.0,2016-06-29,2016.0,,new delhi
93.0,29/06/2016,TrendieApp,,Kolkata,Harsh Vardhan Hada,,"50,000",,Technology,Visual Content Marketing,Seed Funding,,,,,,,,,,,,,,,,,,,,,50000.0,2016-06-29,2016.0,,kolkata
94.0,29/06/2016,ImpactGuru,,Mumbai,Piyush Jain,,,,Consumer Internet,Crowdfunding Platform,Seed Funding,,,,,,,,,,,,,,,,,,,,,,2016-06-29,2016.0,,mumbai
95.0,29/06/2016,Velvetcase,,Mumbai,"Uniqorn Ventures Fund, TV Mohandas Pai, S Somasegar",,"1,500,000",,eCommerce,Online designer jewellery marketplace,Private Equity,,,,,,,,,,,,,,,,,,,,,1500000.0,2016-06-29,2016.0,,mumbai
96.0,30/06/2016,Meru Cabs,,Mumbai,Brand Capital,,"25,000,000",,Consumer Internet,Online/ Mobile Tax Cab booking,Private Equity,,,,,,,,,,,,,,,,,,,,,25000000.0,2016-06-30,2016.0,,mumbai
97.0,30/06/2016,Campus Diaries,,Bangalore,Aarin Capital,,"220,000",,Consumer Internet,Student focussed Content Discovery portal,Seed Funding,,,,,,,,,,,,,,,,,,,,,220000.0,2016-06-30,2016.0,,bangalore
98.0,30/06/2016,Scripbox,,Bangalore,"Omidyar Network, Accel Partners & existing investors",,,,Consumer Internet,Online Mutual Fund Investment platform,Private Equity,,,,,,,,,,,,,,,,,,,,,,2016-06-30,2016.0,,bangalore
99.0,30/06/2016,Biryani Blues,,Gurgaon,Carpediem Capital & Others,,"368,000",,Food & Beverage,QSR Chain,Private Equity,,,,,,,,,,,,,,,,,,,,,368000.0,2016-06-30,2016.0,,gurgaon
100.0,30/06/2016,,,,,,,,,,,,,,,,,,,,,,,,,,,,,,,,2016-06-30,2016.0,,
,,,,,,,,,,,,,,,,,,,,,,,,,,,,,,,,,,,,
1.0,01/3/2016,DriveU,,Bangalore,Unitus Seed Fund,,,,Consumer Internet,Chauffeurs Discovery for private car owners,Seed Funding,,,,,,,,,,,,,,,,,,,,,,2016-01-03,2016.0,,bangalore
2.0,01/3/2016,Gympik,,Bangalore,RoundGlass Partners,,,,Consumer Internet,"Fitness Centres, Gym Discovery online marketplace",Private Equity,,,,,,,,,,,,,,,,,,,,,,2016-01-03,2016.0,,bangalore
3.0,01/3/2016,Testbook,,Mumbai,S Chand & Co,,,,Consumer Internet,Online Test Preparation Platform,Private Equity,,,,,,,,,,,,,,,,,,,,,,2016-01-03,2016.0,,mumbai
4.0,01/3/2016,IQlect,,Bangalore,"Lip-Bu Tan, Michael Marks, Nicolas Braithwaite",,,,Technology,Big Data Analytics Platform,Private Equity,,,,,,,,,,,,,,,,,,,,,,2016-01-03,2016.0,,bangalore
5.0,02/3/2016,MoMark,,Noida,YourNest Angel Fund,,"600,000",,Consumer Internet,Mobile Wallet Aggregation platform,Private Equity,,,,,,,,,,,,,,,,,,,,,600000.0,2016-02-03,2016.0,,noida
6.0,02/3/2016,Skedool,,Seattle / Bangalore,"Kludein LLCPhanindra Sama, Narayan Ramachandran, Pranav Pai",,,,Consumer Internet,AI based Office Assistant Mobile App,Seed Funding,,,,,,,,,,,,,,,,,,,,,,2016-02-03,2016.0,,seattle / bangalore
7.0,02/3/2016,Systemantics,,Bangalore,"Nandan Nilekani, Accel Partners",,"1,400,000",,Technology,Industrial robots maker,Private Equity,,,,,,,,,,,,,,,,,,,,,1400000.0,2016-02-03,2016.0,,bangalore
8.0,03/3/2016,Vertuals,,Mumbai,Dino Morea,,,,Technology,Audio Visual Digital Content creators for Brands,Seed Funding,,,,,,,,,,,,,,,,,,,,,,2016-03-03,2016.0,,mumbai
9.0,03/3/2016,Imarticus Learning,,Mumbai,"Blinc Advisors, Amit Nanavati, Tashwinder Singh, Taranjit Jaswal, Amit Khanna",,"1,000,000",,Education,Financial Services & Analytics Education Institute,Private Equity,,,,,,,,,,,,,,,,,,,,,1000000.0,2016-03-03,2016.0,,mumbai
10.0,03/3/2016,Shouut,,New Delhi,Undisclosed investor,,"500,000",,Consumer Internet,Social Discovery Mobile app,Seed Funding,,,,,,,,,,,,,,,,,,,,,500000.0,2016-03-03,2016.0,,new delhi
11.0,04/3/2016,TinyStep,,Bangalore,Matt Glickman,,,,Consumer Internet,Parenting Social Network Platform,Private Equity,,,,,,,,,,,,,,,,,,,,,,2016-04-03,2016.0,,bangalore
12.0,04/3/2016,Aahaa,,Chennai,"YourNest Angel Fund,",,"1,000,000",,ECommerce,Office Products Super Store,Private Equity,,,,,,,,,,,,,,,,,,,,,1000000.0,2016-04-03,2016.0,,chennai
13.0,04/3/2016,Arcatron Mobility,,Pune,"Sudhir Mehta, Anoop Hingorani",,,,Technology,Smart wheelchair Design and Development,Seed Funding,,,,,,,,,,,,,,,,,,,,,,2016-04-03,2016.0,,pune
14.0,04/3/2016,FTCash,,Kolkata,IvyCap Ventures,,"150,000",,Consumer Internet,Mobile Payments Platform,Seed Funding,,,,,,,,,,,,,,,,,,,,,150000.0,2016-04-03,2016.0,,kolkata
15.0,04/3/2016,Civilsdaily,,New Delhi,Manoj Kumar & Other undisclosed investors,,,,Consumer Internet,Civil Services News Aggregator,Seed Funding,,,,,,,,,,,,,,,,,,,,,,2016-04-03,2016.0,,new delhi
16.0,04/3/2016,Zappka,,Gurgaon,"Daman Soni, Rajat Gupta & Others",,"100,000",,Consumer Internet,Mobile App discovery and review platform,Seed Funding,,,,,,,,,,,,,,,,,,,,,100000.0,2016-04-03,2016.0,,gurgaon
17.0,04/3/2016,Tarusa World,,Mumbai,Mohit Gulati,,,,ECommerce,Handicraft products eTailer,Seed Funding,,,,,,,,,,,,,,,,,,,,,,2016-04-03,2016.0,,mumbai
18.0,04/3/2016,medECUBE,,Gurgaon,Artiman Ventures,,"4,000,000",,Healthcare,Healthcare related Services provider,Private Equity,,,,,,,,,,,,,,,,,,,,,4000000.0,2016-04-03,2016.0,,gurgaon
19.0,07/3/2016,N.O.W,,Noida,"Ruchirans Jaipuria, Anuj Sanghi",,"500,000",,Consumer Internet,Bike Taxi Service & Hyperlocal Delivery App,Seed Funding,,,,,,,,,,,,,,,,,,,,,500000.0,2016-07-03,2016.0,,noida
20.0,07/3/2016,Ninjacart,,Bangalore,"Accel Partners, Qualcomm Ventures, M&S Partners, Zop Smart",,"3,000,000",,ECommerce,B2B marketplace for Farmers & Retailers,Private Equity,,,,,,,,,,,,,,,,,,,,,3000000.0,2016-07-03,2016.0,,bangalore
21.0,07/3/2016,Reach,,Bangalore,"Rebright Partners, Sol Primero, Sudhir Anandarao, Ankur Warikoo, Ankur Singla",,"500,000",,Consumer Internet,Cross Platform P2P file sharing mobile app,Seed Funding,,,,,,,,,,,,,,,,,,,,,500000.0,2016-07-03,2016.0,,bangalore
22.0,07/3/2016,Vanity Cube,,New Delhi,Unicorn Ventures,,"250,000",,Consumer Internet,Hyperlocal Beauty Services platform,Seed Funding,,,,,,,,,,,,,,,,,,,,,250000.0,2016-07-03,2016.0,,new delhi
23.0,07/3/2016,Wooplr,,Bangalore,"Naveen Tewari, Abhay Singhal, Amit Gupta, Piyush Shah, Raghunandan G, Rajiv Mehta",,,,ECommerce,Curated Fashion ECommerce portal,Seed Funding,,,,,,,,,,,,,,,,,,,,,,2016-07-03,2016.0,,bangalore
24.0,07/3/2016,Medidaili,,Bangalore,Undisclosed private investors,,"100,000",,Consumer Internet,Medical Support service platform,Seed Funding,,,,,,,,,,,,,,,,,,,,,100000.0,2016-07-03,2016.0,,bangalore
25.0,08/3/2016,Finomena,,New Delhi,Matrix Partners India,,,,Technology,Credit Worthiness Big Data Analytics,Private Equity,,,,,,,,,,,,,,,,,,,,,,2016-08-03,2016.0,,new delhi
26.0,08/3/2016,Cookaroo,,Bangalore,Vijay Krishna Yadav,,,,Consumer Internet,Food Delivery Platform,Seed Funding,,,,,,,,,,,,,,,,,,,,,,2016-08-03,2016.0,,bangalore
27.0,08/3/2016,vPhrase Analytics,,Mumbai,"Apoorv Ranjan Sharma, Daud Ali and others",,,,Technology,AI based data analytics platform,Seed Funding,,,,,,,,,,,,,,,,,,,,,,2016-08-03,2016.0,,mumbai
28.0,08/3/2016,LoveCycles,,Bangalore,Prime Venture Partners,,"750,000",,Consumer Internet,Women’s health Tracker,Seed Funding,,,,,,,,,,,,,,,,,,,,,750000.0,2016-08-03,2016.0,,bangalore
29.0,08/3/2016,Kartrocket,,New Delhi,"Undisclosed Japanese investor, Bertelsmann India Investments, Nirvana Digital India Fund, Nirvana Digital Investment Holding Co Ltd, 500 Start-Ups",,"8,000,000",,ECommerce,ECommerce SAAS platform,Private Equity,,,,,,,,,,,,,,,,,,,,,8000000.0,2016-08-03,2016.0,,new delhi
30.0,08/3/2016,dunzo,,Bangalore,"Aspada Investment Advisors, Blume Ventures.",,"650,000",,Consumer Internet,Daily Task Management App,Seed Funding,,,,,,,,,,,,,,,,,,,,,650000.0,2016-08-03,2016.0,,bangalore
31.0,09/3/2016,Indiamart,,Noida,Amadeus Capital,,,,ECommerce,B2B Marketplace for SMBs,Private Equity,,,,,,,,,,,,,,,,,,,,,,2016-09-03,2016.0,,noida
32.0,09/3/2016,SmartVizX,,Noida,"Indian Angel Network, Stanford Angels, Entrepreneurs India",,"500,000",,Technology,Virtual Reality Solutions,Seed Funding,,,,,,,,,,,,,,,,,,,,,500000.0,2016-09-03,2016.0,,noida
33.0,09/3/2016,MyGubbi,,Bangalore,"Vipul Parekh, ajesh K Murthy,",,"2,500,000",,Real Estate,Interior Design & Home Décor Solutions,Seed Funding,,,,,,,,,,,,,,,,,,,,,2500000.0,2016-09-03,2016.0,,bangalore
34.0,09/3/2016,Nukkad Shops,,Hyderabad,PurpleTalk Inc,,"1,000,000",,Consumer Internet,Hyperlocal Grocery Delivery Service,Seed Funding,,,,,,,,,,,,,,,,,,,,,1000000.0,2016-09-03,2016.0,,hyderabad
35.0,09/3/2016,Cloudacar,,Pune,"Amit Choudhary, Anuj Puri",,,,Consumer Internet,Carpooling Mobile App,Seed Funding,,,,,,,,,,,,,,,,,,,,,,2016-09-03,2016.0,,pune
36.0,09/3/2016,Justride,,Mumbai,Dheeraj Jain & Other angel investors,,"400,000",,Consumer Internet,Self Drive Car Rental,Seed Funding,,,,,,,,,,,,,,,,,,,,,400000.0,2016-09-03,2016.0,,mumbai
37.0,09/3/2016,Yana,,Gurgaon,"Puneet Gupta,",,,,Consumer Internet,Personal AI Transaction Engine App,Seed Funding,,,,,,,,,,,,,,,,,,,,,,2016-09-03,2016.0,,gurgaon
38.0,10/3/2016,Big Fish Ventures,,New Delhi,Undisclosed investors,,"11,100,000",,Food & Beverage,premium dining lounges Chain,Private Equity,,,,,,,,,,,,,,,,,,,,,11100000.0,2016-10-03,2016.0,,new delhi
39.0,10/3/2016,Stylflip,,Mumbai,"Raj Gala Shah, Zaheer Memon",,,,ECommerce,Pre-Owned Fashion marketplace mobile app,Seed Funding,,,,,,,,,,,,,,,,,,,,,,2016-10-03,2016.0,,mumbai
40.0,10/3/2016,Icertis,,Pune/Seattle,"Ignition Partners, Greycroft Partners, Fidelity Growth Partners India",,"15,000,000",,Technology,Contract Management Software Solutions platform,Private Equity,,,,,,,,,,,,,,,,,,,,,15000000.0,2016-10-03,2016.0,,pune/seattle
41.0,10/3/2016,Supplified,,New Delhi,Mohit Goel,,"1,000,000",,ECommerce,Construction material eTailer,Seed Funding,,,,,,,,,,,,,,,,,,,,,1000000.0,2016-10-03,2016.0,,new delhi
42.0,11/3/2016,JollyFoodFellow,,Ahmedabad,Janak Parikh,,,,Technology,Food Related Marketing & Branding platform,Seed Funding,,,,,,,,,,,,,,,,,,,,,,2016-11-03,2016.0,,ahmedabad
43.0,14/3/2016,PinkBlue,,Bangalore,"Hari Krishna, Ajay Modani, Dr V Ravinder, Anirudh Rastogi, Abhishek Jain, Rakesh Gakhar, Rajeev Mudumba, Nagendra Prasad Bhanuprakash",,"223,608",,ECommerce,Medical Supplies eTailer,Seed Funding,,,,,,,,,,,,,,,,,,,,,223608.0,2016-03-14,2016.0,,bangalore
44.0,14/3/2016,TruckingCube,,New Delhi,Agarwal Movers Group,,"14,900,000",,Logistics,"Domestic, Commercial, and Industrial Goods Movers",Private Equity,,,,,,,,,,,,,,,,,,,,,14900000.0,2016-03-14,2016.0,,new delhi
45.0,14/3/2016,eSwasthya,,Ahmedabad,Hemang Sahani,,,,Consumer Internet,Online Medicine Delivery Aggregator,Seed Funding,,,,,,,,,,,,,,,,,,,,,,2016-03-14,2016.0,,ahmedabad
46.0,15/3/2016,FlipClass,,Bangalore,"S Chand and Co Pvt Ltd, Blume Ventures",,"1,000,000",,Consumer Internet,Tutor Search Platform,Private Equity,,,,,,,,,,,,,,,,,,,,,1000000.0,2016-03-15,2016.0,,bangalore
47.0,15/3/2016,Proximit,,Pune,Funding through 1Crowd platform,,"150,000",,Technology,Advertising Technology,Seed Funding,,,,,,,,,,,,,,,,,,,,,150000.0,2016-03-15,2016.0,,pune
48.0,15/3/2016,WithMe,,Gurgaon,"Alex Kuruvilla, Pradeep Guha, Saket Dhankar, Rajan Pandhare",,"250,000",,Consumer Internet,Personalized Fashion App,Seed Funding,,,,,,,,,,,,,,,,,,,,,250000.0,2016-03-15,2016.0,,gurgaon
49.0,16/3/2016,Gapoon,,Bangalore,"Chandrashekar Tallapragada, Pankaj Kapoor",,"180,000",,Consumer Internet,Hyperlocal Home Maintenance services,Seed Funding,,,,,,,,,,,,,,,,,,,,,180000.0,2016-03-16,2016.0,,bangalore
50.0,16/3/2016,Avagmah,,Bangalore,"Kris Gopalakrishnan, Atul Nishar",,,,Consumer Internet,Online Education Portal,Seed Funding,,,,,,,,,,,,,,,,,,,,,,2016-03-16,2016.0,,bangalore
51.0,16/3/2016,WorkIndia,,Mumbai,Beenext,,,,Consumer Internet,Online Job Board,Seed Funding,,,,,,,,,,,,,,,,,,,,,,2016-03-16,2016.0,,mumbai
52.0,16/3/2016,Wealthy,,Bangalore,"Zishaan Hayath, Abhishek Goyal, Arjun and Rohan Malhotra, Harpreet Singh Grover, Gagan Dugal",,"250,000",,Consumer Internet,Online Investment management portal,Seed Funding,,,,,,,,,,,,,,,,,,,,,250000.0,2016-03-16,2016.0,,bangalore
53.0,17/3/2016,Pramati,,Noida,Undisclosed investors,,"200,000",,Healthcare,Specialized Patient Care platform,Seed Funding,,,,,,,,,,,,,,,,,,,,,200000.0,2016-03-17,2016.0,,noida
54.0,17/3/2016,Qlivery,,Gurgaon,Swastika Company Ltd,,"230,000",,Consumer Internet,Ondemand Concierge Service,Seed Funding,,,,,,,,,,,,,,,,,,,,,230000.0,2016-03-17,2016.0,,gurgaon
55.0,17/3/2016,HealthEnablr,,Mumbai,Undisclosed investors,,"800,000",,Consumer Internet,Doctor Discovery and booking platform,Seed Funding,,,,,,,,,,,,,,,,,,,,,800000.0,2016-03-17,2016.0,,mumbai
56.0,17/3/2016,Liftiee,,Mumbai,"Rannvijay Singh, Anita Hassanandani",,"108,000",,Consumer Internet,Car/ bike Pooling App,Seed Funding,,,,,,,,,,,,,,,,,,,,,108000.0,2016-03-17,2016.0,,mumbai
57.0,18/3/2016,Hello Curry,,Hyderabad,Sashi Reddi & Other unnamed investors,,"1,500,000",,Food & Beverage,Quick Service Restaurant Chain,Private Equity,,,,,,,,,,,,,,,,,,,,,1500000.0,2016-03-18,2016.0,,hyderabad
58.0,19/3/2016,goSporto,,New Delhi,Naveen Gupta,,"30,000",,Consumer Internet,Online Sports discovery and booking platform,Seed Funding,,,,,,,,,,,,,,,,,,,,,30000.0,2016-03-19,2016.0,,new delhi
59.0,21/3/2016,OneClickWash,,Gurgaon,Unitus Seed Fund,,,,Consumer Internet,Online Laundry & Washing service Booking & Delivery,Seed Funding,,,,,,,,,,,,,,,,,,,,,,2016-03-21,2016.0,,gurgaon
60.0,21/3/2016,Girnar Software,,Jaipur,Google Capital,,,,Consumer Internet,Online News Media Network,Private Equity,,,,,,,,,,,,,,,,,,,,,,2016-03-21,2016.0,,jaipur
61.0,21/3/2016,Room On Call,,Gurgaon,CASHurDRIVE Marketing Pvt Ltd,,"2,000,000",,Consumer Internet,Budget hotel aggregator,Private Equity,,,,,,,,,,,,,,,,,,,,,2000000.0,2016-03-21,2016.0,,gurgaon
62.0,22/3/2016,Byju’s,,Bangalore,"Sequoia India, Sofina",,"75,000,000",,Consumer Internet,Educational Video Content Creator,Private Equity,,,,,,,,,,,,,,,,,,,,,75000000.0,2016-03-22,2016.0,,bangalore
63.0,22/3/2016,BigBasket,,Bangalore,Abraaj Group,,"150,000,000",,eCommerce,Online Grocery Shop,Private Equity,,,,,,,,,,,,,,,,,,,,,150000000.0,2016-03-22,2016.0,,bangalore
64.0,22/3/2016,DrivoJoy,,Bangalore,"Indian Angel Network, Tracxn Labs & Others",,"600,000",,Consumer Internet,On-demand 2-wheeler Servicing platform,Seed Funding,,,,,,,,,,,,,,,,,,,,,600000.0,2016-03-22,2016.0,,bangalore
65.0,22/3/2016,Smartron,,Bangalore,Sachin Tendulkar,,,,Technology,Internet of Things Device manufacturer,Private Equity,,,,,,,,,,,,,,,,,,,,,,2016-03-22,2016.0,,bangalore
66.0,22/3/2016,LifCare,,Jaipur,"Rajul Garg, Alok Mittal, Kunal Shah, Rishi Mandawat, Dheeraj Jain, Sandeep Tandon, Dexter Angel Circle",,,,Consumer Internet,Online Pharmacy portal,Seed Funding,,,,,,,,,,,,,,,,,,,,,,2016-03-22,2016.0,,jaipur
67.0,22/3/2016,CreditSeva,,Hyderabad,"Pix Vine Capital, Infocomm Development Authority of Singapore",,"360,000",,Consumer Internet,Online Credit management tools,Seed Funding,,,,,,,,,,,,,,,,,,,,,360000.0,2016-03-22,2016.0,,hyderabad
68.0,22/3/2016,CityShor,,Ahmedabad,GAIN,,,,Consumer Internet,online lifestyle media recommendation portal,Seed Funding,,,,,,,,,,,,,,,,,,,,,,2016-03-22,2016.0,,ahmedabad
69.0,23/3/2016,Endless Robotics,,Hyderabad,"Devidas Desai, Vipul Gautam, Singapore Angel Network",,"100,000",,Technology,Interior Painting Automation,Seed Funding,,,,,,,,,,,,,,,,,,,,,100000.0,2016-03-23,2016.0,,hyderabad
70.0,23/3/2016,SP Robotics,,Chennai,"Indian Angel Network,",,"300,000",,Technology,Robotic Classes for Students,Seed Funding,,,,,,,,,,,,,,,,,,,,,300000.0,2016-03-23,2016.0,,chennai
71.0,23/3/2016,StalkBuyLove,,New Delhi,"500 Startups, Littlerock, Singularity Ventures",,,,eCommerce,Fashion eTailer,Seed Funding,,,,,,,,,,,,,,,,,,,,,,2016-03-23,2016.0,,new delhi
72.0,23/3/2016,eKincare,,Hyderabad,"BitChemy Ventures, Maheshwari Investments Pvt Ltd, Anshoo Gaur, Rama Krishna Reddy, Sandeep Seerapu",,"330,000",,Consumer Internet,Healthcare related solutions,Private Equity,,,,,,,,,,,,,,,,,,,,,330000.0,2016-03-23,2016.0,,hyderabad
73.0,23/3/2016,HashLearn,,,"Bhavish Aggarwal, Binny Bansal,  Rajan Anandan, Mekin Maheshwar, Sunil Kalra, Anupam Mittal, Krishna Mehra, Singapore Angel Network",,,,Consumer Internet,Mobile based private tutoring services,Seed Funding,,,,,,,,,,,,,,,,,,,,,,2016-03-23,2016.0,,
74.0,23/3/2016,Wheelstreet,,Bangalore,Broadbean Capital services,,"500,000",,Consumer Internet,Online Bike Rental platform,Private Equity,,,,,,,,,,,,,,,,,,,,,500000.0,2016-03-23,2016.0,,bangalore
75.0,24/3/2016,Horntell,,Gurgaon,"Bharanidharan Viswanathan, Sanjiv Mittal, Shobhit Shukla, Rahul Agarwal",,"150,000",,Consumer Internet,Unified Push Notification service,Seed Funding,,,,,,,,,,,,,,,,,,,,,150000.0,2016-03-24,2016.0,,gurgaon
76.0,28/3/2016,Schoolkart,,Noida,Undisclosed investors,,"300,000",,eCommerce,Online Marketplace for Schools,Seed Funding,,,,,,,,,,,,,,,,,,,,,300000.0,2016-03-28,2016.0,,noida
77.0,29/3/2016,HealthEminds,,Bangalore,Robin Utthappa,,,,Consumer Internet,Online mental healthcare,Seed Funding,,,,,,,,,,,,,,,,,,,,,,2016-03-29,2016.0,,bangalore
78.0,29/3/2016,Babygogo,,New Delhi,"Rajul Garg, Daljit Singh, Aditya Vij, Kishore Kumar, Shuchin Bajaj",,"300,000",,Consumer Internet,Child healthcare experts aggregator mobile app,Seed Funding,,,,,,,,,,,,,,,,,,,,,300000.0,2016-03-29,2016.0,,new delhi
79.0,29/3/2016,Veritas Finance,,Chennai,Sarva Capital,,"4,700,000",,Finance,Asset Based Lending platform,Private Equity,,,,,,,,,,,,,,,,,,,,,4700000.0,2016-03-29,2016.0,,chennai
80.0,29/3/2016,QikShip,,New Delhi,undisclosed investors,,"200,000",,Consumer Internet,Mobile based Logistics provider,Seed Funding,,,,,,,,,,,,,,,,,,,,,200000.0,2016-03-29,2016.0,,new delhi
81.0,29/3/2016,FixNix,,Chennai,Jay Vijayan,,"500,000",,Consumer Internet,GRC SAAS Platform,Seed Funding,,,,,,,,,,,,,,,,,,,,,500000.0,2016-03-29,2016.0,,chennai
82.0,30/3/2016,True Balance,,Gurgaon,SoftBank Ventures Korea,,,,Technology,Mobile Balance Check App,Private Equity,,,,,,,,,,,,,,,,,,,,,,2016-03-30,2016.0,,gurgaon
83.0,30/3/2016,Touchkin,,Bangalore,"Alok Mittal, Amit Gupta, Anuj Srivastava, Himanshu Aggarwal, Raghunandan G, Puneet Agarwal",,"400,000",,Healthcare,Predictive Healthcare platform,Seed Funding,,,,,,,,,,,,,,,,,,,,,400000.0,2016-03-30,2016.0,,bangalore
84.0,31/3/2016,SwitchMe,,Mumbai,"Mohandas Pai, Hiro Mashita, Singapore Angel Network, 500 Startups, Rajan Anandan, Ajay Sarupria",,,,Consumer Internet,Home Loan Rate comparison platform,Seed Funding,,,,,,,,,,,,,,,,,,,,,,2016-03-31,2016.0,,mumbai
85.0,31/3/2016,Transcell,,Hyderabad,Indian Angel Network,,,,Healthcare,Family Stem Cell Banking Services,Seed Funding,,,,,,,,,,,,,,,,,,,,,,2016-03-31,2016.0,,hyderabad
87.0,,,,,,,,,,,,,,,,,,,,,,,,,,,,,,,,,,,,
88.0,,,,,,,,,,,,,,,,,,,,,,,,,,,,,,,,,,,,
1.0,01/5/2016,MotoMojo,,Mumbai,"Niloufer Dundh, Fauzan Rahim, Balamurugan Mani,",,,,Consumer Internet,Mobile based Vehicle maintenance App,Seed Funding,,,,,,,,,,,,,,,,,,,,,,2016-01-05,2016.0,,mumbai
2.0,01/5/2016,Get My Parking,,New Delhi,The Chennai Angels,,"376,000",,Technology,Parking Technology Platform,Seed Funding,,,,,,,,,,,,,,,,,,,,,376000.0,2016-01-05,2016.0,,new delhi
3.0,01/5/2016,Prescribez,,Pune,Ankush Mehta,,"145,000",,Consumer Internet,Health Service Aggregator Platform,Seed Funding,,,,,,,,,,,,,,,,,,,,,145000.0,2016-01-05,2016.0,,pune
4.0,02/5/2016,Airwood,,Chennai,StartupXseed Ventures,,,,Technology,Agri Data & Analytics Platform,Seed Funding,,,,,,,,,,,,,,,,,,,,,,2016-02-05,2016.0,,chennai
5.0,03/5/2016,Mobikwik,,Gurgaon,"GMO Payment Gateway, MediaTek",,"50,000,000",,Consumer Internet,Mobile & Digital Wallet,Private Equity,,,,,,,,,,,,,,,,,,,,,50000000.0,2016-03-05,2016.0,,gurgaon
6.0,03/5/2016,iDreamCareer,,New Delhi,Brand Capital,,,,Consumer Internet,Career Planning Services Portal,Private Equity,,,,,,,,,,,,,,,,,,,,,,2016-03-05,2016.0,,new delhi
7.0,03/5/2016,Zwayam,,Bangalore,Undisclosed investors,,"250,000",,Consumer Internet,Online Recruitment Platform,Seed Funding,,,,,,,,,,,,,,,,,,,,,250000.0,2016-03-05,2016.0,,bangalore
8.0,03/5/2016,BoiBanit,,Vadodara,Undisclosed investors,,,,Consumer Internet,Online Food Delivery platform,Seed Funding,,,,,,,,,,,,,,,,,,,,,,2016-03-05,2016.0,,vadodara
9.0,03/5/2016,Zuver,,Mumbai,"Shruth & Smith Group, Hermes Group",,"180,000",,Consumer Internet,Car driver Discovery App,Seed Funding,,,,,,,,,,,,,,,,,,,,,180000.0,2016-03-05,2016.0,,mumbai
10.0,03/5/2016,Prepathon,,Mumbai,Blume Ventures,,,,Education,Competitive Exam learning platform,Private Equity,,,,,,,,,,,,,,,,,,,,,,2016-03-05,2016.0,,mumbai
11.0,04/5/2016,EasyRoads,,Mumbai,"Rohan Angrish, Hrishi Oberoi, Rahul Mehta, Kapil Hetamsaria, Pranav Dedhia",,"200,000",,Consumer Internet,Road Trip planning Mobile app,Seed Funding,,,,,,,,,,,,,,,,,,,,,200000.0,2016-04-05,2016.0,,mumbai
12.0,04/5/2016,Lenskart,,New Delhi,"International Finance Corp, TPG Growth, Adveq Management, IDG Ventures, Ratan Tata, Kris Gopalakrishnan",,"60,000,000",,eCommerce,Eyewear & Accessories etailer,Private Equity,,,,,,,,,,,,,,,,,,,,,60000000.0,2016-04-05,2016.0,,new delhi
13.0,04/5/2016,Seclore,,Mumbai,"Sistema Asia Fund, Helion Venture, VentureEast, India Alternatives",,"12,000,000",,Technology,Enterprise Security Technology platform,Private Equity,,,,,,,,,,,,,,,,,,,,,12000000.0,2016-04-05,2016.0,,mumbai
14.0,04/5/2016,SolarTown,,Chennai,Grex.in,,"200,000",,Technology,Solar Rooftop system installation company,Seed Funding,,,,,,,,,,,,,,,,,,,,,200000.0,2016-04-05,2016.0,,chennai
15.0,04/5/2016,Comarete,,Pune,Grex.in,,"200,000",,Technology,Telecom & Media IT services company,Seed Funding,,,,,,,,,,,,,,,,,,,,,200000.0,2016-04-05,2016.0,,pune
16.0,04/5/2016,MyDentistChoice,,Hyderabad,Undisclosed investors,,"150,000",,eCommerce,Medical Supplies eTailer,Seed Funding,,,,,,,,,,,,,,,,,,,,,150000.0,2016-04-05,2016.0,,hyderabad
17.0,04/5/2016,Active.ai,,Singapore,Kalaari Capital Accelerator Program,,"500,000",,Technology,Intelligent Tech platform for Finance vertical,Seed Funding,,,,,,,,,,,,,,,,,,,,,500000.0,2016-04-05,2016.0,,singapore
18.0,04/5/2016,Affordplan,,New Delhi,Kalaari Capital Accelerator Program,,"500,000",,Technology,Affordable non-emergency medical service health plans,Seed Funding,,,,,,,,,,,,,,,,,,,,,500000.0,2016-04-05,2016.0,,new delhi
19.0,04/5/2016,Indee,,Bangalore,Kalaari Capital Accelerator Program,,"500,000",,Consumer Internet,Web Video Streaming Platform,Seed Funding,,,,,,,,,,,,,,,,,,,,,500000.0,2016-04-05,2016.0,,bangalore
20.0,05/5/2016,Unbxd,,New Delhi,"IDG Ventures, Inventus Capital, Indian Angel Network",,,,Technology,eCommerce product discovery software,Private Equity,,,,,,,,,,,,,,,,,,,,,,2016-05-05,2016.0,,new delhi
21.0,05/5/2016,WebAlligator,,Bangalore,Group of undisclosed Angel Investors & HNIs,,"375,000",,Consumer Internet,Cloud Based Software Solutions,Seed Funding,,,,,,,,,,,,,,,,,,,,,375000.0,2016-05-05,2016.0,,bangalore
22.0,06/5/2016,EduAce Services,,Lucknow,MoMagic Technologies,,"1,000,000",,Education,Education Workshops & mentoring programs,Private Equity,,,,,,,,,,,,,,,,,,,,,1000000.0,2016-06-05,2016.0,,lucknow
23.0,06/5/2016,Meesho,,Bangalore,Rajul Garg & Others,,,,eCommerce,Social commerce platform,Seed Funding,,,,,,,,,,,,,,,,,,,,,,2016-06-05,2016.0,,bangalore
24.0,07/5/2016,Zebroads,,Hyderabad,Undisclosed investors,,"75,000",,Logistics,Logistics and Warehousing services,Seed Funding,,,,,,,,,,,,,,,,,,,,,75000.0,2016-07-05,2016.0,,hyderabad
25.0,09/5/2016,Locus,,Bangalore,"Exfinity Venture Partners, Blume Ventures, BeeNext, Rajesh Ranavat",,"2,750,000",,Technology,Logistics Intelligence platform,Private Equity,,,,,,,,,,,,,,,,,,,,,2750000.0,2016-09-05,2016.0,,bangalore
26.0,09/5/2016,Toko Innovations,,Bangalore,"Roopak Saluja, Vishal Khare",,"450,000",,Consumer Internet,Children’s Entertainment Portal,Seed Funding,,,,,,,,,,,,,,,,,,,,,450000.0,2016-09-05,2016.0,,bangalore
27.0,09/5/2016,Rentickle,,New Delhi,"Manish Kheterpal, Vinay Mittal, Dinesh Mittal, Sandeep Gupta",,"250,000",,eCommerce,"Furniture, appliances Portal",Seed Funding,,,,,,,,,,,,,,,,,,,,,250000.0,2016-09-05,2016.0,,new delhi
28.0,10/5/2016,HealthifyMe,,Bangalore,"IDG Ventures India, Inventus Capital, Blume Ventures",,"6,000,000",,Consumer Internet,Health & Fitness App,Private Equity,,,,,,,,,,,,,,,,,,,,,6000000.0,2016-10-05,2016.0,,bangalore
29.0,10/5/2016,Zarget,,Chennai,"Accel Partners, Matrix Partners, Girish Mathrubootham",,"1,500,000",,Consumer Internet,Conversion Rate Optimization Platform,Private Equity,,,,,,,,,,,,,,,,,,,,,1500000.0,2016-10-05,2016.0,,chennai
30.0,10/5/2016,InnoNano Research,,Chennai,NanoHoldings,,"18,000,000",,Technology,Clean Water Technology,Private Equity,,,,,,,,,,,,,,,,,,,,,18000000.0,2016-10-05,2016.0,,chennai
31.0,10/5/2016,SchoolWear,,Mumbai,Undisclosed investors,,"1,500,000",,eCommerce,School Uniform & Supplies Marketplace,Seed Funding,,,,,,,,,,,,,,,,,,,,,1500000.0,2016-10-05,2016.0,,mumbai
32.0,10/5/2016,Swiggy,,Bangalore,"Norwest Venture Partners, DST Global, Accel Partners",,"7,000,000",,Consumer Internet,Food Delivery Platform,Private Equity,,,,,,,,,,,,,,,,,,,,,7000000.0,2016-10-05,2016.0,,bangalore
33.0,11/5/2016,Zenify,,Bangalore,Undisclosed Investors,,"900,000",,Consumer Internet,Home rental Discovery & Booking Portal,Private Equity,,,,,,,,,,,,,,,,,,,,,900000.0,2016-11-05,2016.0,,bangalore
34.0,11/5/2016,Faircent,,Gurgaon,"JM Financial Products Ltd, Arun Tadanki, Doreswamy Nandkishore, Kshitij Jain",,,,Consumer Internet,Online Peer to Peer Lending platform,Private Equity,,,,,,,,,,,,,,,,,,,,,,2016-11-05,2016.0,,gurgaon
35.0,11/5/2016,Fractal Analytics,,Mumbai,Khazanah Nasional Berhad,,"100,000,000",,Technology,Data Analytics Company,Private Equity,,,,,,,,,,,,,,,,,,,,,100000000.0,2016-11-05,2016.0,,mumbai
36.0,12/5/2016,Unacademy,,Bangalore,"Blume Ventures, Rajan Anandan, Sumit Jain, Aprameya Radhakrishna, Sujeet Kumar, Phanindra Sama",,"500,000",,Consumer Internet,Free Online Education Platform,Seed Funding,,,,,,,,,,,,,,,,,,,,,500000.0,2016-12-05,2016.0,,bangalore
37.0,12/5/2016,Capital Float,,Bangalore,"Creation Investments Capital Management, SAIF Partners, Sequoia Capital, Aspada Ventures",,"25,000,000",,Consumer Internet,Online Lending Platform,Private Equity,,,,,,,,,,,,,,,,,,,,,25000000.0,2016-12-05,2016.0,,bangalore
38.0,12/5/2016,Life Circle,,Hyderabad,GROUPE SOS,,"150,000",,Healthcare,Senior Healthcare Services,Private Equity,,,,,,,,,,,,,,,,,,,,,150000.0,2016-12-05,2016.0,,hyderabad
39.0,12/5/2016,Dream Wallets,,Jaipur,"Rakesh Gupta, Aditya Aggarwal, Siddharth Banerjee, Vikas Ranjan, Anshul Jindal, Sunil Koul, and Sanjeev Agrawal",,,,Consumer Internet,Online Crowdfunding platform,Seed Funding,,,,,,,,,,,,,,,,,,,,,,2016-12-05,2016.0,,jaipur
40.0,12/5/2016,ShabdNagari,,Kanpur,ah! Ventures,,,,Consumer Internet,Hindi social networking portal,Seed Funding,,,,,,,,,,,,,,,,,,,,,,2016-12-05,2016.0,,kanpur
41.0,12/5/2016,Galleri5,,Bangalore,"Phanindra Sama, Raghunandan G,",,,,Consumer Internet,Visual Content Discovery platform,Seed Funding,,,,,,,,,,,,,,,,,,,,,,2016-12-05,2016.0,,bangalore
42.0,12/5/2016,Derbii,,Gurgaon,Anurag Chauhan,,,,Logistics,Carpooling Services,Seed Funding,,,,,,,,,,,,,,,,,,,,,,2016-12-05,2016.0,,gurgaon
43.0,13/5/2016,StayZilla,,Chennai,"Matrix Partners, Nexus Ventures",,"13,500,000",,Consumer Internet,Budget Room Aggregator Booking platform,Private Equity,,,,,,,,,,,,,,,,,,,,,13500000.0,2016-05-13,2016.0,,chennai
44.0,13/5/2016,WoW Express,,Mumbai,Undisclosed Investors & Tamarind Family Private Trust,,"2,200,000",,Logistics,E-Commerce Logistics Solutions,Private Equity,,,,,,,,,,,,,,,,,,,,,2200000.0,2016-05-13,2016.0,,mumbai
45.0,16/5/2016,Smartivity,,Delhi,"S Chand, AdvantEdge Partners",,"1,000,000",,eCommerce,Smart Learning products,Private Equity,,,,,,,,,,,,,,,,,,,,,1000000.0,2016-05-16,2016.0,,delhi
46.0,16/5/2016,BedBathMore,,Mumbai,"Kinnevik Group, Rocket Internet",,,,Consumer Internet,Home Decor eMarketplace,Private Equity,,,,,,,,,,,,,,,,,,,,,,2016-05-16,2016.0,,mumbai
47.0,17/5/2016,Murgency,,Mumbai,Rata Tata,,,,Consumer Internet,Medical Emergency Response App,Private Equity,,,,,,,,,,,,,,,,,,,,,,2016-05-17,2016.0,,mumbai
48.0,17/5/2016,Crownit,,Gurgaon,"Undisclosed investors, Accel Partners, Helion Venture Partners",,,,Consumer Internet,Mobile customer rewards management platform,Private Equity,,,,,,,,,,,,,,,,,,,,,,2016-05-17,2016.0,,gurgaon
49.0,17/5/2016,Blinge,,Mumbai,"Anupam Mittal, Anuj Srivastava, Ankit Nagori",,,,eCommerce,Apparel Rental platform,Seed Funding,,,,,,,,,,,,,,,,,,,,,,2016-05-17,2016.0,,mumbai
50.0,18/5/2016,TheSmartQ,,Bangalore,YourNest Angel Fund,,"250,000",,Consumer Internet,Food Ordering Mobile App,Seed Funding,,,,,,,,,,,,,,,,,,,,,250000.0,2016-05-18,2016.0,,bangalore
51.0,18/5/2016,PurpleHealth,,Trivandrum,Katabole Technology Venture,,"100,000",,Consumer Internet,Online health-on-demand platform,Seed Funding,,,,,,,,,,,,,,,,,,,,,100000.0,2016-05-18,2016.0,,trivandrum
52.0,18/5/2016,Fundamentor,,Pune,Subramanya SV,,,,Education,Aptitude Development Program,Seed Funding,,,,,,,,,,,,,,,,,,,,,,2016-05-18,2016.0,,pune
53.0,18/5/2016,EduPristine,,Mumbai,"Kaizen Management Advisors, DeVry Inc",,"10,000,000",,Education,Online Certification Courses,Private Equity,,,,,,,,,,,,,,,,,,,,,10000000.0,2016-05-18,2016.0,,mumbai
54.0,18/5/2016,BhiveWorkspace,,Bangalore,Blume Ventures,,"1,000,000",,Reality,Co-Working Spaces,Private Equity,,,,,,,,,,,,,,,,,,,,,1000000.0,2016-05-18,2016.0,,bangalore
55.0,18/5/2016,Parentlane,,Bangalore,"Sujeet Kumar, Aprameya, Sumit Jain, Subramanya Venkat, Venk, Ravi Machani, Hitesh Gupta, Rohit Choudhary",,,,Consumer Internet,Parenting & Child Care app,Seed Funding,,,,,,,,,,,,,,,,,,,,,,2016-05-18,2016.0,,bangalore
56.0,19/5/2016,Appie,,Mumbai,Undisclosed investors,,"1,000,000",,Consumer Internet,Location-based offline retail discovery platform,Seed Funding,,,,,,,,,,,,,,,,,,,,,1000000.0,2016-05-19,2016.0,,mumbai
57.0,19/5/2016,Niki.ai,,Bangalore,Ratan Tata,,,,Technology,Artificial Intelligence Platform,Private Equity,,,,,,,,,,,,,,,,,,,,,,2016-05-19,2016.0,,bangalore
58.0,19/5/2016,TaxiVaxi,,New Delhi,Undisclosed HNIs,,"500,000",,Consumer Internet,Cab Aggregating Platform,Seed Funding,,,,,,,,,,,,,,,,,,,,,500000.0,2016-05-19,2016.0,,new delhi
59.0,19/5/2016,Veqta,,New Delhi,"Chatsworth Management, ITW Digital",,"500,000",,Consumer Internet,On Demand Digital Sports Network,Seed Funding,,,,,,,,,,,,,,,,,,,,,500000.0,2016-05-19,2016.0,,new delhi
60.0,20/5/2016,i2ifunding,,Noida,Undisclosed Investors,,"300,000",,Consumer Internet,Online Peer to Peer Funding,Seed Funding,,,,,,,,,,,,,,,,,,,,,300000.0,2016-05-20,2016.0,,noida
61.0,23/5/2016,EduRev,,Gurgaon,Pradeep Reddy Kamasan,,,,Consumer Internet,Online Learning Platform,Seed Funding,,,,,,,,,,,,,,,,,,,,,,2016-05-23,2016.0,,gurgaon
62.0,23/5/2016,Hoppingo,,New Delhi,vCommission,,"89,000",,Consumer Internet,Fashion Discovery platform,Seed Funding,,,,,,,,,,,,,,,,,,,,,89000.0,2016-05-23,2016.0,,new delhi
63.0,24/5/2016,Eatonomist,,Gurgaon,MCube Capital Advisors Pvt Ltd,,,,Consumer Internet,Food Delivery Platform,Seed Funding,,,,,,,,,,,,,,,,,,,,,,2016-05-24,2016.0,,gurgaon
64.0,24/5/2016,Goalwise,,Bangalore,Undisclosed HNIs,,"1,000,000",,Consumer Internet,Online investment platform,Seed Funding,,,,,,,,,,,,,,,,,,,,,1000000.0,2016-05-24,2016.0,,bangalore
65.0,25/5/2016,Roast,,New Delhi,Indian Angel Network,,,,Consumer Internet,Mobile entertainment App,Seed Funding,,,,,,,,,,,,,,,,,,,,,,2016-05-25,2016.0,,new delhi
66.0,25/5/2016,Address Health,,Bangalore,Gray Matters Capital,,"1,500,000",,Healthcare,Pediatric Primary Healthcare Network,Private Equity,,,,,,,,,,,,,,,,,,,,,1500000.0,2016-05-25,2016.0,,bangalore
67.0,25/5/2016,Arcatron Mobility,,Pune,Sudhir Mehta,,"100,000",,Technology,Mobility Devices for differently abled,Seed Funding,,,,,,,,,,,,,,,,,,,,,100000.0,2016-05-25,2016.0,,pune
68.0,25/5/2016,SheThePeople,,New Delhi,Anand Mahindra,,,,Consumer Internet,Digital platform for Women,Seed Funding,,,,,,,,,,,,,,,,,,,,,,2016-05-25,2016.0,,new delhi
69.0,26/5/2016,Cleartax,,Bangalore,"FF Angel, Sequoia Capital",,"2,000,000",,Consumer Internet,Online Income Tax Filing platform,Private Equity,,,,,,,,,,,,,,,,,,,,,2000000.0,2016-05-26,2016.0,,bangalore
70.0,26/5/2016,Consure Medical,,New Delhi,"Accel Partners, Indian Angel Network, India Innovation Fund India Venture Partners",,,,Healthcare,Medical Devices Kit manufacturer,Private Equity,,,,,,,,,,,,,,,,,,,,,,2016-05-26,2016.0,,new delhi
71.0,26/5/2016,mChamp,,New Delhi,MoMagic Technologies,,"475,000",,Consumer Internet,Celebrity Entertainment Contest App,Seed Funding,,,,,,,,,,,,,,,,,,,,,475000.0,2016-05-26,2016.0,,new delhi
72.0,27/5/2016,Pianta,,Bangalore,"Kunal Shah, Sandeep Tandon",,,,Consumer Internet,Online healthcare service discovery platform,Seed Funding,,,,,,,,,,,,,,,,,,,,,,2016-05-27,2016.0,,bangalore
73.0,30/5/2016,Vahanalytics,,Mumbai,"Anirudh Damani, Vikram Lakhotia",,"200,000",,Technology,Safe driving Analytics platform,Seed Funding,,,,,,,,,,,,,,,,,,,,,200000.0,2016-05-30,2016.0,,mumbai
74.0,31/5/2016,Play Your Sport,,New Delhi,Ashish Gupta and other undisclosed investors,,,,Consumer Internet,Location based Sports & Fitness Discovery App,Seed Funding,,,,,,,,,,,,,,,,,,,,,,2016-05-31,2016.0,,new delhi
75.0,31/5/2016,Koovs,,New Delhi,HT Media Ltd,,"4,400,000",,eCommerce,Apparel & Lifestyle eTailer,Private Equity,,,,,,,,,,,,,,,,,,,,,4400000.0,2016-05-31,2016.0,,new delhi
76.0,31/5/2016,CCavenue,,Mumbai,NSI Infinium Global Pvt. Ltd,,"8,900,000",,Consumer Internet,Payment Gateway,Private Equity,,,,,,,,,,,,,,,,,,,,,8900000.0,2016-05-31,2016.0,,mumbai
77.0,31/5/2016,1mg,,Gurgaon,HBM Healthcare Investments,,,,eCommerce,Online Pharmacy,Private Equity,,,,,,,,,,,,,,,,,,,,,,2016-05-31,2016.0,,gurgaon
78.0,31/5/2016,Tpot,,Gurgaon,Ashish Gupta,,,,Food & Beverage,QSR Chain,Seed Funding,,,,,,,,,,,,,,,,,,,,,,2016-05-31,2016.0,,gurgaon
79.0,31/5/2016,MachaDalo,,Mumbai,Undisclosed Investors,,"175,000",,Consumer Internet,Hyperlocal Advertising Platform,Seed Funding,,,,,,,,,,,,,,,,,,,,,175000.0,2016-05-31,2016.0,,mumbai
80.0,,,,,,,,,,,,,,,,,,,,,,,,,,,,,,,,,,,,
1.0,01/11/2016,PickMyLaundry,,New Delhi,"Kedar Lele, GHV Accelerator",,"200,000",,Consumer Internet,On-Demand Washing & Dry Cleaning Services,Seed Funding,,,,,,,,,,,,,,,,,,,,,200000.0,2016-01-11,2016.0,,new delhi
2.0,02/11/2016,FreshDesk,,Chennai,"Sequoia Capital India, Accel Partners",,"55,000,000",,Consumer Internet,SAAS Based HelpDesk Services,Private Equity,,,,,,,,,,,,,,,,,,,,,55000000.0,2016-02-11,2016.0,,chennai
3.0,02/11/2016,LaundryAnna,,Bangalore,Undisclosed Investors,,"150,000",,Consumer Internet,On-Demand Washing & Dry Cleaning Services,Seed Funding,,,,,,,,,,,,,,,,,,,,,150000.0,2016-02-11,2016.0,,bangalore
4.0,02/11/2016,LetsMD,,New Delhi,"Calcutta Angels Network, LetsVenture, Anupam Mittal, Currae Healthtech Fund",,,,Consumer Internet,Healthcare Services Comparison Platform,Seed Funding,,,,,,,,,,,,,,,,,,,,,,2016-02-11,2016.0,,new delhi
5.0,02/11/2016,Sattviko,,New Delhi,"Raman Roy, Ashish Gupta, Yogesh Andlay, Vaibhav Jain",,,,Food & Beverage,Health Food Restaurant Chain,Seed Funding,,,,,,,,,,,,,,,,,,,,,,2016-02-11,2016.0,,new delhi
6.0,03/11/2016,Zarget,,Chennai,Sequoia India,,"6,000,000",,Technology,SaaS-based web optimisation and marketing platform,Private Equity,,,,,,,,,,,,,,,,,,,,,6000000.0,2016-03-11,2016.0,,chennai
7.0,03/11/2016,DoSelect,,Bangalore,"3one4 Capital, Mumbai Angels, Aarin Capital",,,,Consumer Internet,Skill Showcasing platform,Seed Funding,,,,,,,,,,,,,,,,,,,,,,2016-03-11,2016.0,,bangalore
8.0,03/11/2016,EasyPolicy,,Noida,"Unilazer Ventures,",,"10,000,000",,Consumer Internet,Online insurance Portal,Private Equity,,,,,,,,,,,,,,,,,,,,,10000000.0,2016-03-11,2016.0,,noida
9.0,04/11/2016,Browntape,,Goa,Gati Ltd,,,,Technology,cloud-based software solutions company,Private Equity,,,,,,,,,,,,,,,,,,,,,,2016-04-11,2016.0,,goa
10.0,04/11/2016,Connect India,,Bangalore,Aavishkaar Venture Management,,"1,000,000",,Logistics,Last mile Delivery Network,Private Equity,,,,,,,,,,,,,,,,,,,,,1000000.0,2016-04-11,2016.0,,bangalore
11.0,04/11/2016,Corseco,,New Delhi,"Ameera Shah, Vivek Bhargava",,"150,000",,Technology,AI-based Software as a Service Solution provider,Seed Funding,,,,,,,,,,,,,,,,,,,,,150000.0,2016-04-11,2016.0,,new delhi
12.0,04/11/2016,vImmune,,Bangalore,Undisclosed investor,,,,Consumer Internet,Immunisation Management Platform,Seed Funding,,,,,,,,,,,,,,,,,,,,,,2016-04-11,2016.0,,bangalore
13.0,04/11/2016,The Gourmet Jar,,Noida,Chandigarh Angels Network,,,,eCommerce,Gourmet Food etailer,Seed Funding,,,,,,,,,,,,,,,,,,,,,,2016-04-11,2016.0,,noida
14.0,05/11/2016,Medzin,,New Delhi,A M Sikander,,"45,000",,eCommerce,Online ordering & Delivery of medicines,Seed Funding,,,,,,,,,,,,,,,,,,,,,45000.0,2016-05-11,2016.0,,new delhi
15.0,05/11/2016,Bizongo,,Mumbai,"IDG Ventures, Accel Partners",,"3,000,000",,eCommerce,Packaging Material Marketplace,Private Equity,,,,,,,,,,,,,,,,,,,,,3000000.0,2016-05-11,2016.0,,mumbai
16.0,07/11/2016,Rivigo,,Gurgaon,Warburg Pincus,,"75,000,000",,Technology,Technology based Logistics platform,Private Equity,,,,,,,,,,,,,,,,,,,,,75000000.0,2016-07-11,2016.0,,gurgaon
17.0,07/11/2016,JustRide,,Mumbai,"Justin Kan, Qasar Younis, Paul Bucche, Susa Ventures, Kima Ventures, Axan Venture, SCM Holdings",,"3,000,000",,Consumer Internet,Online Car Sharing platform,Private Equity,,,,,,,,,,,,,,,,,,,,,3000000.0,2016-07-11,2016.0,,mumbai
18.0,09/11/2016,IIM Jobs,,New Delhi,India Quotient,,"2,000,000",,Consumer Internet,Online Job Portal,Private Equity,,,,,,,,,,,,,,,,,,,,,2000000.0,2016-09-11,2016.0,,new delhi
19.0,09/11/2016,Square Yards,,Gurgaon,ADAG Reliance Private Equity,,"12,000,000",,Consumer Internet,Online Property Search Portal,Private Equity,,,,,,,,,,,,,,,,,,,,,12000000.0,2016-09-11,2016.0,,gurgaon
20.0,10/11/2016,GolfLAN,,New Delhi,"YourNest Angel Fund, iSON",,"1,000,000",,Consumer Internet,Golf Session Online Bookings platform,Private Equity,,,,,,,,,,,,,,,,,,,,,1000000.0,2016-10-11,2016.0,,new delhi
21.0,10/11/2016,Yottaasys,,Bangalore,Gleevoaz Ventures,,,,Technology,Data Sciences platform,Private Equity,,,,,,,,,,,,,,,,,,,,,,2016-10-11,2016.0,,bangalore
22.0,10/11/2016,Tone Tag,,Bangalore,"Arun Seth, T.V. Mohandas Pai, Anand Chandrasekaran, Deepak Ghaisas",,,,Technology,Contactless Payment Solution,Private Equity,,,,,,,,,,,,,,,,,,,,,,2016-10-11,2016.0,,bangalore
23.0,11/11/2016,Life in Control,,Gurgaon,RoundGlass Partners,,,,Consumer Internet,Online Diabetes Management platform,Private Equity,,,,,,,,,,,,,,,,,,,,,,2016-11-11,2016.0,,gurgaon
24.0,14/11/2016,Active.ai,,Singapore,"Kalaari Capital, IDG Ventures India",,"3,000,000",,Technology,Banking & Fintech Platform,Private Equity,,,,,,,,,,,,,,,,,,,,,3000000.0,2016-11-14,2016.0,,singapore
25.0,14/11/2016,ElasticRun,,Pune,"Kalaari Capital, Norwest Venture Partners",,"2,000,000",,Technology,Tech driven Logistic & distribution platform,Private Equity,,,,,,,,,,,,,,,,,,,,,2000000.0,2016-11-14,2016.0,,pune
26.0,15/11/2016,NoBroker,,Bangalore,Vijay Shekhar Sharma,,,,Consumer Internet,Online Rental discovery,Seed Funding,,,,,,,,,,,,,,,,,,,,,,2016-11-15,2016.0,,bangalore
27.0,15/11/2016,Zefo,,Bangalore,"Sequoia India, BEENEXT, Helion Ventures",,"6,000,000",,eCommerce,Used Furniture & Appliances Marketplace,Private Equity,,,,,,,,,,,,,,,,,,,,,6000000.0,2016-11-15,2016.0,,bangalore
28.0,15/11/2016,PlaySimple,,Bangalore,"SAIF Partners, IDG Ventures India",,"4,000,000",,Technology,Mobile Gaming portal,Private Equity,,,,,,,,,,,,,,,,,,,,,4000000.0,2016-11-15,2016.0,,bangalore
29.0,16/11/2016,Stasis Labs,,Bangalore,"RTP-HC, Wonder Ventures, Techstars Ventures & Others",,"5,000,000",,Technology,Cloud based  health monitoring platform,Private Equity,,,,,,,,,,,,,,,,,,,,,5000000.0,2016-11-16,2016.0,,bangalore
30.0,17/11/2016,Scienaptic,,Bangalore,Pramod Bhasin,,,,Technology,Data Analytics platform,Seed Funding,,,,,,,,,,,,,,,,,,,,,,2016-11-17,2016.0,,bangalore
31.0,17/11/2016,Koovs,,New Delhi,Times of India Group & Existing investors,,"13,500,000",,eCommerce,Fashion eTailer,Private Equity,,,,,,,,,,,,,,,,,,,,,13500000.0,2016-11-17,2016.0,,new delhi
32.0,17/11/2016,Lawrato,,New Delhi,Indian Angel Network,,,,Consumer Internet,Free Legal Advice,Seed Funding,,,,,,,,,,,,,,,,,,,,,,2016-11-17,2016.0,,new delhi
33.0,17/11/2016,Trip Tap Toe,,Gurgaon,R.S Sharma,,,,Consumer Internet,Online Travel Portal,Seed Funding,,,,,,,,,,,,,,,,,,,,,,2016-11-17,2016.0,,gurgaon
34.0,17/11/2016,Pictor Imaging,,Mumbai,Quarizon,,"147,000",,Consumer Internet,Product Photography Mobile App,Seed Funding,,,,,,,,,,,,,,,,,,,,,147000.0,2016-11-17,2016.0,,mumbai
35.0,18/11/2016,GramCover,,New Delhi,Omnivore Capital,,"1,000,000",,Finance,Insurance Marketplace for the Rural Sector,Seed Funding,,,,,,,,,,,,,,,,,,,,,1000000.0,2016-11-18,2016.0,,new delhi
36.0,18/11/2016,AerMed,,Mumbai,Hitesh Windlass,,,,eCommerce,Online Pharmacy,Seed Funding,,,,,,,,,,,,,,,,,,,,,,2016-11-18,2016.0,,mumbai
37.0,18/11/2016,WorkIndia,,Mumbai,Asuka Holdings,,,,Consumer Internet,Job Board for Clue Collar Jobs,Seed Funding,,,,,,,,,,,,,,,,,,,,,,2016-11-18,2016.0,,mumbai
38.0,21/11/2016,Bats on delivery,,Gurgaon,Devdeep Singh,,"90,000",,Consumer Internet,"Online food, Grocery ordering & Delivery",Seed Funding,,,,,,,,,,,,,,,,,,,,,90000.0,2016-11-21,2016.0,,gurgaon
39.0,21/11/2016,numberz.in,,Gurgaon,"Kae Capital, Khosla Impact",,"650,000",,Technology,Cash Flow Management Solution for Businesses,Seed Funding,,,,,,,,,,,,,,,,,,,,,650000.0,2016-11-21,2016.0,,gurgaon
40.0,22/11/2016,Housing.com,,Mumbai,Softbank Group,,"5,000,000",,Consumer Internet,Real Estate Portal,Private Equity,,,,,,,,,,,,,,,,,,,,,5000000.0,2016-11-22,2016.0,,mumbai
41.0,22/11/2016,Awesummly,,Bangalore,"Vivek Bhargava, Ameera Shah",,"147,000",,Consumer Internet,Short News Mobile App,Seed Funding,,,,,,,,,,,,,,,,,,,,,147000.0,2016-11-22,2016.0,,bangalore
42.0,22/11/2016,VoLT,,Mumbai,YMS Mobitech,,,,Consumer Internet,Ed-Tech Platform,Seed Funding,,,,,,,,,,,,,,,,,,,,,,2016-11-22,2016.0,,mumbai
43.0,22/11/2016,Vymo,,Bangalore,Sequoia India,,"5,000,000",,Technology,SaaS-based predictive analytics platform,Private Equity,,,,,,,,,,,,,,,,,,,,,5000000.0,2016-11-22,2016.0,,bangalore
44.0,22/11/2016,ShubhLoans,,Bangalore,"Sanjai Vohra, V. Bunty Bohra",,,,Technology,Consumer Finance & Credit Score platform,Seed Funding,,,,,,,,,,,,,,,,,,,,,,2016-11-22,2016.0,,bangalore
45.0,22/11/2016,Noddapp,,Mumbai,Undisclosed multiple investors,,"147,000",,Consumer Internet,App based networking platform,Seed Funding,,,,,,,,,,,,,,,,,,,,,147000.0,2016-11-22,2016.0,,mumbai
46.0,23/11/2016,Knowlarity,,Bangalore,"Delta Partners, Sequoia India,  Mayfield, Blacksoil, Trifecta Capital",,"20,000,000",,Consumer Internet,Cloud Telephony Platform,Private Equity,,,,,,,,,,,,,,,,,,,,,20000000.0,2016-11-23,2016.0,,bangalore
47.0,23/11/2016,Infisecure,,Mumbai,"IDG Ventures, Axilor Ventures",,"600,000",,Technology,Bot Protection Solutions,Seed Funding,,,,,,,,,,,,,,,,,,,,,600000.0,2016-11-23,2016.0,,mumbai
48.0,23/11/2016,Udaan,,Bangalore,"Lightspeed Venture Partners India, Lightspeed US",,"10,000,000",,eCommerce,B2B Marketplace,Private Equity,,,,,,,,,,,,,,,,,,,,,10000000.0,2016-11-23,2016.0,,bangalore
49.0,24/11/2016,FroyoFit,,Indore,Dr. Pooja Gandhi,,,,Consumer Internet,Fitness Discovery Platform,Seed Funding,,,,,,,,,,,,,,,,,,,,,,2016-11-24,2016.0,,indore
50.0,24/11/2016,Betterplace,,Bangalore,Venture Highway,,,,Consumer Internet,Background Verification Services,Seed Funding,,,,,,,,,,,,,,,,,,,,,,2016-11-24,2016.0,,bangalore
51.0,24/11/2016,ShareChat,,Mumbai,"Lightspeed India Partners, SAIF Partners, India Quotient, Venture Highway",,"4,000,000",,Consumer Internet,Local Language Social Networking Platform,Private Equity,,,,,,,,,,,,,,,,,,,,,4000000.0,2016-11-24,2016.0,,mumbai
52.0,24/11/2016,UClean,,Gurgaon,Franchise India,,,,Consumer Internet,Tech Enabled Laundry Service Provider,Private Equity,,,,,,,,,,,,,,,,,,,,,,2016-11-24,2016.0,,gurgaon
53.0,24/11/2016,Servify,,Mumbai,"Blume Ventures, BEENEXT, Barkawi Holdings GmbH, TM Service Technology Holdings Gmbh, Sreevathsa Prabhakar",,,,Consumer Internet,Personal Device Assistant App,Private Equity,,,,,,,,,,,,,,,,,,,,,,2016-11-24,2016.0,,mumbai
54.0,25/11/2016,Hubilo,,Ahmedabad,"Girish Mathrubootham, VC Karthic, Miten Mehta, Umasankar Nistala, Rakesh Patel, Akash Bhavsar, Jeevanandhan Rajagopal, Vikas Chadha & Others",,,,Consumer Internet,End-to-end Event Organizers Solutions,Seed Funding,,,,,,,,,,,,,,,,,,,,,,2016-11-25,2016.0,,ahmedabad
55.0,25/11/2016,FunOnGo,,Mumbai,Reliance Entertainment,,,,Consumer Internet,Digital Media Content and Distribution platform,Private Equity,,,,,,,,,,,,,,,,,,,,,,2016-11-25,2016.0,,mumbai
56.0,25/11/2016,121Policy,,Kolkata,Xelpmoc,,,,Consumer Internet,Online Insurance Platform,Seed Funding,,,,,,,,,,,,,,,,,,,,,,2016-11-25,2016.0,,kolkata
57.0,26/11/2016,TapChief,,Bangalore,"Paytm, Aprameya Radhakrishna, Subramanya Venkat, Venk Krishnan",,,,Consumer Internet,Professional Expert Advice Platform,Seed Funding,,,,,,,,,,,,,,,,,,,,,,2016-11-26,2016.0,,bangalore
58.0,28/11/2016,Kloseby,,Bangalore,Undisclosed Investor,,"100,000",,Consumer Internet,proximity based  Rewards platform,Seed Funding,,,,,,,,,,,,,,,,,,,,,100000.0,2016-11-28,2016.0,,bangalore
59.0,28/11/2016,WholeSaleBox,,Jaipur,"Manish Maheshwari, Contrarian Vriddhi Fund",,"2,000,000",,eCommerce,B2B Wholesale Apparel Marketplace,Private Equity,,,,,,,,,,,,,,,,,,,,,2000000.0,2016-11-28,2016.0,,jaipur
60.0,29/11/2016,Crossahead,,Noida,Mohit Sharma,,,,Consumer Internet,Creative Artists Discovery & Booking platform,Seed Funding,,,,,,,,,,,,,,,,,,,,,,2016-11-29,2016.0,,noida
61.0,29/11/2016,Affordplan,,New Delhi,"Prime Venture Partners, Kalaari Capital",,"3,000,000",,Consumer Internet,Savings platform for Medical Expenses,Private Equity,,,,,,,,,,,,,,,,,,,,,3000000.0,2016-11-29,2016.0,,new delhi
62.0,30/11/2016,HandyTrain,,Goa,"Silver Range Investments, Lumina Datamatics, Shun Yoshida & Others",,"1,000,000",,Consumer Internet,Mobile App for SAAS based Training,Private Equity,,,,,,,,,,,,,,,,,,,,,1000000.0,2016-11-30,2016.0,,goa
63.0,30/11/2016,ShopsUp,,Bangalore,"Anand Sankeshwar, Yang Shu",,"963,000",,eCommerce,Hyperlocal Shopping App,Seed Funding,,,,,,,,,,,,,,,,,,,,,963000.0,2016-11-30,2016.0,,bangalore
64.0,30/11/2016,Indofash,,Bangalore,"Shekhar Sahu, Nitesh Pant",,"150,000",,eCommerce,Ethnic Indian Fashion Marketplace,Seed Funding,,,,,,,,,,,,,,,,,,,,,150000.0,2016-11-30,2016.0,,bangalore
65.0,30/11/2016,Entropika,,Bangalore,"Dileep Bhatt, Milind Chaudhary",,"200,000",,Technology,"AI, Machine learning Solutions",Seed Funding,,,,,,,,,,,,,,,,,,,,,200000.0,2016-11-30,2016.0,,bangalore
66.0,30/11/2016,MarianaIQ,,Bangalore,Exfinity Venture Partners,,"2,000,000",,Technology,AI-driven B2B marketing platform,Private Equity,,,,,,,,,,,,,,,,,,,,,2000000.0,2016-11-30,2016.0,,bangalore
67.0,30/11/2016,Chai Thela,,Noida,Quarizon,,"218,000",,Food & Beverage,Quick Service Restaurants,Seed Funding,,,,,,,,,,,,,,,,,,,,,218000.0,2016-11-30,2016.0,,noida
68.0,30/11/2016,Interviewpad,,Pune,Krishna Rokhale,,"100,000",,Technology,Engineering Interview facilitation platform,Seed Funding,,,,,,,,,,,,,,,,,,,,,100000.0,2016-11-30,2016.0,,pune
69.0,30/11/2016,Math Buddy,,Vadodara,Menterra Social Impact Fund,,"440,000",,Consumer Internet,Online Math Learn,Seed Funding,,,,,,,,,,,,,,,,,,,,,440000.0,2016-11-30,2016.0,,vadodara
70.0,30/11/2016,Pulse,,Bangalore,SAIF Partners,,"500,000",,Consumer Internet,Campus Social Networking App,Private Equity,,,,,,,,,,,,,,,,,,,,,500000.0,2016-11-30,2016.0,,bangalore
71.0,30/11/2016,MonkeyBox,,Bangalore,Blume Ventures & Others,,,,Consumer Internet,Healthy Food Delivery platform,Seed Funding,,,,,,,,,,,,,,,,,,,,,,2016-11-30,2016.0,,bangalore
72.0,30/11/2016,Carcrew.in,,Mumbai,TVS Group,,"500,000",,Consumer Internet,Online Car repair Marketplace,Seed Funding,,,,,,,,,,,,,,,,,,,,,500000.0,2016-11-30,2016.0,,mumbai
73.0,,,,,,,,,,,,,,,,,,,,,,,,,,,,,,,,,,,,
1.0,03/10/2016,MeraKisan,,Bangalore,Mahindra Univeg,,,,eCommerce,Fruit & vegetable eTailer,Seed Funding,,,,,,,,,,,,,,,,,,,,,,2016-03-10,2016.0,,bangalore
2.0,03/10/2016,Mystifly,,Bangalore,Recruit Holdings,,"5,000,000",,Consumer Internet,Airline Ticket Aggregator,Private Equity,,,,,,,,,,,,,,,,,,,,,5000000.0,2016-03-10,2016.0,,bangalore
3.0,03/10/2016,HelpChat,,Bangalore,"American Express Ventures, Sequoia Capital",,,,Consumer Internet,AI Powered Content & Commerce platform,Private Equity,,,,,,,,,,,,,,,,,,,,,,2016-03-10,2016.0,,bangalore
4.0,03/10/2016,Uniphore,,Chennai,"IDG Ventures, Indian Angel Network (IAN), YourNest Angel Fund",,"2,000,000",,Technology,Speech Recognition Solutions,Private Equity,,,,,,,,,,,,,,,,,,,,,2000000.0,2016-03-10,2016.0,,chennai
5.0,03/10/2016,World Art Community,,Gurgaon,Viraj Tyagi & Others,,"200,000",,eCommerce,Art & Craft Marketplace,Seed Funding,,,,,,,,,,,,,,,,,,,,,200000.0,2016-03-10,2016.0,,gurgaon
6.0,04/10/2016,Giftxoxo,,Bangalore,Mahindra Holidays & Resorts India Ltd,,"450,000",,eCommerce,Online Gifting platform,Private Equity,,,,,,,,,,,,,,,,,,,,,450000.0,2016-04-10,2016.0,,bangalore
7.0,04/10/2016,Bharat Bazaar,,Mumbai,"BeeNext, TV Mohandas Pai, Kunal Shah, Sandeep Tandon",,,,eCommerce,Online B2B Marketplace,Seed Funding,,,,,,,,,,,,,,,,,,,,,,2016-04-10,2016.0,,mumbai
8.0,04/10/2016,GOQii,,Mumbai,Ratan Tata,,,,Consumer Internet,Health & Fitness Wearable Device,Private Equity,,,,,,,,,,,,,,,,,,,,,,2016-04-10,2016.0,,mumbai
9.0,04/10/2016,India Gifts Portal,,Noida,"Naveen Arya, Tarun Joshi",,"2,000,000",,eCommerce,Online Gifting platform,Private Equity,,,,,,,,,,,,,,,,,,,,,2000000.0,2016-04-10,2016.0,,noida
10.0,04/10/2016,Moglix,,Noida,"Accel Partners, Jungle Ventures, SeedPlus",,"4,200,000",,eCommerce,Industrial & Home products marketplace,Private Equity,,,,,,,,,,,,,,,,,,,,,4200000.0,2016-04-10,2016.0,,noida
11.0,04/10/2016,NetLinx,,Hyderabad,"Xchange Investors NV, TransGlobal FZC",,"3,000,000",,Consumer Internet,Internet Service Provider,Private Equity,,,,,,,,,,,,,,,,,,,,,3000000.0,2016-04-10,2016.0,,hyderabad
12.0,04/10/2016,Scandid,,Pune,3One4 Capital,,,,Consumer Internet,Product Shopping Comparison App,Private Equity,,,,,,,,,,,,,,,,,,,,,,2016-04-10,2016.0,,pune
13.0,04/10/2016,Remitr,,Mumbai,"Vijay Shekhar Sharma, Pravin Gandhi,  Smart Start Fund; Kunal Shah,  Sandeep Tandon, Vishal Gondal, & Others",,"1,000,000",,Consumer Internet,Foreign Currency Payments Platform,Seed Funding,,,,,,,,,,,,,,,,,,,,,1000000.0,2016-04-10,2016.0,,mumbai
14.0,04/10/2016,InnerChef,,Gurgaon,"Mistletoe, M&S Partners",,"2,500,000",,Consumer Internet,Online food ordering platform,Private Equity,,,,,,,,,,,,,,,,,,,,,2500000.0,2016-04-10,2016.0,,gurgaon
15.0,04/10/2016,AppsDaily,,Mumbai,"Zodius Capital, Kalaari Capital, Qualcomm Ventures, Russian venture capital fund Ru-Net, Mumbai Angels",,"3,750,000",,Consumer Internet,"Mobile Phone Theft, Damage Protection platform",Private Equity,,,,,,,,,,,,,,,,,,,,,3750000.0,2016-04-10,2016.0,,mumbai
16.0,05/10/2016,MuhurtMaza,,Pune,Undisclosed Investor,,,,Consumer Internet,Online Puja Booking Service,Seed Funding,,,,,,,,,,,,,,,,,,,,,,2016-05-10,2016.0,,pune
17.0,05/10/2016,Azuro,,Mumbai,"White Unicorn Ventures, Kae Capital, Mumbai Angels",,,,Consumer Internet,Rental Property Finder platform,Private Equity,,,,,,,,,,,,,,,,,,,,,,2016-05-10,2016.0,,mumbai
18.0,05/10/2016,NeuroSynaptic,,Bangalore,"Indian Angel Network, Healthsquad, Axilor Ventures",,,,Technology,Remote Healthcare Delivery Solutions,Private Equity,,,,,,,,,,,,,,,,,,,,,,2016-05-10,2016.0,,bangalore
19.0,05/10/2016,UE LifeSciences,,Mumbai,"Kiran Mazumdar-Shaw, Unitus Seed Fund",,"1,200,000",,Technology,Mobile Health Technology Solutions,Private Equity,,,,,,,,,,,,,,,,,,,,,1200000.0,2016-05-10,2016.0,,mumbai
20.0,06/10/2016,FindmeaShoe,,Bangalore,Ventureast Fund Advisors,,,,Consumer Internet,Footwear Recommendation App,Seed Funding,,,,,,,,,,,,,,,,,,,,,,2016-06-10,2016.0,,bangalore
21.0,06/10/2016,RealBox,,Noida,Hyderabad Angels,,"300,000",,Technology,Data Sciences Platform,Seed Funding,,,,,,,,,,,,,,,,,,,,,300000.0,2016-06-10,2016.0,,noida
22.0,06/10/2016,Sportido,,Noida,Sumpoorna Group,,,,Consumer Internet,Sports Discovery platform,Seed Funding,,,,,,,,,,,,,,,,,,,,,,2016-06-10,2016.0,,noida
23.0,06/10/2016,GoZefo,,Bangalore,"Helion Venture Partners, BeeNext",,"1,050,000",,eCommerce,Used Furniture & Appliances Marketplace,Private Equity,,,,,,,,,,,,,,,,,,,,,1050000.0,2016-06-10,2016.0,,bangalore
24.0,07/10/2016,RayIOT,,Bangalore,HAX Accelerator,,"100,000",,Technology,Baby Monitoring Devices manufacturer,Seed Funding,,,,,,,,,,,,,,,,,,,,,100000.0,2016-07-10,2016.0,,bangalore
25.0,07/10/2016,KOOH Sports,,Mumbai,"HDFC, Faering Capital, Elevate Sports",,"2,200,000",,Technology,Sports Training & Technology,Private Equity,,,,,,,,,,,,,,,,,,,,,2200000.0,2016-07-10,2016.0,,mumbai
26.0,07/10/2016,Flexiloans,,Mumbai,"Sanjay Nayar, Vikram Sud, Anil Jaggia, Narayan Seshadri",,"15,000,000",,Consumer Internet,Online Funds Raising Platform,Private Equity,,,,,,,,,,,,,,,,,,,,,15000000.0,2016-07-10,2016.0,,mumbai
27.0,07/10/2016,Sibia Analytics,,Kolkata,Radhakrishnan Natarajan & Others,,,,Technology,Marketing & Customer Analytics Solutions,Seed Funding,,,,,,,,,,,,,,,,,,,,,,2016-07-10,2016.0,,kolkata
28.0,10/10/2016,Vithi.com,,New Delhi,undisclosed investor,,"375,000",,eCommerce,Online Hair Extension etailer,Seed Funding,,,,,,,,,,,,,,,,,,,,,375000.0,2016-10-10,2016.0,,new delhi
29.0,11/10/2016,Yupp TV,,Bangalore,Emerald Media,,"50,000,000",,Consumer Internet,Internet-based TV streaming service provider,Private Equity,,,,,,,,,,,,,,,,,,,,,50000000.0,2016-11-10,2016.0,,bangalore
30.0,11/10/2016,Deyor Camps,,Gurgaon,"Nitin Passi, Manickam Mahalingam, Udaan Angels, Rajesh Arora, Arkas Industries",,"500,000",,Consumer Internet,Branded Camping location Aggregator,Seed Funding,,,,,,,,,,,,,,,,,,,,,500000.0,2016-11-10,2016.0,,gurgaon
31.0,12/10/2016,ZipLoan,,New Delhi,"GrowX Ventures, Sunil Kalra, Arun Venkatachalam,  Badal Malick",,,,Consumer Internet,online lending platform,Seed Funding,,,,,,,,,,,,,,,,,,,,,,2016-12-10,2016.0,,new delhi
32.0,13/10/2016,FabAlley,,Noida,"India Quotient, FAO Ventures, Indian Angel Network, Tushar Singh, Ranjan Sharma",,"2,000,000",,ecommerce,online fashion brand store,Private Equity,,,,,,,,,,,,,,,,,,,,,2000000.0,2016-10-13,2016.0,,noida
33.0,13/10/2016,Shoekonnect,,Agra,Indian Angel Network,,,,eCommerce,B2B Marketplace for Shoes,Seed Funding,,,,,,,,,,,,,,,,,,,,,,2016-10-13,2016.0,,agra
34.0,13/10/2016,Maya,,Bangalore,Rajan Anandan,,,,Consumer Internet,Womens Health Tracker App,Seed Funding,,,,,,,,,,,,,,,,,,,,,,2016-10-13,2016.0,,bangalore
35.0,13/10/2016,RoboVac,,Ahmedabad,Virendra Patel,,"450,000",,Technology,waterless car washing solution,Seed Funding,,,,,,,,,,,,,,,,,,,,,450000.0,2016-10-13,2016.0,,ahmedabad
36.0,14/10/2016,Newspatrolling,,New Delhi,Undisclosed,,"25,000",,Consumer Internet,Online News portal,Seed Funding,,,,,,,,,,,,,,,,,,,,,25000.0,2016-10-14,2016.0,,new delhi
37.0,14/10/2016,Postman,,Bangalore,Nexus Venture Partners,,"7,000,000",,Consumer Internet,API Platform,Private Equity,,,,,,,,,,,,,,,,,,,,,7000000.0,2016-10-14,2016.0,,bangalore
38.0,14/10/2016,ISFC,,Hyderabad,Gray Matters Capital,,"6,000,000",,Finance,Education Sector Lending,Private Equity,,,,,,,,,,,,,,,,,,,,,6000000.0,2016-10-14,2016.0,,hyderabad
39.0,14/10/2016,BeatRoute,,Gurgaon,Quarizon Consultancy Services LLP,,,,Technology,SAAS based mobile application platform,Seed Funding,,,,,,,,,,,,,,,,,,,,,,2016-10-14,2016.0,,gurgaon
40.0,14/10/2016,Kidsstoppress,,Mumbai,Karan Bhagat,,,,Consumer Internet,Parenting and Baby care Platform,Seed Funding,,,,,,,,,,,,,,,,,,,,,,2016-10-14,2016.0,,mumbai
41.0,14/10/2016,Innov8,,Bangalore,Punit Soni,,,,Consumer Internet,Co-Working Spaces aggregator,Seed Funding,,,,,,,,,,,,,,,,,,,,,,2016-10-14,2016.0,,bangalore
42.0,15/10/2016,DailyHunt,,Bangalore,"ByteDance, Arun Sarin, Matrix Partners, Sequoia Capital India, Omidyar Network,  Falcon Edge",,"25,000,000",,Consumer Internet,Vernacular content mobile app,Private Equity,,,,,,,,,,,,,,,,,,,,,25000000.0,2016-10-15,2016.0,,bangalore
43.0,15/10/2016,Tazzo Bikes,,Hyderabad,DSG Consumer Partners,,"227,000",,Consumer Internet,Motorbike rental platform,Seed Funding,,,,,,,,,,,,,,,,,,,,,227000.0,2016-10-15,2016.0,,hyderabad
44.0,15/10/2016,MyKindofJob,,Mumbai,"Mayank Shah, Shreyans Shah",,"1,000,000",,Consumer Internet,Internet & Fresher Job platform,Seed Funding,,,,,,,,,,,,,,,,,,,,,1000000.0,2016-10-15,2016.0,,mumbai
45.0,17/10/2016,Trilyo,,Bangalore,"Vishnu Bhat, Rajiv Lunkad, Naresh Ravindranath",,,,Technology,B2B SAAS based product,Seed Funding,,,,,,,,,,,,,,,,,,,,,,2016-10-17,2016.0,,bangalore
46.0,17/10/2016,Rooter,,New Delhi,"Boman Irani, Dhruv Chitgopekar, Prantik Dasgupta",,,,Consumer Internet,Sports Social Network mobile app,Seed Funding,,,,,,,,,,,,,,,,,,,,,,2016-10-17,2016.0,,new delhi
47.0,17/10/2016,Yumigo,,Gurgaon,Hemant Sahni,,"300,000",,Consumer Internet,App based Travel Discovery and Transactions platform,Seed Funding,,,,,,,,,,,,,,,,,,,,,300000.0,2016-10-17,2016.0,,gurgaon
48.0,17/10/2016,Rentalpha,,Mumbai,Bravia Capital,,"16,000,000",,Others,equipment rental and leasing company,Private Equity,,,,,,,,,,,,,,,,,,,,,16000000.0,2016-10-17,2016.0,,mumbai
49.0,18/10/2016,3Dexter,,New Delhi,Newbie Promoters,,"150,000",,Technology,3D Printing Solutions for Edu space,Seed Funding,,,,,,,,,,,,,,,,,,,,,150000.0,2016-10-18,2016.0,,new delhi
50.0,18/10/2016,BabyChakra,,Mumbai,RoundGlass Partners,,,,Consumer Internet,Parenting and Child Care portal,Private Equity,,,,,,,,,,,,,,,,,,,,,,2016-10-18,2016.0,,mumbai
51.0,18/10/2016,Coppre,,Pune,Ganesh Natarajan,,,,eCommerce,Copper based items etailer,Seed Funding,,,,,,,,,,,,,,,,,,,,,,2016-10-18,2016.0,,pune
52.0,18/10/2016,MySUN,,Noida,General Catalyst Partners,,"2,500,000",,Technology,Solar Energy harnessing products marketplace,Private Equity,,,,,,,,,,,,,,,,,,,,,2500000.0,2016-10-18,2016.0,,noida
53.0,18/10/2016,ePathsala,,Bangalore,"Hyderabad Angels, TLabs",,,,Technology,Cloud based ERP for Accreditation & ICT,Seed Funding,,,,,,,,,,,,,,,,,,,,,,2016-10-18,2016.0,,bangalore
54.0,19/10/2016,Furlenco,,Bangalore,"Lightbox Ventures, Axis Capital & Others",,"30,000,000",,Consumer Internet,Online Furniture Rental platform,Private Equity,,,,,,,,,,,,,,,,,,,,,30000000.0,2016-10-19,2016.0,,bangalore
55.0,19/10/2016,Fisdom,,Bangalore,"Saama Capital, Raghunandan G, Aprameya Radhakrishna",,"1,100,000",,Consumer Internet,Personal Wealth Management Platform & App,Private Equity,,,,,,,,,,,,,,,,,,,,,1100000.0,2016-10-19,2016.0,,bangalore
56.0,19/10/2016,Actofit,,Mumbai,Next Orbit Ventures Fund,,"750,000",,Technology,Wearable Technology platform & devices,Private Equity,,,,,,,,,,,,,,,,,,,,,750000.0,2016-10-19,2016.0,,mumbai
57.0,20/10/2016,Stayology,,Bangalore,Ranjan Pai,,,,Consumer Internet,Stay & Travel related services,Seed Funding,,,,,,,,,,,,,,,,,,,,,,2016-10-20,2016.0,,bangalore
58.0,20/10/2016,Hipcask,,Mumbai,Mobikon,,,,Consumer Internet,Alcoholic beverage discovery platform,Seed Funding,,,,,,,,,,,,,,,,,,,,,,2016-10-20,2016.0,,mumbai
59.0,20/10/2016,RailYatri,,Noida,"Helion Ventures, Blume ventures",,,,Consumer Internet,Train Travel Info mobile app,Private Equity,,,,,,,,,,,,,,,,,,,,,,2016-10-20,2016.0,,noida
60.0,21/10/2016,ChatOnGo,,Mumbai,Janak Jain,,"300,000",,Consumer Internet,Hyperlocal  Communication Mobile app,Seed Funding,,,,,,,,,,,,,,,,,,,,,300000.0,2016-10-21,2016.0,,mumbai
61.0,23/10/2016,WOTU,,Bangalore,KAE capital,,,,eCommerce,B2B Marketplace for traders,Seed Funding,,,,,,,,,,,,,,,,,,,,,,2016-10-23,2016.0,,bangalore
62.0,24/10/2016,Healthians,,Gurgaon,BEENEXT,,"3,000,000",,Consumer Internet,Health Test Discovery & Ordering service,Private Equity,,,,,,,,,,,,,,,,,,,,,3000000.0,2016-10-24,2016.0,,gurgaon
63.0,24/10/2016,Box8,,Mumbai,"IIFL Seed Ventures Fund, Mayfield Ventures",,"7,500,000",,Consumer Internet,Online Food Ordering platform/App,Private Equity,,,,,,,,,,,,,,,,,,,,,7500000.0,2016-10-24,2016.0,,mumbai
64.0,25/10/2016,Kredx,,Bangalore,Sequoia Capital,,"6,000,000",,eCommerce,Invoice discounting marketplace,Private Equity,,,,,,,,,,,,,,,,,,,,,6000000.0,2016-10-25,2016.0,,bangalore
65.0,25/10/2016,CreditMate,,Mumbai,India Quotient,,"500,000",,Consumer Internet,Credit Report Info platform,Seed Funding,,,,,,,,,,,,,,,,,,,,,500000.0,2016-10-25,2016.0,,mumbai
66.0,25/10/2016,Pickrr,,New Delhi,Swastika Company Ltd,,,,Technology,Courier Logistics & Order management Solutions,Seed Funding,,,,,,,,,,,,,,,,,,,,,,2016-10-25,2016.0,,new delhi
67.0,25/10/2016,SatvaKart,,Gurgaon,Nimit Panigrahi,,,,eCommerce,Online Grocery Etailer,Seed Funding,,,,,,,,,,,,,,,,,,,,,,2016-10-25,2016.0,,gurgaon
68.0,25/10/2016,SooperMO,,Gurgaon,Lalit Vase,,"100,000",,Technology,Android utility app suite creator,Seed Funding,,,,,,,,,,,,,,,,,,,,,100000.0,2016-10-25,2016.0,,gurgaon
69.0,26/10/2016,OrangeTwig,,New Delhi,Undisclosed investor,,"1,000,000",,Consumer Internet,Social Media Marketing platform,Seed Funding,,,,,,,,,,,,,,,,,,,,,1000000.0,2016-10-26,2016.0,,new delhi
70.0,26/10/2016,Wooplr,,Bangalore,"Astarc Ventures, Anand Chandrasekaran",,,,Consumer Internet,Fashion Discovery App,Seed Funding,,,,,,,,,,,,,,,,,,,,,,2016-10-26,2016.0,,bangalore
71.0,26/10/2016,The Kettlery,,Ahmedabad,"hooting Starts Sports LLP, Franchise India Brands",,"1,000,000",,eCommerce,Online Tea Etailer,Private Equity,,,,,,,,,,,,,,,,,,,,,1000000.0,2016-10-26,2016.0,,ahmedabad
72.0,27/10/2016,Idea Bubbles,,Bangalore,"1Crowd, Eureka Forbes Ltd, Shapoorji Pallonji & Co. Ltd.",,"700,000",,Consumer Internet,Doctor Consulting platform,Private Equity,,,,,,,,,,,,,,,,,,,,,700000.0,2016-10-27,2016.0,,bangalore
73.0,27/10/2016,FR8,,Chennai,Omnivore Partners,,"971,000",,Technology,Truck Fleet Operation platform,Private Equity,,,,,,,,,,,,,,,,,,,,,971000.0,2016-10-27,2016.0,,chennai
74.0,27/10/2016,Ather Energy,,Bangalore,Hero MotoCorp,,"27,000,000",,Technology,Electric Vehicle Manufacturer,Private Equity,,,,,,,,,,,,,,,,,,,,,27000000.0,2016-10-27,2016.0,,bangalore
75.0,28/10/2016,Pikkol,,Bangalore,"Ajay Nanavati, Afsal Salu",,,,Logistics,Relocation Service provider,Seed Funding,,,,,,,,,,,,,,,,,,,,,,2016-10-28,2016.0,,bangalore
76.0,29/10/2016,Velmenni,,New Delhi,Kalaari Capital,,"100,000",,Technology,LiFi based wireless communication provider,Seed Funding,,,,,,,,,,,,,,,,,,,,,100000.0,2016-10-29,2016.0,,new delhi
77.0,29/10/2016,Volta Motors,,Chennai,Kalaari Capital,,"100,000",,Technology,Electric Bike Manufacturer,Seed Funding,,,,,,,,,,,,,,,,,,,,,100000.0,2016-10-29,2016.0,,chennai
78.0,29/10/2016,Cyclops,,Bangalore,Kalaari Capital,,"100,000",,Technology,Clinical and Wearable Diagnostic Product creator,Seed Funding,,,,,,,,,,,,,,,,,,,,,100000.0,2016-10-29,2016.0,,bangalore
79.0,30/10/2016,Impact Analytics,,Bangalore,"Aarin Capital, Michael Herzig, Ashish Lakhanpal",,"750,000",,Technology,Business intelligence and data science Startup,Private Equity,,,,,,,,,,,,,,,,,,,,,750000.0,2016-10-30,2016.0,,bangalore
80.0,31/10/2016,Talent Next,,Mumbai,Karanpal Singh & Others,,"1,000,000",,Consumer Internet,Talent Discovery & Audition management platform,Seed Funding,,,,,,,,,,,,,,,,,,,,,1000000.0,2016-10-31,2016.0,,mumbai
81.0,,,,,,,,,,,,,,,,,,,,,,,,,,,,,,,,,,,,
1.0,01/9/2016,Mad Street Den,,Chennai,"Sequoia India, Exfinity Ventures, growX ventures,",,,,Technology,Artificial Intelligence platform,Private Equity,,,,,,,,,,,,,,,,,,,,,,2016-01-09,2016.0,,chennai
2.0,01/9/2016,Mihup,,Kolkata,Accel Partners,,"6,700,000",,Technology,Personal Digital Assistant,Private Equity,,,,,,,,,,,,,,,,,,,,,6700000.0,2016-01-09,2016.0,,kolkata
3.0,01/9/2016,Renowala,,Hyderabad,Pradeep Dhobale,,,,eCommerce,Home Improvement Marketplace,Seed Funding,,,,,,,,,,,,,,,,,,,,,,2016-01-09,2016.0,,hyderabad
4.0,01/9/2016,Lucideus,,New Delhi,Amit Choudhary,,,,Technology,IT Risk Assessment and Digital Security Services provider.,Seed Funding,,,,,,,,,,,,,,,,,,,,,,2016-01-09,2016.0,,new delhi
5.0,04/9/2016,Trackbizz,,Kochi,Grasshoppers,,,,Technology,Field Force Automation System,Private Equity,,,,,,,,,,,,,,,,,,,,,,2016-04-09,2016.0,,kochi
6.0,05/9/2016,Social Quotient,,Mumbai,"Anita Dongre, Yash Dongre, Milind Sarwate",,,,Technology,Platform for Social Causes,Seed Funding,,,,,,,,,,,,,,,,,,,,,,2016-05-09,2016.0,,mumbai
7.0,05/9/2016,Stalk Buy Love,,New Delhi,William Bissel,,,,eCommerce,Fashion Apparel eTailer,Seed Funding,,,,,,,,,,,,,,,,,,,,,,2016-05-09,2016.0,,new delhi
8.0,06/9/2016,eShakti,,Chennai,"Infina Finance Pvt. Ltd, Uday Kotak",,"1,350,000",,eCommerce,Women’s Fashion Apparel eTailer,Private Equity,,,,,,,,,,,,,,,,,,,,,1350000.0,2016-06-09,2016.0,,chennai
9.0,06/9/2016,CheersOye!,,Mumbai,Undisclosed Investors,,"500,000",,Consumer Internet,Online Gift Vouchers platform,Seed Funding,,,,,,,,,,,,,,,,,,,,,500000.0,2016-06-09,2016.0,,mumbai
10.0,06/9/2016,Lenskart,,New Delhi,PremjiInvest,,,,eCommerce,Online Eyewear eTailer,Private Equity,,,,,,,,,,,,,,,,,,,,,,2016-06-09,2016.0,,new delhi
11.0,06/9/2016,BigStylist,,Mumbai,Info Edge (India) Ltd,,"900,000",,Consumer Internet,Hyperlocal doorstep Beauty Services provider,Private Equity,,,,,,,,,,,,,,,,,,,,,900000.0,2016-06-09,2016.0,,mumbai
12.0,07/9/2016,Zilingo,,Bangalore/ Bangkok,"Venturra Capital, Sequoia India, Susquehanna International Group.  Wavemaker Partners, Beenext, Beenos, Digital Garage",,"8,000,000",,eCommerce,Online Fashion Retailer,Private Equity,,,,,,,,,,,,,,,,,,,,,8000000.0,2016-07-09,2016.0,,bangalore/ bangkok
13.0,07/9/2016,Alternacare,,New Delhi,Eros Labs,,"500,000",,Consumer Internet,Online Doctor Consulting platform,Seed Funding,,,,,,,,,,,,,,,,,,,,,500000.0,2016-07-09,2016.0,,new delhi
14.0,07/9/2016,Simplilearn,,Bangalore,InnoVen Capital India,,"6,000,000",,Education,Online Certification programs,Private Equity,,,,,,,,,,,,,,,,,,,,,6000000.0,2016-07-09,2016.0,,bangalore
15.0,07/9/2016,Prozo,,Gurgaon,"Earlsfield Capital, Sailender Solanki, Rajiv Solanki",,"315,000",,eCommerce,Study Material Marketplace,Seed Funding,,,,,,,,,,,,,,,,,,,,,315000.0,2016-07-09,2016.0,,gurgaon
16.0,08/9/2016,TopRankers,,Bangalore,"CareerNet Consulting Pvt. Ltd, Ideation Initiative Pvt. Ltd,",,"670,000",,Education,Online Test Preparation platform,Seed Funding,,,,,,,,,,,,,,,,,,,,,670000.0,2016-08-09,2016.0,,bangalore
17.0,08/9/2016,BuildTraders,,Bangalore,Idein Ventures,,"200,000",,eCommerce,Online Construction Materials Marketplace,Seed Funding,,,,,,,,,,,,,,,,,,,,,200000.0,2016-08-09,2016.0,,bangalore
18.0,09/9/2016,Byju’s,,Bangalore,"Chan Zuckerberg Initiative, Times Internet Ltd, Sequoia Capital, Sofina, Lightspeed Ventures",,"50,000,000",,Education,Online Learning App,Private Equity,,,,,,,,,,,,,,,,,,,,,50000000.0,2016-09-09,2016.0,,bangalore
29.0,09/9/2016,NoBroker,,Bangalore,Anand Chandrasekaran,,,,Consumer Internet,Online Home Rental platform,Seed Funding,,,,,,,,,,,,,,,,,,,,,,2016-09-09,2016.0,,bangalore
20.0,10/9/2016,Freshboxx,,Hubli,Ravi Linganuri,,,,eCommerce,Fruits & vegetable eTailer,Seed Funding,,,,,,,,,,,,,,,,,,,,,,2016-10-09,2016.0,,hubli
21.0,10/9/2016,CureInstant,,New Delhi,Dr. Rameshwar Kumar,,"150,000",,Consumer Internet,Social Health Networking Platform,Seed Funding,,,,,,,,,,,,,,,,,,,,,150000.0,2016-10-09,2016.0,,new delhi
22.0,10/9/2016,Poshtic,,Noida,"havya Sharma, Amit Nagar",,"450,000",,Consumer Internet,Online health & Wellness platform,Seed Funding,,,,,,,,,,,,,,,,,,,,,450000.0,2016-10-09,2016.0,,noida
23.0,10/9/2016,KarmaCircles,,New Delhi,"Harinder Takhar, Zain Raj, Dr. Prasad Kaipa, Abaran Deep, Aseem Sood, Mustafa Patni",,,,Consumer Internet,Peer-to-peer Social Learning platform,Seed Funding,,,,,,,,,,,,,,,,,,,,,,2016-10-09,2016.0,,new delhi
24.0,12/9/2016,Purple Style Labs,,Mumbai,"Augment Ventures, Rahul Kayan, Nikhil Golcha, Shubham Gupta, Roy Kwan",,"448,000",,Consumer Internet,Personal Styling Online platform,Seed Funding,,,,,,,,,,,,,,,,,,,,,448000.0,2016-12-09,2016.0,,mumbai
25.0,12/9/2016,Inuxu,,Pune,Fork Media,,"3,000,000",,Technology,Online Advertising Solutions,Private Equity,,,,,,,,,,,,,,,,,,,,,3000000.0,2016-12-09,2016.0,,pune
26.0,12/9/2016,Nykaa,,Mumbai,"Sunil Munjal, Mariwala family",,"12,300,000",,eCommerce,Online Beauty products eTailer,Private Equity,,,,,,,,,,,,,,,,,,,,,12300000.0,2016-12-09,2016.0,,mumbai
27.0,12/9/2016,Glam Studios,,Noida,"Pradeep Mirani, Aqeel Ahmed, Anand Ladsariya, Nitin Agarwal",,"300,000",,Consumer Internet,Beauty Salon Aggregator,Seed Funding,,,,,,,,,,,,,,,,,,,,,300000.0,2016-12-09,2016.0,,noida
28.0,13/9/2016,Findow,,Bangalore,Raj Singh Bhandal,,,,Consumer Internet,Fashion Discovery Mobile app,Seed Funding,,,,,,,,,,,,,,,,,,,,,,2016-09-13,2016.0,,bangalore
29.0,13/9/2016,IdeaChakki,,Delhi,Ratan Tata,,,,Consumer Internet,Restaurant Menu & Food mobile app,Seed Funding,,,,,,,,,,,,,,,,,,,,,,2016-09-13,2016.0,,delhi
30.0,13/9/2016,ShoeKonnect,,Agra,Indian Angels Network,,,,eCommerce,Footwear & Leather B2B App,Seed Funding,,,,,,,,,,,,,,,,,,,,,,2016-09-13,2016.0,,agra
31.0,13/9/2016,NearBuy,,Gurgaon,BlackSoil Capital Pvt. Ltd.,,"2,500,000",,Consumer Internet,Online Deals & Discount platform,Private Equity,,,,,,,,,,,,,,,,,,,,,2500000.0,2016-09-13,2016.0,,gurgaon
32.0,14/9/2016,ZeroInfy,,Kolkata,Calcutta Angels Network,,,,Consumer Internet,Online Video Lectures platform,Seed Funding,,,,,,,,,,,,,,,,,,,,,,2016-09-14,2016.0,,kolkata
33.0,14/9/2016,Flocareer,,Bangalore,"Balasubramanian Krishnamurthy, Sidhartha Hazarika & Others",,"150,000",,Consumer Internet,Jobs & Skill Validation platform,Seed Funding,,,,,,,,,,,,,,,,,,,,,150000.0,2016-09-14,2016.0,,bangalore
34.0,14/9/2016,LensPick,,Bangalore,Scadea Solutions Inc,,,,eCommerce,eyewear eTailer,Private Equity,,,,,,,,,,,,,,,,,,,,,,2016-09-14,2016.0,,bangalore
35.0,15/9/2016,infeedo,,Gurgaon,"Dheeraj Jain, Palash Jain, Anupam Mittal, Ameera Shah,  Vivek Bhargava, Rahul Singh, Ambarish Gupta,",,"200,000",,Consumer Internet,Employee engagement platform,Seed Funding,,,,,,,,,,,,,,,,,,,,,200000.0,2016-09-15,2016.0,,gurgaon
36.0,15/9/2016,Furlenco,,Bangalore,Lightbox Ventures and others,,"5,000,000",,eCommerce,Online furniture rental startup,Private Equity,,,,,,,,,,,,,,,,,,,,,5000000.0,2016-09-15,2016.0,,bangalore
37.0,15/9/2016,GoPigeon,,Bangalore,Nexus Venture Partners,,"1,500,000",,Consumer Internet,on-demand logistics service provider,Private Equity,,,,,,,,,,,,,,,,,,,,,1500000.0,2016-09-15,2016.0,,bangalore
38.0,16/9/2016,NewsDistill,,Hyderabad,"Ganesh Narasimhan, Ramana Thumu, Sudhir Mallem",,"100,000",,Consumer Internet,City based News Aggregator App,Seed Funding,,,,,,,,,,,,,,,,,,,,,100000.0,2016-09-16,2016.0,,hyderabad
39.0,16/9/2016,DoctorInsta,,Gurgaon,RoundGlass Partners,,"1,000,000",,Consumer Internet,Online Doctor Consultations,Private Equity,,,,,,,,,,,,,,,,,,,,,1000000.0,2016-09-16,2016.0,,gurgaon
40.0,19/9/2016,Milofy,,Bangalore,Accel Partners,,"750,000",,Consumer Internet,Couple Socialization App,Seed Funding,,,,,,,,,,,,,,,,,,,,,750000.0,2016-09-19,2016.0,,bangalore
41.0,19/9/2016,Liqvid,,New Delhi,Gray Matters Capital,,,,Technology,Integrated eLearning content solutions,Private Equity,,,,,,,,,,,,,,,,,,,,,,2016-09-19,2016.0,,new delhi
42.0,19/9/2016,Swiggy,,Bangalore,Bessemer Venture Partners,,"15,000,000",,Consumer Internet,Online Food Ordering & Delivery,Private Equity,,,,,,,,,,,,,,,,,,,,,15000000.0,2016-09-19,2016.0,,bangalore
43.0,20/9/2016,Codemojo,,Bangalore,CIO Angel Network,,,,Consumer Internet,Customer Engagement Platform,Seed Funding,,,,,,,,,,,,,,,,,,,,,,2016-09-20,2016.0,,bangalore
44.0,20/9/2016,JustLikeNew,,Hyderabad,LetsVenture,,"500,000",,eCommerce,Online gadget Repair Services Marketplace,Seed Funding,,,,,,,,,,,,,,,,,,,,,500000.0,2016-09-20,2016.0,,hyderabad
45.0,20/9/2016,JoeHukum,,New Delhi,Sumit Jain,,,,Technology,Enterprise customer engagement solutions,Seed Funding,,,,,,,,,,,,,,,,,,,,,,2016-09-20,2016.0,,new delhi
46.0,21/9/2016,Co Life,,Bangalore,Undisclosed Investors,,"1,000,000",,Consumer Internet,shared living and working spaces platform,Seed Funding,,,,,,,,,,,,,,,,,,,,,1000000.0,2016-09-21,2016.0,,bangalore
47.0,21/9/2016,PurpleDocs,,Vadodara,"KellyGamma, Lead Angels & Others",,,,Consumer Internet,Electronic Health care records platform,Seed Funding,,,,,,,,,,,,,,,,,,,,,,2016-09-21,2016.0,,vadodara
48.0,21/9/2016,Pepperfry,,Mumbai,"Goldman Sachs Group, Zodius Technology Fund, Norwest Venture Partners, Bertelsmann India",,"31,300,000",,eCommerce,Furniture eTailer,Private Equity,,,,,,,,,,,,,,,,,,,,,31300000.0,2016-09-21,2016.0,,mumbai
49.0,21/9/2016,eQuickies,,Ahmedabad,Lothal Angel Ventures,,"298,000",,eCommerce,Online Book etailer,Seed Funding,,,,,,,,,,,,,,,,,,,,,298000.0,2016-09-21,2016.0,,ahmedabad
50.0,21/9/2016,Khel Now,,New Delhi,Anglian Omega Network,,"350,000",,Consumer Internet,Mobile-based social networking platform,Seed Funding,,,,,,,,,,,,,,,,,,,,,350000.0,2016-09-21,2016.0,,new delhi
51.0,22/9/2016,Gadgetwood,,New Delhi,Carpediem Capital,,"6,000,000",,Consumer Internet,On-Demand Gadget repair services platform,Private Equity,,,,,,,,,,,,,,,,,,,,,6000000.0,2016-09-22,2016.0,,new delhi
52.0,22/9/2016,DailyRounds,,Bangalore,"Accel Partners, Beenext, Powerhouse Ventures, Akusa Holdings",,,,Consumer Internet,Mobile App for Doctors,Private Equity,,,,,,,,,,,,,,,,,,,,,,2016-09-22,2016.0,,bangalore
53.0,22/9/2016,Flixy Games,,Bangalore,Rebright Partners,,"425,000",,Technology,Mobile Game Publisher for Indian audience,Seed Funding,,,,,,,,,,,,,,,,,,,,,425000.0,2016-09-22,2016.0,,bangalore
54.0,22/9/2016,HashTaag,,Bangalore,Undisclosed investors,,"1,000,000",,Technology,Mobile App Development company,Seed Funding,,,,,,,,,,,,,,,,,,,,,1000000.0,2016-09-22,2016.0,,bangalore
55.0,22/9/2016,PharmaRack,,Pune,"Currae Healthtech Fund, Unicorn India Ventures",,"745,000",,Technology,SAAS application for Pharma Industry,Private Equity,,,,,,,,,,,,,,,,,,,,,745000.0,2016-09-22,2016.0,,pune
56.0,23/9/2016,CloudCherry,,Chennai,"Vertex Ventures, Cisco Ventures, IDG Ventures",,"6,000,000",,Technology,CRM SAAS Platform,Private Equity,,,,,,,,,,,,,,,,,,,,,6000000.0,2016-09-23,2016.0,,chennai
57.0,23/9/2016,Parentlane,,Bangalore,Rohit MA,,,,Consumer Internet,Social Platform for babycare and parenting,Seed Funding,,,,,,,,,,,,,,,,,,,,,,2016-09-23,2016.0,,bangalore
58.0,23/9/2016,First Moms Club,,Mumbai,Idea Wave Labs,,,,Consumer Internet,Social Network for Mothers,Seed Funding,,,,,,,,,,,,,,,,,,,,,,2016-09-23,2016.0,,mumbai
59.0,23/9/2016,inMotion,,Noida,"Prashant Tandon, Gaurav Agarwal, Gaurav Bhogle, Shrishti Sahu, Shantanu Mathur, Prabhat Aggarwal",,,,Technology,Financial platform for daily wage earning communities,Seed Funding,,,,,,,,,,,,,,,,,,,,,,2016-09-23,2016.0,,noida
60.0,26/9/2016,Let’s Barter,,New Delhi,Scale Ventures Funds,,,,Consumer Internet,Goods & Services Barter Platform,Seed Funding,,,,,,,,,,,,,,,,,,,,,,2016-09-26,2016.0,,new delhi
61.0,26/9/2016,EvenGini,,Chennai,Procam International Pvt. Ltd,,,,Consumer Internet,Event Registration and Ticketing platform,Private Equity,,,,,,,,,,,,,,,,,,,,,,2016-09-26,2016.0,,chennai
62.0,27/9/2016,TinyStep,,Bangalore,Flipkart Logistics Pvt. Ltd,,"1,580,000",,Consumer Internet,Parenting Network Platform,Private Equity,,,,,,,,,,,,,,,,,,,,,1580000.0,2016-09-27,2016.0,,bangalore
63.0,27/9/2016,Canvs,,Mumbai,Pratik Seal,,,,Consumer Internet,Community Platform for Artists and Designers,Seed Funding,,,,,,,,,,,,,,,,,,,,,,2016-09-27,2016.0,,mumbai
64.0,28/9/2016,Beardo,,Ahmedabad,Venture Catalysts,,"500,000",,eCommerce,Mens Grooming products etailer,Seed Funding,,,,,,,,,,,,,,,,,,,,,500000.0,2016-09-28,2016.0,,ahmedabad
65.0,28/9/2016,Instacar,,Indore,Swastika Co Ltd.,,"1,000,000",,Consumer Internet,Out-Station Taxi Rental Platform,Seed Funding,,,,,,,,,,,,,,,,,,,,,1000000.0,2016-09-28,2016.0,,indore
66.0,28/9/2016,Celes Care,,Hyderabad,Endiya Partners,,"1,000,000",,Consumer Internet,Virtual Health Clinic for Women,Seed Funding,,,,,,,,,,,,,,,,,,,,,1000000.0,2016-09-28,2016.0,,hyderabad
67.0,28/9/2016,Druva,,Pune,"Sequoia India, EDBI, Blue Cloud Ventures, Hercules Capital",,"51,000,000",,Technology,Cloud Based Data Protection Solution,Private Equity,,,,,,,,,,,,,,,,,,,,,51000000.0,2016-09-28,2016.0,,pune
68.0,29/9/2016,Promon,,New Delhi,Now Capital,,"180,000",,eCommerce,Local Commerce Platform,Seed Funding,,,,,,,,,,,,,,,,,,,,,180000.0,2016-09-29,2016.0,,new delhi
69.0,29/9/2016,Fastudent,,Noida,"Kanwaljit Singh, Ajay Lakhotia, Pavan Ongole, Ashish Gupta",,,,eCommerce,Education eCommerce platform,Seed Funding,,,,,,,,,,,,,,,,,,,,,,2016-09-29,2016.0,,noida
70.0,29/9/2016,Unocoin,,Bangalore,"Blume Ventures, Mumbai Angels, ah! Ventures, Digital Currency Group, Boost VC, Bank to the Future and Funders Club",,"1,500,000",,Consumer Internet,Bitcoin Wallet,Private Equity,,,,,,,,,,,,,,,,,,,,,1500000.0,2016-09-29,2016.0,,bangalore
71.0,30/9/2016,Demyto,,Pune,Deepak Nathani,,,,Consumer Internet,Vehicle maintenance Services platform,Seed Funding,,,,,,,,,,,,,,,,,,,,,,2016-09-30,2016.0,,pune
72.0,30/9/2016,Zeta,,Mumbai,Bhavin Turakhia,,"19,000,000",,Technology,Enterprise Cloud Solutions,Private Equity,,,,,,,,,,,,,,,,,,,,,19000000.0,2016-09-30,2016.0,,mumbai
73.0,30/9/2016,Kalaage,,Jaipur,Rajasthan Angel Innovators Network,,,,Consumer Internet,Social Networking Platform for Writers,Seed Funding,,,,,,,,,,,,,,,,,,,,,,2016-09-30,2016.0,,jaipur
74.0,30/9/2016,,,,,,,,,,,,,,,,,,,,,,,,,,,,,,,,2016-09-30,2016.0,,
75.0,30/9/2016,,,,,,,,,,,,,,,,,,,,,,,,,,,,,,,,2016-09-30,2016.0,,
76.0,,,,,,,,,,,,,,,,,,,,,,,,,,,,,,,,,,,,
,,,,,,,,,,,,,,,,,,,,,,,,,,,,,,,,,,,,
1.0,01/04/2017,Cashe,,Mumbai,"Mathew Cyriac, Florintree Advisors,",Private Equity,"3,800,000",,Consumer Internet,Online & Mobile based Lending platform,,,,,,,,,,,,,,,,,,,,,,3800000.0,2017-01-04,2017.0,,mumbai
2.0,03/04/2017,Eruditus,,Mumbai,Bertelsmann India,Private Equity,"8,200,000",,Education,Executive Education Provider,,,,,,,,,,,,,,,,,,,,,,8200000.0,2017-03-04,2017.0,,mumbai
3.0,03/04/2017,TestBook,,Mumbai,Matrix Partners India,Private Equity,,,Consumer Internet,Online Test Preparation Platform,,,,,,,,,,,,,,,,,,,,,,,2017-03-04,2017.0,,mumbai
4.0,03/04/2017,Healthcare at Home,,Noida,Quadria Capital Advisors,Private Equity,"40,000,000",,Healthcare,Home Healthcare Provider,,,,,,,,,,,,,,,,,,,,,,40000000.0,2017-03-04,2017.0,,noida
5.0,03/04/2017,Tyre Express,,Mumbai,Rohitash Gupta,Seed Funding,,,Technology,Enterprise IoT solutions For Tyre Performance,,,,,,,,,,,,,,,,,,,,,,,2017-03-04,2017.0,,mumbai
6.0,03/04/2017,SmartCoin,,Bangalore,Unicorn India Ventures & Others,Private Equity,,,Consumer Internet,Micro Lending platform,,,,,,,,,,,,,,,,,,,,,,,2017-03-04,2017.0,,bangalore
7.0,04/04/2017,WayCool,,Chennai,Aspada Investments,Private Equity,"2,700,000",,Food & Beverage,Fresh-Produce Distribution Platform,,,,,,,,,,,,,,,,,,,,,,2700000.0,2017-04-04,2017.0,,chennai
8.0,04/04/2017,Perfios,,Bangalore,Bessemer Venture Partners,Private Equity,"6,100,000",,Technology,Fin-Tech Solutions,,,,,,,,,,,,,,,,,,,,,,6100000.0,2017-04-04,2017.0,,bangalore
9.0,04/04/2017,Whatfix,,Bangalore,"Stellaris Venture Partners, Helion Venture Partners, Powerhouse Ventures, Gokul Rajaram, Girish Mathrubootham, Aneesh Reddy, Vispi Daver",Private Equity,"3,690,000",,Technology,Interactive Tech-Support Guides,,,,,,,,,,,,,,,,,,,,,,3690000.0,2017-04-04,2017.0,,bangalore
10.0,04/04/2017,ElastiRun,,Pune,"Kalaari Capital, Norwest Venture Partners",Private Equity,"7,000,000",,Technology,App based Logistics & Distribution platform,,,,,,,,,,,,,,,,,,,,,,7000000.0,2017-04-04,2017.0,,pune
11.0,04/04/2017,Trukky,,Ahmedabad,"Keyur Joshi, Pavan Bakeri",Seed Funding,"500,000",,Consumer Internet,Online Truck Aggregator & Booking platform,,,,,,,,,,,,,,,,,,,,,,500000.0,2017-04-04,2017.0,,ahmedabad
12.0,04/04/2017,Konsult App,,New Delhi,"Koen Bouwers, Lomesh Agarwal, Jeroen Mensen, Pablo van den Bosch & Others",Seed Funding,"500,000",,Consumer Internet,App based Doctor Consulting platform,,,,,,,,,,,,,,,,,,,,,,500000.0,2017-04-04,2017.0,,new delhi
13.0,05/04/2017,Credit Sudhaar,,Mumbai,"Deepak Kulkarni, Sandeep Pangal",Seed Funding,,,Consumer Internet,Credit Score Improvement platform,,,,,,,,,,,,,,,,,,,,,,,2017-05-04,2017.0,,mumbai
14.0,05/04/2017,Fingerlix,,Mumbai,Zephyr Peacock India,Private Equity,"3,000,000",,Consumer Internet,Food Delivery Platform,,,,,,,,,,,,,,,,,,,,,,3000000.0,2017-05-04,2017.0,,mumbai
15.0,05/04/2017,DataWeave,,Bangalore,"FreakOut Group, Blume Ventures, Herb Madan, WaterBridge Ventures",Private Equity,,,Technology,Business Intelligence Solutions,,,,,,,,,,,,,,,,,,,,,,,2017-05-04,2017.0,,bangalore
16.0,06/04/2017,Medwell Ventures,,Bangalore,"Mahindra Partners, Eight Roads Ventures, F-Prime Capital Partners",Private Equity,"21,000,000",,Healthcare,Home-Based Healthcare provider,,,,,,,,,,,,,,,,,,,,,,21000000.0,2017-06-04,2017.0,,bangalore
17.0,06/04/2017,Mech Mocha,,Bangalore,"Accel Partners, Shunwei Capital",Private Equity,"5,000,000",,Consumer Internet,Mobile gaming startup,,,,,,,,,,,,,,,,,,,,,,5000000.0,2017-06-04,2017.0,,bangalore
18.0,07/04/2017,Startup Buddy,,Gurgaon,"YouWeCan Ventures,",Seed Funding,,,Consumer Internet,Startup Support Platform,,,,,,,,,,,,,,,,,,,,,,,2017-07-04,2017.0,,gurgaon
19.0,07/04/2017,QorQI,,Noida,Paytm,Seed Funding,,,Healthcare,Online Healthcare provider,,,,,,,,,,,,,,,,,,,,,,,2017-07-04,2017.0,,noida
20.0,07/04/2017,Twenty Two Motors,,Gurgaon,"Ishwar Singh,Farhaan Shabbir",Seed Funding,,,Technology,Smart Scooter manufacturer,,,,,,,,,,,,,,,,,,,,,,,2017-07-04,2017.0,,gurgaon
21.0,07/04/2017,PharmEasy,,Mumbai,"Bessemer Venture Partners, Orios Venture Partners, Trifecta Capital,",Private Equity,"18,000,000",,eCommerce,Online Pharmacy,,,,,,,,,,,,,,,,,,,,,,18000000.0,2017-07-04,2017.0,,mumbai
22.0,08/04/2017,WonderChef,,Mumbai,Labruyere Eberlé,Private Equity,,,eCommerce,Online marketplace for kitchen products,,,,,,,,,,,,,,,,,,,,,,,2017-08-04,2017.0,,mumbai
23.0,08/04/2017,FastFox,,Gurgaon,"Lightspeed India Partners, Blume Ventures, CyberAgent Ventures, GrowX Ventures, IMJ Investment Partners",Private Equity,"4,600,000",,Consumer Internet,Online rental discovery platform,,,,,,,,,,,,,,,,,,,,,,4600000.0,2017-08-04,2017.0,,gurgaon
24.0,10/04/2017,Omnify,,Bangalore,"Rajan Anandan, L.D Sharma, Saurabh Arora",Seed Funding,"150,000",,Technology,SaaS platform for SMEs,,,,,,,,,,,,,,,,,,,,,,150000.0,2017-10-04,2017.0,,bangalore
25.0,10/04/2017,Capital Float,,Bangalore,Mahindra and Mahindra Financial Services,Private Equity,"2,300,000",,Consumer Internet,Online Lending Platform for SME,,,,,,,,,,,,,,,,,,,,,,2300000.0,2017-10-04,2017.0,,bangalore
26.0,11/04/2017,Ninjacart,,Bangalore,"Accel Partners, Nandan Nilekani’s NRJN Trust, Mistletoe, Qualcomm Ventures, M&S Partners",Private Equity,"5,500,000",,eCommerce,B2B agri-marketing platform,,,,,,,,,,,,,,,,,,,,,,5500000.0,2017-11-04,2017.0,,bangalore
27.0,11/04/2017,MergerWare,,Bangalore,Philippe Bouchet,Seed Funding,"100,000",,Technology,Software solutions for M&As,,,,,,,,,,,,,,,,,,,,,,100000.0,2017-11-04,2017.0,,bangalore
28.0,11/04/2017,Sports Flashes,,New Delhi,"Sushil Kumar, Sandeep Singh",Seed Funding,,,Consumer Internet,Online Sports portal & Mobile app,,,,,,,,,,,,,,,,,,,,,,,2017-11-04,2017.0,,new delhi
29.0,12/04/2017,Clovia,,New Delhi,"Ivycap Ventures Advisors, Singularity Ventures and Ravi Dhariwal",Private Equity,"4,000,000",,eCommerce,Online lingerie & Sleepwear etailer,,,,,,,,,,,,,,,,,,,,,,4000000.0,2017-12-04,2017.0,,new delhi
30.0,12/04/2017,Emiza,,Mumbai,"Mayfield, Nishant Rao, Dileep Nath",Private Equity,"4,500,000",,Logistics,Third Party Logistics provider,,,,,,,,,,,,,,,,,,,,,,4500000.0,2017-12-04,2017.0,,mumbai
31.0,12/04/2017,HackerEarth,,Bangalore,"DHI Group Inc, Prime Venture Partners, Beenext, Beenos, Digital Garage, BizReach",Private Equity,"4,500,000",,Consumer Internet,Online Skill Assessment Platform,,,,,,,,,,,,,,,,,,,,,,4500000.0,2017-12-04,2017.0,,bangalore
32.0,12/04/2017,Squadrun,,Noida,"Blume Ventures, Contrarian Capital, 91springboard, Emergent Ventures, Abstract Ventures, Anthill Ventures, Axilor Ventures",Private Equity,"2,100,000",,Technology,Software-As-a-Service Platform,,,,,,,,,,,,,,,,,,,,,,2100000.0,2017-12-04,2017.0,,noida
33.0,12/04/2017,Tinmen,,Hyderabad,"MAPE Advisory Group, R Ramaraj, Corvus Ventures",Seed Funding,,,Consumer Internet,Food Delivery Platform,,,,,,,,,,,,,,,,,,,,,,,2017-12-04,2017.0,,hyderabad
34.0,12/04/2017,ScoutMyTrip,,Mumbai,Z Nation Lab,Seed Funding,,,Consumer Internet,Online Travel planner,,,,,,,,,,,,,,,,,,,,,,,2017-12-04,2017.0,,mumbai
35.0,13/04/2017,SafetyKart,,Gurgaon,Redcliffe Capital,Private Equity,,,eCommerce,Safety & Hygiene Products etailer,,,,,,,,,,,,,,,,,,,,,,,2017-04-13,2017.0,,gurgaon
36.0,13/04/2017,WeAreHolidays,,Gurgaon,"Urrshila Kerkar,",Private Equity,"7,700,000",,Consumer Internet,Travel Packages & Planner marketplace,,,,,,,,,,,,,,,,,,,,,,7700000.0,2017-04-13,2017.0,,gurgaon
37.0,14/04/2017,Ola Cabs,,Bangalore,SIMI Pacific Pte,Private Equity,"260,000,000",,Consumer Internet,Cab Aggregator App,,,,,,,,,,,,,,,,,,,,,,260000000.0,2017-04-14,2017.0,,bangalore
38.0,15/04/2017,Myly,,Jaipur,mall Industries Development Bank of India (SIDBI),Seed Funding,"310,000",,Consumer Internet,Mobile App for Schools,,,,,,,,,,,,,,,,,,,,,,310000.0,2017-04-15,2017.0,,jaipur
39.0,17/04/2017,CrediHealth,,Gurgaon,"Tolaram Inc, Mountain Pine Capital",Private Equity,"1,500,000",,Consumer Internet,Online Medical Assistance platform,,,,,,,,,,,,,,,,,,,,,,1500000.0,2017-04-17,2017.0,,gurgaon
40.0,17/04/2017,Navia Life Care,,New Delhi,Benori Ventures LLP,Seed Funding,,,Technology,Health Technology platform,,,,,,,,,,,,,,,,,,,,,,,2017-04-17,2017.0,,new delhi
41.0,17/04/2017,Raw Pressery,,Mumbai,Jacqueline Fernandez,Seed Funding,,,Food & Beverages,Raw Pressed Juices manufacturer,,,,,,,,,,,,,,,,,,,,,,,2017-04-17,2017.0,,mumbai
42.0,17/04/2017,Snackible,,Mumbai,"Nibhrant Shah, Anandbir Singh, Anirudh Sheth, Pratik Singhi, Vikram Mehta, Murali Nair",Seed Funding,"175,000",,Food & Beverages,Healthy Snacks manufacturer,,,,,,,,,,,,,,,,,,,,,,175000.0,2017-04-17,2017.0,,mumbai
43.0,17/04/2017,Be U Salons,,New Delhi,"Gaurav Kachru, Sundeep Singh Sahni, Jatin Aneja, Arun Malhotra",Seed Funding,"620,000",,Consumer Internet,Online Salon discovery & Booking Services,,,,,,,,,,,,,,,,,,,,,,620000.0,2017-04-17,2017.0,,new delhi
44.0,17/04/2017,Simulanis,,New Delhi,Village Capital,Seed Funding,,,Consumer Internet,eLearning & Skills Development plat,,,,,,,,,,,,,,,,,,,,,,,2017-04-17,2017.0,,new delhi
45.0,17/04/2017,LendingKart,,Ahmedabad,Anicut Capital,Private Equity,"4,650,000",,Consumer Internet,Lending platform for small businesses,,,,,,,,,,,,,,,,,,,,,,4650000.0,2017-04-17,2017.0,,ahmedabad
46.0,18/04/2017,Innefu Security Consulting,,New Delhi,IndiaNivesh Venture Capital Fund,Private Equity,"2,000,000",,Technology,Cyber Security solutions using AI,,,,,,,,,,,,,,,,,,,,,,2000000.0,2017-04-18,2017.0,,new delhi
47.0,18/04/2017,Whodat,,Bangalore,Ideaspring Capital,Private Equity,"600,000",,Technology,Markerless AR platform,,,,,,,,,,,,,,,,,,,,,,600000.0,2017-04-18,2017.0,,bangalore
48.0,18/04/2017,Absentia VR,,Bangalore,Exfinity Venture Partners,Private Equity,"1,250,000",,Technology,Virtual Reality Startup,,,,,,,,,,,,,,,,,,,,,,1250000.0,2017-04-18,2017.0,,bangalore
49.0,19/04/2017,IOTrek,,New Delhi,Undisclosed Investor,Seed Funding,"155,000",,Technology,IoT Platform for Bus,,,,,,,,,,,,,,,,,,,,,,155000.0,2017-04-19,2017.0,,new delhi
50.0,20/04/2017,HolaChef,,Mumbai,"SIDBI Venture Capital Ltd, Kalaari Capital",Private Equity,"3,000,000",,Consumer Internet,Online Food Delivery,,,,,,,,,,,,,,,,,,,,,,3000000.0,2017-04-20,2017.0,,mumbai
51.0,20/04/2017,Wooplr,,Bangalore,Ankit Nagori,Private Equity,,,eCommerce,Social Commerce  Fashion platform,,,,,,,,,,,,,,,,,,,,,,,2017-04-20,2017.0,,bangalore
52.0,21/04/2017,Video Ken,,Bangalore,"Ravi Garikipati, Surot Chatterjee, Ashish Agrawal, LG Chandrasekhar, Sashi Reddi",Seed Funding,"1,000,000",,Consumer Internet,Video Based Collaborative Learning,,,,,,,,,,,,,,,,,,,,,,1000000.0,2017-04-21,2017.0,,bangalore
53.0,24/04/2017,Faasos,,Pune,"Ligthbox Ventures II, Lightbox Expansion Fund, Sequoia Capital India, RuNet South Asia, RB Investments",Private Equity,"6,300,000",,Food & Beverage,QSR chain and online food delivery,,,,,,,,,,,,,,,,,,,,,,6300000.0,2017-04-24,2017.0,,pune
54.0,24/04/2017,Oyo Rooms,,Gurgaon,"SoftBank Vision Fund, Lightspeed Venture Partners, Sequoia Capital India Advisors, Greenoaks Capital Partners",Private Equity,"250,000,000",,Consumer Internet,Branded Budget Hotels Aggregator,,,,,,,,,,,,,,,,,,,,,,250000000.0,2017-04-24,2017.0,,gurgaon
55.0,24/04/2017,Toppr,,Mumbai,WGG International,Private Equity,"3,200,000",,Consumer Internet,Learning mobile app for students,,,,,,,,,,,,,,,,,,,,,,3200000.0,2017-04-24,2017.0,,mumbai
56.0,24/04/2017,Niramai,,Bangalore,"pi Ventures, Axilor Ventures, 500 Startups, Binny Bansal",Seed Funding,,,Healthcare,Breast Cancer Screening Solutions,,,,,,,,,,,,,,,,,,,,,,,2017-04-24,2017.0,,bangalore
57.0,25/04/2017,The Office Pass,,Gurgaon,"Arun Tadanki, Aditya Verma",Seed Funding,"245,000",,Consumer Internet,CoWorking Spaces booking platform,,,,,,,,,,,,,,,,,,,,,,245000.0,2017-04-25,2017.0,,gurgaon
58.0,25/04/2017,UrbanClap,,Gurgaon,Trifecta Capital,Private Equity,"3,100,000",,Consumer Internet,Mobile Services Marketplace,,,,,,,,,,,,,,,,,,,,,,3100000.0,2017-04-25,2017.0,,gurgaon
59.0,26/04/2017,Awfis,,Mumbai,Sequoia India,Private Equity,"20,000,000",,Consumer Internet,Collaborative co-Working Spaces,,,,,,,,,,,,,,,,,,,,,,20000000.0,2017-04-26,2017.0,,mumbai
60.0,26/04/2017,Myra,,Bangalore,"Times Internet,Matrix Partners",Private Equity,,,Consumer Internet,Online Pharmacy,,,,,,,,,,,,,,,,,,,,,,,2017-04-26,2017.0,,bangalore
61.0,26/04/2017,Flytxt,,Mumbai,DAH Beteiligungs GmbH,Private Equity,"11,000,000",,Technology,Customer data analytics software,,,,,,,,,,,,,,,,,,,,,,11000000.0,2017-04-26,2017.0,,mumbai
62.0,26/04/2017,Howdy Ventures,,Chennai,S. Xavier Britto,Seed Funding,"1,500,000",,Consumer Internet,Public and Private Events creation app,,,,,,,,,,,,,,,,,,,,,,1500000.0,2017-04-26,2017.0,,chennai
63.0,26/04/2017,StalkBuyLove,,New Delhi,Trifecta Capital,Private Equity,"1,000,000",,eCommerce,Online fashion marketplace,,,,,,,,,,,,,,,,,,,,,,1000000.0,2017-04-26,2017.0,,new delhi
64.0,26/04/2017,ZipGo,,Bangalore,"Orios Ventures Partners, Team Builder Ventures, Omidyar Networks",Private Equity,,,Consumer Internet,Bus Pooling services platform,,,,,,,,,,,,,,,,,,,,,,,2017-04-26,2017.0,,bangalore
65.0,27/04/2017,Scootsy,,Mumbai,"Agnus Capital, Khattar Holdings",Private Equity,"3,600,000",,Consumer Internet,On-Demand Food Delivery,,,,,,,,,,,,,,,,,,,,,,3600000.0,2017-04-27,2017.0,,mumbai
66.0,27/04/2017,Autobix,,Pune,GardX International,Seed Funding,,,Technology,Software Solutions for Auto Dealership,,,,,,,,,,,,,,,,,,,,,,,2017-04-27,2017.0,,pune
67.0,27/04/2017,eShiksha,,Jaipur,Cross Border Angels & Experts,Seed Funding,,,Technology,Education Institution Management Solutions,,,,,,,,,,,,,,,,,,,,,,,2017-04-27,2017.0,,jaipur
68.0,27/04/2017,iNurture,,Bangalore,BlackSoil Capital Pvt. Ltd,Private Equity,"1,500,000",,Consumer Internet,Online Educational courses,,,,,,,,,,,,,,,,,,,,,,1500000.0,2017-04-27,2017.0,,bangalore
69.0,28/04/2017,Sepalika,,New Delhi,Accel Partners,Seed Funding,"750,000",,Consumer Internet,Healthcare related content platform,,,,,,,,,,,,,,,,,,,,,,750000.0,2017-04-28,2017.0,,new delhi
70.0,28/04/2017,Mintwalk,,Mumbai,Poshika Financial Ecosystem,Seed Funding,,,Consumer Internet,Financial advisory mobile app,,,,,,,,,,,,,,,,,,,,,,,2017-04-28,2017.0,,mumbai
71.0,29/04/2017,Qriyo,,Jaipur,NB Ventures,Private Equity,,,Consumer Internet,Tutor Discovery & Booking platform,,,,,,,,,,,,,,,,,,,,,,,2017-04-29,2017.0,,jaipur
72.0,29/04/2017,,,,,,,,,,,,,,,,,,,,,,,,,,,,,,,,2017-04-29,2017.0,,
1.0,,TouchKin,,,,,,,,Predictive Care Platform,,01/08/2017,Technology,Bangalore,Kae Capital,Private Equity,"1,300,000",,,,,,,,,,,,,,,,,,,
2.0,,Ethinos,,,,,,,,Digital Marketing Agency,,02/08/2017,Technology,Mumbai,Triton Investment Advisors,Private Equity,,,,,,,,,,,,,,,,,,,,
3.0,,Leverage Edu,,,,,,,,Online platform for Higher Education Services,,02/08/2017,Consumer Internet,New Delhi,"Kashyap Deorah, Anand Sankeshwar, Deepak Jain, Sadashiva NT, Arjun Mehta, Satish Kaul, Anindya Ghose",Seed Funding,,,,,,,,,,,,,,,,,,,,
4.0,,Zepo,,,,,,,,DIY Ecommerce platform,,02/08/2017,Consumer Internet,Mumbai,"Kunal Shah, LetsVenture, Anupam Mittal, Hetal Sonpal",Seed Funding,"500,000",,,,,,,,,,,,,,,,,,,
5.0,,Click2Clinic,,,,,,,,healthcare service aggregator,,02/08/2017,Consumer Internet,Hyderabad,"Narottam Thudi, Shireesh Palle",Seed Funding,"850,000",,,,,,,,,,,,,,,,,,,
6.0,,SpeedBox,,,,,,,,On-Demand Logistics Service provider,,03/08/2017,Logistics,Mumbai,Cismat Cargo Services Pvt. Ltd.,Seed Funding,"300,000",,,,,,,,,,,,,,,,,,,
7.0,,Skill Connect,,,,,,,,Recruitment Portal,,03/08/2017,Consumer Internet,Jaipur,Rajasthan Angel Investor Network,Seed Funding,,,,,,,,,,,,,,,,,,,,
8.0,,Chai Point,,,,,,,,Tea Delivery Portal & offline stores,,03/08/2017,Consumer Internet,Bangalore,"DSG Consumer Partners, Eight Roads Ventures India",Private Equity,,,,,,,,,,,,,,,,,,,,
9.0,,Zoctr,,,,,,,,Health Products & Services Aggregator,,03/08/2017,Consumer Internet,Mumbai,SIDBI,Private Equity,,,,,,,,,,,,,,,,,,,,
10.0,,Lime Tray,,,,,,,,Restaurant Management Solutions,,04/08/2017,Technology,New Delhi,JSW Ventures,Private Equity,,,,,,,,,,,,,,,,,,,,
11.0,,CoutLoot,,,,,,,,Fashion Resale Marketplace,,04/08/2017,eCommerce,Mumbai,"Anuj Puri, Redcliffe Capital, Artha India Ventures, Siddharth Kothari, Apoorv Ranjan Sharma,",Seed Funding,,,,,,,,,,,,,,,,,,,,
12.0,,Box My Space,,,,,,,,Warehouse Aggregator,,04/08/2017,Logistics,Mumbai,"R. Jayakumar, Vaibhav Vohra, Aditya Vazirani, Rhea Vazirani, AVN Business Solutions, Dreamweaver Investments",Seed Funding,,,,,,,,,,,,,,,,,,,,
13.0,,Curatio,,,,,,,,Skincare Speciality services,,05/08/2017,Healthcare,Chennai,Anicut Capital,Private Equity,,,,,,,,,,,,,,,,,,,,
14.0,,New Castle Technologies,,,,,,,,Hospital Management Software,,08/08/2017,Technology,Chennai,Undisclosed investors,Seed Funding,"243,000",,,,,,,,,,,,,,,,,,,
15.0,,My Forex Eye,,,,,,,,foreign exchange services,,08/08/2017,Consumer Internet,New Delhi,"Rahul Dev Kumar, Rajesh Mahajan, Ankit Sharma and others",Seed Funding,"220,000",,,,,,,,,,,,,,,,,,,
16.0,,TruxApp,,,,,,,,Mobile based Logistics Service,,09/08/2017,Logistics,New Delhi,"Venugopal Dhoot, Ajay Bhatia, Tarun Khandelwal, Ganpat Singhvi, Mandhian family & Others",Seed Funding,"3,100,000",,,,,,,,,,,,,,,,,,,
17.0,,CroFarm,,,,,,,,Agriculture Supply Chain solutions,,09/08/2017,Technology,Gurgaon,Factor[e] Ventures,Seed Funding,"783,000",,,,,,,,,,,,,,,,,,,
18.0,,DoodhWala,,,,,,,,Online milk delivery,,09/08/2017,Consumer Internet,Bangalore,Tom Varkey,Seed Funding,,,,,,,,,,,,,,,,,,,,
19.0,,Stayabode,,,,,,,,Co-Living space aggregator,,10/08/2017,Consumer Internet,Bangalore,"Incubate Fund, Sanjay Shenoy, Mridul Upreti,",Private Equity,,,,,,,,,,,,,,,,,,,,
20.0,,Flipkart,,,,,,,,Online Marketplace,,11/08/2017,eCommerce,Bangalore,Softbank,Private Equity,"2,500,000,000",,,,,,,,,,,,,,,,,,,
21.0,,Moong Labs,,,,,,,,Mobile games developer,,11/08/2017,Technology,New Delhi,Nazara Games,Private Equity,,,,,,,,,,,,,,,,,,,,
22.0,,Ola Cabs,,,,,,,,App based cab aggregation Service,,11/08/2017,Consumer Internet,Gurgaon,Tekne Capital Management,Private Equity,"36,000,000",,,,,,,,,,,,,,,,,,,
23.0,,Sports Flashes,,,,,,,,Sports Content Mobile App,,14/08/2017,Consumer Internet,New Delhi,"Bennett, Coleman and Company Ltd (BCCL),",Private Equity,,,,,,,,,,,,,,,,,,,,
24.0,,Digilend,,,,,,,,Personal Loans & EMI solutions platform,,14/08/2017,Technology,Mumbai,"InCred Finance, Fullerton India Credit Company Ltd",Seed Funding,"312,000",,,,,,,,,,,,,,,,,,,
25.0,,KNAB Finance,,,,,,,,Unsecured Small Business Loans,,15/08/2017,Consumer Internet,Bangalore,"InCred, Krishnakumar Natarajan, Ravi Bhardwaj",Seed Funding,"385,000",,,,,,,,,,,,,,,,,,,
26.0,,Get Simpl,,,,,,,,Payment Solution Mobile app,,17/08/2017,Consumer Internet,Mumbai,"Green Visor Capital LP II, IA Venture Strategies Fund II LP, Boillot Family Trust, Russell M Byrne, The Oliver R. Grace, Jr. Millennium Trust, SF Capital Investments LP",Seed Funding,,,,,,,,,,,,,,,,,,,,
27.0,,Rootefy,,,,,,,,Building material online store,,20/08/2017,eCommerce,New Delhi,"Abhinav Gupta,",Seed Funding,"187,000",,,,,,,,,,,,,,,,,,,
28.0,,Uniphore,,,,,,,,speech recognition startup,,21/08/2017,Technology,Chennai,IDG Ventures,Private Equity,"6,800,000",,,,,,,,,,,,,,,,,,,
29.0,,Cerebroz,,,,,,,,E-Tech platform,,21/08/2017,Consumer Internet,Vadodara,Undisclosed HNI’s,Seed Funding,"734,000",,,,,,,,,,,,,,,,,,,
30.0,,Flochat,,,,,,,,instant messaging platform,,22/08/2017,Consumer Internet,Mumbai,"iSquare Global,",Seed Funding,,,,,,,,,,,,,,,,,,,,
31.0,,EasyGov,,,,,,,,Govt service application portal,,22/08/2017,Consumer Internet,Noida,"Social Alpha, Rajan Anandan, Rajeev Ahuja, Kshitij Arora",Seed Funding,,,,,,,,,,,,,,,,,,,,
32.0,,Milk Basket,,,,,,,,Online Grocery platform,,23/08/2017,Consumer Internet,Gurgaon,Blume Ventures. Lenovo Capital and Incubator Group (LCIG),Seed Funding,,,,,,,,,,,,,,,,,,,,
33.0,,Dhruva,,,,,,,,Cloud data protection and management solutions,,23/08/2017,Technology,Pune,"Riverwood Capital, Sequoia Capital India, Nexus Venture Partners, Tenaya Capital",Private Equity,"80,000,000",,,,,,,,,,,,,,,,,,,
34.0,,Bombay Shaving Company,,,,,,,,Men Grooming product etailer,,23/08/2017,eCommerce,New Delhi,Fireside Ventures,Private Equity,"2,300,000",,,,,,,,,,,,,,,,,,,
35.0,,Awign,,,,,,,,Operations and manpower outsourcing,,23/08/2017,Technology,Bangalore,"IIT Ropar, Imanpreet Singh Arora, Sidharth Rozario, Saurabh Abichandani, Shikhar Gupta,",Seed Funding,,,,,,,,,,,,,,,,,,,,
36.0,,Indiez,,,,,,,,Software & Mobile app development platform,,23/08/2017,Technology,Bangalore,Haresh Chawla,Seed Funding,"500,000",,,,,,,,,,,,,,,,,,,
37.0,,Ezetap,,,,,,,,mPOS solutions provider,,24/08/2017,Technology,Bangalore,"JS Capital Management, Social Capital, Horizons Ventures,",Private Equity,"16,000,000",,,,,,,,,,,,,,,,,,,
38.0,,Ink Monk,,,,,,,,Online printing marketplace,,25/08/2017,Consumer Internet,Chennai,"VAMM Ventures, Raksul, Dena",Seed Funding,"750,000",,,,,,,,,,,,,,,,,,,
39.0,,Medinfi,,,,,,,,Online Doctor Discovery Platform,,25/08/2017,Consumer Internet,Bangalore,"PBS Srinivas, Vinod Martin,",Seed Funding,"125,000",,,,,,,,,,,,,,,,,,,
40.0,,Mobikon,,,,,,,,Restaurant & Hotel CRM platform,,28/08/2017,Technology,Pune,"Sistema Asia Fund, C31 Ventures, Qualgro.",Private Equity,"7,000,000",,,,,,,,,,,,,,,,,,,
41.0,,CureFit,,,,,,,,End to End health and wellness platform.,,29/08/2017,Consumer Internet,Bangalore,"Accel Partners, IDG Ventures, Kalaari Capital,  UC-RNT fund",Private Equity,"25,000,000",,,,,,,,,,,,,,,,,,,
42.0,,Doxper,,,,,,,,Healthtech IoT platform,,29/08/2017,Technology,Mumbai,"idal Health, growx ventures, Capier Investments, Globevestor & others",Seed Funding,"750,000",,,,,,,,,,,,,,,,,,,
43.0,,Fieldassist,,,,,,,,SAAS based sales force automation services,,29/08/2017,Technology,Gurgaon,Small Industries Development Bank of India (SIDBI),Debt Funding,,,,,,,,,,,,,,,,,,,,
44.0,,Treebo,,,,,,,,Budget Hotel Aggregator platform,,30/08/2017,Consumer Internet,Bangalore,"Ward Ferry Management and Karst Peak Capital,",Private Equity,"34,000,000",,,,,,,,,,,,,,,,,,,
45.0,,MedGenome,,,,,,,,Genomics Research and Diagnostics Solutions,,30/08/2017,Technology,Bangalore,"Sequoia India, Sofina s.a., Zodius Capital, Kris Gopalakrishnan, Lakshmi Narayanan,",Private Equity,"30,000,000",,,,,,,,,,,,,,,,,,,
1.0,,Strata Enviro,,,,,,,,IoT based air pollution controller,,1/12/2017,Technology,Mumbai,Scale Minds,Private Equity,,,,,,,,,,,,,,,,,,,,
2.0,,Dunzo,,,,,,,,Daily Task Management Mobile App,,5/12/2017,Technology,Bangalore,Google,Private Equity,"12,300,000",,,,,,,,,,,,,,,,,,,
3.0,,Tata Housing,,,,,,,,Residential Project,,5/12/2017,Real Estate,Mumbai,Hines,Private Equity,"23,000,000",,,,,,,,,,,,,,,,,,,
4.0,,HandyTrain,,,,,,,,Mobile Learning Management Platform,,5/12/2017,Technology,Goa,NB Ventures,Private Equity,"1,000,000",,,,,,,,,,,,,,,,,,,
5.0,,Mobycy,,,,,,,,Bicycle sharing Platform,,5/12/2017,Technology,Gurgaon,Undisclosed Investors,Seed/Angel Funding,"500,000",,,,,,,,,,,,,,,,,,,
6.0,,Greenlight Planet,,,,,,,,Off-grid solar products platform,,6/12/2017,Technology,Mumbai,"Apis Partner, Eight Roads Ventures, Bamboo Capital Partners",Private Equity,"60,000,000",,,,,,,,,,,,,,,,,,,
7.0,,Fintobox,,,,,,,,Child Learning & Development Platform,,6/12/2017,Technology,Chennai,Lightbox,Private Equity,"7,000,000",,,,,,,,,,,,,,,,,,,
8.0,,Mswipe,,,,,,,,Mobile point of sale services provider,,7/12/2017,Technology,Mumbai,Eduardo Saverin,Private Equity,"10,000,000",,,,,,,,,,,,,,,,,,,
9.0,,The Label Life,,,,,,,,Home Decor and Online Fashion Portal,,7/12/2017,E-Commerce,Mumbai,Kalpvriksh,Private Equity,"3,100,000",,,,,,,,,,,,,,,,,,,
10.0,,Cygnus Hospitals,,,,,,,,Super speciality Hospitals,,7/12/2017,Healthcare,Gurgaon,Somerset Indus Capital Ventures,Seed/Angel Funding,"750,000",,,,,,,,,,,,,,,,,,,
11.0,,eShakti,,,,,,,,Women's Fashion Clothing Online Platform,,7/12/2017,Ecommerce,Chennai,IDG Ventures,Debt Funding,"2,300,000",,,,,,,,,,,,,,,,,,,
12.0,,Inshorts,,,,,,,,Mobile News Curation App,,8/12/2017,Technology,Noida,Tiger Global,Private Equity,"5,000,000",,,,,,,,,,,,,,,,,,,
13.0,,Vahdam Tea,,,,,,,,Online Platform Selling Indian Tea Globally,,11/12/2017,E-Commerce,Delhi,"Singapore Angel Network, Mumbai Angel",Private Equity,"1,500,000",,,,,,,,,,,,,,,,,,,
14.0,,Logic Roots,,,,,,,,Educational Platform to Learn Mathematics,,11/12/2017,Technology,Mumbai,Village Capital,Seed/Angel Funding,"50,000",,,,,,,,,,,,,,,,,,,
15.0,,Project Mudra,,,,,,,,Assisting Visually Impaired to learn through Braille,,11/12/2017,Technology,Bengaluru,Village Capital,Seed/Angel Funding,"50,000",,,,,,,,,,,,,,,,,,,
16.0,,Furlenco,,,,,,,,Furniture Rental Platform,,11/12/2017,Technology,Bengaluru,Aamir Khan,Debt Funding,"1,200,000",,,,,,,,,,,,,,,,,,,
17.0,,I Can Stay,,,,,,,,Hotel Aggregator Platform,,12/12/2017,Technology,Delhi,HT Media,Private Equity,"1,800,000",,,,,,,,,,,,,,,,,,,
18.0,,Fracktal Works,,,,,,,,Platform based on 3D printing and Digital Manufacturing,,12/12/2017,Technology,Bengaluru,Hyderabad Angels,Seed/Angel Funding,,,,,,,,,,,,,,,,,,,,
19.0,,Simility,,,,,,,,Adaptive Fraud Intelligence Platform,,12/12/2017,Technology,Hyderabad,Accel Partners,Private Equity,"17,500,000",,,,,,,,,,,,,,,,,,,
20.0,,Shopholix,,,,,,,,Fashion and Lifestyle Coupon Platform,,12/12/2017,E-Commerce,Gurgaon,Munesh Khanna,Seed/Angel Funding,"233,000",,,,,,,,,,,,,,,,,,,
21.0,,MindTickle,,,,,,,,Gamification Platform to train Sales People,,13/12/2017,Technology,Pune,Canaan Partners,Private Equity,"27,000,000",,,,,,,,,,,,,,,,,,,
22.0,,Nazara Technologies,,,,,,,,Mobile Games Development Firm,,13/12/2017,Technology,Mumbai,Rakesh Jhunjhunwala,Private Equity,"27,000,000",,,,,,,,,,,,,,,,,,,
23.0,,DocsApp,,,,,,,,Mobile Application for Doctor Consultation,,13/12/2017,Technology,Bengaluru,Bessemer Venture Partners,Private Equity,"7,200,000",,,,,,,,,,,,,,,,,,,
24.0,,Capita World,,,,,,,,Artificial Intelligence Platform to Raise Funds,,13/12/2017,Technology,Mumbai,"Mohan Tanksale, Kiran Shetty, Darshak Shah, Mandar Mhatre",Private Equity,,,,,,,,,,,,,,,,,,,,
25.0,,Tea Box,,,,,,,,Fresh Indian Tea Selling Platform across 112 countries,,14/12/2017,E-Commerce,Bengaluru,RB Investments,Private Equity,"7,000,000",,,,,,,,,,,,,,,,,,,
26.0,,Transversal Technologies,,,,,,,,Hyperlocal Video Information Sharing Platform,,14/12/2017,Technology,Bengaluru,Matrix Partners,Private Equity,"6,000,000",,,,,,,,,,,,,,,,,,,
27.0,,Curofy,,,,,,,,Mobile App for Network of Doctors,,14/12/2017,Technology,Gurgaon,RoundGlass Partners LLC,Seed/Angel Funding,"250,000",,,,,,,,,,,,,,,,,,,
28.0,,HomeLane,,,,,,,,Online Furniture Marketplace,,14/12/2017,E-Commerce,Bengaluru,"Accel Partners, Sequoia Capital, RB Investments",Private Equity,"10,000,000",,,,,,,,,,,,,,,,,,,
29.0,,WeDoSky,,,,,,,,Provides Business Insights using Drone Imaginary,,14/12/2017,Technology,Delhi,Mumbai Angels Network,Private Equity,,,,,,,,,,,,,,,,,,,,
30.0,,Purplle,,,,,,,,Beauty Products Online Marketplace,,15/12/2017,E-Commerce,Mumbai,"Mountain Pain Capital, Suncoast Investments",Seed/Angel Funding,"537,000",,,,,,,,,,,,,,,,,,,
31.0,,Cash Suvidha,,,,,,,,Online Micro-Lending Platform,,15/12/2017,E-Commerce,Delhi,,Debt Funding,"2,700,000",,,,,,,,,,,,,,,,,,,
32.0,,Sky Met Weather,,,,,,,,Weather Forecast Platform,,18/12/2017,Technology,Noida,InsuResillience Investment Fund,Private Equity,,,,,,,,,,,,,,,,,,,,
33.0,,Springboard,,,,,,,,Online Courses and Mentoring from Experts,,19/12/2017,Technology,Bengaluru,"Costanoa, Learn Capital, Jyoti Bansal",Private Equity,"9,500,000",,,,,,,,,,,,,,,,,,,
34.0,,Peel Works,,,,,,,,SaaS based Big Data Analytics Platform,,19/12/2017,Technology,Mumbai,Unilever Ventures,Private Equity,,,,,,,,,,,,,,,,,,,,
35.0,,9Stacks,,,,,,,,Online Poker Platform,,19/12/2017,Technology,Delhi,"Swati Gupta, Purnima Khandelwal, Maheshwar Peri, Sanjay Singh",Private Equity,"1,500,000",,,,,,,,,,,,,,,,,,,
36.0,,Your Quote,,,,,,,,Vernacular and Video Content Platform,,20/12/2017,Technology,Bengaluru,"Axilor Ventures, E-City VEntures Atul Goel",Private Equity,"1,000,000",,,,,,,,,,,,,,,,,,,
37.0,,Spandana Sphoorty,,,,,,,,Micro finance institution providing small ticket unsecured loans to women,,20/12/2017,Finance,Hyderabad,"Kedaraa Capital, Ontario Teachers'",Private Equity,"19,500,000",,,,,,,,,,,,,,,,,,,
38.0,,Indus OS,,,,,,,,Regional Operating System for Smartphones,,21/12/2017,Technology,Mumbai,Omidyar Network,Private Equity,"4,000,000",,,,,,,,,,,,,,,,,,,
39.0,,EasyEcom,,,,,,,,Ecommerce enabler platform,,21/12/2017,E-Commerce,Bengaluru,"Ambarish Gupta, Aneesh Reddy, Bold Ventures, Vona Investments",Seed/Angel Funding,"150,000",,,,,,,,,,,,,,,,,,,
40.0,,IGP.com,,,,,,,,Online Gifting Platform,,21/12/2017,E-Commerce,Uttar Pradesh,Venture Catalysts,Private Equity,,,,,,,,,,,,,,,,,,,,
41.0,,Specsmakers,,,,,,,,Online Spects Platform for Men and Women,,26/12/2017,E-Commerce,Chennai,Eight Roads Ventures India,Private Equity,"10,000,000",,,,,,,,,,,,,,,,,,,
42.0,,Garage On Road,,,,,,,,Online vehicle service booking platform,,27/12/2017,E-Commerce,Noida,Gaurav Gupta,Private Equity,,,,,,,,,,,,,,,,,,,,
43.0,,Foyr.com,,,,,,,,Realty Tech Startup solving real life Interior Designing problems,,27/12/2017,Technology,Hyderabad,Jones Lang LaSalle,Private Equity,"3,800,000",,,,,,,,,,,,,,,,,,,
1.0,02/02/2017,Clodura,,Pune,Undisclosed Investors,,,,Technology,Intelligent Sales Assistant,Seed Funding,,,,,,,,,,,,,,,,,,,,,,2017-02-02,2017.0,,pune
2.0,03/02/2017,Stockroom.io,,Hyderabad,"Satya D Sinha, Gyanendra Singh",,,,Consumer Internet,Curated Platform for Developers,Seed Funding,,,,,,,,,,,,,,,,,,,,,,2017-03-02,2017.0,,hyderabad
3.0,06/02/2017,Capital Float,,Bangalore,IFMR Capital Finance,,"2,500,000",,Consumer Internet,Online lending platform,Private Equity,,,,,,,,,,,,,,,,,,,,,2500000.0,2017-06-02,2017.0,,bangalore
4.0,06/02/2017,iManageMyHotel,,Kolkata,Jaarvis Accelerator,,,,Technology,Hotel Management Solution,Seed Funding,,,,,,,,,,,,,,,,,,,,,,2017-06-02,2017.0,,kolkata
5.0,07/02/2017,Inner Hour,,Mumbai,"Batlivala & Karani Securities, Venture Works",,"450,000",,Consumer Internet,Online Counselling Platform,Seed Funding,,,,,,,,,,,,,,,,,,,,,450000.0,2017-07-02,2017.0,,mumbai
6.0,07/02/2017,Travel Triangle,,Noida,"RB Investments, SAIF Partners, Bessemer Venture Partners",,"10,000,000",,Consumer Internet,Online travel agent marketplace,Private Equity,,,,,,,,,,,,,,,,,,,,,10000000.0,2017-07-02,2017.0,,noida
7.0,08/02/2017,Wandertrails,,Bangalore,Earlsfield Capital,,"1,000,000",,Consumer Internet,"Online Travel, Adventure & Activities Portal",Seed Funding,,,,,,,,,,,,,,,,,,,,,1000000.0,2017-08-02,2017.0,,bangalore
8.0,08/02/2017,Zenatix,,Gurgaon,"pi Ventures, Blume Ventures",,"1,200,000",,Technology,IoT Based Energy Monitoring & Control,Private Equity,,,,,,,,,,,,,,,,,,,,,1200000.0,2017-08-02,2017.0,,gurgaon
9.0,08/02/2017,Cartrade,,Mumbai,Temasek Holdings,,"55,000,000",,Consumer Internet,Automobile Classifieds Portal,Private Equity,,,,,,,,,,,,,,,,,,,,,55000000.0,2017-08-02,2017.0,,mumbai
10.0,08/02/2017,MindYourFleet,,Noida,"Japan Vyas, Tarun Adlakha",,,,Technology,Car Rental Software Solutions,Seed Funding,,,,,,,,,,,,,,,,,,,,,,2017-08-02,2017.0,,noida
11.0,08/02/2017,Edurev,,Gurgaon,Facebook FB Start programme,,"40,000",,Consumer Internet,Online Education Portal,Seed Funding,,,,,,,,,,,,,,,,,,,,,40000.0,2017-08-02,2017.0,,gurgaon
12.0,09/02/2017,Voonik,,Bangalore,"RB Investments, Sequoia Capital",,"6,000,000",,ECommerce,Women Apparel & Lifestyle etailer,Private Equity,,,,,,,,,,,,,,,,,,,,,6000000.0,2017-09-02,2017.0,,bangalore
13.0,09/02/2017,1Crowd,,Mumbai,Ganesh Natarajan,,,,Finance,Startup Crowd-funding platform,Seed Funding,,,,,,,,,,,,,,,,,,,,,,2017-09-02,2017.0,,mumbai
14.0,09/02/2017,Wooplr,,Bangalore,"Sistema Asia Fund, Amereus Group, Helion Ventures",,"8,000,000",,ECommerce,Women Fashion Portal,Private Equity,,,,,,,,,,,,,,,,,,,,,8000000.0,2017-09-02,2017.0,,bangalore
15.0,10/02/2017,48East,,Bangalore,Al Dhaheri family,,"500,000",,ECommerce,Online Food Delivery Platform,Private Equity,,,,,,,,,,,,,,,,,,,,,500000.0,2017-10-02,2017.0,,bangalore
16.0,10/02/2017,Redesyn,,Mumbai,ThinQbate,,,,Consumer Internet,Tech Enabler for Artists,Seed Funding,,,,,,,,,,,,,,,,,,,,,,2017-10-02,2017.0,,mumbai
17.0,13/02/2017,Sigtuple,,Bangalore,"Accel Partners, IDG Ventures, Endiya Partners, pi Ventures, VH Capital, Axilor Partners",,"5,800,000",,Technology,Medical Automation platform,Private Equity,,,,,,,,,,,,,,,,,,,,,5800000.0,2017-02-13,2017.0,,bangalore
18.0,13/02/2017,Flutura,,Bangalore,"Vertex Ventures, Lumis Partners",,"7,500,000",,Technology,Decision Sciences Analytics Solutions,Private Equity,,,,,,,,,,,,,,,,,,,,,7500000.0,2017-02-13,2017.0,,bangalore
19.0,13/02/2017,Wassup,,Chennai,Anil Jain & other HNIs,,"3,200,000",,Consumer Internet,On Demand Laundry & Dry Cleaning Services,Private Equity,,,,,,,,,,,,,,,,,,,,,3200000.0,2017-02-13,2017.0,,chennai
20.0,13/02/2017,Better Mortgage,,Gurgaon,"Kleiner Perkins, Goldman Sachs, Pine Brook",,"15,000,000",,Consumer Internet,Mortgage Offering Platform,Private Equity,,,,,,,,,,,,,,,,,,,,,15000000.0,2017-02-13,2017.0,,gurgaon
21.0,13/02/2017,Nurturey,,New Delhi,Mohit Joshi & Others,,"330,000",,Consumer Internet,Parenting Mobile App,Seed Funding,,,,,,,,,,,,,,,,,,,,,330000.0,2017-02-13,2017.0,,new delhi
22.0,13/02/2017,Fyle,,Bangalore,Pravega Ventures,,"400,000",,Technology,Expense Management Solution,Seed Funding,,,,,,,,,,,,,,,,,,,,,400000.0,2017-02-13,2017.0,,bangalore
23.0,14/02/2017,GoBumpr,,Chennai,"Mahalingam K, Girish Mathrubootham",,"300,000",,Consumer Internet,Online Bike & Car Services provider,Seed Funding,,,,,,,,,,,,,,,,,,,,,300000.0,2017-02-14,2017.0,,chennai
24.0,14/02/2017,CCAvenue,,Mumbai,Infibeam,,"22,400,000",,Consumer Internet,Online Payment Gateway,Private Equity,,,,,,,,,,,,,,,,,,,,,22400000.0,2017-02-14,2017.0,,mumbai
25.0,14/02/2017,Connaizen,,New Delhi,Vikram Sud,,,,Technology,Data Analytics platform,Seed Funding,,,,,,,,,,,,,,,,,,,,,,2017-02-14,2017.0,,new delhi
26.0,15/02/2017,Innov8,,New Delhi,"Vijay Shekhar Sharma, Rajan Anandan, Kunal Shah, Girish Mathrubootham, Punit Soni, Anand Chandrasekaran, Sunil Kalra, Utsav Somani, Vishal Gondal, Vikram Limaye",,,,Consumer Internet,Co-Working Space Platform,Seed Funding,,,,,,,,,,,,,,,,,,,,,,2017-02-15,2017.0,,new delhi
27.0,15/02/2017,ZestMoney,,Bangalore,"PayU, Ribbit Capital, Omidyar Network",,"6,500,000",,Consumer Internet,Online Consumer Lending platform,Private Equity,,,,,,,,,,,,,,,,,,,,,6500000.0,2017-02-15,2017.0,,bangalore
28.0,15/02/2017,AirZaar,,Missourie,Quake Capital,,"350,000",,Technology,Drone operations management platform,Seed Funding,,,,,,,,,,,,,,,,,,,,,350000.0,2017-02-15,2017.0,,missourie
29.0,16/02/2017,Truebil,,Mumbai,Shunwei Capital,,"3,000,000",,Consumer Internet,Online Marketplace for Used Cars,Private Equity,,,,,,,,,,,,,,,,,,,,,3000000.0,2017-02-16,2017.0,,mumbai
30.0,16/02/2017,YourStory,,Bangalore,"Kalaari Capital Partners, Qualcomm, 3ONE4 Capital Advisors, UC-RNT",,"3,000,000",,Consumer Internet,Online Media,Private Equity,,,,,,,,,,,,,,,,,,,,,3000000.0,2017-02-16,2017.0,,bangalore
31.0,17/02/2017,Imaginate,,Hyderabad,SRI Capital,,"500,000",,Technology,AR & VR platform,Seed Funding,,,,,,,,,,,,,,,,,,,,,500000.0,2017-02-17,2017.0,,hyderabad
32.0,17/02/2017,The Ken,,Bangalore,"Aprameya Radhakrishna, Deepak Natraj, Girish Mathrubootham, Mahesh Murthy, Pallav Nadhani, Pavan Ongole, Sandeep Mathur, Vijay Shekhar Sharma & Others",,"400,000",,Consumer Internet,Online Media Platform,Seed Funding,,,,,,,,,,,,,,,,,,,,,400000.0,2017-02-17,2017.0,,bangalore
33.0,17/02/2017,Urban Ladder,,Bangalore,"Kalaari Capital, SAIF Partners, Steadview Capital, Sequoia Capital",,"15,200,000",,ECommerce,Online Furniture Store,Private Equity,,,,,,,,,,,,,,,,,,,,,15200000.0,2017-02-17,2017.0,,bangalore
34.0,17/02/2017,Aisle,,Bangalore,"Konglo Ventures, White Unicorn Ventures, LetsVenture",,,,Consumer Internet,Online match-making app,Seed Funding,,,,,,,,,,,,,,,,,,,,,,2017-02-17,2017.0,,bangalore
35.0,17/02/2017,TownScript,,Pune,BookMyShow,,,,Consumer Internet,DIY event registration and ticketing portal,Private Equity,,,,,,,,,,,,,,,,,,,,,,2017-02-17,2017.0,,pune
36.0,17/02/2017,Leopetra,,Mumbai,Facebook FBStart,,"40,000",,eCommerce,Solution provider for pet needs,Seed Funding,,,,,,,,,,,,,,,,,,,,,40000.0,2017-02-17,2017.0,,mumbai
37.0,18/02/2017,Blood n Care,,Gurgaon,Facebook FBStart,,"40,000",,Consumer Internet,First Aid care app,Seed Funding,,,,,,,,,,,,,,,,,,,,,40000.0,2017-02-18,2017.0,,gurgaon
38.0,20/02/2017,Flipkart,,Bangalore,"Bennett, Coleman and Co. Ltd (BCCL)",,"38,700,000",,eCommerce,Online Marketplace,Private Equity,,,,,,,,,,,,,,,,,,,,,38700000.0,2017-02-20,2017.0,,bangalore
39.0,21/02/2017,True Balance,,Gurgaon,"Softbank Ventures Korea, IMM Investment",,"15,000,000",,Consumer Internet,Mobile balance Checking App,Private Equity,,,,,,,,,,,,,,,,,,,,,15000000.0,2017-02-21,2017.0,,gurgaon
40.0,22/02/2017,Vebbler,,Bangalore,Facebook FBStart,,"40,000",,Consumer Internet,Photo Sharing for Groups,Seed Funding,,,,,,,,,,,,,,,,,,,,,40000.0,2017-02-22,2017.0,,bangalore
42.0,23/02/2017,Get My Parking,,New Delhi,"Indian Angel Network (IAN), BEENEXT, The Chennai Angels, Sunil Munjal",,"1,100,000",,Consumer Internet,Smart Parking Platform,Private Equity,,,,,,,,,,,,,,,,,,,,,1100000.0,2017-02-23,2017.0,,new delhi
43.0,23/02/2017,Lets Reap,,Mumbai,"Kunal Shah, Sandeep Tandon, Nitin Saluja, Gagan Goyal",,,,Consumer Internet,B2B Mobile App for Pharmacies,Seed Funding,,,,,,,,,,,,,,,,,,,,,,2017-02-23,2017.0,,mumbai
44.0,24/02/2017,Oglas,,Noida,"Pankaj Rungta, Yogesh Agarwal",,,,Consumer Internet,Mobile Advertising App,Seed Funding,,,,,,,,,,,,,,,,,,,,,,2017-02-24,2017.0,,noida
45.0,27/02/2017,Staydobe,,Bangalore,Ishan Manaktala,,,,Consumer Internet,Co-Living Spaces Aggregator,Seed Funding,,,,,,,,,,,,,,,,,,,,,,2017-02-27,2017.0,,bangalore
46.0,27/02/2017,Biryani By Kilo,,Gurgaon,"Chandigarh Angels, Ashish Gupta, Rohit, Ashish Chand, Sunil Singh & Others",,"375,000",,Consumer Internet,Online Food Ordering & Delivery Portal,Seed Funding,,,,,,,,,,,,,,,,,,,,,375000.0,2017-02-27,2017.0,,gurgaon
47.0,27/02/2017,Johari Shop,,Bangalore,Undisclosed Investors,,"94,000",,ECommerce,Online Jewellery etailer,Seed Funding,,,,,,,,,,,,,,,,,,,,,94000.0,2017-02-27,2017.0,,bangalore
48.0,28/02/2017,NeoStencil,,New Delhi,"Brand Capital, Paragon Trust",,"1,000,000",,Consumer Internet,Live Online Coaching Classes,Private Equity,,,,,,,,,,,,,,,,,,,,,1000000.0,2017-02-28,2017.0,,new delhi
49.0,28/02/2017,Blackbuck,,Bangalore,"Sands Capital, IFC, Accel Partners, Flipkart, Sanjiv Rangrass",,"70,000,000",,Logistics,Online freight aggregator,Private Equity,,,,,,,,,,,,,,,,,,,,,70000000.0,2017-02-28,2017.0,,bangalore
50.0,28/02/2017,,,,,,,,,,,,,,,,,,,,,,,,,,,,,,,,2017-02-28,2017.0,,
1.0,02/01/2017,TaxSutra,,Pune,"TV Mohandas Pai, V Balakrishnan, PV Srinivasan",,"366,000",,Consumer Internet,Online Tax Filing platform,Seed Funding,,,,,,,,,,,,,,,,,,,,,366000.0,2017-02-01,2017.0,,pune
2.0,03/01/2017,TempoGo,,Panaji,K2 Capital,,"825,000",,Technology,IoT & SAAS Solutions for Transportation Industry,Seed Funding,,,,,,,,,,,,,,,,,,,,,825000.0,2017-03-01,2017.0,,panaji
3.0,03/01/2017,GoFynd,,Mumbai,"Anand Chandrasekaran, Rajiv Mehta, Ramakant Sharma",,,,ecommerce,Fashion ecommerce portal,Seed Funding,,,,,,,,,,,,,,,,,,,,,,2017-03-01,2017.0,,mumbai
4.0,03/01/2017,Vow Car Clinic,,Gurgaon,Vishal Malik,,,,Consumer Internet,Online/App Based Car cleaning service provider,Seed Funding,,,,,,,,,,,,,,,,,,,,,,2017-03-01,2017.0,,gurgaon
5.0,04/01/2017,LearnTron,,Chennai,Kae Capital,,,,Technology,Blended Learning Delivery App for Schools & Corporates,Seed Funding,,,,,,,,,,,,,,,,,,,,,,2017-04-01,2017.0,,chennai
6.0,05/01/2017,MobiDent,,Bangalore,DanGold Investment Corp,,,,Consumer Internet,Dentist Appointments booking platform,Private Equity,,,,,,,,,,,,,,,,,,,,,,2017-05-01,2017.0,,bangalore
7.0,05/01/2017,Yostra,,Bangalore,"Marico Innovation Foundation (MIF), Villgro",,,,Technology,Healthcare Technology Solutions,Private Equity,,,,,,,,,,,,,,,,,,,,,,2017-05-01,2017.0,,bangalore
8.0,06/01/2017,Leap India,,Mumbai,"India Nivesh Growth Fund, Sixth Sense, TCI Ventures",,"13,000,000",,Logistics,Supply Chain Solutions Provider,Private Equity,,,,,,,,,,,,,,,,,,,,,13000000.0,2017-06-01,2017.0,,mumbai
9.0,07/01/2017,FreeCharge,,Mumbai,Jasper Infotech Pvt Ltd,,"57,000,000",,Consumer Internet,Mobile Wallet,Private Equity,,,,,,,,,,,,,,,,,,,,,57000000.0,2017-07-01,2017.0,,mumbai
10.0,09/01/2017,TicketNew,,Chennai,Alibaba Pictures,,"35,000,000",,Consumer Internet,Movie Ticket Booking platform,Private Equity,,,,,,,,,,,,,,,,,,,,,35000000.0,2017-09-01,2017.0,,chennai
11.0,10/01/2017,Intelligence Node,,Mumbai,BlackSoil Capital Pvt Ltd,,"800,000",,Technology,SAAS Based Retail Analytics Solutions,Private Equity,,,,,,,,,,,,,,,,,,,,,800000.0,2017-10-01,2017.0,,mumbai
12.0,10/01/2017,Securens,,Mumbai,"Mayfield India, Trifecta Capital",,"5,000,000",,Technology,e-surveillance services provider,Private Equity,,,,,,,,,,,,,,,,,,,,,5000000.0,2017-10-01,2017.0,,mumbai
13.0,10/01/2017,Loan Frame,,Gurgaon,"Vedanta Capital, William Campbell, Toos N Daruvala",,"2,250,000",,Consumer Internet,Small Business Loans Marketplace platform,Private Equity,,,,,,,,,,,,,,,,,,,,,2250000.0,2017-10-01,2017.0,,gurgaon
14.0,10/01/2017,DriveSkool,,Bangalore,Aavya Ventures,,,,Consumer Internet,online marketplace for driving schools,Seed Funding,,,,,,,,,,,,,,,,,,,,,,2017-10-01,2017.0,,bangalore
15.0,10/01/2017,Medinfi,,Bangalore,"Vinod Martin, Evan Lim, Kanchan Ghoshal, Ram Kumar Kakani",,"100,000",,Consumer Internet,Doctor & Clinic Discovery portal,Seed Funding,,,,,,,,,,,,,,,,,,,,,100000.0,2017-10-01,2017.0,,bangalore
16.0,10/01/2017,LensKart,,Bangalore,Ronnie Screwvala,,"3,500,000",,eCommerce,Online eyewear retailer,Private Equity,,,,,,,,,,,,,,,,,,,,,3500000.0,2017-10-01,2017.0,,bangalore
17.0,11/01/2017,InstaOffice,,Gurgaon,"Zishaan Hayath, Karan Chellani, Mohit Satyan",,,,Consumer Internet,CoWorking Spaces booking platform,Seed Funding,,,,,,,,,,,,,,,,,,,,,,2017-11-01,2017.0,,gurgaon
18.0,12/01/2017,Hansel.io,,Bangalore,"IDG Ventures, Endiya Partners",,"1,350,000",,Consumer Internet,Real-time Mobile App Management Platform,Private Equity,,,,,,,,,,,,,,,,,,,,,1350000.0,2017-12-01,2017.0,,bangalore
19.0,12/01/2017,Square Yards,,Gurgaon,"Lohia Group, Andre Hoffman",,"10,000,000",,Consumer Internet,Property Search Aggregator platform,Private Equity,,,,,,,,,,,,,,,,,,,,,10000000.0,2017-12-01,2017.0,,gurgaon
20.0,13/01/2017,Roambee,,Mumbai,Deutsche Telekom Strategic Investments & Others,,"4,100,000",,Technology,IoT smart Logistics and Asset Management Company,Private Equity,,,,,,,,,,,,,,,,,,,,,4100000.0,2017-01-13,2017.0,,mumbai
21.0,13/01/2017,PaisaWapas,,Bangalore,Vividhity Ventures,,,,Consumer Internet,Cashback & Coupons platform,Seed Funding,,,,,,,,,,,,,,,,,,,,,,2017-01-13,2017.0,,bangalore
22.0,13/01/2017,iService,,Bangalore,"Blume Ventures, Girish Mathrubootham, Aprameya Radhakrishna",,"440,000",,Consumer Internet,Gadgets Repair & Service Booking platform,Seed Funding,,,,,,,,,,,,,,,,,,,,,440000.0,2017-01-13,2017.0,,bangalore
23.0,14/01/2017,Unacademy,,Bangalore,"Nexus Venture Partners, Blume Ventures",,"4,500,000",,Consumer Internet,Online learning platform,Private Equity,,,,,,,,,,,,,,,,,,,,,4500000.0,2017-01-14,2017.0,,bangalore
24.0,14/01/2017,SecururAX,,Bangalore,"Axilor Ventures, Parampara Early Stage Opportunities Fund & Others",,,,Technology,Cloud-based solutions provider,Private Equity,,,,,,,,,,,,,,,,,,,,,,2017-01-14,2017.0,,bangalore
25.0,16/01/2017,Leadburg,,Bangalore,"Harsh V. Pant, Ratheesh Raveendran",,,,Consumer Internet,Personality Development Mobile App,Seed Funding,,,,,,,,,,,,,,,,,,,,,,2017-01-16,2017.0,,bangalore
26.0,16/01/2017,ZoloStays,,Bangalore,"Nexus Venture Partners, Innoven Capital",,"5,000,000",,Consumer Internet,Branded PG Accomodation booking platform,Private Equity,,,,,,,,,,,,,,,,,,,,,5000000.0,2017-01-16,2017.0,,bangalore
27.0,16/01/2017,Oi Media,,New Delhi,Quarizon,,,,Technology,SAAS Based Media Marketing platform,Seed Funding,,,,,,,,,,,,,,,,,,,,,,2017-01-16,2017.0,,new delhi
28.0,16/01/2017,HipCouch,,Mumbai,Undisclosed Investors,,"700,000",,Consumer Internet,Custom & Modular Furniture platform,Seed Funding,,,,,,,,,,,,,,,,,,,,,700000.0,2017-01-16,2017.0,,mumbai
29.0,17/01/2017,Curiositi,,Bangalore,"Menterra Social Impact Fund, Unitus Seed Fund",,"800,000",,Consumer Internet,Online Learning Platform,Private Equity,,,,,,,,,,,,,,,,,,,,,800000.0,2017-01-17,2017.0,,bangalore
30.0,17/01/2017,TinyStep,,Bangalore,Flipkart,,"2,000,000",,Consumer Internet,Parenting Info & Social Network,Private Equity,,,,,,,,,,,,,,,,,,,,,2000000.0,2017-01-17,2017.0,,bangalore
31.0,17/01/2017,Practo,,Bangalore,"Tencent,  ru-Net, RSI Fund, Thrive Capital",,"55,000,000",,Consumer Internet,Online Healthcare platform,Private Equity,,,,,,,,,,,,,,,,,,,,,55000000.0,2017-01-17,2017.0,,bangalore
32.0,17/01/2017,Ketchupp,,New Delhi,India Quotient and others,,"441,000",,Consumer Internet,Food Discovery Platform,Seed Funding,,,,,,,,,,,,,,,,,,,,,441000.0,2017-01-17,2017.0,,new delhi
33.0,17/01/2017,Hoopy,,Gwalior,undisclosed investors,,"500,000",,Consumer Internet,Online Car Service Platform,Seed Funding,,,,,,,,,,,,,,,,,,,,,500000.0,2017-01-17,2017.0,,gwalior
34.0,17/01/2017,Ezytruk,,Bangalore,"Ajith Nair, Anish K",,"147,000",,Consumer Internet,Logistics and truck aggregator platform,Seed Funding,,,,,,,,,,,,,,,,,,,,,147000.0,2017-01-17,2017.0,,bangalore
35.0,18/01/2017,Kratikal,,New Delhi,"Amajit Gupta, Praveen Dubey, J.P. Bhatt",,,,Technology,Cyber Security Solution provider,Seed Funding,,,,,,,,,,,,,,,,,,,,,,2017-01-18,2017.0,,new delhi
36.0,18/01/2017,Direct Create,,Gurgaon,Rajasthan Venture Capital Fund,,,,eCommerce,B2B Marketplace for Handicrafts,Seed Funding,,,,,,,,,,,,,,,,,,,,,,2017-01-18,2017.0,,gurgaon
37.0,18/01/2017,Vahdam Teas,,New Delhi,"Mumbai Angels Network, Fireside Ventures, Singapore Angel Network",,"650,000",,eCommerce,Online Tea etailer,Seed Funding,,,,,,,,,,,,,,,,,,,,,650000.0,2017-01-18,2017.0,,new delhi
38.0,18/01/2017,Qwikspec,,Bangalore,Undisclosed Investors,,"300,000",,Technology,Cloud-based construction,Seed Funding,,,,,,,,,,,,,,,,,,,,,300000.0,2017-01-18,2017.0,,bangalore
39.0,19/01/2017,PParke,,Bangalore,SB Ventures,,,,Consumer Internet,Parking Solutions mobile app,Seed Funding,,,,,,,,,,,,,,,,,,,,,,2017-01-19,2017.0,,bangalore
40.0,19/01/2017,Weddingz.in,,Mumbai,Singularity Ventures,,"1,000,000",,Consumer Internet,Online Marketplace for Wedding Venues and vendors,Private Equity,,,,,,,,,,,,,,,,,,,,,1000000.0,2017-01-19,2017.0,,mumbai
41.0,19/01/2017,Native Special,,Karur,"Indian Angel Network, Native Angels Network",,,,eCommerce,Indian Sweets & Snacks etailer,Seed Funding,,,,,,,,,,,,,,,,,,,,,,2017-01-19,2017.0,,karur
42.0,19/01/2017,Fitnapp,,Noida,SD Group,,,,Consumer Internet,Fitness Mobile App,Private Equity,,,,,,,,,,,,,,,,,,,,,,2017-01-19,2017.0,,noida
43.0,20/01/2017,Ethosh,,Pune,Deepak Nathani,,,,Technology,Visual and Interactive communications Solutions,Seed Funding,,,,,,,,,,,,,,,,,,,,,,2017-01-20,2017.0,,pune
44.0,20/01/2017,Wydr,,Gurgaon,"Bessemer Venture Partners, Stellaris Venture Partners, Jungle Venture Partners, Axis Capital",,,,eCommerce,B2B Wholesale Marketplace in India,Private Equity,,,,,,,,,,,,,,,,,,,,,,2017-01-20,2017.0,,gurgaon
45.0,20/01/2017,Tyre Express,,Mumbai,IvyCamp Ventures,,,,Technology,IoT platform for Tyre Performance management & tracking,Seed Funding,,,,,,,,,,,,,,,,,,,,,,2017-01-20,2017.0,,mumbai
46.0,20/01/2017,Connaizen,,New Delhi,Umang Moondra,,,,Technology,Data Analytics platform,Seed Funding,,,,,,,,,,,,,,,,,,,,,,2017-01-20,2017.0,,new delhi
47.0,22/01/2017,MessaGif,,New Delhi,Undisclosed investor,,"50,000",,Consumer Internet,social messaging platform,Seed Funding,,,,,,,,,,,,,,,,,,,,,50000.0,2017-01-22,2017.0,,new delhi
48.0,23/01/2017,SmartHi,,Pune,Singapore based investor,,,,Technology,Audit automation Solutions,Seed Funding,,,,,,,,,,,,,,,,,,,,,,2017-01-23,2017.0,,pune
49.0,23/01/2017,CRON Systems,,New Delhi,YourNest Fund II,,,,Technology,Border Intrusion Alert Solutions,Seed Funding,,,,,,,,,,,,,,,,,,,,,,2017-01-23,2017.0,,new delhi
50.0,23/01/2017,CueMath,,New Delhi,"CapitalG, Sequoia India",,"15,000,000",,Technology,Maths Learning program,Private Equity,,,,,,,,,,,,,,,,,,,,,15000000.0,2017-01-23,2017.0,,new delhi
51.0,23/01/2017,ChipperSage,,Bangalore,India Educational Investment Fund,,,,Technology,Online learning platform,Seed Funding,,,,,,,,,,,,,,,,,,,,,,2017-01-23,2017.0,,bangalore
52.0,24/01/2017,SelectJobs,,Mumbai,India Educational Investment Fund,,,,Consumer Internet,Online Job portal,Seed Funding,,,,,,,,,,,,,,,,,,,,,,2017-01-24,2017.0,,mumbai
53.0,24/01/2017,Khel Now,,Bangalore,Indochine International,,"500,000",,Consumer Internet,Mobile-based Social Platform for Sports,Private Equity,,,,,,,,,,,,,,,,,,,,,500000.0,2017-01-24,2017.0,,bangalore
54.0,24/01/2017,NowFloats,,Hyderabad,"Iron Pillar and IIFL, Blume Ventures, Omidyar Network",,"10,000,000",,Consumer Internet,Platform to take businesses online,Private Equity,,,,,,,,,,,,,,,,,,,,,10000000.0,2017-01-24,2017.0,,hyderabad
55.0,24/01/2017,Lets Transport,,Bangalore,"GMO Japan, Neelesh Bhatnagar",,"4,000,000",,Consumer Internet,Online transport vehicle booking platform,Private Equity,,,,,,,,,,,,,,,,,,,,,4000000.0,2017-01-24,2017.0,,bangalore
56.0,24/01/2017,BetaOut,,Noida,East Ventures & Others,,,,Technology,ECommerce Marketing Software,Private Equity,,,,,,,,,,,,,,,,,,,,,,2017-01-24,2017.0,,noida
57.0,25/01/2017,Wishberry,,Mumbai,"Sharad Sharma, Rajan Anandan,  Amit Ranjan, Alok Mittal & others",,,,Consumer Internet,Crowdfunding Platform,Seed Funding,,,,,,,,,,,,,,,,,,,,,,2017-01-25,2017.0,,mumbai
58.0,25/01/2017,RML Agtech,,Pune,IvyCap Ventures,,"4,000,000",,Technology,Agri Decision Support Solution for farmers,Private Equity,,,,,,,,,,,,,,,,,,,,,4000000.0,2017-01-25,2017.0,,pune
59.0,25/01/2017,LoyaltyPrime,,New Delhi,"Senovo, Unternehmertum Venture Capital, Alexander Bruehl",,,,Technology,Loyalty program management solutions,Private Equity,,,,,,,,,,,,,,,,,,,,,,2017-01-25,2017.0,,new delhi
60.0,25/01/2017,InstaSafe,,Bangalore,ABM Knowledgeware,,"2,200,000",,Technology,Security-as-a-Service solution provider,Private Equity,,,,,,,,,,,,,,,,,,,,,2200000.0,2017-01-25,2017.0,,bangalore
61.0,25/01/2017,Infibeam,,Ahmedabad,"Bennett, Coleman and Company Ltd",,"8,800,000",,eCommerce,eCommerce Marketplace,Private Equity,,,,,,,,,,,,,,,,,,,,,8800000.0,2017-01-25,2017.0,,ahmedabad
62.0,2/01/2017,99Games,,Udupi,Dream Incubator,,,,Technology,Mobile Game Developer Studio,Seed Funding,,,,,,,,,,,,,,,,,,,,,,2017-02-01,2017.0,,udupi
63.0,26/01/2017,AirMed Labs,,Ahmedabad,Brand Capital,,"1,400,000",,Consumer Internet,Health Tests Booking platform & ePharmacy,Private Equity,,,,,,,,,,,,,,,,,,,,,1400000.0,2017-01-26,2017.0,,ahmedabad
64.0,26/01/2017,99PerHour,,Chennai,V Aanand R,,"300,000",,Consumer Internet,Hyper-local Handyman Service provider,Seed Funding,,,,,,,,,,,,,,,,,,,,,300000.0,2017-01-26,2017.0,,chennai
65.0,26/01/2017,Kochi Post,,Kochi,"Rajesh Yohannan, Puthen & Cole",,,,Consumer Internet,English Online News portal,Seed Funding,,,,,,,,,,,,,,,,,,,,,,2017-01-26,2017.0,,kochi
66.0,30/01/2017,Intuit Things,,Mumbai,Sanjay Mehta & Others ( The Ten Minute Million),,"106,000",,Technology,IoT solutions for home automation applications,Seed Funding,,,,,,,,,,,,,,,,,,,,,106000.0,2017-01-30,2017.0,,mumbai
67.0,30/01/2017,Cloudrino,,New Delhi,The Ten Minute Million,,"22,500",,Technology,Cloud based Virtual Servers,Seed Funding,,,,,,,,,,,,,,,,,,,,,22500.0,2017-01-30,2017.0,,new delhi
68.0,30/01/2017,FabX,,Mumbai,The Ten Minute Million,,"68,000",,eCommerce,Used Furniture Marketplace,Seed Funding,,,,,,,,,,,,,,,,,,,,,68000.0,2017-01-30,2017.0,,mumbai
69.0,30/01/2017,Maptags,,Bangalore,The Ten Minute Million,,"18,000",,Consumer Internet,Smart Online address tags,Seed Funding,,,,,,,,,,,,,,,,,,,,,18000.0,2017-01-30,2017.0,,bangalore
70.0,30/01/2017,YOLO Health,,Mumbai,Chandigarh Angels Network (CAN),,,,Consumer Internet,Online Healthcare platform,Seed Funding,,,,,,,,,,,,,,,,,,,,,,2017-01-30,2017.0,,mumbai
71.0,31/01/2017,Heads Up For Tails,,New Delhi,Undisclosed Investors,,"2,000,000",,eCommerce,Online Pet Products Store,Private Equity,,,,,,,,,,,,,,,,,,,,,2000000.0,2017-01-31,2017.0,,new delhi
72.0,31/01/2017,Register My Marriage,,New Delhi,Mumbai Angels,,,,Consumer Internet,Online Marriage Registration services,Seed Funding,,,,,,,,,,,,,,,,,,,,,,2017-01-31,2017.0,,new delhi
73.0,31/01/2017,,,,,,,,,,,,,,,,,,,,,,,,,,,,,,,,2017-01-31,2017.0,,
1.0,01/07/2017,Billion Loans,,Bangalore,Reliance Corporate Advisory Services Ltd,Seed Funding,"1,000,000",,Consumer Internet,Peer to Peer Lending platform,,,,,,,,,,,,,,,,,,,,,,1000000.0,2017-01-07,2017.0,,bangalore
2.0,03/07/2017,Ecolibriumenergy,,Ahmedabad,"Infuse Ventures, JLL",Private Equity,"2,600,000",,Technology,Energy management solutions provider,,,,,,,,,,,,,,,,,,,,,,2600000.0,2017-03-07,2017.0,,ahmedabad
3.0,04/07/2017,Droom,,Gurgaon,"Asset Management (Asia) Ltd, Digital Garage Inc",Private Equity,"20,000,000",,eCommerce,Online marketplace for automobiles,,,,,,,,,,,,,,,,,,,,,,20000000.0,2017-04-07,2017.0,,gurgaon
4.0,05/07/2017,Jumbotail,,Bangalore,"Kalaari Capital, Nexus India Capital Advisors",Private Equity,"8,500,000",,eCommerce,online marketplace for food and grocery,,,,,,,,,,,,,,,,,,,,,,8500000.0,2017-05-07,2017.0,,bangalore
5.0,05/07/2017,Moglix,,Noida,"International Finance Corporation, Rocketship, Accel Partners, Jungle Ventures, Shailesh Rao, Venture Highway",Private Equity,"12,000,000",,eCommerce,B2B marketplace for Industrial products,,,,,,,,,,,,,,,,,,,,,,12000000.0,2017-05-07,2017.0,,noida
6.0,05/07/2017,Timesaverz,,Mumbai,BCCL,Private Equity,"1,000,000",,Consumer Internet,Hyperlocal home services provider,,,,,,,,,,,,,,,,,,,,,,1000000.0,2017-05-07,2017.0,,mumbai
7.0,06/07/2017,Minjar,,Bangalore,"Blume Ventures, Contrarian Capital India Partners, Emergent Ventures India, Pallav Nadhani, Ashish Gupta, Sharad Sharma, Sirion Labs",Seed Funding,,,Technology,Cloud Solutions provider,,,,,,,,,,,,,,,,,,,,,,,2017-06-07,2017.0,,bangalore
8.0,06/07/2017,MyCity4kids,,Gurgaon,,Seed Funding,,,Consumer Internet,parenting blog and kids’ events discovery platform,,,,,,,,,,,,,,,,,,,,,,,2017-06-07,2017.0,,gurgaon
9.0,07/07/2017,Clip App,,Bangalore,"India Quotient, Shunwei Capital",Seed Funding,"1,000,000",,Consumer Internet,Digital Media Video platform,,,,,,,,,,,,,,,,,,,,,,1000000.0,2017-07-07,2017.0,,bangalore
10.0,07/07/2017,Upwardly.in,,Bangalore,"Sreeram Iyer, Suvo Sarkar, Anita Gupta, Likemind Ventures",Seed Funding,,,Consumer Internet,MF investment platform,,,,,,,,,,,,,,,,,,,,,,,2017-07-07,2017.0,,bangalore
11.0,10/07/2017,Autorox.co,,Hyderabad,Mitsui & Co.,Private Equity,"3,000,000",,Technology,Workshop Management Software Platform,,,,,,,,,,,,,,,,,,,,,,3000000.0,2017-10-07,2017.0,,hyderabad
12.0,11/07/2017,Fabogo,,Pune,Dunamis Ventures Pte Ltd,Private Equity,"2,250,000",,Consumer Internet,Salon & Spa Aggregation & Discovery platform,,,,,,,,,,,,,,,,,,,,,,2250000.0,2017-11-07,2017.0,,pune
13.0,11/07/2017,Flickstree,,Mumbai,"Venture Catalysts, Sourav Ganguly, Ankit Aditya, Moksh Sports Ventures",Seed Funding,"464,000",,Consumer Internet,Video Content Discovery Platform,,,,,,,,,,,,,,,,,,,,,,464000.0,2017-11-07,2017.0,,mumbai
14.0,11/07/2017,Design Cafe,,Bangalore,"Fireside Ventures, Apurva Salarpuria, Sidharth Pansari, Sprout Capital",Seed Funding,,,Consumer Internet,Online Interior Design platform,,,,,,,,,,,,,,,,,,,,,,,2017-11-07,2017.0,,bangalore
15.0,12/07/2017,Innoviti,,Bangalore,"SBI-FMO Fund, Bessemer Venture Partners, Catamaran Ventures",Private Equity,"18,500,000",,Technology,Digital payments solutions,,,,,,,,,,,,,,,,,,,,,,18500000.0,2017-12-07,2017.0,,bangalore
16.0,12/07/2017,VDeliver,,Hyderabad,"Corvus Ventures, MAPE Advisory Group",Private Equity,,,Logistics,Door Step Delivery platform,,,,,,,,,,,,,,,,,,,,,,,2017-12-07,2017.0,,hyderabad
17.0,12/07/2017,Bottr.me,,Bangalore,"500 Startups, Purvi Capital, Rajan Anandan, Abhishek Gupta",Seed Funding,,,Technology,Chatbot creation tool,,,,,,,,,,,,,,,,,,,,,,,2017-12-07,2017.0,,bangalore
18.0,12/07/2017,Arcatron,,Pune,Indian Angel Network,Seed Funding,,,Technology,Next Gen Mobility device manufacturer,,,,,,,,,,,,,,,,,,,,,,,2017-12-07,2017.0,,pune
19.0,14/07/2017,QwikSpec,,Bangalore,"Brigade Innovations LLP, TV Mohandas Pai, Suhail Rahman, Bobby Reddy, M George Oommen",Seed Funding,"540,000",,Technology,Construction site operations and analytics platform,,,,,,,,,,,,,,,,,,,,,,540000.0,2017-07-14,2017.0,,bangalore
20.0,14/07/2017,Chumbak,,Bangalore,Blacksoil Capital Pvt. Ltd,Private Equity,"1,700,000",,eCommerce,Designer consumer products Marketplace,,,,,,,,,,,,,,,,,,,,,,1700000.0,2017-07-14,2017.0,,bangalore
21.0,17/07/2017,Increff,,Bangalore,"Sequoia Capital, Grey Orange, Rajesh Ramaiah, Anshuman Das, Rishi Das",Seed Funding,"2,000,000",,Technology,Sales Solutions for Fashion Brands,,,,,,,,,,,,,,,,,,,,,,2000000.0,2017-07-17,2017.0,,bangalore
22.0,17/07/2017,Vayana,,Pune,"IDG Ventures India Advisors, Jungle Ventures",Private Equity,"4,000,000",,Technology,Enterprise Banking Solutions,,,,,,,,,,,,,,,,,,,,,,4000000.0,2017-07-17,2017.0,,pune
23.0,18/07/2017,MObiquest,,Noida,One97 Communication Ltd,Private Equity,,,Technology,Mobile Services & Solutions,,,,,,,,,,,,,,,,,,,,,,,2017-07-18,2017.0,,noida
24.0,18/07/2017,Ambee,,Hyderabad,"Uber Technologies Inc, Amaya Capital LLP",Seed Funding,,,Consumer Internet,Ambulance Aggregation Services,,,,,,,,,,,,,,,,,,,,,,,2017-07-18,2017.0,,hyderabad
25.0,18/07/2017,Ideal Insurance,,Kolkata,Xelpmoc,Seed Funding,,,Consumer Internet,Online Insurance platform,,,,,,,,,,,,,,,,,,,,,,,2017-07-18,2017.0,,kolkata
26.0,18/07/2017,Hypernova Interactive,,Bangalore,Kae Capital,Seed Funding,,,Technology,Mobile games creator,,,,,,,,,,,,,,,,,,,,,,,2017-07-18,2017.0,,bangalore
27.0,19/07/2017,Rentomojo,,Bangalore,"ain Capital Ventures, Renaud Laplanche",Private Equity,"10,000,000",,Consumer Internet,Consumer Leasing Platform,,,,,,,,,,,,,,,,,,,,,,10000000.0,2017-07-19,2017.0,,bangalore
28.0,19/07/2017,AirCTO,,Bangalore,Francesco Cara,Seed Funding,,,Consumer Internet,AI powered recruitment platform,,,,,,,,,,,,,,,,,,,,,,,2017-07-19,2017.0,,bangalore
29.0,19/07/2017,Playablo,,Bangalore,ABI-Showatech (India) Ltd,Seed Funding,"600,000",,Technology,Gamified Learning App,,,,,,,,,,,,,,,,,,,,,,600000.0,2017-07-19,2017.0,,bangalore
30.0,20/07/2017,Trupay,,Gurgaon,"Kae Capital, M&S Partners,",Seed Funding,"700,000",,Technology,Online payments platform,,,,,,,,,,,,,,,,,,,,,,700000.0,2017-07-20,2017.0,,gurgaon
31.0,21/07/2017,Brick2Wall,,Gurgaon,"Subramani Somasundaram, Sundeep Sahni, Mayank Mittal & Others",Seed Funding,"200,000",,eCommerce,Online Marketplace for Construction Material,,,,,,,,,,,,,,,,,,,,,,200000.0,2017-07-21,2017.0,,gurgaon
32.0,21/07/2017,FableStreet,,New Delhi,"Harmeet Bajaj, Pameela P, Fusiontech Ventures & Others",Seed Funding,,,eCommerce,Women Work wear etailer,,,,,,,,,,,,,,,,,,,,,,,2017-07-21,2017.0,,new delhi
33.0,21/07/2017,Monsoon Fintech,,New Delhi,"Sunil Kalra, Aditya Singh, Rishi Srivastava, Rajan Anandan",Seed Funding,,,Technology,Machine Learning Access platform,,,,,,,,,,,,,,,,,,,,,,,2017-07-21,2017.0,,new delhi
34.0,21/07/2017,MonkeyBox,,Bangalore,"Blume Ventures, NB Ventures, Nspira",Seed Funding,,,Consumer Internet,Healthy Food Delivery Platform,,,,,,,,,,,,,,,,,,,,,,,2017-07-21,2017.0,,bangalore
35.0,25/07/2017,Noticeboard,,Bangalore,"Stellaris Venture Partners,",Private Equity,"1,200,000",,Consumer Internet,Mobile-first Enterprise communication platform,,,,,,,,,,,,,,,,,,,,,,1200000.0,2017-07-25,2017.0,,bangalore
36.0,25/07/2017,Byju’s,,Bangalore,Tencent Holdings,Private Equity,"35,000,000",,Consumer Internet,Mobile Learning App,,,,,,,,,,,,,,,,,,,,,,35000000.0,2017-07-25,2017.0,,bangalore
37.0,26/07/2017,Creator’s Gurukul,,New Delhi,Yuvraj Singh,Seed Funding,,,Others,Co-Working Space Provider,,,,,,,,,,,,,,,,,,,,,,,2017-07-26,2017.0,,new delhi
38.0,26/07/2017,Fab Hotels,,New Delhi,Goldman Sachs,Private Equity,"25,000,000",,Consumer Internet,Budget hotels brand & Aggregator Platform,,,,,,,,,,,,,,,,,,,,,,25000000.0,2017-07-26,2017.0,,new delhi
39.0,26/07/2017,ThinkerBell,,Bangalore,"Indian Angel Network, Anand Mahindra",Seed Funding,"200,000",,Consumer Internet,Assisted Learning Startup,,,,,,,,,,,,,,,,,,,,,,200000.0,2017-07-26,2017.0,,bangalore
40.0,27/07/2017,1mg,,Gurgaon,"HBM Healthcare Investments, Maverick Capital Ventures, Sequoia India, Omidyar Network and Kae Capital",Private Equity,"15,000,000",,eCommerce,Online Pharmacy,,,,,,,,,,,,,,,,,,,,,,15000000.0,2017-07-27,2017.0,,gurgaon
41.0,28/07/2017,Jhakaas,,Mumbai,Amen Dhyllon,Seed Funding,,,Consumer Internet,App-based Aggregator of Offline Businesses,,,,,,,,,,,,,,,,,,,,,,,2017-07-28,2017.0,,mumbai
42.0,28/07/2017,BigStylist,,Mumbai,Info Edge (India) Ltd,Private Equity,"1,250,000",,Consumer Internet,Beauty Services Marketplace,,,,,,,,,,,,,,,,,,,,,,1250000.0,2017-07-28,2017.0,,mumbai
43.0,28/07/2017,Gympik.com,,Bangalore,RoundGlass Partners,Seed Funding,,,Consumer Internet,online marketplace for discovering fitness centres,,,,,,,,,,,,,,,,,,,,,,,2017-07-28,2017.0,,bangalore
44.0,,,,,,,,,,,,,,,,,,,,,,,,,,,,,,,,,,,,
1.0,01/06/2017,Tripeur,,Bangalore,"Grace Grace Techno Ventures LLP, Rajul Garg & Other undisclosed investors",Seed Funding,,,Technology,Mobile based travel ERP platform,,,,,,,,,,,,,,,,,,,,,,,2017-01-06,2017.0,,bangalore
2.0,02/06/2017,RentOnGo,,Bangalore,TVS Motor Company,Seed Funding,"234,000",,eCommerce,"Online Marketplace for Renting Bikes, Electronics & Appliances",,,,,,,,,,,,,,,,,,,,,,234000.0,2017-02-06,2017.0,,bangalore
3.0,05/06/2017,Goomo,,Mumbai,Emerging India,Private Equity,"50,000,000",,Consumer Internet,Online Travel & Holiday Booking platform,,,,,,,,,,,,,,,,,,,,,,50000000.0,2017-05-06,2017.0,,mumbai
4.0,05/06/2017,MaxMyWealth,,Mumbai,"blockchain ecosystem Global Advisors, Horseferry",Private Equity,,,Consumer Internet,Online Wealth Management & Savings platform,,,,,,,,,,,,,,,,,,,,,,,2017-05-06,2017.0,,mumbai
5.0,06/06/2017,Spinny,,Gurgaon,"Blume Ventures, Indian Angel Network, Kunal Shah, Sandeep Tandon",Private Equity,"1,000,000",,eCommerce,Online Used Car marketplace,,,,,,,,,,,,,,,,,,,,,,1000000.0,2017-06-06,2017.0,,gurgaon
6.0,06/06/2017,Healthbuds,,Kolkata,"Arun Patodia, Bharat Kedia",Seed Funding,,,Consumer Internet,Healthcare Discovery & booking platform,,,,,,,,,,,,,,,,,,,,,,,2017-06-06,2017.0,,kolkata
7.0,06/06/2017,Ftcash,,Mumbai,"500 Startups, IvyCap Ventures",Private Equity,,,Consumer Internet,Mobile Payments platform,,,,,,,,,,,,,,,,,,,,,,,2017-06-06,2017.0,,mumbai
8.0,06/06/2017,BHIVE Workspace,,Bangalore,Blume Ventures,Private Equity,"1,200,000",,Consumer Internet,co-working spaces,,,,,,,,,,,,,,,,,,,,,,1200000.0,2017-06-06,2017.0,,bangalore
9.0,06/06/2017,wayForward,,New Delhi,"Harsh Mahajan, Farhan Naqvi, Sreepathy Viswanathan",Seed Funding,"1,000,000",,Consumer Internet,Mobile app for Mental Health,,,,,,,,,,,,,,,,,,,,,,1000000.0,2017-06-06,2017.0,,new delhi
10.0,06/06/2017,GyanDhan,,New Delhi,Sundaram Finance Holdings,Private Equity,,,Consumer Internet,Education Marketplace,,,,,,,,,,,,,,,,,,,,,,,2017-06-06,2017.0,,new delhi
11.0,06/06/2017,Hungry Foal,,Gurgaon,SBI (Stand Up India Scheme),Private Equity,,,Consumer Internet,For profit Social Venture,,,,,,,,,,,,,,,,,,,,,,,2017-06-06,2017.0,,gurgaon
12.0,07/06/2017,ZipLoan,,New Delhi,WaterBridge Ventures,Seed Funding,"650,000",,Consumer Internet,Online lending platform,,,,,,,,,,,,,,,,,,,,,,650000.0,2017-07-06,2017.0,,new delhi
13.0,07/06/2017,GrowFitter,,Mumbai,SQue Capital,Seed Funding,"600,000",,Consumer Internet,health and fitness discovery platform,,,,,,,,,,,,,,,,,,,,,,600000.0,2017-07-06,2017.0,,mumbai
14.0,08/06/2017,Stratfit,,Hyderabad,Bodhtree Consulting Limited,Seed Funding,"232,000",,Consumer Internet,Health coaching programs,,,,,,,,,,,,,,,,,,,,,,232000.0,2017-08-06,2017.0,,hyderabad
15.0,08/06/2017,Multiplier Solutions,,Hyderabad,Norwest Venture Partners,Private Equity,"1,500,000",,Technology,CRM Software for Healthcare space,,,,,,,,,,,,,,,,,,,,,,1500000.0,2017-08-06,2017.0,,hyderabad
16.0,08/06/2017,ABI Health,,Bangalore,Norwest Venture Partners,Private Equity,"1,500,000",,Technology,Unified Digital Health Platform,,,,,,,,,,,,,,,,,,,,,,1500000.0,2017-08-06,2017.0,,bangalore
17.0,08/06/2017,Stockal,,Bangalore,"Mohan Alexander, R. Natarajan, Vikrant Varshney, Amit Sinha",Seed Funding,"350,000",,Consumer Internet,App-based Investment advisory Services,,,,,,,,,,,,,,,,,,,,,,350000.0,2017-08-06,2017.0,,bangalore
18.0,09/06/2017,Guidoo,,Mumbai,"Pawan Borle, Nirmal Singh, Manish Prasad, Vineet Varma, Nick Haulkoury, Abhai S. Rao",Seed Funding,"300,000",,Consumer Internet,Travel & adventure planning platform,,,,,,,,,,,,,,,,,,,,,,300000.0,2017-09-06,2017.0,,mumbai
19.0,09/06/2017,eSahai.in,,Hyderabad,"Dr Ramesh Ayyala, Satya Muthyala",Seed Funding,"250,000",,Consumer Internet,ambulance aggregator and medical taxi provider,,,,,,,,,,,,,,,,,,,,,,250000.0,2017-09-06,2017.0,,hyderabad
20.0,12/06/2017,Loanmeet,,Bangalore,"Cao Yibin, Huang Wei, Madhusudan E,",Seed Funding,,,Consumer Internet,Online peer-to-peer lending platform,,,,,,,,,,,,,,,,,,,,,,,2017-12-06,2017.0,,bangalore
21.0,12/06/2017,LendingKart,,Ahmedabad,Yes Bank,Debt Funding,"7,800,000",,Consumer Internet,Online Lending platform,,,,,,,,,,,,,,,,,,,,,,7800000.0,2017-12-06,2017.0,,ahmedabad
22.0,12/06/2017,Boxx.ai,,Bangalore,"Unicorn India Ventures, Venky Krishnakumar, Suresh Shankar, Vivek Bhargava",Private Equity,"500,000",,Technology,Artificial Intelligence,,,,,,,,,,,,,,,,,,,,,,500000.0,2017-12-06,2017.0,,bangalore
23.0,12/06/2017,PeeSafe.in,,New Delhi,"Venture Catalysts, Alfa Capital, Green Shots Capital, Real Time Ventures",Private Equity,"1,000,000",,Healthcare,Hygiene care product manufacturer,,,,,,,,,,,,,,,,,,,,,,1000000.0,2017-12-06,2017.0,,new delhi
24.0,12/06/2017,Vista Rooms,,Mumbai,"Artha India Ventures, Singularity Holdings, Rajan Anandan, Girish Mathrubootham",Seed Funding,"776,000",,Consumer Internet,Online rooms aggregation platform,,,,,,,,,,,,,,,,,,,,,,776000.0,2017-12-06,2017.0,,mumbai
25.0,12/06/2017,CoverFox,,Mumbai,Transamerica,Private Equity,"15,000,000",,Consumer Internet,Online insurance brokerage platform,,,,,,,,,,,,,,,,,,,,,,15000000.0,2017-12-06,2017.0,,mumbai
26.0,13/06/2017,HyperTrack,,New Delhi,"Nexus Venture Partners, Founders Fund",Private Equity,,,Technology,Location tracking solutions,,,,,,,,,,,,,,,,,,,,,,,2017-06-13,2017.0,,new delhi
27.0,13/06/2017,Goodera,,Bangalore,"Nexus Venture Partners, Omidyar Network",Private Equity,"5,500,000",,Technology,CSR and sustainability management platform,,,,,,,,,,,,,,,,,,,,,,5500000.0,2017-06-13,2017.0,,bangalore
28.0,13/06/2017,Digit,,Bangalore,Fairfax Holdings,Private Equity,,,Technology,Tech driven Insurance platform,,,,,,,,,,,,,,,,,,,,,,,2017-06-13,2017.0,,bangalore
29.0,14/06/2017,Ola,,Bangalore,Tekne Capital Management LLC,Private Equity,"50,000,000",,Consumer Internet,Cab Aggregation App,,,,,,,,,,,,,,,,,,,,,,50000000.0,2017-06-14,2017.0,,bangalore
30.0,14/06/2017,Vanitycask,,Mumbai,RB Investments,Seed Funding,,,Consumer Internet,Beauty products discovery platform,,,,,,,,,,,,,,,,,,,,,,,2017-06-14,2017.0,,mumbai
31.0,14/06/2017,MrNeeds,,Noida,undisclosed investors,Seed Funding,"500,000",,Consumer Internet,Micro Food Delivery platform,,,,,,,,,,,,,,,,,,,,,,500000.0,2017-06-14,2017.0,,noida
32.0,15/06/2017,MoneyTap,,Bangalore,"Sequoia India, NEA, Prime Venture Partners",Private Equity,"12,300,000",,Consumer Internet,Money Lending platform,,,,,,,,,,,,,,,,,,,,,,12300000.0,2017-06-15,2017.0,,bangalore
33.0,16/06/2017,Goodbox,,Bangalore,"Nexus Venture Partners, Mekin Maheshwari",Private Equity,"1,000,000",,eCommerce,Mobile SAAS  ECommerce platform for SMEs,,,,,,,,,,,,,,,,,,,,,,1000000.0,2017-06-16,2017.0,,bangalore
34.0,16/06/2017,Fincash,,Mumbai,"Mohammed Khan, Sameer Narayan & Others",Seed Funding,"100,000",,Consumer Internet,Personal Finance platform,,,,,,,,,,,,,,,,,,,,,,100000.0,2017-06-16,2017.0,,mumbai
35.0,16/06/2017,PortDesk,,Noida,Alphard Maritime Group,Seed Funding,"2,000,000",,Technology,Maritime Solutions,,,,,,,,,,,,,,,,,,,,,,2000000.0,2017-06-16,2017.0,,noida
36.0,16/06/2017,EdgeFx,,Hyderabad,"Cross Border Angels & Experts, Rajasthan Angel Innovators Network, The Chennai Angels",Seed Funding,,,eCommerce,DIY project Kits seller,,,,,,,,,,,,,,,,,,,,,,,2017-06-16,2017.0,,hyderabad
37.0,16/06/2017,EazyDiner,,Gurgaon,YouWeCan Ventures,Seed Funding,,,Consumer Internet,Online Restaurant Reservation Platform,,,,,,,,,,,,,,,,,,,,,,,2017-06-16,2017.0,,gurgaon
38.0,16/06/2017,HealthIntel,,New Delhi,BLIP Initiatives,Seed Funding,,,Healthcare,Online Pharmacy,,,,,,,,,,,,,,,,,,,,,,,2017-06-16,2017.0,,new delhi
39.0,19/06/2017,Unbxd,,Bangalore,Eight Roads Ventures,Private Equity,"12,500,000",,Technology,Cloud-based product discovery platform,,,,,,,,,,,,,,,,,,,,,,12500000.0,2017-06-19,2017.0,,bangalore
40.0,19/06/2017,DarwinBox,,Hyderabad,"Lightspeed India Partners, Endiya Partners, 3one4 Capital Advisors LLP, Startupxseed Ventures LLP",Private Equity,"4,000,000",,Technology,Enterprise human resources management platform,,,,,,,,,,,,,,,,,,,,,,4000000.0,2017-06-19,2017.0,,hyderabad
41.0,20/06/2017,ForeverShop,,Bangalore,91maker.com,Seed Funding,"300,000",,Consumer Internet,Mobile based ecommerce platform,,,,,,,,,,,,,,,,,,,,,,300000.0,2017-06-20,2017.0,,bangalore
42.0,20/06/2017,Insider.in,,Mumbai,Paytm,Private Equity,"5,200,000",,Consumer Internet,Events Ticketing platform,,,,,,,,,,,,,,,,,,,,,,5200000.0,2017-06-20,2017.0,,mumbai
43.0,21/06/2017,Fynd,,Mumbai,"IIFL Seed Ventures, Kae Capital, FJ Labs, Singularity Ventures, GrowX, Tracxn Labs, Axis Capital",Private Equity,"2,400,000",,eCommerce,Fashion etailer,,,,,,,,,,,,,,,,,,,,,,2400000.0,2017-06-21,2017.0,,mumbai
44.0,21/06/2017,Grow Fit,,Bangalore,"Manipal Education and Medical Group (MEMG), SAR Group, The Grover Trust",Private Equity,"4,500,000",,Consumer Internet,Health-Tech platform,,,,,,,,,,,,,,,,,,,,,,4500000.0,2017-06-21,2017.0,,bangalore
45.0,21/06/2017,Fabulyst,,Hyderabad,iBhubs,Seed Funding,"215,000",,Technology,Artificial Intelligence based platform,,,,,,,,,,,,,,,,,,,,,,215000.0,2017-06-21,2017.0,,hyderabad
46.0,21/06/2017,mSwipe,,Mumbai,"UC-RNT Fund, Matrix Partners, alcon Edge Capital, DSG Consumer Partners",Private Equity,"31,000,000",,Technology,Point-of-Sale services,,,,,,,,,,,,,,,,,,,,,,31000000.0,2017-06-21,2017.0,,mumbai
47.0,21/06/2017,OneAssist,,Mumbai,Sequoia Capital,Private Equity,,,Consumer Internet,Credit card fraud protection,,,,,,,,,,,,,,,,,,,,,,,2017-06-21,2017.0,,mumbai
48.0,22/06/2017,Julia Computing,,Bangalore,"General Catalyst, Founder Collective",Private Equity,"4,600,000",,Technology,Open Source Language for Data Science and Machine Learning,,,,,,,,,,,,,,,,,,,,,,4600000.0,2017-06-22,2017.0,,bangalore
49.0,22/06/2017,Kissht,,Mumbai,"Endiya Partners, Ventureast",Private Equity,"2,000,000",,Consumer Internet,Consumer Lending platform,,,,,,,,,,,,,,,,,,,,,,2000000.0,2017-06-22,2017.0,,mumbai
50.0,22/06/2017,Explore Life traveling,,Bangalore,"Mekin Maheshwari, Bharat Vijay, Krish Seshadri, Amar Arsikere",Seed Funding,"500,000",,Consumer Internet,Local homes booking platform,,,,,,,,,,,,,,,,,,,,,,500000.0,2017-06-22,2017.0,,bangalore
51.0,23/06/2017,Loantap,,Mumbai,"Kae Capital, India Quotient, IFMR, and MAS Financial Services Ltd",Private Equity,"4,000,000",,Consumer Internet,Lending platform for salaried professionals,,,,,,,,,,,,,,,,,,,,,,4000000.0,2017-06-23,2017.0,,mumbai
52.0,23/06/2017,Voxweb,,Mumbai,Undisclosed investors,Seed Funding,"1,000,000",,Consumer Internet,Mobile based social networking platform,,,,,,,,,,,,,,,,,,,,,,1000000.0,2017-06-23,2017.0,,mumbai
53.0,26/06/2017,HUG Innovations,,Hyderabad,"Mohit Srivastav, Kishore Ganji, Venkat Vallabhaneni, Rajeev Menon",Private Equity,"5,000,000",,Technology,Gesture based  Smartwatch manufacturer,,,,,,,,,,,,,,,,,,,,,,5000000.0,2017-06-26,2017.0,,hyderabad
54.0,26/06/2017,Flipkart,,Bangalore,Naspers,Private Equity,"71,000,000",,eCommerce,Online marketplace,,,,,,,,,,,,,,,,,,,,,,71000000.0,2017-06-26,2017.0,,bangalore
55.0,26/06/2017,V Resorts,,Noida,"Seedfund, RB International",Private Equity,"4,000,000",,Consumer Internet,Holiday & Vacation resort aggregator,,,,,,,,,,,,,,,,,,,,,,4000000.0,2017-06-26,2017.0,,noida
56.0,27/06/2017,Stashfin,,New Delhi,"Snow Leopard Ventures, Alto Partners",Private Equity,"5,000,000",,Consumer Internet,Personal Finance App,,,,,,,,,,,,,,,,,,,,,,5000000.0,2017-06-27,2017.0,,new delhi
57.0,27/06/2017,Formcept,,Bangalore,Gujarat Venture Finance Ltd,Private Equity,,,Consumer Internet,Unified Data Analysis platform,,,,,,,,,,,,,,,,,,,,,,,2017-06-27,2017.0,,bangalore
58.0,27/06/2017,Spares Hub,,Pune,"The Chennai Angels, Anthill Scale Ventures, Esvee Technologies Inc, Inc95 Consulting",Seed Funding,"311,000",,eCommerce,Automobile parts marketplace,,,,,,,,,,,,,,,,,,,,,,311000.0,2017-06-27,2017.0,,pune
59.0,28/06/2017,FiTraQ,,New Delhi,"Aparup Sengupta, Devendra Reddy,",Seed Funding,,,Consumer Internet,Fitness Centre Discovery Platform,,,,,,,,,,,,,,,,,,,,,,,2017-06-28,2017.0,,new delhi
60.0,28/06/2017,Rubique,,Mumbai,"Kalaari Capital, Udayan Goyal",Private Equity,"3,000,000",,Consumer Internet,Online Marketplace for financial products,,,,,,,,,,,,,,,,,,,,,,3000000.0,2017-06-28,2017.0,,mumbai
61.0,28/06/2017,Niki.ai,,Bangalore,"SAP.iO, Unilazer Ventures",Private Equity,"2,000,000",,Consumer Internet,AI Based Personal Assistant,,,,,,,,,,,,,,,,,,,,,,2000000.0,2017-06-28,2017.0,,bangalore
62.0,29/06/2017,Fitpass,,New Delhi,"Abhinav Bindra, Gaurav Marya",Private Equity,"1,000,000",,Consumer Internet,Online Fitness Marketplace,,,,,,,,,,,,,,,,,,,,,,1000000.0,2017-06-29,2017.0,,new delhi
63.0,29/06/2017,ZingHR,,Mumbai,Zeta,Private Equity,,,Technology,"digital employee solutions,",,,,,,,,,,,,,,,,,,,,,,,2017-06-29,2017.0,,mumbai
64.0,30/06/2017,Tagos Design,,Bangalore,Undisclosed Investors,Private Equity,"5,000,000",,Technology,in-video discovery platform,,,,,,,,,,,,,,,,,,,,,,5000000.0,2017-06-30,2017.0,,bangalore
65.0,30/06/2017,UrbanClap,,Gurgaon,"Vy Capital, SAIF Partners, Accel Partner, Bessemer Venture Partners",Private Equity,"21,000,000",,Consumer Internet,Mobile Services Marketplace,,,,,,,,,,,,,,,,,,,,,,21000000.0,2017-06-30,2017.0,,gurgaon
66.0,30/06/2017,,,,,,,,,,,,,,,,,,,,,,,,,,,,,,,,2017-06-30,2017.0,,
1.0,01/03/2017,Ola,,Bangalore,SoftBank Group Corp,,"330,000,000",,Consumer Internet,App based cab aggregator,Private Equity,,,,,,,,,,,,,,,,,,,,,330000000.0,2017-01-03,2017.0,,bangalore
2.0,01/03/2017,Belong,,Bangalore,Sequoia Capital India,,"10,000,000",,Consumer Internet,Online Jon Portal,Private Equity,,,,,,,,,,,,,,,,,,,,,10000000.0,2017-01-03,2017.0,,bangalore
3.0,01/03/2017,Seenit,,Kolkata,"Calcutta Angels Network (CAN), Augment Ventures",,,,Consumer Internet,AI based Fashion Search Portal,Seed Funding,,,,,,,,,,,,,,,,,,,,,,2017-01-03,2017.0,,kolkata
4.0,01/03/2017,Paalak,,New Delhi,"Vishwadeep Bajaj, Harsh Kundra, Nandkumar Rane, LN Buddharaju, Anupam Tyagi",,,,ECommerce,Fresh Produce Selling portal,Seed Funding,,,,,,,,,,,,,,,,,,,,,,2017-01-03,2017.0,,new delhi
5.0,02/03/2017,Celes Care,,Hyderabad,"Ventureast, Endiya Partners, Eight Roads Ventures, F-Prime Capital Partners",,"1,500,000",,Consumer Internet,Women Healthcare & Information portal,Private Equity,,,,,,,,,,,,,,,,,,,,,1500000.0,2017-02-03,2017.0,,hyderabad
6.0,02/03/2017,Karomi,,Chennai,Ideaspring Capital,,"500,000",,Technology,Packaging Artwork Management software,Seed Funding,,,,,,,,,,,,,,,,,,,,,500000.0,2017-02-03,2017.0,,chennai
7.0,02/03/2017,Red Carpet,,Gurgaon,Lightspeed Venture Partners,,"2,500,000",,Consumer Internet,Micro Lending platform,Private Equity,,,,,,,,,,,,,,,,,,,,,2500000.0,2017-02-03,2017.0,,gurgaon
8.0,02/03/2017,Kreate Konnect,,Vadodara,Langoor,,,,Technology,End-to-End Seller e-commerce solutions Provider,Seed Funding,,,,,,,,,,,,,,,,,,,,,,2017-02-03,2017.0,,vadodara
9.0,02/03/2017,CreditMantri,,Chennai,Quona Capital,,"7,600,000",,Consumer Internet,Online Credit score & lending platform,Private Equity,,,,,,,,,,,,,,,,,,,,,7600000.0,2017-02-03,2017.0,,chennai
10.0,03/03/2017,Lets Endorse,,Bangalore,"Chandigarh Angels Network, Social Alpha and other unnamed angel investors",,,,Consumer Internet,Online Ecosystem of social innovators,Seed Funding,,,,,,,,,,,,,,,,,,,,,,2017-03-03,2017.0,,bangalore
11.0,03/03/2017,Tydy,,Bangalore,"Bhupen Shah, Jayesh Parekh, Sanjay Sathe",,"275,000",,Technology,Employee Onboarding and Engagement platform,Seed Funding,,,,,,,,,,,,,,,,,,,,,275000.0,2017-03-03,2017.0,,bangalore
12.0,03/03/2017,Nactus,,Jaipur,"Sandeep Aggarwal, Gautam Chhaochharia, R Balachandar",,,,Consumer Internet,Professional Tutors discovery & booking mobile app,Seed Funding,,,,,,,,,,,,,,,,,,,,,,2017-03-03,2017.0,,jaipur
13.0,03/03/2017,Oho Shop,,Ahmedabad,"Bennett, Coleman and Company Ltd",,"6,700,000",,Technology,eCommerce Mobile App Builder,Private Equity,,,,,,,,,,,,,,,,,,,,,6700000.0,2017-03-03,2017.0,,ahmedabad
14.0,03/03/2017,Emojifi,,Hyderabad,Undisclosed angel investors,,,,Consumer Internet,Mobile App for live emoji,Seed Funding,,,,,,,,,,,,,,,,,,,,,,2017-03-03,2017.0,,hyderabad
15.0,03/03/2017,Paytm Marketplace,,Bangalore,Alibaba,,"200,000,000",,ECommerce,ECommerce Marketplace,Private Equity,,,,,,,,,,,,,,,,,,,,,200000000.0,2017-03-03,2017.0,,bangalore
16.0,04/03/2017,iGenetics,,Mumbai,CDC Group Plc,,"19,500,000",,Healthcare,Health Diagnostic Solutions,Private Equity,,,,,,,,,,,,,,,,,,,,,19500000.0,2017-04-03,2017.0,,mumbai
17.0,06/03/2017,Juno Clinic,,Mumbai,Atul Nishar,,"1,200,000",,Consumer Internet,Online Counseling Platform,Seed Funding,,,,,,,,,,,,,,,,,,,,,1200000.0,2017-06-03,2017.0,,mumbai
18.0,06/03/2017,Summerlabel,,Gurgaon,"Aneesh Seth, Tushar Mittal",,"150,000",,Consumer Internet,Fashion and Lifestyle discovery platform,Seed Funding,,,,,,,,,,,,,,,,,,,,,150000.0,2017-06-03,2017.0,,gurgaon
19.0,06/03/2017,PickMe,,Mumbai,SIDBI Venture Capital Fund,,"1,790,000",,Consumer Internet,Gadget Insurance & Repair Services platform,Private Equity,,,,,,,,,,,,,,,,,,,,,1790000.0,2017-06-03,2017.0,,mumbai
20.0,07/03/2017,Agrostar,,Pune,Accel Partners,,"10,000,000",,Technology,Direct-to-Farmer Mobile-Based Retail platform,Private Equity,,,,,,,,,,,,,,,,,,,,,10000000.0,2017-07-03,2017.0,,pune
21.0,07/03/2017,Zapr,,Bangalore,Star India Pvt Ltd,,"10,000,000",,Technology,"DSP, TV Analytics & Cross-Platform advertising",Private Equity,,,,,,,,,,,,,,,,,,,,,10000000.0,2017-07-03,2017.0,,bangalore
22.0,07/03/2017,Data Resolve,,Noida,IDFC Parampara Early Stage Opportunities Fund,,"1,000,000",,Technology,Cyber Security Solutions,Private Equity,,,,,,,,,,,,,,,,,,,,,1000000.0,2017-07-03,2017.0,,noida
23.0,07/03/2017,Book Servicing,,New Delhi,National Science and Technology Entrepreneurship Development Board,,"30,000",,Consumer Internet,Online Vehicle Services Booking platform,Seed Funding,,,,,,,,,,,,,,,,,,,,,30000.0,2017-07-03,2017.0,,new delhi
24.0,07/03/2017,Blowhorn,,Bangalore,"IDG Ventures India, Michael & Susan Dell Foundation, Draper Associates, Unitus Seed Fund",,"3,650,000",,Consumer Internet,Intra-City Logistics provider,Private Equity,,,,,,,,,,,,,,,,,,,,,3650000.0,2017-07-03,2017.0,,bangalore
25.0,08/03/2017,Rivigo,,Gurgaon,Private Sector Banks (Debt Funding),,"15,000,000",,Logistics,Technology Enabled Logistics Company,Private Equity,,,,,,,,,,,,,,,,,,,,,15000000.0,2017-08-03,2017.0,,gurgaon
26.0,08/03/2017,PipeCandy,,Chennai,"IDG ventures, Axilor Ventures, Emergent Ventures, Indian Angel Network",,"1,100,000",,Technology,Intelligent Sales Prospecting Platform,Seed Funding,,,,,,,,,,,,,,,,,,,,,1100000.0,2017-08-03,2017.0,,chennai
27.0,08/03/2017,Supr Daily,,Mumbai,Y Combinator,,"120,000",,Consumer Internet,Subscription based Home Delivery Platform,Seed Funding,,,,,,,,,,,,,,,,,,,,,120000.0,2017-08-03,2017.0,,mumbai
28.0,08/03/2017,Parentune,,Gurgaon,"Kae Capital, SEGNEL Ventures",,,,Consumer Internet,Online Community for Parents,Private Equity,,,,,,,,,,,,,,,,,,,,,,2017-08-03,2017.0,,gurgaon
29.0,09/03/2017,AppBrowzer,,Bangalore,Deepak Gurnani,,"500,000",,Consumer Internet,Instant Mobile Apps Store,Seed Funding,,,,,,,,,,,,,,,,,,,,,500000.0,2017-09-03,2017.0,,bangalore
30.0,09/03/2017,MagicBricks,,Mumbai,Times Internet Ltd,,"4,500,000",,Consumer Internet,Online Real Estate Portal,Private Equity,,,,,,,,,,,,,,,,,,,,,4500000.0,2017-09-03,2017.0,,mumbai
31.0,10/03/2017,PeeBuddy,,New Delhi,Indian Angel Network,,"443,000",,Healthcare,Female Hygiene product manufacturer,Seed Funding,,,,,,,,,,,,,,,,,,,,,443000.0,2017-10-03,2017.0,,new delhi
32.0,10/03/2017,iOrderFresh,,New Delhi,Singapore Angel Network,,,,ECommerce,Online fresh fruits and grocery store,Seed Funding,,,,,,,,,,,,,,,,,,,,,,2017-10-03,2017.0,,new delhi
33.0,10/03/2017,Lavelle Networks,,Bangalore,Ideaspring Capital,,"600,000",,Technology,SDN Solutions,Seed Funding,,,,,,,,,,,,,,,,,,,,,600000.0,2017-10-03,2017.0,,bangalore
34.0,10/03/2017,PropertyShare,,Bangalore,"Asuka, Pravega Ventures, BEENEXT",,,,Consumer Internet,Fractional Proerty Ownership & Rental platform,Seed Funding,,,,,,,,,,,,,,,,,,,,,,2017-10-03,2017.0,,bangalore
35.0,14/03/2017,MyDermacy,,New Delhi,Cyber Carrier,,,,Consumer Internet,Online Dermatology consultation platform,Private Equity,,,,,,,,,,,,,,,,,,,,,,2017-03-14,2017.0,,new delhi
36.0,15/03/2017,LatestOne,,Hyderabad,"Florintree, Mathew Cyriac, Chidambaram Palaniappan, Bharat Sheth",,"3,350,000",,eCommerce,Tech Accessories e-tailer,Private Equity,,,,,,,,,,,,,,,,,,,,,3350000.0,2017-03-15,2017.0,,hyderabad
37.0,15/03/2017,Frapperz,,Kolkata,Undisclosed Investor,,"100,000",,Consumer Internet,On-demand home services provider,Seed Funding,,,,,,,,,,,,,,,,,,,,,100000.0,2017-03-15,2017.0,,kolkata
38.0,16/03/2017,mPaani,,Mumbai,"IDG Ventures, Blume Ventures, Saha Fund,",,"1,350,000",,Consumer Internet,Loyalty rewards app,Private Equity,,,,,,,,,,,,,,,,,,,,,1350000.0,2017-03-16,2017.0,,mumbai
39.0,16/03/2017,ShilpMIS,,Surat,"Puneet Gupta, Nimitt Desai & Others",,,,Technology,Virtual Reality platform,Seed Funding,,,,,,,,,,,,,,,,,,,,,,2017-03-16,2017.0,,surat
40.0,16/03/2017,POPxo,,New Delhi,"GREE Ventures, Kalaari Capital and IDG Ventures India, Summit Media, Atul Goel, and Gurpreet Singh",,"3,100,000",,Consumer Internet,Digital Media publication for women,Private Equity,,,,,,,,,,,,,,,,,,,,,3100000.0,2017-03-16,2017.0,,new delhi
41.0,16/03/2017,Fitso,,Gurgaon,"Sujeet Kumar, Bhupender Singh, Yashish Dhaiya",,"200,000",,Consumer Internet,Fitness Mobile App,Seed Funding,,,,,,,,,,,,,,,,,,,,,200000.0,2017-03-16,2017.0,,gurgaon
42.0,17/03/2017,FarMart,,Gurgaon,Indian Angel Network,,,,Technology,Farming rental equipment provider,Seed Funding,,,,,,,,,,,,,,,,,,,,,,2017-03-17,2017.0,,gurgaon
43.0,21/03/2017,Flipkart,,Bangalore,"Microsoft, eBay, Tencent Holdings",,"1,400,000,000",,eCommerce,ECommerce Marketplace,Private Equity,,,,,,,,,,,,,,,,,,,,,1400000000.0,2017-03-21,2017.0,,bangalore
44.0,21/03/2017,Airpay,,Mumbai,"Kalaari Capital, Rakesh and Rajesh Jhunjhunwala",,"3,670,000",,Technology,Online payment Gateway,Private Equity,,,,,,,,,,,,,,,,,,,,,3670000.0,2017-03-21,2017.0,,mumbai
45.0,21/03/2017,MyGlamm,,Mumbai,L’Occitane,,"5,300,000",,Consumer Internet,On-Demand Beauty Services,Private Equity,,,,,,,,,,,,,,,,,,,,,5300000.0,2017-03-21,2017.0,,mumbai
46.0,22/03/2017,The Mons Co.,,New Delhi,"Shripad Nadkarni, Nandu Nandkishore",,,,eCommerce,Pregnancy & Baby Care etailer,Seed Funding,,,,,,,,,,,,,,,,,,,,,,2017-03-22,2017.0,,new delhi
47.0,22/03/2017,Haqdarshak,,Bangalore,"Ravi Saxena, Sandeep Raju,",,"191,000",,Consumer Internet,Tech-Enabled Social Enterprise,Seed Funding,,,,,,,,,,,,,,,,,,,,,191000.0,2017-03-22,2017.0,,bangalore
48.0,23/03/2017,Ixigo,,Gurgaon,"Sequoia Capital, Kinzon Capital",,"15,000,000",,Consumer Internet,Online Travel Search Engine,Private Equity,,,,,,,,,,,,,,,,,,,,,15000000.0,2017-03-23,2017.0,,gurgaon
49.0,23/03/2017,Markets and Markets,,Pune,"FTV Capital, Zodius Capital",,"56,000,000",,Technology,Marketing Research Company,Private Equity,,,,,,,,,,,,,,,,,,,,,56000000.0,2017-03-23,2017.0,,pune
50.0,24/03/2017,Bizom,,Bangalore,Ojas Ventures,,"382,000",,Technology,supply chain automation platform,Seed Funding,,,,,,,,,,,,,,,,,,,,,382000.0,2017-03-24,2017.0,,bangalore
51.0,24/03/2017,BabyonBoard,,Bangalore,"Mahavir Sharma, Vishal Jain, Rohit Sethi, Gaurav Luniya",,,,Consumer Internet,Parenting Mobile App,Seed Funding,,,,,,,,,,,,,,,,,,,,,,2017-03-24,2017.0,,bangalore
52.0,24/03/2017,Delhivery,,New Delhi,"Carlyle Group, Tiger Global",,"100,000,000",,Technology,Tech enabled Fulfilment & Logistics Solutions,Private Equity,,,,,,,,,,,,,,,,,,,,,100000000.0,2017-03-24,2017.0,,new delhi
53.0,27/03/2017,Sport Flashes,,New Delhi,"Vikas Bajaj, Amit Kharbanda,",,,,Consumer Internet,Sports Based Online Media portal,Seed Funding,,,,,,,,,,,,,,,,,,,,,,2017-03-27,2017.0,,new delhi
54.0,28/03/2017,Fynd,,Mumbai,Venture Catalysts,,"500,000",,ECommerce,Online fashion marketplace,Private Equity,,,,,,,,,,,,,,,,,,,,,500000.0,2017-03-28,2017.0,,mumbai
55.0,28/03/2017,Wigzo,,New Delhi,3one4 capital,,,,Technology,Enterprise Automation suite,Private Equity,,,,,,,,,,,,,,,,,,,,,,2017-03-28,2017.0,,new delhi
56.0,28/03/2017,DoneThing,,Gurgaon,Brand Capital,,"300,000",,Consumer Internet,On-demand Personal Assistant service,Private Equity,,,,,,,,,,,,,,,,,,,,,300000.0,2017-03-28,2017.0,,gurgaon
57.0,29/03/2017,Zapyle,,Bangalore,Undisclosed Investors,,,,ECommerce,Luxury Fashion Marketplace,Seed Funding,,,,,,,,,,,,,,,,,,,,,,2017-03-29,2017.0,,bangalore
58.0,29/03/2017,Ithaka,,Mumbai,"Ankit Gupta, Puneet Motihar",,"325,000",,Consumer Internet,Vacation Trip Planning platform,Seed Funding,,,,,,,,,,,,,,,,,,,,,325000.0,2017-03-29,2017.0,,mumbai
59.0,29/03/2017,perpule,,Bangalore,KStart Capital,,"650,000",,eCommerce,Self-Checkout ECommerce App,Seed Funding,,,,,,,,,,,,,,,,,,,,,650000.0,2017-03-29,2017.0,,bangalore
60.0,29/03/2017,Byju’s,,Bangalore,Verlinvest,,,,Consumer Internet,Online Education Platform,Private Equity,,,,,,,,,,,,,,,,,,,,,,2017-03-29,2017.0,,bangalore
61.0,29/03/2017,Licious,,Bangalore,"Mayfield India, 3one4 Capital, Sistema Asia Fund, Neoplux Technology Fund",,"10,000,000",,ECommerce,Online Meat Ordering platform,Private Equity,,,,,,,,,,,,,,,,,,,,,10000000.0,2017-03-29,2017.0,,bangalore
62.0,29/03/2017,Medinfi,,Bangalore,"Vinod Martin, Hemant Kaul, Prof. Ram Kumar Kakani & Others",,"50,000",,Consumer Internet,Doctor & Hospital search Platform,Seed Funding,,,,,,,,,,,,,,,,,,,,,50000.0,2017-03-29,2017.0,,bangalore
63.0,30/03/2017,Indus OS,,Mumbai,"JSW Ventures, VenturEast",,,,Technology,Mobile OS creator,Private Equity,,,,,,,,,,,,,,,,,,,,,,2017-03-30,2017.0,,mumbai
64.0,30/03/2017,Emflux Motors,,Bangalore,"Meher Roy, Nikhil Arora, Meet Kanodia, Krit Sankalp, Nitish Singh, Risabh Gupta",,,,Technology,Electric Motorcycle manufacturer,Seed Funding,,,,,,,,,,,,,,,,,,,,,,2017-03-30,2017.0,,bangalore
65.0,30/03/2017,Klinic App,,Gurgaon,Om Chaudhry,,,,Consumer Internet,Pathology & Diagnostic Tests Portal,Seed Funding,,,,,,,,,,,,,,,,,,,,,,2017-03-30,2017.0,,gurgaon
66.0,31/03/2017,Jhakaas,,Mumbai,"Malini Patel, Stelcore Management Services, Anjani Prasad",,"155,000",,Consumer Internet,Offline Business Aggregator App,Seed Funding,,,,,,,,,,,,,,,,,,,,,155000.0,2017-03-31,2017.0,,mumbai
67.0,31/03/2017,Oriano Solar,,Mumbai,Samridhi Fund,,"3,000,000",,Technology,Turnkey Solar Solutions,Private Equity,,,,,,,,,,,,,,,,,,,,,3000000.0,2017-03-31,2017.0,,mumbai
68.0,31/03/2017,BigBasket,,Bangalore,Trifecta Capital,,"7,000,000",,ECommerce,Online Grocer,Private Equity,,,,,,,,,,,,,,,,,,,,,7000000.0,2017-03-31,2017.0,,bangalore
69.0,31/03/2017,Rooter,,New Delhi,Intex Technologies,,,,Consumer Internet,Sports engagement platform,Private Equity,,,,,,,,,,,,,,,,,,,,,,2017-03-31,2017.0,,new delhi
70.0,31/03/2017,FalconBrick,,Bangalore,"Satveer Thakral, LetsVenture, Mumbai Angels",,,,Technology,Real-Estate Workflow mobile app,Seed Funding,,,,,,,,,,,,,,,,,,,,,,2017-03-31,2017.0,,bangalore
71.0,31/03/2017,Icertis,,Pune,"B Capital Group, Ignition Partners, Greycroft, e.ventures,  Eight Roads Ventures",,"25,000,000",,Technology,ERP solutions provider,Private Equity,,,,,,,,,,,,,,,,,,,,,25000000.0,2017-03-31,2017.0,,pune
72.0,31/03/2017,,,,,,,,,,,,,,,,,,,,,,,,,,,,,,,,2017-03-31,2017.0,,
73.0,31/03/2017,,,,,,,,,,,,,,,,,,,,,,,,,,,,,,,,2017-03-31,2017.0,,
,,,,,,,,,,,,,,,,,,,,,,,,,,,,,,,,,,,,
,,,,,,,,,,,,,,,,,,,,,,,,,,,,,,,,,,,,
1.0,01/05/2017,Ace2three,,Hyderabad,Clairvest Group,Private Equity,"73,700,000",,Consumer Internet,Online Rummy playing Website,,,,,,,,,,,,,,,,,,,,,,73700000.0,2017-01-05,2017.0,,hyderabad
2.0,01/05/2017,Power2SME,,Gurgaon,International Finance Corporation,Private Equity,"10,000,000",,eCommerce,Buying portal for SMEs,,,,,,,,,,,,,,,,,,,,,,10000000.0,2017-01-05,2017.0,,gurgaon
3.0,02/05/2017,Innovapptive,,Hyderabad,Hyderabad Angels,Seed Funding,"1,500,000",,Technology,Enterprise Mobility Solutions,,,,,,,,,,,,,,,,,,,,,,1500000.0,2017-02-05,2017.0,,hyderabad
4.0,02/05/2017,4tigo,,Bangalore,"Accel Partners, Nandan Nilekani,",Private Equity,"10,000,000",,Logistics,Truck Network company,,,,,,,,,,,,,,,,,,,,,,10000000.0,2017-02-05,2017.0,,bangalore
5.0,02/05/2017,SMECorner,,Mumbai,Dutch government fund,Private Equity,,,Consumer Internet,Online Platform for small business loans,,,,,,,,,,,,,,,,,,,,,,,2017-02-05,2017.0,,mumbai
6.0,02/05/2017,ZippServe,,Bangalore,undisclosed investors,Seed Funding,"390,000",,Consumer Internet,Real estate risk assessment platform,,,,,,,,,,,,,,,,,,,,,,390000.0,2017-02-05,2017.0,,bangalore
7.0,03/05/2017,Ola,,Bangalore,"Falcon Edge Capital,  Capital Advisers",Private Equity,"104,500,000",,Consumer Internet,Cab Aggregation App,,,,,,,,,,,,,,,,,,,,,,104500000.0,2017-03-05,2017.0,,bangalore
8.0,03/05/2017,Sumeru,,Bangalore,undisclosed investors,Seed Funding,"1,000,000",,Technology,Software & Mobile development services,,,,,,,,,,,,,,,,,,,,,,1000000.0,2017-03-05,2017.0,,bangalore
9.0,04/05/2017,Healthians,,New Delhi,"Asuka Holdings, YouWeCan Ventures, Beenext, Beenos, M&S Partners",Private Equity,,,Consumer Internet,Online Diagnostics and wellness platform,,,,,,,,,,,,,,,,,,,,,,,2017-04-05,2017.0,,new delhi
10.0,05/05/2017,HealthMir,,New Delhi,Nimit Panigrahi,Seed Funding,,,Consumer Internet,AI-based health content platform,,,,,,,,,,,,,,,,,,,,,,,2017-05-05,2017.0,,new delhi
11.0,05/05/2017,Uactive,,Mumbai,Hinduja family,Seed Funding,,,Consumer Internet,Health-based social networking & discovery App,,,,,,,,,,,,,,,,,,,,,,,2017-05-05,2017.0,,mumbai
12.0,05/05/2017,i-lend,,Hyderabad,50K Ventures,Seed Funding,,,Consumer Internet,Peer-to-peer lending platform,,,,,,,,,,,,,,,,,,,,,,,2017-05-05,2017.0,,hyderabad
13.0,05/05/2017,Good Methods Global,,Trivandrum,Accel Partners,Private Equity,,,Technology,Cloud Based Practice Management Software,,,,,,,,,,,,,,,,,,,,,,,2017-05-05,2017.0,,trivandrum
14.0,05/05/2017,Balance App,,Bangalore,Rainmatter,Seed Funding,"233,000",,Consumer Internet,Money Savings & Management App,,,,,,,,,,,,,,,,,,,,,,233000.0,2017-05-05,2017.0,,bangalore
15.0,08/05/2017,YepMe,,Gurgaon,"Rainbow Digital Services Pvt. Ltd, ILearnFinance Academy Pvt. Ltd.",Private Equity,"700,000",,eCommerce,Private Label Fashion etailer,,,,,,,,,,,,,,,,,,,,,,700000.0,2017-08-05,2017.0,,gurgaon
16.0,08/05/2017,Nightstay,,New Delhi,"Indian Angels Network, LetsVenture",Seed Funding,,,Consumer Internet,Last minute hotel booking mobile app,,,,,,,,,,,,,,,,,,,,,,,2017-08-05,2017.0,,new delhi
17.0,08/05/2017,Devourin,,Pune,Deepak Nathani,Seed Funding,,,Technology,Restaurant Automation Solution,,,,,,,,,,,,,,,,,,,,,,,2017-08-05,2017.0,,pune
18.0,08/05/2017,MyGreens,,New Delhi,"Ajay Relan, LetsVenture",Seed Funding,"1,000,000",,Food & Beverage,Cold-press Juices manufacturer,,,,,,,,,,,,,,,,,,,,,,1000000.0,2017-08-05,2017.0,,new delhi
19.0,08/05/2017,Ace Turtle,,Bangalore,"Vertex Ventures, C31 Ventures",Private Equity,"5,000,000",,Technology,Omni-Channel Platform,,,,,,,,,,,,,,,,,,,,,,5000000.0,2017-08-05,2017.0,,bangalore
20.0,08/05/2017,CureFit,,Bangalore,"Trifecta Capital Advisors LLP, Prathithi Investment Trust, RNT Capital, Gokul Rajaram, Aditya Agarwal, Ruchi Sanghvi & others",Private Equity,"3,200,000",,Technology,Health-Tech Platform,,,,,,,,,,,,,,,,,,,,,,3200000.0,2017-08-05,2017.0,,bangalore
21.0,09/05/2017,Curie Labs,,New Delhi,Satoshi Studios,Seed Funding,"50,000",,Technology,Energy Analytics startup,,,,,,,,,,,,,,,,,,,,,,50000.0,2017-09-05,2017.0,,new delhi
22.0,09/05/2017,Uncanny Vision,,Bangalore,Anand Chandrasekaran,Seed Funding,,,Technology,Computer Vision on Embedded Systems,,,,,,,,,,,,,,,,,,,,,,,2017-09-05,2017.0,,bangalore
23.0,09/05/2017,Anchanto,,Pune,Luxasia Group,Private Equity,,,Technology,Ecommerce Fulfilment and Technology Platform,,,,,,,,,,,,,,,,,,,,,,,2017-09-05,2017.0,,pune
24.0,09/05/2017,Sequretek,,Mumbai,"GVFL, Unicorn India Ventures",Private Equity,,,Technology,IT Security & Data Management Services,,,,,,,,,,,,,,,,,,,,,,,2017-09-05,2017.0,,mumbai
25.0,10/05/2017,Lucideus,,New Delhi,"Vellayan Subbiah, Jonathan Boutelle, Rajan Anandan,  Rahul Chawla, Salil Donde, Amit Ranjan, Govind Rajan & Others",Seed Funding,,,Technology,Cyber Security Startup,,,,,,,,,,,,,,,,,,,,,,,2017-10-05,2017.0,,new delhi
26.0,10/05/2017,Vidooly,,Noida,"Times Internet, GVFL",Private Equity,"1,400,000",,Consumer Internet,Video Intelligence platform,,,,,,,,,,,,,,,,,,,,,,1400000.0,2017-10-05,2017.0,,noida
27.0,10/05/2017,Shopclues,,Gurgaon,InnoVen Capital,Private Equity,"7,700,000",,eCommerce,Online marketplace,,,,,,,,,,,,,,,,,,,,,,7700000.0,2017-10-05,2017.0,,gurgaon
28.0,10/05/2017,Fourth Ambit,,Bangalore,1Crowd,Seed Funding,"600,000",,Consumer Internet,Community Building platform,,,,,,,,,,,,,,,,,,,,,,600000.0,2017-10-05,2017.0,,bangalore
29.0,10/05/2017,Chymera VR,,Bangalore,"Varsha Rao, Surojit Chatterjee, Nirav Choksi & Others",Seed Funding,,,Technology,Advertising Platform for Virtual Reality,,,,,,,,,,,,,,,,,,,,,,,2017-10-05,2017.0,,bangalore
30.0,11/05/2017,Early Salary,,Pune,"DG Ventures India, Dewan Housing Finance Corp",Private Equity,"4,000,000",,Consumer Internet,Online lending platform,,,,,,,,,,,,,,,,,,,,,,4000000.0,2017-11-05,2017.0,,pune
31.0,11/05/2017,Book My Diamond,,Mumbai,Chirag Nikunj Sheth & Others,Seed Funding,,,eCommerce,Diamond B2B eTailer,,,,,,,,,,,,,,,,,,,,,,,2017-11-05,2017.0,,mumbai
32.0,11/05/2017,ION Energy,,Mumbai,"Aakrit Vaish, Swapan Rajdev, Sushill Jiwarajka",Seed Funding,,,Technology,Clean Tech Startup,,,,,,,,,,,,,,,,,,,,,,,2017-11-05,2017.0,,mumbai
33.0,12/05/2017,Legal Raasta,,New Delhi,Impanix Capital,Private Equity,"5,000,000",,Consumer Internet,Legal Services to SMEs & Individuals,,,,,,,,,,,,,,,,,,,,,,5000000.0,2017-12-05,2017.0,,new delhi
34.0,12/05/2017,Log 9 Materials,,Bangalore,GEMs,Seed Funding,,,Technology,NanoTech product developer,,,,,,,,,,,,,,,,,,,,,,,2017-12-05,2017.0,,bangalore
35.0,12/05/2017,Remit Guru,,Mumbai,"Infibeam, CCavenue",Private Equity,"466,000",,Consumer Internet,Digital money transfer platform,,,,,,,,,,,,,,,,,,,,,,466000.0,2017-12-05,2017.0,,mumbai
36.0,12/05/2017,Aequm,,Bangalore,undisclosed investors,Seed Funding,"1,000,000",,eCommerce,Cloud ECommerce platform,,,,,,,,,,,,,,,,,,,,,,1000000.0,2017-12-05,2017.0,,bangalore
37.0,15/05/2017,Zapty,,Bangalore,IdeaSpring Capital,Seed Funding,"500,000",,Technology,Project Management tool,,,,,,,,,,,,,,,,,,,,,,500000.0,2017-05-15,2017.0,,bangalore
38.0,15/05/2017,Vernacular.ai,,Bangalore,Kstart Capital,Seed Funding,,,Technology,Multi-lingual AI Platform for Businesses,,,,,,,,,,,,,,,,,,,,,,,2017-05-15,2017.0,,bangalore
39.0,16/05/2017,Niki.ai,,Bangalore,SAP,Private Equity,,,Technology,AI-based chatbot,,,,,,,,,,,,,,,,,,,,,,,2017-05-16,2017.0,,bangalore
40.0,16/05/2017,Telr,,Mumbai,Innovations East,Private Equity,"3,000,000",,Technology,Online Payment Gateway,,,,,,,,,,,,,,,,,,,,,,3000000.0,2017-05-16,2017.0,,mumbai
41.0,16/05/2017,Fynd,,Mumbai,Rocketship,Private Equity,"500,000",,eCommerce,Fashion ECommerce Portal,,,,,,,,,,,,,,,,,,,,,,500000.0,2017-05-16,2017.0,,mumbai
42.0,17/05/2017,Genie,,Chennai,undisclosed investors,Seed Funding,"250,000",,Consumer Internet,hyperlocal delivery and logistics mobile app,,,,,,,,,,,,,,,,,,,,,,250000.0,2017-05-17,2017.0,,chennai
43.0,17/05/2017,Paysense,,Mumbai,Jungle Ventures,Private Equity,"5,300,000",,Consumer Internet,Online Lending platform,,,,,,,,,,,,,,,,,,,,,,5300000.0,2017-05-17,2017.0,,mumbai
44.0,18/05/2017,The Good Life,,Mumbai,"Ayesha Takia Azmi, Abu Farhan Azmi",Seed Funding,"1,000,000",,ECommerce,Online Luxury Tea etailer,,,,,,,,,,,,,,,,,,,,,,1000000.0,2017-05-18,2017.0,,mumbai
45.0,18/05/2017,PumpKart,,Chandigarh,Dr. Ritesh Malik,Seed Funding,,,eCommerce,Online Water Pumps etailer,,,,,,,,,,,,,,,,,,,,,,,2017-05-18,2017.0,,chandigarh
46.0,18/05/2017,Paytm,,Bangalore,SoftBank Group,Private Equity,"1,400,000,000",,ECommerce,Mobile Wallet & ECommerce platform,,,,,,,,,,,,,,,,,,,,,,1400000000.0,2017-05-18,2017.0,,bangalore
47.0,19/05/2017,EzCred,,Bangalore,"Dheeraj Pandey, Rajesh Yohannan, Akash Garg",Seed Funding,"1,000,000",,Consumer Internet,Consumer Lending Platform,,,,,,,,,,,,,,,,,,,,,,1000000.0,2017-05-19,2017.0,,bangalore
48.0,19/05/2017,HealthSutra,,Hyderabad,"Ankur Capital, Hyderabad Angels",Seed Funding,,,Food & Beverage,Health Food Maker,,,,,,,,,,,,,,,,,,,,,,,2017-05-19,2017.0,,hyderabad
49.0,20/05/2017,YepMe,,New Delhi,Gokaldas Exports Ltd,Private Equity,,,eCommerce,Private Fashion Brand etailer,,,,,,,,,,,,,,,,,,,,,,,2017-05-20,2017.0,,new delhi
50.0,22/05/2017,Delhivery,,New Delhi,Fosun International,Private Equity,"30,000,000",,Logistics,ECommerce Logistics provider,,,,,,,,,,,,,,,,,,,,,,30000000.0,2017-05-22,2017.0,,new delhi
51.0,22/05/2017,ZipGrid,,Mumbai,"JLL, 1Crowd",Seed Funding,"500,000",,Consumer Internet,"Cashless, paperless solutions for Housing societies",,,,,,,,,,,,,,,,,,,,,,500000.0,2017-05-22,2017.0,,mumbai
52.0,23/05/2017,TravelSpice,,Hyderabad,Eagle10 Ventures,Seed Funding,,,ECommerce,Travel ECommerce portal,,,,,,,,,,,,,,,,,,,,,,,2017-05-23,2017.0,,hyderabad
53.0,23/05/2017,Magicpin,,Gurgaon,"Lightspeed Venture Partners, Vy Capital,",Private Equity,"6,600,000",,Consumer Internet,Hyperlocal discovery platform,,,,,,,,,,,,,,,,,,,,,,6600000.0,2017-05-23,2017.0,,gurgaon
54.0,23/05/2017,The Print,,New Delhi,"Ratan Tata, Nandan Nilekani, Uday Kotak, Vijay Shekhar Sharma, Kiran Mazumdar-Shaw, Rajiv C Mody",Seed Funding,,,Consumer Internet,News Portal,,,,,,,,,,,,,,,,,,,,,,,2017-05-23,2017.0,,new delhi
55.0,23/05/2017,Box8,,Mumbai,Trifecta Capital,Private Equity,"1,000,000",,Consumer Internet,Food Delivery Platform,,,,,,,,,,,,,,,,,,,,,,1000000.0,2017-05-23,2017.0,,mumbai
56.0,24/05/2017,GenNext Students,,Mumbai,Undisclosed Investors,Seed Funding,"580,000",,Consumer Internet,Online Tutoring Services,,,,,,,,,,,,,,,,,,,,,,580000.0,2017-05-24,2017.0,,mumbai
57.0,25/05/2017,Aye Finance,,Gurgaon,Blue Orchard,Private Equity,"8,000,000",,Finance,Non-Banking Financial Company,,,,,,,,,,,,,,,,,,,,,,8000000.0,2017-05-25,2017.0,,gurgaon
58.0,26/05/2017,WhatsLoan,,Bangalore,Lahiri Music’s family office,Seed Funding,,,Consumer Internet,Online Lending mobile app,,,,,,,,,,,,,,,,,,,,,,,2017-05-26,2017.0,,bangalore
59.0,29/05/2017,Cube Consumer Services,,Mumbai,,Seed Funding,,,Consumer Internet,Finance management Mobile app,,,,,,,,,,,,,,,,,,,,,,,2017-05-29,2017.0,,mumbai
60.0,29/05/2017,Nivesh,,Noida,"PV Sahad, Sandeep Shroff, Rahul Gupta",Seed Funding,,,Consumer Internet,Online MF investment platform,,,,,,,,,,,,,,,,,,,,,,,2017-05-29,2017.0,,noida
61.0,29/05/2017,Wowflux,,New Delhi,Undisclosed Investors,Seed Funding,,,Technology,image Processing solution,,,,,,,,,,,,,,,,,,,,,,,2017-05-29,2017.0,,new delhi
62.0,29/05/2017,Collateral Medical,,Mumbai,Carpediem Capital,Private Equity,"3,500,000",,eCommerce,Online Medical equipment supplier,,,,,,,,,,,,,,,,,,,,,,3500000.0,2017-05-29,2017.0,,mumbai
63.0,30/05/2017,Loadshare,,Bangalore,Matrix Partners,Seed Funding,,,Logistics,Express Logistics Network,,,,,,,,,,,,,,,,,,,,,,,2017-05-30,2017.0,,bangalore
64.0,30/05/2017,SimpliLend,,New Delhi,Undisclosed Investors,Seed Funding,,,Consumer Internet,Online lending platform,,,,,,,,,,,,,,,,,,,,,,,2017-05-30,2017.0,,new delhi
65.0,30/05/2017,Supr Daily,,Mumbai,"Soma Capital, Great Oaks Ventures, 122 West Ventures",Private Equity,"1,500,000",,Consumer Internet,Subscription based delivery platform,,,,,,,,,,,,,,,,,,,,,,1500000.0,2017-05-30,2017.0,,mumbai
66.0,30/05/2017,Swiggy,,Bangalore,"Nasper, Accel India, SAIF Partners, Bessemer Venture Partners, Harmony Partners, Norwest Venture Partners",Private Equity,"80,000,000",,Consumer Internet,Online food delivery platform,,,,,,,,,,,,,,,,,,,,,,80000000.0,2017-05-30,2017.0,,bangalore
67.0,31/05/2017,SastaSundar,,Kolkata,Rohto Pharmaceutical,Private Equity,"5,000,000",,eCommerce,Online Pharmacy,,,,,,,,,,,,,,,,,,,,,,5000000.0,2017-05-31,2017.0,,kolkata
68.0,31/05/2017,Magicpin,,Gurgaon,"Lightspeed India Partners, Waterbridge Ventures",Private Equity,"7,000,000",,Consumer Internet,Hyperlocal Discovery  & Rewards platform,,,,,,,,,,,,,,,,,,,,,,7000000.0,2017-05-31,2017.0,,gurgaon
69.0,31/05/2017,,,,,,,,,,,,,,,,,,,,,,,,,,,,,,,,2017-05-31,2017.0,,
70.0,31/05/2017,,,,,,,,,,,,,,,,,,,,,,,,,,,,,,,,2017-05-31,2017.0,,
71.0,,,,,,,,,,,,,,,,,,,,,,,,,,,,,,,,,,,,
,,,,,,,,,,,,,,,,,,,,,,,,,,,,,,,,,,,,
1.0,,Prest Loans,,,,,,,,Business & SME Loans provider,,02/11/2017,Finance,New Delhi,"Manish Poddar, Arun Garg, Parmeshwar Sharma",Seed Funding,"570,000",,,,,,,,,,,,,,,,,,,
2.0,,AadharAPI.com,,,,,,,,Aadhaar-based API provider,,02/11/2017,Technology,Pune,CIO Angel Network,Seed Funding,,,,,,,,,,,,,,,,,,,,
3.0,,FreshBoxx,,,,,,,,Online Grocery Store,,02/11/2017,ECommerce,Bangalore,Jayant Humbarwadi,Seed Funding,,,,,,,,,,,,,,,,,,,,
4.0,,Vagupu,,,,,,,,Online Tutorial Marketplace,,03/11/2017,Technology,Bangalore,Undisclosed Investors,Seed Funding,"1,000,000",,,,,,,,,,,,,,,,,,,
5.0,,HalaPlay,,,,,,,,Online Fantasy Games,,03/11/2017,Consumer Internet,Mumbai,"Kae Capital Management, Nazara Technologies",Seed Funding,,,,,,,,,,,,,,,,,,,,
6.0,,Kalpnik Technologies,,,,,,,,VR based Spiritual platform,,03/11/2017,Technology,Bangalore,Venture Catalysts,Seed Funding,"500,000",,,,,,,,,,,,,,,,,,,
7.0,,Hevo Data,,,,,,,,Real time data analytics & reporting,,04/11/2017,Technology,Bangalore,IDG Ventures India,Private Equity,"1,000,000",,,,,,,,,,,,,,,,,,,
8.0,,Smart Karma,,,,,,,,Financial Technology Research Platform,,06/11/2017,Technology,Bangalore,IDG Ventures India,Private Equity,,,,,,,,,,,,,,,,,,,,
9.0,,Leverage Edu,,,,,,,,Online platform for Higher Education Services,,06/11/2017,ECommerce,New Delhi,"Alok Mittal, Deepak Jain, Ritesh Malik, Jim Schimdktke",Seed Funding,,,,,,,,,,,,,,,,,,,,
10.0,,Crayon Data,,,,,,,,Customer Engagement Platform,,07/11/2017,Technology,New Delhi,Infosys co-founder Kris Gopalakrishnan,Seed Funding,,,,,,,,,,,,,,,,,,,,
11.0,,DocTalk,,,,,,,,Doctor Patient Communication platform,,07/11/2017,Technology,Mumbai,"Matrix Partners India, Khosla Ventures",Private Equity,"5,000,000",,,,,,,,,,,,,,,,,,,
12.0,,CoveIoT,,,,,,,,Wearable tech and Internet of Things platform,,07/11/2017,Technology,Bangalore,"Titan Co Ltd, Tata Group’s watch and jewellery retailing firm",Private Equity,"5,000,000",,,,,,,,,,,,,,,,,,,
13.0,,TalentEdge,,,,,,,,Distance Education Learning Platform,,08/11/2017,Technology,Bangalore,Lumis Partners,Private Equity,"7,600,000",,,,,,,,,,,,,,,,,,,
14.0,,Fisdom,,,,,,,,Mutual Fund Investment App,,08/11/2017,Finance,Bangalore,Quona Capital Management,Private Equity,"3,000,000",,,,,,,,,,,,,,,,,,,
15.0,,FarmLink,,,,,,,,Online platform for Agricultural products,,08/11/2017,eCommerce,Mumbai,"Pioneering Ventures, Syngenta AG",Private Equity,"3,000,000",,,,,,,,,,,,,,,,,,,
16.0,,OpenApp,,,,,,,,IoT based Tech Startup,,08/11/2017,Technology,Bangalore,"Axilor Ventures, Kumar Vembu",Private Equity,"3,600,000",,,,,,,,,,,,,,,,,,,
17.0,,NoPaperForms,,,,,,,,Enrolment Management Platform,,09/11/2017,Technology,Delhi,Info Edge,Seed Funding,"872,000",,,,,,,,,,,,,,,,,,,
18.0,,Tilite Technologies Pvt. Ltd,,,,,,,,Saas based Corporate Travel Management Solution,,09/11/2017,Technology,Bangalore,Matrix Partners,Seed Funding,,,,,,,,,,,,,,,,,,,,
19.0,,Mobiliz AR,,,,,,,,Augmented Reality based Tech platform,,09/11/2017,Technology,Bangalore,"IDG Ventures, IDFC-Parampara Fund",Private Equity,,,,,,,,,,,,,,,,,,,,
20.0,,Qubole,,,,,,,,Big Data based analytics platform,,10/11/2017,Technology,Bangalore,"Singtel, Innov8, Harmony Partners",Private Equity,"25,000,000",,,,,,,,,,,,,,,,,,,
21.0,,Happily Unmarried,,,,,,,,Online Gifting platform,,10/11/2017,ECommerce,Nw Delhi,Wipro Consumer Care,Private Equity,,,,,,,,,,,,,,,,,,,,
22.0,,Universal Sportsbiz Pvt. Ltd,,,,,,,,Celebrity fashion accessories and merchandise,,13/11/2017,ECommerce,Mumbai,Accel Partners,PrivateEquity,"15,000,000",,,,,,,,,,,,,,,,,,,
23.0,,Hungry Foal,,,,,,,,Healthy & Nutrition based snacks online platform,,14/11/2017,Ecommerce,Gurgaon,GAIL India Ltd,Seed Funding,,,,,,,,,,,,,,,,,,,,
23.0,,Active AI,,,,,,,,AI based FinTech platform,,14/11/2017,Technology,Bangalore,Vertex Ventures,Private Equity,"825,0000",,,,,,,,,,,,,,,,,,,
24.0,,Sumeru,,,,,,,,Banking Software License Platform,,15/11/2017,Technology,Bangalore,Undisclosed Investors,Seed Funding,"900,000",,,,,,,,,,,,,,,,,,,
25.0,,ElderAid Wellness,,,,,,,,Social Healthcare Enterprise,,15/11/2017,Health Care,Bangalore,Rugmini Menon,Angel Funding,,,,,,,,,,,,,,,,,,,,
26.0,,Omnia Information,,,,,,,,WiFi Analytics Platform,,15/11/2017,Technology,Delhi,Omidyar Network,Private Equity,"3,000,000",,,,,,,,,,,,,,,,,,,
27.0,,Josh Talks,,,,,,,,Storytelling platform,,15/11/2017,Inspiration,Gurgaon,"Girish Mathrubootham, Apurva Chamaria, Rohit Chanana",Private Equity,,,,,,,,,,,,,,,,,,,,
28.0,,Reniso,,,,,,,,End-to-End property management for landlords living away,,15/11/2017,Technology,New Delhi,"Nishit Sharma, Alok Srivastava",Seed Funding,,,,,,,,,,,,,,,,,,,,
29.0,,Kanhaiya,,,,,,,,Storytelling platform,,17/11/2017,Inspiration,Hyderabad,Undisclosed Investors,Seed/Angel Funding,"200,000",,,,,,,,,,,,,,,,,,,
30.0,,Perspectico,,,,,,,,Placement preparation and career growth training platform,,17/11/2017,Technology,Delhi,"SSCBS Innovation, Incubation Foundation (SIIF)",Seed/Angel Funding,,,,,,,,,,,,,,,,,,,,
31.0,,ONN Bikes,,,,,,,,Self riding bike rental program,,20/11/2017,Technology,Mumbai,Z Nation Lab,Seed/Angel Funding,"692,000",,,,,,,,,,,,,,,,,,,
32.0,,Rapido,,,,,,,,Bike and Taxi pooling online platform,,21/11/2017,Technology,Hyderabad,"Skycatcher Fund, Aravind Sanka",Seed/Angel Funding,"329,230",,,,,,,,,,,,,,,,,,,
33.0,,Heckyl,,,,,,,,Big Data Analytics Platform,,21/11/2017,Technology,Mumbai,"Notion Capital, IDG Ventures",Private Equity,"2,700,000",,,,,,,,,,,,,,,,,,,
34.0,,Nuvepro,,,,,,,,Managed Cloud Environment Solutions,,21/11/2017,Technology,Mumbai,1Crowd,Seed/Angel Funding,"400,000",,,,,,,,,,,,,,,,,,,
35.0,,RedBook,,,,,,,,AI based pharmacy drugs insights platform,,21/11/2017,Technology,Mumbai,"Vida Ventures, Dr. Aniruddha Malpani",Seed/Angel Funding,"250,000",,,,,,,,,,,,,,,,,,,
36.0,,Portea,,,,,,,,Healthcare facilities at doorstep,,21/11/2017,Healthcare,Bangalore,"Sabre Partners, MEMG CDC",Private Equity,"26,000,000",,,,,,,,,,,,,,,,,,,
37.0,,Credit Mate,,,,,,,,Vehicle loan approval platform,,21/11/2017,Technology,Mumbai,Paytm,Private Equity,,,,,,,,,,,,,,,,,,,,
38.0,,Epiq Capital,,,,,,,,Tech based investor firm,,21/11/2017,Finance,Mumbai,Global Institutional Investors,Private Equity,"20,000,0000",,,,,,,,,,,,,,,,,,,
39.0,,MiStay,,,,,,,,Online Hotel Reservation Platform,,22/11/2017,Technology,Bangalore,Axilor Ventures,Seed/Angel Funding,,,,,,,,,,,,,,,,,,,,
40.0,,WittyFeed,,,,,,,,Viral Content and storytelling platform,,23/11/2017,Storytelling,Indore,Sandeep Aggarwal,Seed/Angel Funding,,,,,,,,,,,,,,,,,,,,
41.0,,IDG Ventures,,,,,,,,Venture Capitalist,,24/11/2017,Finance,Bangalore,Uniliver Ventures,Private Equity,"10,000,000",,,,,,,,,,,,,,,,,,,
42.0,,TempGo,,,,,,,,IoT and SaaS based transportation platform,,24/11/2017,Technology,Goa,Javelin StartupO Victory Fund,Seed/Angel Funding,"250,000",,,,,,,,,,,,,,,,,,,
43.0,,Edelweiss,,,,,,,,Diversified Financial,,27/11/2017,Finance,Mumbai,Undisclosed investors,Private Equity,"270,000,000",,,,,,,,,,,,,,,,,,,
44.0,,ERA,,,,,,,,Identity management platform,,27/11/2017,Technology,Mumbai,Amit Patni,Seed/Angel Funding,"39,000",,,,,,,,,,,,,,,,,,,
44.0,,Smaaash,,,,,,,,Virtual Reality based gaming platform,,27/11/2017,Technology,Mumbai,Sixth Sense Ventures,Private Equity,"3,800,000",,,,,,,,,,,,,,,,,,,
45.0,,Chumbak,,,,,,,,Designer-led consumer products,,28/11/2017,Lifestyle,Bangalore,Gaja Capital,Private Equity,"13,000,000",,,,,,,,,,,,,,,,,,,
46.0,,FR8,,,,,,,,Online Truck aggregator platform,,28/11/2017,Technology,Chennai,IFMR Capital,Debt Funding,"1,500,000",,,,,,,,,,,,,,,,,,,
47.0,,MobieFit,,,,,,,,Health and fitness based mobile App,,28/11/2017,Healthcare,Goa,"NB Ventures, MediAssist",Seed/Angel Funding,"1,350,000",,,,,,,,,,,,,,,,,,,
48.0,,Stanza Living,,,,,,,,Student accommodation platform,,28/11/2017,Technology,Delhi,"Matrix PArtners, Accel",Private Equity,"2,000,000",,,,,,,,,,,,,,,,,,,
1.0,,ChqBook,,,,,,,,Home Loans Aggregation platform,,3/10/2017,Consumer Internet,Gurgaon,"Startup Buddy, Apurva Chamaria,Sachin Arora, Bharat Gupta, Amit Manocha",Seed Funding,,,,,,,,,,,,,,,,,,,,
2.0,,HomeCapital,,,,,,,,Home Loan Down payment assistance program,,3/10/2017,Consumer Internet,Mumbai,Venture Catalysts,Seed Funding,,,,,,,,,,,,,,,,,,,,
3.0,,Ola Cabs,,,,,,,,App based cab hailing services,,3/10/2017,Consumer Internet,Bangalore,"Tencent, Softbank Group",Private Equity,"110,000,000",,,,,,,,,,,,,,,,,,,
4.0,,Elanic,,,,,,,,P2P platform for Fashion sales,,4/10/2017,Consumer Internet,Bangalore,Digital Garage,Seed Funding,,,,,,,,,,,,,,,,,,,,
5.0,,CollPoll,,,,,,,,Education collaboration platform,,4/10/2017,Consumer Internet,Bangalore,Sprout Angels,Seed Funding,"306,000",,,,,,,,,,,,,,,,,,,
6.0,,PhonePe,,,,,,,,Digital Wallet,,4/10/2017,Consumer Internet,Bangalore,Flipkart,Private Equity,"38,700,000",,,,,,,,,,,,,,,,,,,
7.0,,Little Black Book,,,,,,,,Local Recommendations and Discoveries Platform,,5/10/2017,Consumer Internet,New Delhi,"Blume Ventures, IDG Ventures & Indian Angel Network",Private Equity,"1,000,000",,,,,,,,,,,,,,,,,,,
8.0,,Oorjan,,,,,,,,rooftop solar platform,,5/10/2017,Technology,Mumbai,Globevestor,Seed Funding,"450,000",,,,,,,,,,,,,,,,,,,
9.0,,Zefo,,,,,,,,Ecommerce Portal for Used Goods,,5/10/2017,ECommerce,Bangalore,"Sequoia India, Helion Venture Partners, Beenext",Private Equity,"9,200,000",,,,,,,,,,,,,,,,,,,
10.0,,Yaantra,,,,,,,,Mobile repair and Refurbishment platform,,6/10/2017,ECommerce,New Delhi,Carpediem Capital,Private Equity,"3,100,000",,,,,,,,,,,,,,,,,,,
11.0,,Farm Taaza,,,,,,,,Fresh Produce SCM company,,6/10/2017,Technology,Bangalore,"Epsilon Venture Partners, Tara India Fund IV and others",Private Equity,"8,000,000",,,,,,,,,,,,,,,,,,,
12.0,,Drivezy,,,,,,,,Self Drive car and bike rental platform,,6/10/2017,Consumer Internet,Bangalore,"Das Capital, Axan Partners, Das Capital and IT Farm",Private Equity,"10,000,000",,,,,,,,,,,,,,,,,,,
13.0,,Slice Pay,,,,,,,,Student Micro-financing platform,,6/10/2017,Consumer Internet,Bangalore,"Das Capital, Simile Ventures",Private Equity,"2,000,000",,,,,,,,,,,,,,,,,,,
14.0,,Agrowave,,,,,,,,Agriculture Supply Chain management solutions,,9/10/2017,Technology,Gurgaon,Daffodil Software,Seed Funding,,,,,,,,,,,,,,,,,,,,
15.0,,MyGubbi,,,,,,,,Home Interior Designing Seller,,9/10/2017,eCommerce,Bangalore,"Firoze Irani, Vipul Parekh, Ananda Kallugadde, Rajesh K Murthy",Private Equity,"2,700,000",,,,,,,,,,,,,,,,,,,
16.0,,IBSFintech,,,,,,,,Treasury Risk Management Solution,,9/10/2017,Technology,Bangalore,Shailesh Haribhakti,Seed Funding,,,,,,,,,,,,,,,,,,,,
17.0,,Letsservice,,,,,,,,Auto Service Logistics & SAAS platform,,9/10/2017,Consumer Internet,Bangalore,Aequs Group,Private Equity,,,,,,,,,,,,,,,,,,,,
